task_id,annotation_id,completed_by,relevance_choice,annotation_created_at,company_name,post_date,comment_id,parent_id,comment_text,comment_date,comment_type,reaction_count,before_DEI,has_DEI,root_id,depth,sibling_count,time_since_root,cleaned_text,full_text
140,140,1,0 (Not Relevant),2025-04-20T20:20:15.992705Z,Delta,2025-02-13 09:30:00,Y29tbWVudDoxMDIxMzAxOTAwMDE4NzIyXzY0ODY2NTQ3NzYyODI5NA==,,"Just got told by their customer service rep that the pilots and stewards all over slept. Meanwhile they just keep pn delaying us over and over and over. Gave the entire flight rooms last night, spent almost 45 minutes waiting to get bags back. Get to the hotel only to get up to be back here by 430am just to get the flight delayed some more. After rechecking bags, we get all the way to TSA just to find out that we mow have to have a paper ticket since the flights were supposed to yesterday. You'd think for what Delta charges we wouldn't be getting treated like crap. Common sense would be to tell everyone that's rechecking their bags they need a paper boarding pass instead of making them walk back and forth several times. We watched this happen to several people.",2025-02-22,initial,6,0,1,Y29tbWVudDoxMDIxMzAxOTAwMDE4NzIyXzY0ODY2NTQ3NzYyODI5NA==,0,480,0 days,"just got told by their customer service rep that the pilots and stewards all over slept. meanwhile they just keep pn delaying us over and over and over. gave the entire flight rooms last night, spent almost 45 minutes waiting to get bags back. get to the hotel only to get up to be back here by 430am just to get the flight delayed some more. after rechecking bags, we get all the way to tsa just to find out that we mow have to have a paper ticket since the flights were supposed to yesterday. you'd think for what delta charges we wouldn't be getting treated like crap. common sense would be to tell everyone that's rechecking their bags they need a paper boarding pass instead of making them walk back and forth several times. we watched this happen to several people.","just got told by their customer service rep that the pilots and stewards all over slept. meanwhile they just keep pn delaying us over and over and over. gave the entire flight rooms last night, spent almost 45 minutes waiting to get bags back. get to the hotel only to get up to be back here by 430am just to get the flight delayed some more. after rechecking bags, we get all the way to tsa just to find out that we mow have to have a paper ticket since the flights were supposed to yesterday. you'd think for what delta charges we wouldn't be getting treated like crap. common sense would be to tell everyone that's rechecking their bags they need a paper boarding pass instead of making them walk back and forth several times. we watched this happen to several people."
141,141,1,1 (Relevant),2025-04-20T20:20:20.811500Z,Delta,2025-02-17 14:08:00,Y29tbWVudDoxMDI0NTU2NjI5NjkzMjQ5XzE3MzE2MTg4NDQwNjU2NzY=,,Are you sure it’s not your DEI policies? Delta Air Lines,2025-02-22,initial,0,0,1,Y29tbWVudDoxMDI0NTU2NjI5NjkzMjQ5XzE3MzE2MTg4NDQwNjU2NzY=,0,540,0 days,are you sure its not your dei policies? delta air lines,are you sure its not your dei policies? delta air lines
142,142,1,0 (Not Relevant),2025-04-20T20:20:26.827049Z,Costco,2025-01-21 12:00:00,Y29tbWVudDoxMDI2NDgwMjY5NTEwMTM2XzE2OTk0MTExNDQzMTA5MDI=,,"My Doxie, Harper!!
 Actually, my health and well-being in order to take great care of my Doxie!!",2025-01-24,initial,0,0,1,Y29tbWVudDoxMDI2NDgwMjY5NTEwMTM2XzE2OTk0MTExNDQzMTA5MDI=,0,458,0 days,"my doxie, harper!! actually, my health and well-being in order to take great care of my doxie!!","my doxie, harper!! actually, my health and well-being in order to take great care of my doxie!!"
143,143,1,0 (Not Relevant),2025-04-20T20:20:31.628928Z,Costco,2025-01-23 09:00:00,Y29tbWVudDoxMDI3ODA5MTc5Mzc3MjQ1XzE0MTU5ODU2MDkzNzc0OTY=,,Yum,2025-01-25,initial,0,0,1,Y29tbWVudDoxMDI3ODA5MTc5Mzc3MjQ1XzE0MTU5ODU2MDkzNzc0OTY=,0,603,0 days,yum,yum
144,144,1,1 (Relevant),2025-04-20T20:20:41.574848Z,Costco,2025-01-23 09:00:00,Y29tbWVudDoxMDI3ODA5MTc5Mzc3MjQ1XzEzMTA3Nzg5NzY4MTE1Mzk=,Y29tbWVudDoxMDI3ODA5MTc5Mzc3MjQ1XzI0NjA2NzYyMTA5NTMwMjY=,LOL.....delusional,2025-02-01,reply,0,0,1,Y29tbWVudDoxMDI3ODA5MTc5Mzc3MjQ1XzI0NjA2NzYyMTA5NTMwMjY=,1,15,7 days,lol.....delusional,"i'm only going to shop at costco and spend as much as i can due to your dei stance, and tell all my friends to shop there, too! to reject dei is to say, ""i am a racist."" → lol.....delusional"
145,145,1,1 (Relevant),2025-04-20T20:20:45.932807Z,Costco,2025-01-29 09:00:00,Y29tbWVudDoxMDMyMzEyMjAyMjYwMjc2XzEyNzc4ODYyMDAxODAxNTQ=,Y29tbWVudDoxMDMyMzEyMjAyMjYwMjc2XzEzMTAyMTc1OTAxNzA3NTk=,bye bye snowflakes,2025-02-01,reply,1,0,1,Y29tbWVudDoxMDMyMzEyMjAyMjYwMjc2XzEzMTAyMTc1OTAxNzA3NTk=,1,2,0 days,bye bye snowflakes,dei is a joke. → bye bye snowflakes
146,146,1,0 (Not Relevant),2025-04-20T20:20:57.175863Z,Costco,2025-01-28 15:40:00,Y29tbWVudDoxMDMxNzczMjA1NjQ3NTA5Xzk2NDQzOTg0MTgwMTgzOQ==,Y29tbWVudDoxMDMxNzczMjA1NjQ3NTA5XzYyOTU3MTA1MjkxOTc2OA==,and here we have another gutless person thinking they are making a difference,2025-02-01,reply,0,0,1,Y29tbWVudDoxMDMxNzczMjA1NjQ3NTA5Xzk2NDQzOTg0MTgwMTgzOQ==,0,520,0 days,and here we have another gutless person thinking they are making a difference,and here we have another gutless person thinking they are making a difference
147,147,1,0 (Not Relevant),2025-04-20T20:21:03.995457Z,Google,2025-02-19 09:09:00,Y29tbWVudDoxMTg2OTY3MjM2MTE4MDQyXzU5Njg4MTkyNjQ5NzEwNQ==,,Nice,2025-02-20,initial,0,0,0,Y29tbWVudDoxMTg2OTY3MjM2MTE4MDQyXzU5Njg4MTkyNjQ5NzEwNQ==,0,230,0 days,nice,nice
148,148,1,0 (Not Relevant),2025-04-20T20:21:08.534654Z,Google,2025-02-28 13:39:00,Y29tbWVudDoxMTkzNjk0OTE1NDQ1Mjc0XzExNTM4MjUzNzk1Njg4ODM=,,Congratulations google team.and thank you.,2025-03-06,initial,3,0,0,Y29tbWVudDoxMTkzNjk0OTE1NDQ1Mjc0XzExNTM4MjUzNzk1Njg4ODM=,0,440,0 days,congratulations google team.and thank you.,congratulations google team.and thank you.
149,149,1,0 (Not Relevant),2025-04-20T20:21:16.788259Z,Target,2025-02-22 08:15:00,Y29tbWVudDoxMTg1Mjk1NzcyOTU1ODEyXzQ4MjQ4NTE1NzEwNzM0ODE=,Y29tbWVudDoxMTg1Mjk1NzcyOTU1ODEyXzIwNTA5MjMxOTg3NDE2NzQ=,in what way?,2025-02-28,reply,1,0,0,Y29tbWVudDoxMTg1Mjk1NzcyOTU1ODEyXzIwNTA5MjMxOTg3NDE2NzQ=,1,19,0 days,in what way?,"i have been a devoted target shopper for years, but my money will go elsewhere until you grow a spine/conscience. → in what way?"
150,150,1,0 (Not Relevant),2025-04-20T20:21:22.322831Z,Target,2025-01-23 08:01:00,Y29tbWVudDoxMTYzOTEwNDE1MDk0MzQ4XzEyNDQ5MTY3OTMyNjI5NTA=,,Weasels,2025-01-31,initial,13,0,0,Y29tbWVudDoxMTYzOTEwNDE1MDk0MzQ4XzEyNDQ5MTY3OTMyNjI5NTA=,0,139,0 days,weasels,weasels
151,151,1,0 (Not Relevant),2025-04-20T20:21:56.583418Z,Google,2025-01-31 14:11:00,Y29tbWVudDoxMTczOTUzMDk0MDg2MTIzXzI2MTE5MjA3NDU2NzQ0MDQ=,,Hey Google I have a $10 Google Play gift card I bought it to months ago and I put in the code and it said oh yeah okay confirm $10 gift card I say yes and it says we need more information then it says it needs basically see a receipt and the store was bought at can you please take a picture of it and email it to us okay it was a f****** gift you don't put receipts and gifts like are you serious it knows there's 10 dollars on the card how dare you I want my f****** money I want my card,2025-02-27,initial,0,0,0,Y29tbWVudDoxMTczOTUzMDk0MDg2MTIzXzI2MTE5MjA3NDU2NzQ0MDQ=,0,133,0 days,hey google i have a $10 google play gift card i bought it to months ago and i put in the code and it said oh yeah okay confirm $10 gift card i say yes and it says we need more information then it says it needs basically see a receipt and the store was bought at can you please take a picture of it and email it to us okay it was a f****** gift you don't put receipts and gifts like are you serious it knows there's 10 dollars on the card how dare you i want my f****** money i want my card,hey google i have a $10 google play gift card i bought it to months ago and i put in the code and it said oh yeah okay confirm $10 gift card i say yes and it says we need more information then it says it needs basically see a receipt and the store was bought at can you please take a picture of it and email it to us okay it was a f****** gift you don't put receipts and gifts like are you serious it knows there's 10 dollars on the card how dare you i want my f****** money i want my card
152,152,1,0 (Not Relevant),2025-04-20T20:22:02.552961Z,Costco,2025-01-26 19:21:00,Y29tbWVudDoxMDMwNDA2MjQyNDUwODcyXzk3Nzc3NDM0MTA3NjU0NQ==,Y29tbWVudDoxMDMwNDA2MjQyNDUwODcyXzYwMTQ0NTQyOTE3MjU5Mg==,"thank you for sharing. However, the full article was not readable in the format you provided.",2025-02-01,reply,0,0,1,Y29tbWVudDoxMDMwNDA2MjQyNDUwODcyXzk3Nzc3NDM0MTA3NjU0NQ==,0,341,0 days,"thank you for sharing. however, the full article was not readable in the format you provided.","thank you for sharing. however, the full article was not readable in the format you provided."
153,153,1,1 (Relevant),2025-04-20T20:22:08.628136Z,Costco,2025-01-21 12:00:00,Y29tbWVudDoxMDI2NDgwMjY5NTEwMTM2XzkwNDI2MzUyNDg5Mzc4Nw==,,"Thank you for not succumbing to pressure to halt your DEI programs! To express my support, I joined Costco last week (even though my house is too small to store most Costco-size packages) and I just bought a couple of shares of stock. I hope it helps",2025-01-31,initial,33,0,1,Y29tbWVudDoxMDI2NDgwMjY5NTEwMTM2XzkwNDI2MzUyNDg5Mzc4Nw==,0,458,0 days,"thank you for not succumbing to pressure to halt your dei programs! to express my support, i joined costco last week (even though my house is too small to store most costco-size packages) and i just bought a couple of shares of stock. i hope it helps","thank you for not succumbing to pressure to halt your dei programs! to express my support, i joined costco last week (even though my house is too small to store most costco-size packages) and i just bought a couple of shares of stock. i hope it helps"
154,154,1,0 (Not Relevant),2025-04-20T20:22:16.365698Z,Google,2025-02-06 10:26:00,Y29tbWVudDoxMTc3ODI4ODM3MDMxODgyXzIwMzg2OTAwMzMyNjcwNDU=,Y29tbWVudDoxMTc3ODI4ODM3MDMxODgyXzEzNjY0NjkzNjc2ODA4OTA=,everything will be change so soon,2025-02-27,reply,0,0,0,Y29tbWVudDoxMTc3ODI4ODM3MDMxODgyXzg1NTAyMjQ5NjY4Njk3OA==,4,0,14 days,everything will be change so soon,ugh. time to message apple as well! → changed on apple maps too. unbelievable. → everything will be change so soon
155,155,1,0 (Not Relevant),2025-04-20T20:22:28.813711Z,Target,2025-01-24 08:17:00,Y29tbWVudDoxMTY0NjU3NjQxNjg2MjkyXzQ3NjYwNzU5MjE2MjIwOA==,,Really stupid move. They aren’t going to shop with you anyway. Now no one is left,2025-01-31,initial,0,0,0,Y29tbWVudDoxMTY0NjU3NjQxNjg2MjkyXzQ3NjYwNzU5MjE2MjIwOA==,0,488,0 days,really stupid move. they arent going to shop with you anyway. now no one is left,really stupid move. they arent going to shop with you anyway. now no one is left
156,156,1,0 (Not Relevant),2025-04-20T20:22:33.667127Z,Delta,2025-02-13 09:30:00,Y29tbWVudDoxMDIxMzAxOTAwMDE4NzIyXzkzMDg3NDc4NjU4NTQ1OTE=,,Except when planes land upside down.,2025-02-22,initial,0,0,1,Y29tbWVudDoxMDIxMzAxOTAwMDE4NzIyXzkzMDg3NDc4NjU4NTQ1OTE=,0,480,0 days,except when planes land upside down.,except when planes land upside down.
157,157,1,1 (Relevant),2025-04-20T20:23:04.668172Z,Delta,2025-02-17 14:08:00,Y29tbWVudDoxMDI0NTU2NjI5NjkzMjQ5XzE2MjU5NjY3NDgyOTE2ODg=,Y29tbWVudDoxMDI0NTU2NjI5NjkzMjQ5XzYyMjQ5NDY4MDM3MTgwMQ==,How is this positive.,2025-02-22,reply,2,0,1,Y29tbWVudDoxMDI0NTU2NjI5NjkzMjQ5XzYyMjQ5NDY4MDM3MTgwMQ==,1,0,0 days,how is this positive.,thank you for standing by your dei policies → how is this positive.
158,158,1,0 (Not Relevant),2025-04-20T20:23:08.433737Z,Google,2025-01-30 14:51:00,Y29tbWVudDoxMTczMjk0MzcwODE4NjYyXzUxMzAzODIyMTMyNjMzNA==,,Congratulations,2025-02-06,initial,0,0,0,Y29tbWVudDoxMTczMjk0MzcwODE4NjYyXzUxMzAzODIyMTMyNjMzNA==,0,112,0 days,congratulations,congratulations
159,159,1,1 (Relevant),2025-04-20T20:23:14.458493Z,Google,2025-02-06 10:26:00,Y29tbWVudDoxMTc3ODI4ODM3MDMxODgyXzExNzY0MzkyNjcxNzUzMjg=,,Why are you rolling back DEI? https://www.facebook.com/share/18Zqv5Ho7F/?mibextid=wwXIfr,2025-02-13,initial,1,0,0,Y29tbWVudDoxMTc3ODI4ODM3MDMxODgyXzExNzY0MzkyNjcxNzUzMjg=,0,444,0 days,why are you rolling back dei? <url>,why are you rolling back dei? <url>
160,160,1,1 (Relevant),2025-04-20T20:23:19.626509Z,Costco,2025-01-29 09:00:00,Y29tbWVudDoxMDMyMzEyMjAyMjYwMjc2XzE1NjMxMTQyNTQzNDc3ODM=,,Love my Costco shopping and now that I have learned the DEI initiatives they have adopted have made the shopping experience more enjoyable for all customers (with commitment to meeting the wants/needs of all shoppers the main focus)and the bottom financial line stronger I will happily continue my patronage. Don’t relent to the stupidity of the Trump administration…keep your eye on the ball.,2025-02-01,initial,0,0,1,Y29tbWVudDoxMDMyMzEyMjAyMjYwMjc2XzE1NjMxMTQyNTQzNDc3ODM=,0,306,0 days,love my costco shopping and now that i have learned the dei initiatives they have adopted have made the shopping experience more enjoyable for all customers (with commitment to meeting the wants/needs of all shoppers the main focus)and the bottom financial line stronger i will happily continue my patronage. dont relent to the stupidity of the trump administration...keep your eye on the ball.,love my costco shopping and now that i have learned the dei initiatives they have adopted have made the shopping experience more enjoyable for all customers (with commitment to meeting the wants/needs of all shoppers the main focus)and the bottom financial line stronger i will happily continue my patronage. dont relent to the stupidity of the trump administration...keep your eye on the ball.
161,161,1,0 (Not Relevant),2025-04-20T20:23:27.118857Z,Costco,2025-01-26 19:20:00,Y29tbWVudDoxMDMwNDA2MTQ5MTE3NTQ4XzE1NTU0Mjc4ODg0NDc3NTc=,Y29tbWVudDoxMDMwNDA2MTQ5MTE3NTQ4XzkwNjY3MjQ1MTY3MTAwMTI=,are you kidding? People are flocking to them. I can't wait to shop there.,2025-02-01,reply,1,0,1,Y29tbWVudDoxMDMwNDA2MTQ5MTE3NTQ4XzE4NTQ2ODcxMjE5OTcxNDQ=,2,0,0 days,are you kidding? people are flocking to them. i can't wait to shop there.,when are you going to open a store in ri? → they will be closing stores after their stock goes to hell! → are you kidding? people are flocking to them. i can't wait to shop there.
162,162,1,0 (Not Relevant),2025-04-20T20:23:34.233632Z,Costco,2025-01-16 09:00:00,Y29tbWVudDoxMDIyNzMxNzg5ODg0OTg0XzQ4OTUyNDIwMzgxNDMxNw==,Y29tbWVudDoxMDIyNzMxNzg5ODg0OTg0XzkyNDE3MTIwODkyNTMzNzM=,"Francoise, we show item #13777, Packaged Fruit Trees (assorted varieties), available at our Concord warehouse. Feel free to inquire further by calling that location directly. -Christina",2025-01-24,reply,0,0,1,Y29tbWVudDoxMDIyNzMxNzg5ODg0OTg0XzkyNDE3MTIwODkyNTMzNzM=,1,0,7 days,"francoise, we show item #13777, packaged fruit trees (assorted varieties), available at our concord warehouse. feel free to inquire further by calling that location directly. -christina","when will you start carrying fruit plants at costco in concord, ca → francoise, we show item #13777, packaged fruit trees (assorted varieties), available at our concord warehouse. feel free to inquire further by calling that location directly. -christina"
163,163,1,0 (Not Relevant),2025-04-20T20:23:42.409122Z,Delta,2025-02-24 11:00:00,Y29tbWVudDoxMDI5NjQyMTg1ODUxMzYwXzY4NDM4NjIzNDAzMzcxMQ==,,This is really unprofessional of your business,2025-03-08,initial,0,0,1,Y29tbWVudDoxMDI5NjQyMTg1ODUxMzYwXzY4NDM4NjIzNDAzMzcxMQ==,0,69,0 days,this is really unprofessional of your business,this is really unprofessional of your business
164,164,1,0 (Not Relevant),2025-04-20T20:23:47.037244Z,Costco,2025-02-04 14:13:00,Y29tbWVudDoxMDM2ODY0MDQ1MTM4NDI1XzEyODE3MjgzMDMwODEyMDk=,Y29tbWVudDoxMDM2ODY0MDQ1MTM4NDI1XzE2NjAyNDAzNDgyNTk2MzE=,it’s the us Costco page moron,2025-02-09,reply,0,0,1,Y29tbWVudDoxMDM2ODY0MDQ1MTM4NDI1XzE2NjAyNDAzNDgyNTk2MzE=,1,4,0 days,its the us costco page moron,must be american costco → its the us costco page moron
165,165,1,1 (Relevant),2025-04-20T20:23:59.636150Z,Costco,2025-01-26 19:20:00,Y29tbWVudDoxMDMwNDA2MTQ5MTE3NTQ4XzYzODk2Mjg1NTIxODE3Mw==,,Thank you for standing strong and respecting your employees and your corporate mission! We appreciate your leadership!,2025-02-01,initial,1,0,1,Y29tbWVudDoxMDMwNDA2MTQ5MTE3NTQ4XzYzODk2Mjg1NTIxODE3Mw==,0,163,0 days,thank you for standing strong and respecting your employees and your corporate mission! we appreciate your leadership!,thank you for standing strong and respecting your employees and your corporate mission! we appreciate your leadership!
166,166,1,0 (Not Relevant),2025-04-20T20:24:05.237097Z,Costco,2025-01-18 12:00:00,Y29tbWVudDoxMDI0MzM4NTg2MzkwOTcxXzEwNDMwODc3NTc2NjYxNjQ=,Y29tbWVudDoxMDI0MzM4NTg2MzkwOTcxXzEyODIzNjk5MTI5NzAxMjA=,"Imelda, noted, thanks for sharing your interest!",2025-01-24,reply,0,0,1,Y29tbWVudDoxMDI0MzM4NTg2MzkwOTcxXzEyODIzNjk5MTI5NzAxMjA=,1,0,0 days,"imelda, noted, thanks for sharing your interest!","hey costco! could you bring more product like asian foods? → imelda, noted, thanks for sharing your interest!"
167,167,1,0 (Not Relevant),2025-04-20T20:24:12.940279Z,Costco,2025-01-18 12:00:00,Y29tbWVudDoxMDI0MzM4NTg2MzkwOTcxXzQwNzg2NDI3NzIzNjYwNzc=,Y29tbWVudDoxMDI0MzM4NTg2MzkwOTcxXzk3MDAxNzMwMTcxODMyNA==,disgusting and tilapia is the worst!,2025-01-24,reply,4,0,1,Y29tbWVudDoxMDI0MzM4NTg2MzkwOTcxXzU4MDE2MzU4NDgyNjEzMQ==,3,0,0 days,disgusting and tilapia is the worst!,"john bartush its easy... farm raised fish and shrimp are raised in cesspools. → correct! there is absolutely no regulation on what the farm raised seafood is fed. a lot of it gets fed other animal feces (pig feces, for example). → disgusting and tilapia is the worst!"
168,168,1,1 (Relevant),2025-04-20T20:24:18.228376Z,Costco,2025-01-28 15:40:00,Y29tbWVudDoxMDMxNzczMjA1NjQ3NTA5XzEyNzMxMjMzNTcxMTA1MjM=,,I for one will slow my shopping at Costco while you support DEI,2025-02-01,initial,2,0,1,Y29tbWVudDoxMDMxNzczMjA1NjQ3NTA5XzEyNzMxMjMzNTcxMTA1MjM=,0,520,0 days,i for one will slow my shopping at costco while you support dei,i for one will slow my shopping at costco while you support dei
169,169,1,0 (Not Relevant),2025-04-20T20:24:25.692465Z,Costco,2025-01-21 12:00:00,Y29tbWVudDoxMDI2NDgwMjY5NTEwMTM2XzUwMDIxMjM4MzEwNjMyOQ==,Y29tbWVudDoxMDI2NDgwMjY5NTEwMTM2Xzk1NzU1NjM2NTkwMjEzNg==,No my problem is with Costco not enforcing the 2 box limit they imposed,2025-01-24,reply,0,0,1,Y29tbWVudDoxMDI2NDgwMjY5NTEwMTM2XzYwMDMyNDYxNjI3MTg3OA==,2,0,0 days,no my problem is with costco not enforcing the 2 box limit they imposed,do better costco → they are a wholesaler your problem is with the manufacturer → no my problem is with costco not enforcing the 2 box limit they imposed
170,170,1,1 (Relevant),2025-04-20T20:24:36.229958Z,Costco,2025-01-27 15:18:00,Y29tbWVudDoxMDMxMDIyMzcyMzg5MjU5XzEyMzY3NjkxNjQwNzc1OTI=,,I can’t believe how many racists￼ there are in the comments on this post that are actually proud to be racist. Screw all of you and I will do all of my shopping possible at Costco from here on out!,2025-02-01,initial,1,0,1,Y29tbWVudDoxMDMxMDIyMzcyMzg5MjU5XzEyMzY3NjkxNjQwNzc1OTI=,0,899,0 days,i cant believe how many racists there are in the comments on this post that are actually proud to be racist. screw all of you and i will do all of my shopping possible at costco from here on out!,i cant believe how many racists there are in the comments on this post that are actually proud to be racist. screw all of you and i will do all of my shopping possible at costco from here on out!
171,171,1,0 (Not Relevant),2025-04-20T20:24:40.367151Z,Delta,2025-02-17 14:08:00,Y29tbWVudDoxMDI0NTU2NjI5NjkzMjQ5XzE4NzMwNTk3NTY4Mjk4ODA=,,Thank the Lord,2025-02-22,initial,2,0,1,Y29tbWVudDoxMDI0NTU2NjI5NjkzMjQ5XzE4NzMwNTk3NTY4Mjk4ODA=,0,540,0 days,thank the lord,thank the lord
172,172,1,0 (Not Relevant),2025-04-20T20:24:57.799238Z,Delta,2025-02-18 06:49:00,Y29tbWVudDoxMDI1MDcyNTEyOTc0OTk0XzEwODUzMTgzMDAwMTc5Nzg=,Y29tbWVudDoxMDI1MDcyNTEyOTc0OTk0Xzk5NTI3MzYzNTgzNjQzMQ==,Please do not spread false information about the crew. Endeavor air doesn't have gray strips on their shirts. This is clearly a picture of another regional pilot crew.,2025-02-22,reply,2,0,1,Y29tbWVudDoxMDI1MDcyNTEyOTc0OTk0XzEwODUzMTgzMDAwMTc5Nzg=,0,510,0 days,please do not spread false information about the crew. endeavor air doesn't have gray strips on their shirts. this is clearly a picture of another regional pilot crew.,please do not spread false information about the crew. endeavor air doesn't have gray strips on their shirts. this is clearly a picture of another regional pilot crew.
173,173,1,0 (Not Relevant),2025-04-20T20:25:06.878021Z,Costco,2025-02-20 13:00:00,Y29tbWVudDoxMDQ4OTQ1NjYzOTMwMjYzXzExMTk1MzA1MDk4NzE3NDY=,Y29tbWVudDoxMDQ4OTQ1NjYzOTMwMjYzXzU1NjQzMjgzNzQyMDY1NQ==,"Kristan- Oh no! We’re certainly sorry to hear of your experience with the frozen blueberries you purchased. We recommend you return it to your local Costco at your earliest convenience for a full refund. If you’ve already disposed of it, please contact the location. Our staff is equipped to assist in these matters. -Max",2025-03-02,reply,7,0,1,Y29tbWVudDoxMDQ4OTQ1NjYzOTMwMjYzXzU1NjQzMjgzNzQyMDY1NQ==,1,5,7 days,"kristan- oh no! were certainly sorry to hear of your experience with the frozen blueberries you purchased. we recommend you return it to your local costco at your earliest convenience for a full refund. if youve already disposed of it, please contact the location. our staff is equipped to assist in these matters. -max","costco the kirkland organic frozen blueberries at bellingham have a lot of rotten blueberries in them! very shriveled up, with a white film on the exterior, and brown insides! i just opened my second bag of them! → kristan- oh no! were certainly sorry to hear of your experience with the frozen blueberries you purchased. we recommend you return it to your local costco at your earliest convenience for a full refund. if youve already disposed of it, please contact the location. our staff is equipped to assist in these matters. -max"
174,174,1,0 (Not Relevant),2025-04-20T20:25:17.355397Z,Delta,2025-02-18 06:49:00,Y29tbWVudDoxMDI1MDcyNTEyOTc0OTk0XzE2ODM1Njc0MzU5MDkwMDI=,Y29tbWVudDoxMDI1MDcyNTEyOTc0OTk0Xzk4MDA0MzIzNjk1OTUyMg==,agree that it looked like a hard landing and perhaps the left landing gear collapsed ( left as looking at the plane from straight on). Wind is definitely a factor. So glad everyone got out!,2025-02-22,reply,0,0,1,Y29tbWVudDoxMDI1MDcyNTEyOTc0OTk0XzEzNTU2ODUwODU0NTc3Njg=,3,2,0 days,agree that it looked like a hard landing and perhaps the left landing gear collapsed ( left as looking at the plane from straight on). wind is definitely a factor. so glad everyone got out!,"never mind i just seen the other video. that was definitely a freak accident. looks like the touched down and wind lifted one side causing wing to hit ground and plane to roll. → only speculation based on information, but seems like a hard landing (for unknown reason) that caused the gear to break due to the hard landing. → agree that it looked like a hard landing and perhaps the left landing gear collapsed ( left as looking at the plane from straight on). wind is definitely a factor. so glad everyone got out!"
175,175,1,1 (Relevant),2025-04-20T20:25:22.025820Z,Costco,2025-01-22 13:45:00,Y29tbWVudDoxMDI3MjI4OTIyNzY4NjA0XzExNjIwNzIwMTg5MjczMzU=,Y29tbWVudDoxMDI3MjI4OTIyNzY4NjA0XzI1Nzg3MTUxMDIzMTU1MDI=,"They don't have a DEI department; they just don't discriminate based on gender, race or sexual orientation. What do you have against fair hiring practices?",2025-01-31,reply,0,0,1,Y29tbWVudDoxMDI3MjI4OTIyNzY4NjA0XzI1Nzg3MTUxMDIzMTU1MDI=,1,16,0 days,"they don't have a dei department; they just don't discriminate based on gender, race or sexual orientation. what do you have against fair hiring practices?","costco needs to end its dei department now!!! → they don't have a dei department; they just don't discriminate based on gender, race or sexual orientation. what do you have against fair hiring practices?"
176,176,1,0 (Not Relevant),2025-04-20T20:25:26.828004Z,Google,2025-02-10 13:54:00,Y29tbWVudDoxMTgwNjc5NzUzNDEzNDU3XzExNjU2Mzg0ODE4NTQ0NTA=,,"Honey, please send me a private message",2025-02-13,initial,0,0,0,Y29tbWVudDoxMTgwNjc5NzUzNDEzNDU3XzExNjU2Mzg0ODE4NTQ0NTA=,0,676,0 days,"honey, please send me a private message","honey, please send me a private message"
177,177,1,1 (Relevant),2025-04-20T20:25:33.315927Z,Costco,2025-02-03 11:07:00,Y29tbWVudDoxMDM2MDU3NTIxODg1NzQ0XzcyMjEyODcwMzY4NTM1OA==,Y29tbWVudDoxMDM2MDU3NTIxODg1NzQ0XzU0MDI5MjA2NDk4ODE0Mw==,boy oh boy are you gonna be surprised at what happens with these new tariffs that you Traitor in Chief just penned.,2025-02-09,reply,6,0,1,Y29tbWVudDoxMDM2MDU3NTIxODg1NzQ0Xzk2OTU5OTQ1Nzk3MTMyNw==,3,1,0 days,boy oh boy are you gonna be surprised at what happens with these new tariffs that you traitor in chief just penned.,says the mediocre white guy who doesn't know what dei is. stop it. you're embarrassing. → that's dei in a nutshell. makes you say racist comments. grow up and be an american. division inequity and exclusion → boy oh boy are you gonna be surprised at what happens with these new tariffs that you traitor in chief just penned.
