task_id,annotation_id,completed_by,relevance_choice,annotation_created_at,company_name,post_date,comment_id,parent_id,comment_text,comment_date,comment_type,reaction_count,before_DEI,has_DEI,root_id,depth,sibling_count,time_since_root,cleaned_text,full_text
336,336,1,0 (Not Relevant),2025-04-20T21:06:30.512323Z,Google,2025-01-31 14:11:00,Y29tbWVudDoxMTczOTUzMDk0MDg2MTIzXzEzNTcxMDAyOTIxMjQ4ODM=,,"welcome my Google, good job, thanks Google",2025-02-06,initial,1,0,0,Y29tbWVudDoxMTczOTUzMDk0MDg2MTIzXzEzNTcxMDAyOTIxMjQ4ODM=,0,133,0 days,"welcome my google, good job, thanks google","welcome my google, good job, thanks google"
337,337,1,0 (Not Relevant),2025-04-20T21:06:39.130965Z,Target,2025-01-30 07:55:00,Y29tbWVudDoxMTY5MDA3NTk0NTg0NjMwXzEwMjA0OTQ5MDk4OTE3OTE=,Y29tbWVudDoxMTY5MDA3NTk0NTg0NjMwXzYzODI4MjkxMjAyODkyMg==,no we just keeping our money in our pocket.,2025-01-31,reply,30,0,0,Y29tbWVudDoxMTY5MDA3NTk0NTg0NjMwXzYzODI4MjkxMjAyODkyMg==,1,5,0 days,no we just keeping our money in our pocket.,lol so many butthurt people keep coming back to the comments section just to get mad and comment more. keep target rent free in your heads! i love it! → no we just keeping our money in our pocket.
338,338,1,0 (Not Relevant),2025-04-20T21:06:45.661397Z,Delta,2025-02-18 06:49:00,Y29tbWVudDoxMDI1MDcyNTEyOTc0OTk0XzExNjkyMjUyNjQ3MzEwMDI=,Y29tbWVudDoxMDI1MDcyNTEyOTc0OTk0XzExMjYwMjgzMDU5MzMxNDQ=,how bout we get some facts first ! You a pilot?,2025-02-22,reply,10,0,1,Y29tbWVudDoxMDI1MDcyNTEyOTc0OTk0XzExMjYwMjgzMDU5MzMxNDQ=,1,17,0 days,how bout we get some facts first ! you a pilot?,"the delta pilot should be stripped. no job, no retirement. he had no idea what he was doing. → how bout we get some facts first ! you a pilot?"
339,339,1,0 (Not Relevant),2025-04-20T21:06:50.487382Z,Costco,2025-02-15 09:00:00,Y29tbWVudDoxMDQ0ODExNzY0MzQzNjUzXzEyMTg1Mjc0OTM2MDg2MDA=,,Awww so adorable,2025-02-16,initial,2,0,1,Y29tbWVudDoxMDQ0ODExNzY0MzQzNjUzXzEyMTg1Mjc0OTM2MDg2MDA=,0,44,0 days,awww so adorable,awww so adorable
340,340,1,1 (Relevant),2025-04-20T21:07:01.059199Z,Costco,2025-01-29 09:00:00,Y29tbWVudDoxMDMyMzEyMjAyMjYwMjc2XzkyOTQ1MDAyOTM0NDY2OA==,Y29tbWVudDoxMDMyMzEyMjAyMjYwMjc2XzE0MDQzNzc0Njc2MzczMzY=,"So educate me please, if I'm 'ignorant'.",2025-02-01,reply,0,0,1,Y29tbWVudDoxMDMyMzEyMjAyMjYwMjc2XzkxNzQzMDMyMzkyOTkyMDM=,10,0,0 days,"so educate me please, if i'm 'ignorant'.","why would you assume that the most qualified isn't going to be someone of color? whitey has made sure for far too long that poc can't get ahead. → you apparently don't understand the rules for dei. i'm not assuming anything, you're just ignorant. → so educate me please, if i'm 'ignorant'."
341,341,1,0 (Not Relevant),2025-04-20T21:07:14.646360Z,Costco,2025-01-28 15:40:00,Y29tbWVudDoxMDMxNzczMjA1NjQ3NTA5Xzg0MjE1NDgyNjEyODA2MDA=,,I would tell you on X but you shut it down,2025-02-01,initial,1,0,1,Y29tbWVudDoxMDMxNzczMjA1NjQ3NTA5Xzg0MjE1NDgyNjEyODA2MDA=,0,520,0 days,i would tell you on x but you shut it down,i would tell you on x but you shut it down
342,342,1,0 (Not Relevant),2025-04-20T21:07:31.359530Z,Costco,2025-01-14 09:15:00,Y29tbWVudDoxMDIxMzAxNjkwMDI3OTk0XzEzMjgxNzE1NzgyMTM2NTk=,Y29tbWVudDoxMDIxMzAxNjkwMDI3OTk0XzY0MTExNDU5ODMzNzc2MA==,"unfortunately. If you want people to manage huge organizations with many thousands of people, and an experienced leader, you have to pay. ￼",2025-01-17,reply,2,1,1,Y29tbWVudDoxMDIxMzAxNjkwMDI3OTk0XzExNzE4MjgzMTEwMjc1MjE=,3,0,0 days,"unfortunately. if you want people to manage huge organizations with many thousands of people, and an experienced leader, you have to pay.","why? → the monies going to staff and overhead versus actually going towards the cause. the main person makes a high 6 figure salary your donations isn't going towards the cause → unfortunately. if you want people to manage huge organizations with many thousands of people, and an experienced leader, you have to pay."
343,343,1,0 (Not Relevant),2025-04-20T21:07:39.282722Z,Google,2025-01-22 13:06:00,Y29tbWVudDoxMTY3NjYzODQxMzgxNzE1XzQyNzUxNzMzNzAyMTAwOQ==,,"I have designed a logarithm of supranational regulatory foundation that, in the face of the daily challenges that Google faces, safeguards it from lawsuits for unfair competition, dominance over the market on internet platforms and monopoly. I gladly await your kind response.",2025-01-30,initial,0,1,0,Y29tbWVudDoxMTY3NjYzODQxMzgxNzE1XzQyNzUxNzMzNzAyMTAwOQ==,0,48,0 days,"i have designed a logarithm of supranational regulatory foundation that, in the face of the daily challenges that google faces, safeguards it from lawsuits for unfair competition, dominance over the market on internet platforms and monopoly. i gladly await your kind response.","i have designed a logarithm of supranational regulatory foundation that, in the face of the daily challenges that google faces, safeguards it from lawsuits for unfair competition, dominance over the market on internet platforms and monopoly. i gladly await your kind response."
344,344,1,1 (Relevant),2025-04-20T21:07:44.227036Z,Google,2025-02-06 07:26:00,Y29tbWVudDoxMTQ2MDY0MjQ2OTA1NTUxXzEyMDQ0ODcwMzgzNDk4NTY=,,We got anti-Semitic Google before GTAVI,2025-02-13,initial,0,0,0,Y29tbWVudDoxMTQ2MDY0MjQ2OTA1NTUxXzEyMDQ0ODcwMzgzNDk4NTY=,0,114,0 days,we got anti-semitic google before gtavi,we got anti-semitic google before gtavi
345,345,1,0 (Not Relevant),2025-04-20T21:07:48.950214Z,Google,2025-02-19 09:09:00,Y29tbWVudDoxMTg2OTY3MjM2MTE4MDQyXzE3OTcxNTQzODA4NDgyNDc=,,Very god,2025-02-20,initial,0,0,0,Y29tbWVudDoxMTg2OTY3MjM2MTE4MDQyXzE3OTcxNTQzODA4NDgyNDc=,0,230,0 days,very god,very god
346,346,1,0 (Not Relevant),2025-04-20T21:07:55.750968Z,Google,2025-03-03 09:03:00,Y29tbWVudDoxMTk1NzMzMTA1MjQxNDU1XzM1NDY5ODY0NjIyNzU4Mzg=,Y29tbWVudDoxMTk1NzMzMTA1MjQxNDU1Xzk5NzQwNzY5NTc4NDcxNQ==,"This,great",2025-03-06,reply,0,0,0,Y29tbWVudDoxMTk1NzMzMTA1MjQxNDU1Xzk5NzQwNzY5NTc4NDcxNQ==,1,0,0 days,"this,great","hey! can i toggle the map to change the name of the gulf of mexico back to the gulf of mexico? this gulf of america bull crap is stupid. → this,great"
347,347,1,0 (Not Relevant),2025-04-20T21:08:01.596529Z,Costco,2025-01-29 09:00:00,Y29tbWVudDoxMDMyMzEyMjAyMjYwMjc2XzExNDIzNTkyNzc0NDQwNjU=,Y29tbWVudDoxMDMyMzEyMjAyMjYwMjc2XzYwMDM3MzU4NTk0Mzg3NQ==,Dear? Are you Ghanaian?,2025-02-01,reply,0,0,1,Y29tbWVudDoxMDMyMzEyMjAyMjYwMjc2XzE2MTYxNDg3MjI0NDI2MzE=,4,0,0 days,dear? are you ghanaian?,verstehen sie sarcasm aly oops? → well. that's just stupid. try again dear. → dear? are you ghanaian?
348,348,1,0 (Not Relevant),2025-04-20T21:08:08.460127Z,Target,2025-02-22 08:15:00,Y29tbWVudDoxMTg1Mjk1NzcyOTU1ODEyXzE4NTc2NDM5OTE2NDAwNzg=,Y29tbWVudDoxMTg1Mjk1NzcyOTU1ODEyXzYwMDc1NDM3OTQ3MTcxNQ==,home Goods!,2025-02-28,reply,1,0,0,Y29tbWVudDoxMTg1Mjk1NzcyOTU1ODEyXzEzMzAxOTE2MjQ4NTE0MTc=,3,0,0 days,home goods!,im confused. what exactly is target doing/not doing? → good question! → home goods!
349,349,1,0 (Not Relevant),2025-04-20T21:08:14.132408Z,Target,2025-02-02 11:06:00,Y29tbWVudDoxMTcxMzM2NDkxMDE4NDA3XzE2ODg5NTUwMTQ5ODcxMzg=,Y29tbWVudDoxMTcxMzM2NDkxMDE4NDA3XzQ5ODM2OTgxMjkxODM4OA==,same!!,2025-02-07,reply,0,0,0,Y29tbWVudDoxMTcxMzM2NDkxMDE4NDA3XzQ5ODM2OTgxMjkxODM4OA==,1,15,0 days,same!!,i ran to these comments with lightning speed for the dragging and i was not disappointed → same!!
350,350,1,0 (Not Relevant),2025-04-20T21:08:24.288079Z,Google,2025-02-05 08:47:00,Y29tbWVudDoxMTczOTUzMDk0MDg2MTIzXzIzOTA5NTIyMzQ2MDU0MDY=,,"Why does Google show you many search results when you search, far from what you are searching for, and you also have to search in the results.....just because your search words are similar to the words of the topics....Why isn't there a search (classified carousel)?",2025-02-06,initial,11,0,0,Y29tbWVudDoxMTczOTUzMDk0MDg2MTIzXzIzOTA5NTIyMzQ2MDU0MDY=,0,98,0 days,"why does google show you many search results when you search, far from what you are searching for, and you also have to search in the results.....just because your search words are similar to the words of the topics....why isn't there a search (classified carousel)?","why does google show you many search results when you search, far from what you are searching for, and you also have to search in the results.....just because your search words are similar to the words of the topics....why isn't there a search (classified carousel)?"
351,351,1,0 (Not Relevant),2025-04-20T21:08:31.509398Z,Costco,2025-02-11 14:38:00,Y29tbWVudDoxMDQxOTQ2MTUxMjk2ODgxXzI1MDIzNDYzODM0MzMxNTY=,Y29tbWVudDoxMDQxOTQ2MTUxMjk2ODgxXzY0MTYzMDEyODMyOTQ1Ng==,"so you are saying I’m safe from running into the likes of you there? Well thank the heavens for that, I may move in there if that’s the case",2025-02-16,reply,20,0,1,Y29tbWVudDoxMDQxOTQ2MTUxMjk2ODgxXzY0MTYzMDEyODMyOTQ1Ng==,1,12,0 days,"so you are saying im safe from running into the likes of you there? well thank the heavens for that, i may move in there if thats the case","go woke / go broke → so you are saying im safe from running into the likes of you there? well thank the heavens for that, i may move in there if thats the case"
352,352,1,0 (Not Relevant),2025-04-20T21:08:39.700376Z,Delta,2025-02-17 14:08:00,Y29tbWVudDoxMDI0NTU2NjI5NjkzMjQ5XzI1ODc4NTM5NzgwNzA5NDE=,Y29tbWVudDoxMDI0NTU2NjI5NjkzMjQ5XzYwMTUzMjEzOTQzMTc2OA==,"Surviving to the hospital is a good sign though. Critical condition means a lot of different things also, but still",2025-02-22,reply,1,0,1,Y29tbWVudDoxMDI0NTU2NjI5NjkzMjQ5XzYwOTYxODEwMTg3MTkyNQ==,2,0,0 days,"surviving to the hospital is a good sign though. critical condition means a lot of different things also, but still","glad to hear no fatalities. kudos to all crew, toronto staff, etc. hoping the various local hospitals were able to absorb the evaluations of the passengers without too much difficulty → yet. a few in critical condition → surviving to the hospital is a good sign though. critical condition means a lot of different things also, but still"
353,353,1,0 (Not Relevant),2025-04-20T21:08:44.613268Z,Costco,2025-02-12 09:23:00,Y29tbWVudDoxMDQyNDY2Mzc0NTc4MTkyXzk3Njg1MjA1NzcxNzIwMg==,,Jimmy Rivera !!!!!,2025-02-16,initial,0,0,1,Y29tbWVudDoxMDQyNDY2Mzc0NTc4MTkyXzk3Njg1MjA1NzcxNzIwMg==,0,120,0 days,jimmy rivera !!!!!,jimmy rivera !!!!!
354,354,1,0 (Not Relevant),2025-04-20T21:08:56.587492Z,Google,2025-02-05 09:03:00,Y29tbWVudDoxMTc3MTQ3NzcwNDMzMzIyXzExNzQ2NjUxNzQxNzYzMzM=,,Google still running WOKE and DEI Look at the Rainbow in the name,2025-02-13,initial,0,0,0,Y29tbWVudDoxMTc3MTQ3NzcwNDMzMzIyXzExNzQ2NjUxNzQxNzYzMzM=,0,122,0 days,google still running woke and dei look at the rainbow in the name,google still running woke and dei look at the rainbow in the name
355,355,1,0 (Not Relevant),2025-04-20T21:09:03.844060Z,Costco,2025-02-09 09:00:00,Y29tbWVudDoxMDM5NjIyNDU0ODYyNTg0XzEzNDkxNDE0OTk2MDQ0NjQ=,,"I love these. They come out with a new set every year. After buying them for 3 years, I told myself I couldn't buy anymore. I didn't need them. I usually get a couple of boxes each year when the death star appears. I use them for gifts. I love them.",2025-02-16,initial,0,0,1,Y29tbWVudDoxMDM5NjIyNDU0ODYyNTg0XzEzNDkxNDE0OTk2MDQ0NjQ=,0,801,0 days,"i love these. they come out with a new set every year. after buying them for 3 years, i told myself i couldn't buy anymore. i didn't need them. i usually get a couple of boxes each year when the death star appears. i use them for gifts. i love them.","i love these. they come out with a new set every year. after buying them for 3 years, i told myself i couldn't buy anymore. i didn't need them. i usually get a couple of boxes each year when the death star appears. i use them for gifts. i love them."
356,356,1,0 (Not Relevant),2025-04-20T21:09:08.006294Z,Costco,2025-02-05 10:15:00,Y29tbWVudDoxMDM3NDU4MTExNzQ1Njg1XzE0MDQxMDU1MTA1NjA1ODU=,,There ya go Lisa Narveson,2025-02-09,initial,0,0,1,Y29tbWVudDoxMDM3NDU4MTExNzQ1Njg1XzE0MDQxMDU1MTA1NjA1ODU=,0,293,0 days,there ya go lisa narveson,there ya go lisa narveson
357,357,1,0 (Not Relevant),2025-04-20T21:09:12.521662Z,Delta,2025-02-13 09:30:00,Y29tbWVudDoxMDIxMzAxOTAwMDE4NzIyXzE1OTAyMDgxNTQ5ODUyNjI=,,Sign us up!,2025-04-05,initial,0,0,1,Y29tbWVudDoxMDIxMzAxOTAwMDE4NzIyXzE1OTAyMDgxNTQ5ODUyNjI=,0,480,0 days,sign us up!,sign us up!
358,358,1,0 (Not Relevant),2025-04-20T21:09:23.571321Z,Costco,2025-02-07 09:00:00,Y29tbWVudDoxMDM4ODY0NTIxNjA1MDQ0XzExMjIyNzMyMjYyOTY1NzI=,Y29tbWVudDoxMDM4ODY0NTIxNjA1MDQ0XzEyOTk2ODc5NjQ0ODI3MjU=,bye,2025-02-09,reply,0,0,1,Y29tbWVudDoxMDM4ODY0NTIxNjA1MDQ0XzEyOTk2ODc5NjQ0ODI3MjU=,1,6,0 days,bye,i will no longer shop at costco until they change their perverted policies. → bye
359,359,1,0 (Not Relevant),2025-04-20T21:09:27.742063Z,Costco,2025-02-16 09:00:00,Y29tbWVudDoxMDQ1NjAzNjA0MjY0NDY5XzEzMzUwMjg3OTQyMTE5MjM=,,It should be “combo” pulls,2025-02-16,initial,7,0,1,Y29tbWVudDoxMDQ1NjAzNjA0MjY0NDY5XzEzMzUwMjg3OTQyMTE5MjM=,0,134,0 days,it should be combo pulls,it should be combo pulls
360,360,1,0 (Not Relevant),2025-04-20T21:09:31.659067Z,Google,2025-01-22 10:58:00,Y29tbWVudDoxMTY3NjA5MTE0NzIwNTIxXzExMjcxOTYxMTE4NjAyNzE=,,good information technology,2025-01-23,initial,0,1,0,Y29tbWVudDoxMTY3NjA5MTE0NzIwNTIxXzExMjcxOTYxMTE4NjAyNzE=,0,71,0 days,good information technology,good information technology
361,361,1,1 (Relevant),2025-04-20T21:09:42.098847Z,Google,2025-01-30 14:51:00,Y29tbWVudDoxMTczMjk0MzcwODE4NjYyXzExNTczMzkyNDU5NDc1Nzg=,Y29tbWVudDoxMTczMjk0MzcwODE4NjYyXzU4ODcwNjExMDk4NjM5Mw==,great job,2025-02-06,reply,1,0,0,Y29tbWVudDoxMTczMjk0MzcwODE4NjYyXzU4ODcwNjExMDk4NjM5Mw==,1,0,0 days,great job,"we're so proud to represent our home state of west virginia in the campaign! we're inspired by all of these stories. as a woman-owned, family-run small business, we know what it takes to make it work. thanks to google workspace with gemini for including us! → great job"
362,362,1,0 (Not Relevant),2025-04-20T21:10:01.033658Z,Costco,2025-01-30 10:37:00,Y29tbWVudDoxMDMzMDc4OTQ1NTE2OTM1XzUzMTk1ODE3MjU2MDAxMQ==,Y29tbWVudDoxMDMzMDc4OTQ1NTE2OTM1XzExNjgxODQ1Njc5ODE1ODE=,"Enoch 98: 2For ye men shall put on more adornments than a woman, And coloured garments more than a virgin: In royalty and in grandeur and in power, And in silver and in gold and in purple, And in splendour and in food they shall be poured out as water. 3Therefore they shall be wanting in doctrine and wisdom, And they shall perish thereby together with their possessions; And with all their glory and their splendour, And in shame and in slaughter and in great destitution, Their spirits shall be cast into the furnace of fire.",2025-02-01,reply,2,0,1,Y29tbWVudDoxMDMzMDc4OTQ1NTE2OTM1XzEzMzU2Njk4Nzc0NjM5MjM=,2,0,0 days,"enoch 98: 2for ye men shall put on more adornments than a woman, and coloured garments more than a virgin: in royalty and in grandeur and in power, and in silver and in gold and in purple, and in splendour and in food they shall be poured out as water. 3therefore they shall be wanting in doctrine and wisdom, and they shall perish thereby together with their possessions; and with all their glory and their splendour, and in shame and in slaughter and in great destitution, their spirits shall be cast into the furnace of fire.","we canceled our costco membership after 25 years. we went into the store to ask a full refund! they complied. → oh thank god! so happy to hear this move by the amazing costco is weeding out people like you. → enoch 98: 2for ye men shall put on more adornments than a woman, and coloured garments more than a virgin: in royalty and in grandeur and in power, and in silver and in gold and in purple, and in splendour and in food they shall be poured out as water. 3therefore they shall be wanting in doctrine and wisdom, and they shall perish thereby together with their possessions; and with all their glory and their splendour, and in shame and in slaughter and in great destitution, their spirits shall be cast into the furnace of fire."
363,363,1,0 (Not Relevant),2025-04-20T21:10:06.338571Z,Google,2025-01-31 14:11:00,Y29tbWVudDoxMTczOTUzMDk0MDg2MTIzXzEzOTk4MzMzNjgwNjEwOTc=,,It can't be the year of the snake. I thought he left office on January 20th?,2025-02-06,initial,0,0,0,Y29tbWVudDoxMTczOTUzMDk0MDg2MTIzXzEzOTk4MzMzNjgwNjEwOTc=,0,133,0 days,it can't be the year of the snake. i thought he left office on january 20th?,it can't be the year of the snake. i thought he left office on january 20th?
364,364,1,1 (Relevant),2025-04-20T21:10:34.231785Z,Target,2025-02-23 09:39:00,Y29tbWVudDoxMTg2MDQwMTY5NTQ4MDM5XzE2OTM0MDUxODgyNzk2NDk=,,"Who’s going to tell the kids what DEI was when they grow up to a dog eat dog lifestyle, and millionaire’s don’t have an opened mind for different people .",2025-02-28,initial,93,0,0,Y29tbWVudDoxMTg2MDQwMTY5NTQ4MDM5XzE2OTM0MDUxODgyNzk2NDk=,0,146,0 days,"whos going to tell the kids what dei was when they grow up to a dog eat dog lifestyle, and millionaires dont have an opened mind for different people .","whos going to tell the kids what dei was when they grow up to a dog eat dog lifestyle, and millionaires dont have an opened mind for different people ."
365,365,1,1 (Relevant),2025-04-20T21:10:39.433191Z,Costco,2025-01-26 19:21:00,Y29tbWVudDoxMDMwNDA2MjQyNDUwODcyXzE4NTU4MDk1NTE4MjQ4MzM=,Y29tbWVudDoxMDMwNDA2MjQyNDUwODcyXzExNjgyNjYyOTE1NjgyODA=,Dale Earnhardt Incorporated.,2025-02-01,reply,1,0,1,Y29tbWVudDoxMDMwNDA2MjQyNDUwODcyXzE1NDAyMTE1MDY2ODkyNjU=,2,0,0 days,dale earnhardt incorporated.,go woke go broke. dei is divisive and toxic. → do you even know what dei stands for? → dale earnhardt incorporated.
366,366,1,1 (Relevant),2025-04-20T21:10:49.042679Z,Target,2025-02-22 08:15:00,Y29tbWVudDoxMTg1Mjk1NzcyOTU1ODEyXzIyNTM2MDAwNzUwNDA1OTk=,,"Still think abandoning your DEI policies is a good idea, Target? The comments seem to say otherwise.",2025-02-28,initial,8,0,0,Y29tbWVudDoxMTg1Mjk1NzcyOTU1ODEyXzIyNTM2MDAwNzUwNDA1OTk=,0,205,0 days,"still think abandoning your dei policies is a good idea, target? the comments seem to say otherwise.","still think abandoning your dei policies is a good idea, target? the comments seem to say otherwise."
367,367,1,0 (Not Relevant),2025-04-20T21:10:54.673543Z,Costco,2025-02-17 15:16:00,Y29tbWVudDoxMDQ2NTU4MDQ3NTAyMzU4XzE2MTYwNDg4MjI2MTg1NTY=,,"Breaded chicken sandwiches in the frozen department, they were the best,bring them back",2025-02-23,initial,1,0,1,Y29tbWVudDoxMDQ2NTU4MDQ3NTAyMzU4XzE2MTYwNDg4MjI2MTg1NTY=,0,168,0 days,"breaded chicken sandwiches in the frozen department, they were the best,bring them back","breaded chicken sandwiches in the frozen department, they were the best,bring them back"
368,368,1,0 (Not Relevant),2025-04-20T21:11:08.314990Z,Costco,2025-01-27 15:18:00,Y29tbWVudDoxMDMxMDIyMzcyMzg5MjU5XzE1OTU4OTQwODQzODI3NzA=,Y29tbWVudDoxMDMxMDIyMzcyMzg5MjU5XzE3MzQ3MjY1MDM3NjU1ODE=,"oh, you’re a troll",2025-02-01,reply,1,0,1,Y29tbWVudDoxMDMxMDIyMzcyMzg5MjU5XzE1OTU4OTQwODQzODI3NzA=,0,899,0 days,"oh, youre a troll","oh, youre a troll"
369,369,1,0 (Not Relevant),2025-04-20T21:11:15.379538Z,Delta,2025-02-18 06:49:00,Y29tbWVudDoxMDI1MDcyNTEyOTc0OTk0XzEzMzgxMzYxODA5MzgwMjQ=,,"I sincerely hope your heroic crew are well compensated, looked after and acknowledged for saving the lives of everyone onboard. It’s so much more then just “chicken or beef, tea or coffee” as proven by your hero crew of flight 4819!! Well done to them!",2025-02-22,initial,4,0,1,Y29tbWVudDoxMDI1MDcyNTEyOTc0OTk0XzEzMzgxMzYxODA5MzgwMjQ=,0,510,0 days,"i sincerely hope your heroic crew are well compensated, looked after and acknowledged for saving the lives of everyone onboard. its so much more then just chicken or beef, tea or coffee as proven by your hero crew of flight 4819!! well done to them!","i sincerely hope your heroic crew are well compensated, looked after and acknowledged for saving the lives of everyone onboard. its so much more then just chicken or beef, tea or coffee as proven by your hero crew of flight 4819!! well done to them!"
370,370,1,0 (Not Relevant),2025-04-20T21:11:19.996729Z,Google,2025-03-04 13:41:00,Y29tbWVudDoxMTk2NjU1NjA4NDgyNTM4XzExNzI4MjEyNzc5NzI1NDc=,,I have a two-factor security Google account and I forgot my password and phone number. I hope Google can help me recover it. I have a lot of...,2025-03-06,initial,1,0,0,Y29tbWVudDoxMTk2NjU1NjA4NDgyNTM4XzExNzI4MjEyNzc5NzI1NDc=,0,94,0 days,i have a two-factor security google account and i forgot my password and phone number. i hope google can help me recover it. i have a lot of...,i have a two-factor security google account and i forgot my password and phone number. i hope google can help me recover it. i have a lot of...
371,371,1,0 (Not Relevant),2025-04-20T21:11:24.558400Z,Target,2025-02-02 11:06:00,Y29tbWVudDoxMTcxMzM2NDkxMDE4NDA3XzExNjMyMDc5MzIxODU4MjE=,,Everything looks very nice.,2025-02-07,initial,0,0,0,Y29tbWVudDoxMTcxMzM2NDkxMDE4NDA3XzExNjMyMDc5MzIxODU4MjE=,0,719,0 days,everything looks very nice.,everything looks very nice.
372,372,1,1 (Relevant),2025-04-20T21:11:30.472110Z,Target,2025-02-10 09:24:00,Y29tbWVudDoxMTc2ODA2MjgwNDcxNDI4XzI0NDQ2MDcxNTI1NTgyNjk=,Y29tbWVudDoxMTc2ODA2MjgwNDcxNDI4XzYwNTUzNzc5NTU2NTIzMQ==,Walmarts calling your name!,2025-02-14,reply,0,0,0,Y29tbWVudDoxMTc2ODA2MjgwNDcxNDI4XzYzNzMxMDc0NTUxNTQxNQ==,2,0,0 days,walmarts calling your name!,this comment section did not disappoint no dei = no shopping at target! → youre part of dei but do you → walmarts calling your name!
373,373,1,0 (Not Relevant),2025-04-20T21:11:34.366941Z,Target,2025-02-13 13:26:00,Y29tbWVudDoxMTc4ODgyNTAwMjYzODA2XzY2ODA3NjMzODkwMjk5NQ==,,#Targetnoannualfee!!,2025-02-21,initial,2,0,0,Y29tbWVudDoxMTc4ODgyNTAwMjYzODA2XzY2ODA3NjMzODkwMjk5NQ==,0,60,0 days,#targetnoannualfee!!,#targetnoannualfee!!
374,374,1,0 (Not Relevant),2025-04-20T21:11:38.230010Z,Google,2025-02-28 13:39:00,Y29tbWVudDoxMTkzNjk0OTE1NDQ1Mjc0XzYxMTUzNDI3NTE5OTA1OA==,,Amazing,2025-03-06,initial,0,0,0,Y29tbWVudDoxMTkzNjk0OTE1NDQ1Mjc0XzYxMTUzNDI3NTE5OTA1OA==,0,440,0 days,amazing,amazing
375,375,1,0 (Not Relevant),2025-04-20T21:11:42.084918Z,Costco,2025-02-09 09:00:00,Y29tbWVudDoxMDQwMzExMDU0NzkzNzI0XzExMTE4OTg2MTczMDA4NTE=,Y29tbWVudDoxMDQwMzExMDU0NzkzNzI0XzY0OTg0OTE1NDEyODk2MQ==,Yes!!,2025-02-09,reply,2,0,1,Y29tbWVudDoxMDQwMzExMDU0NzkzNzI0XzY0OTg0OTE1NDEyODk2MQ==,1,2,0 days,yes!!,bring back supreme pizza → yes!!
376,376,1,0 (Not Relevant),2025-04-20T21:11:46.753253Z,Delta,2025-02-13 09:30:00,Y29tbWVudDoxMDIxMzAxOTAwMDE4NzIyXzE2NTI5MzQwODg5MTA4MzQ=,Y29tbWVudDoxMDIxMzAxOTAwMDE4NzIyXzE3MTQyNzE3Mzk0NDU2NTQ=,you get what you pay for,2025-02-15,reply,1,0,1,Y29tbWVudDoxMDIxMzAxOTAwMDE4NzIyXzE3MTQyNzE3Mzk0NDU2NTQ=,1,1,0 days,you get what you pay for,those seats look hard as rocks. → you get what you pay for
377,377,1,0 (Not Relevant),2025-04-20T21:11:50.632654Z,Costco,2025-02-09 09:00:00,Y29tbWVudDoxMDM5NjIyNDU0ODYyNTg0XzM2OTUyNzExMjkyMTUzOQ==,,How much,2025-02-16,initial,0,0,1,Y29tbWVudDoxMDM5NjIyNDU0ODYyNTg0XzM2OTUyNzExMjkyMTUzOQ==,0,801,0 days,how much,how much
378,378,1,0 (Not Relevant),2025-04-20T21:11:57.197920Z,Delta,2025-02-17 14:08:00,Y29tbWVudDoxMDI0NTU2NjI5NjkzMjQ5XzY1Mzk4NjM3MzgyNDIzNg==,,Those flight attendants should get a raise they didn't leave the plane till everybody was out it could have been the first people out,2025-02-22,initial,3,0,1,Y29tbWVudDoxMDI0NTU2NjI5NjkzMjQ5XzY1Mzk4NjM3MzgyNDIzNg==,0,540,0 days,those flight attendants should get a raise they didn't leave the plane till everybody was out it could have been the first people out,those flight attendants should get a raise they didn't leave the plane till everybody was out it could have been the first people out
379,379,1,0 (Not Relevant),2025-04-20T21:12:09.171401Z,Costco,2025-02-11 14:38:00,Y29tbWVudDoxMDQxOTQ2MTUxMjk2ODgxXzExNTAyNDIzNzY1NTA3OTg=,Y29tbWVudDoxMDQxOTQ2MTUxMjk2ODgxXzY0ODkzNTk2NDE4ODkzMw==,try Instacart,2025-02-16,reply,3,0,1,Y29tbWVudDoxMDQxOTQ2MTUxMjk2ODgxXzY0ODkzNTk2NDE4ODkzMw==,1,5,0 days,try instacart,so mad at costco not letting my son shop for me while i recovered from a traumatic brain injury. ty costco → try instacart
380,380,1,1 (Relevant),2025-04-20T21:12:19.315976Z,Costco,2025-01-27 15:18:00,Y29tbWVudDoxMDMxMDIyMzcyMzg5MjU5XzI4NzYxNTEzNTI1NDY1MzU=,Y29tbWVudDoxMDMxMDIyMzcyMzg5MjU5XzUzNDkxODA0NjIzMzM2Ng==,"You said you don't want to shop for politics, yet you are buying right into the plan of dividing us further.",2025-02-01,reply,0,0,1,Y29tbWVudDoxMDMxMDIyMzcyMzg5MjU5XzUzNDkxODA0NjIzMzM2Ng==,1,68,0 days,"you said you don't want to shop for politics, yet you are buying right into the plan of dividing us further.","cancelled my membership today after 16 years. i dont want to shop for politics and groceries. i will shop at the dirty sams club before i support you fools again. → you said you don't want to shop for politics, yet you are buying right into the plan of dividing us further."
381,381,1,0 (Not Relevant),2025-04-20T21:17:43.584071Z,Target,2025-02-20 13:56:00,Y29tbWVudDoxMTg0MDQyMTUzMDgxMTc0XzExNzIwMTc0NDQ1MjMwMjc=,Y29tbWVudDoxMTg0MDQyMTUzMDgxMTc0XzE3MDExMDc4NzA1MTc4MjE=,May God give you the desire of your heart and make all your plans succeed.,2025-02-21,reply,0,0,0,Y29tbWVudDoxMTg0MDQyMTUzMDgxMTc0XzE3MDExMDc4NzA1MTc4MjE=,1,0,0 days,may god give you the desire of your heart and make all your plans succeed.,screw you target → may god give you the desire of your heart and make all your plans succeed.
382,382,1,0 (Not Relevant),2025-04-20T21:17:48.418149Z,Costco,2025-01-28 15:40:00,Y29tbWVudDoxMDMxNzczMjA1NjQ3NTA5XzY1NzAxNzUyNzAxODEwMQ==,,Viking Cruise. Leaving on our 20th in 2 days!,2025-02-01,initial,0,0,1,Y29tbWVudDoxMDMxNzczMjA1NjQ3NTA5XzY1NzAxNzUyNzAxODEwMQ==,0,520,0 days,viking cruise. leaving on our 20th in 2 days!,viking cruise. leaving on our 20th in 2 days!
