company_name,post_date,id,parent_id,comment_text,comment_date,comment_type,reaction_count
Costco,2025-02-01 09:00:00,Y29tbWVudDoxMDM0NDgxMjg1Mzc2NzAxXzYyOTA5NjI0NjE2NTY3Nw==,Y29tbWVudDoxMDM0NDgxMjg1Mzc2NzAxXzE1NzExODc3MzM1Mjc2MzY=,"Feel free to go to Sam's where they coach their employees how to apply for welfare programs, since they get no benefits and horrible pay. Sounds like your kind of business.",2025-02-01,reply,12
Costco,2025-02-01 09:00:00,Y29tbWVudDoxMDM0NDgxMjg1Mzc2NzAxXzY0NzY5MzEwMTAxNzUzNw==,Y29tbWVudDoxMDM0NDgxMjg1Mzc2NzAxXzE1NzExODc3MzM1Mjc2MzY=,Agreed.,2025-02-01,reply,3
Costco,2025-02-01 09:00:00,Y29tbWVudDoxMDM0NDgxMjg1Mzc2NzAxXzkzMDE4ODM4ODg3Mjk4OA==,Y29tbWVudDoxMDM0NDgxMjg1Mzc2NzAxXzE1NzExODc3MzM1Mjc2MzY=,I’m joining tomorrow. We‘ll see how Costco is doing vs Target in a month or two. All you anti-DEI people were probably Walmart shoppers anyway and will probably be surprised at what DEI initiatives actually benefited you and your family members once they are all gone,2025-02-01,reply,5
Costco,2025-02-01 09:00:00,Y29tbWVudDoxMDM0NDgxMjg1Mzc2NzAxXzk2NTgyNDgzODM0OTc3NQ==,Y29tbWVudDoxMDM0NDgxMjg1Mzc2NzAxXzE1NzExODc3MzM1Mjc2MzY=,don’t listen to these idiots Costco…they have plenty of racist locations to shop!!,2025-02-01,reply,5
Costco,2025-02-01 09:00:00,Y29tbWVudDoxMDM0NDgxMjg1Mzc2NzAxXzY0NTE0MDEwMTM2ODkyNw==,Y29tbWVudDoxMDM0NDgxMjg1Mzc2NzAxXzE1NzExODc3MzM1Mjc2MzY=,yup!,2025-02-08,reply,0
Costco,2025-02-01 09:00:00,Y29tbWVudDoxMDM0NDgxMjg1Mzc2NzAxXzE1NjU5OTgzNzc0Njc4OTI=,,We love Costco!! Thank you for standing up for what is right!!,2025-02-01,initial,11
Costco,2025-02-01 09:00:00,Y29tbWVudDoxMDM0NDgxMjg1Mzc2NzAxXzE1NTYwMDkzMzg0MzIzMDI=,Y29tbWVudDoxMDM0NDgxMjg1Mzc2NzAxXzE1NjU5OTgzNzc0Njc4OTI=,and so you support racism? Wow.,2025-02-01,reply,1
Costco,2025-02-01 09:00:00,Y29tbWVudDoxMDM0NDgxMjg1Mzc2NzAxXzM5Mzc5MjMwNDY0MjA1NjM=,,Today after probably 15+ years or longer I canceled my membership because of Costco‘s DEI policy and I will continue to push my friends and family to do the same. I know they don’t care until it hurts their bottom line so we can only hope that people aren’t too lazy to show Costco leftism is a mental illness & should never be supported by normal people,2025-02-01,initial,10
Costco,2025-02-01 09:00:00,Y29tbWVudDoxMDM0NDgxMjg1Mzc2NzAxXzExNDIzMzY1OTcyNDM2NDM=,Y29tbWVudDoxMDM0NDgxMjg1Mzc2NzAxXzM5Mzc5MjMwNDY0MjA1NjM=,"""normal""?? Lol",2025-02-08,reply,2
Costco,2025-02-01 09:00:00,Y29tbWVudDoxMDM0NDgxMjg1Mzc2NzAxXzk2MzU4NzkyOTIwMDIzMQ==,Y29tbWVudDoxMDM0NDgxMjg1Mzc2NzAxXzExNDIzMzY1OTcyNDM2NDM=,yes normal as God intended not mentally ill,2025-02-08,reply,2
Costco,2025-02-01 09:00:00,Y29tbWVudDoxMDM0NDgxMjg1Mzc2NzAxXzQ3MzcwODg4NTYxOTUwMA==,Y29tbWVudDoxMDM0NDgxMjg1Mzc2NzAxXzk2MzU4NzkyOTIwMDIzMQ==,screw god,2025-02-08,reply,0
Costco,2025-02-01 09:00:00,Y29tbWVudDoxMDM0NDgxMjg1Mzc2NzAxXzU5NDg5MDk1NjczMTExNg==,Y29tbWVudDoxMDM0NDgxMjg1Mzc2NzAxXzQ3MzcwODg4NTYxOTUwMA==,that’s about what I would expect from a leftist,2025-02-08,reply,3
Costco,2025-02-01 09:00:00,Y29tbWVudDoxMDM0NDgxMjg1Mzc2NzAxXzIwNjkxMTk2MTM1ODYxOTg=,Y29tbWVudDoxMDM0NDgxMjg1Mzc2NzAxXzU5NDg5MDk1NjczMTExNg==,"except I'm not a leftist, I actually think for myself. Not everything is political, you should try it sometime",2025-02-08,reply,1
Costco,2025-02-01 09:00:00,Y29tbWVudDoxMDM0NDgxMjg1Mzc2NzAxXzEzMTYzOTkyNTI3Mjk2NTk=,Y29tbWVudDoxMDM0NDgxMjg1Mzc2NzAxXzIwNjkxMTk2MTM1ODYxOTg=,only leftists act like you stop with the lies,2025-02-08,reply,1
Costco,2025-02-01 09:00:00,Y29tbWVudDoxMDM0NDgxMjg1Mzc2NzAxXzEzNDA0MTQ2NDczODQxNDA=,Y29tbWVudDoxMDM0NDgxMjg1Mzc2NzAxXzEzMTYzOTkyNTI3Mjk2NTk=,bots,2025-02-08,reply,0
Costco,2025-02-01 09:00:00,Y29tbWVudDoxMDM0NDgxMjg1Mzc2NzAxXzk3MjIxMjg0MTUzNzI3NA==,Y29tbWVudDoxMDM0NDgxMjg1Mzc2NzAxXzM5Mzc5MjMwNDY0MjA1NjM=,"good, shopping around less MAGAts sounds wonderful",2025-02-08,reply,1
Costco,2025-02-01 09:00:00,Y29tbWVudDoxMDM0NDgxMjg1Mzc2NzAxXzUwNzgxNjUwNTY3NzY4OA==,,Why are you selling salmon with worms in it ? And dangerous Apeel on all your produce?,2025-02-08,initial,0
Costco,2025-02-01 09:00:00,Y29tbWVudDoxMDM0NDgxMjg1Mzc2NzAxXzEyNzQ3NTcyNTY5Nzc5MTE=,,PLEASE STICK TO YOUR GUNS ABOUT DEI!,2025-02-08,initial,2
Costco,2025-02-01 09:00:00,Y29tbWVudDoxMDM0NDgxMjg1Mzc2NzAxXzEyMDI4ODI5MTQ1ODcwOTg=,,"I still great great service and product at Costco, Yorkshire and 27th Ave.",2025-02-08,initial,0
Costco,2025-02-01 09:00:00,Y29tbWVudDoxMDM0NDgxMjg1Mzc2NzAxXzg1MjE0NDA1MDMxNTQyNQ==,,Please open a retail store in india and create employment opportunities,2025-02-08,initial,0
Costco,2025-02-01 09:00:00,Y29tbWVudDoxMDM0NDgxMjg1Mzc2NzAxXzEzMzA2NDA0MjE2MDA2ODM=,,"Thank you for being courageous to stand up to the authoritarian racist masquerading as a leader. Yours is unfortunately only one major corporation who has not caved like the rest to this witless, inhumane bully.",2025-02-01,initial,4
Costco,2025-02-01 09:00:00,Y29tbWVudDoxMDM0NDgxMjg1Mzc2NzAxXzM5NTg5NDYwNzQzNDEzODU=,,I didn't need most of the stuff I bought but I wanted to support Costco and their not backing down to the Republican Administration's dismissing of the DEI employment.,2025-02-01,initial,7
Costco,2025-02-01 09:00:00,Y29tbWVudDoxMDM0NDgxMjg1Mzc2NzAxXzkzMjg2MjE5OTAzODk0OA==,,"Which is indirect calls of what happened in Washington DC. Over 2000 qualified applicants were not hired in the FAA because they did not meet the criteria of the demonic evil influence. Hence the FAA has been in shortage for employees for years, 11 short employees the night of the crash, and only one directing both the airplane and the helicopter when there should’ve been 2",2025-02-01,initial,5
Costco,2025-02-01 09:00:00,Y29tbWVudDoxMDM0NDgxMjg1Mzc2NzAxXzIzOTA4MTkzNjEyOTYyMjA=,Y29tbWVudDoxMDM0NDgxMjg1Mzc2NzAxXzkzMjg2MjE5OTAzODk0OA==,this is about COSTCO.,2025-02-01,reply,3
Costco,2025-02-01 09:00:00,Y29tbWVudDoxMDM0NDgxMjg1Mzc2NzAxXzEzMzk2NzI4MzA1NDgzODE=,Y29tbWVudDoxMDM0NDgxMjg1Mzc2NzAxXzkzMjg2MjE5OTAzODk0OA==,you sound very culty,2025-02-01,reply,3
Costco,2025-02-01 09:00:00,Y29tbWVudDoxMDM0NDgxMjg1Mzc2NzAxXzU2NDY3OTk2NjU3MjM2OA==,Y29tbWVudDoxMDM0NDgxMjg1Mzc2NzAxXzkzMjg2MjE5OTAzODk0OA==,demonic evil influence? What? Are you ok? This is such a weird interpretation of actual events.,2025-02-01,reply,2
Costco,2025-02-01 09:00:00,Y29tbWVudDoxMDM0NDgxMjg1Mzc2NzAxXzExNjAyOTk0NDkwODE5MzE=,Y29tbWVudDoxMDM0NDgxMjg1Mzc2NzAxXzU2NDY3OTk2NjU3MjM2OA==,And there’s only two genders there’s no such thing as transgender that’s from your boss the devil that’s why it’s gone now,2025-02-01,reply,0
Costco,2025-02-01 09:00:00,Y29tbWVudDoxMDM0NDgxMjg1Mzc2NzAxXzE1NjA0NjU4Mjc5NjUyNDM=,,"Thank you Costco for being American, where all Americans live Free.",2025-02-08,initial,2
Costco,2025-02-01 09:00:00,Y29tbWVudDoxMDM0NDgxMjg1Mzc2NzAxXzE4MTgyMDk4NzU2MDEwODc=,,Thank you Costco for not caving into racist overreach from the orange Fuhrer.,2025-02-01,initial,8
Costco,2025-02-01 09:00:00,Y29tbWVudDoxMDM0NDgxMjg1Mzc2NzAxXzE2Njc4MTM4MzcyNzY0NDQ=,,I just wanted to say thank you for holding your ground and refusing to go backwards.,2025-02-08,initial,2
Costco,2025-02-01 09:00:00,Y29tbWVudDoxMDM0NDgxMjg1Mzc2NzAxXzExNTkyOTAyMTU3NzE3ODY=,,DEI Cookware?,2025-02-01,initial,2
Costco,2025-02-01 09:00:00,Y29tbWVudDoxMDM0NDgxMjg1Mzc2NzAxXzE1NjQ2Mjk2Nzc1NzQ0Mzg=,Y29tbWVudDoxMDM0NDgxMjg1Mzc2NzAxXzExNTkyOTAyMTU3NzE3ODY=,"pretty sure it works identical to the way it would if a gay, POC, disabled or Veteran worker sold it to you. That's what DEI protects. All those categories",2025-02-08,reply,0
Costco,2025-02-01 09:00:00,Y29tbWVudDoxMDM0NDgxMjg1Mzc2NzAxXzY1MzIyNTAzMDQ2OTMxMQ==,,Purchasing membership now!,2025-02-01,initial,3
Costco,2025-02-01 09:00:00,Y29tbWVudDoxMDM0NDgxMjg1Mzc2NzAxXzk5MTIyMTk2OTU5NDA4MQ==,,Love Costco,2025-02-01,initial,4
Costco,2025-02-01 09:00:00,Y29tbWVudDoxMDM0NDgxMjg1Mzc2NzAxXzEyOTM0NjcxMzE5MzUzNzk=,,Will you be carrying the special edition Diet Coke?,2025-02-01,initial,0
Costco,2025-02-01 09:00:00,Y29tbWVudDoxMDM0NDgxMjg1Mzc2NzAxXzIzNzQ3ODg1NjYyNDcyNTY=,,Ditto!,2025-02-08,initial,0
Costco,2025-02-01 09:00:00,Y29tbWVudDoxMDM0NDgxMjg1Mzc2NzAxXzM4ODIzNzQ2NjU0MTI1Mzk=,,COOKWARE IS JUNK,2025-02-01,initial,3
Costco,2025-02-01 09:00:00,Y29tbWVudDoxMDM0NDgxMjg1Mzc2NzAxXzkwMTMwODM4MTU0NTY3NDA=,Y29tbWVudDoxMDM0NDgxMjg1Mzc2NzAxXzM4ODIzNzQ2NjU0MTI1Mzk=,there is always that one who bashes something but never says why.,2025-02-01,reply,2
Costco,2025-02-01 09:00:00,Y29tbWVudDoxMDM0NDgxMjg1Mzc2NzAxXzYwMjU3MzI4OTE1ODAxMw==,Y29tbWVudDoxMDM0NDgxMjg1Mzc2NzAxXzkwMTMwODM4MTU0NTY3NDA=,", low quality, nonstick was nonstick about 4 months. Always hand washed, and silicone utensils used. Maybe it was a bad batch, but they went into the recycle bin.",2025-02-01,reply,1
Costco,2025-02-01 09:00:00,Y29tbWVudDoxMDM0NDgxMjg1Mzc2NzAxXzE4NTE1OTY3NzU2NTIxOTA=,Y29tbWVudDoxMDM0NDgxMjg1Mzc2NzAxXzYwMjU3MzI4OTE1ODAxMw==,"You could have taken back to Costco for a refund,",2025-02-01,reply,3
Costco,2025-02-01 09:00:00,Y29tbWVudDoxMDM0NDgxMjg1Mzc2NzAxXzEwMDE3MzQxNDg0Njg1MjA=,Y29tbWVudDoxMDM0NDgxMjg1Mzc2NzAxXzE4NTE1OTY3NzU2NTIxOTA=,", could have, just disapointed",2025-02-01,reply,0
Costco,2025-02-01 09:00:00,Y29tbWVudDoxMDM0NDgxMjg1Mzc2NzAxXzM5OTQ2ODA2MTc1MjAwNTY=,Y29tbWVudDoxMDM0NDgxMjg1Mzc2NzAxXzEwMDE3MzQxNDg0Njg1MjA=,"thank you, much better explanation.",2025-02-01,reply,0
Costco,2025-02-01 09:00:00,Y29tbWVudDoxMDM0NDgxMjg1Mzc2NzAxXzYyOTIxNTExOTUwNTg1OA==,Y29tbWVudDoxMDM0NDgxMjg1Mzc2NzAxXzM5OTQ2ODA2MTc1MjAwNTY=,", sorry but I was at work for my first response",2025-02-01,reply,0
Costco,2025-02-01 09:00:00,Y29tbWVudDoxMDM0NDgxMjg1Mzc2NzAxXzExNDQ2MTA0NTA1MzE2MTI=,Y29tbWVudDoxMDM0NDgxMjg1Mzc2NzAxXzYyOTIxNTExOTUwNTg1OA==,understood,2025-02-01,reply,0
Costco,2025-02-01 09:00:00,Y29tbWVudDoxMDM0NDgxMjg1Mzc2NzAxXzM4NzQ1MzEzOTk1MzI2NTg=,Y29tbWVudDoxMDM0NDgxMjg1Mzc2NzAxXzM4ODIzNzQ2NjU0MTI1Mzk=,"I now feel better about this ,because my husband wanted to buy and I said no,and he was not happy with my answer!",2025-02-01,reply,1
Costco,2025-02-01 09:00:00,Y29tbWVudDoxMDM0NDgxMjg1Mzc2NzAxXzEyODExNzc4ODMxMTg1Nzk=,Y29tbWVudDoxMDM0NDgxMjg1Mzc2NzAxXzM4ODIzNzQ2NjU0MTI1Mzk=,you can ALWAYS return things. They have wonderful customer service in this area. Very little ever goes back from our house but it’s nice to know they stand behind things they sell.,2025-02-01,reply,2
Costco,2025-02-01 09:00:00,Y29tbWVudDoxMDM0NDgxMjg1Mzc2NzAxXzY0MzEwNTYwNDg1OTkyNg==,Y29tbWVudDoxMDM0NDgxMjg1Mzc2NzAxXzM4ODIzNzQ2NjU0MTI1Mzk=,thank you for your review. I was considering this set. I think I’ll keep on looking.,2025-02-01,reply,0
Costco,2025-02-01 09:00:00,Y29tbWVudDoxMDM0NDgxMjg1Mzc2NzAxXzExMzg1ODE1MTQ1NzMyOTM=,Y29tbWVudDoxMDM0NDgxMjg1Mzc2NzAxXzY0MzEwNTYwNDg1OTkyNg==,", we have several Kitchen-Aid products, this one just didn't seem to perform for us.",2025-02-01,reply,0
Costco,2025-02-01 09:00:00,Y29tbWVudDoxMDM0NDgxMjg1Mzc2NzAxXzYwNzU4NTkyODY2OTQyNA==,,https://youtu.be/paminX6V9Rk?si=MgDweuvRzsS1KkvJ,2025-02-08,initial,0
Costco,2025-02-01 09:00:00,Y29tbWVudDoxMDM0NDgxMjg1Mzc2NzAxXzk3NTQyNzI5NDUxODE3OA==,,Seems racist!!,2025-02-08,initial,2
Costco,2025-02-01 09:00:00,Y29tbWVudDoxMDM0NDgxMjg1Mzc2NzAxXzYwNjM1NzUxNTM0MTAyMQ==,Y29tbWVudDoxMDM0NDgxMjg1Mzc2NzAxXzk3NTQyNzI5NDUxODE3OA==,you’re racist if you voted for the orange POS,2025-02-08,reply,0
Costco,2025-02-01 09:00:00,Y29tbWVudDoxMDM0NDgxMjg1Mzc2NzAxXzk2MzYxNzQ5NTMzNTM5OQ==,Y29tbWVudDoxMDM0NDgxMjg1Mzc2NzAxXzE2NzMxNjI0OTY2MzI2MTQ=,let’s review shall we?,2025-02-08,reply,0
Costco,2025-02-01 09:00:00,Y29tbWVudDoxMDM0NDgxMjg1Mzc2NzAxXzM4OTkxNTc0OTAyOTkwMzc=,Y29tbWVudDoxMDM0NDgxMjg1Mzc2NzAxXzk1MjIzODY2OTg5OTg3Mw==,2. Highly qualified white air traffic controllers were turned away because they did not align with DEI goals. Buttigieg’s FAA did this under Biden’s direction,2025-02-08,reply,1
Costco,2025-02-01 09:00:00,Y29tbWVudDoxMDM0NDgxMjg1Mzc2NzAxXzEzMjE2ODc2NjU4MTUzNTI=,,Thank you 4 DEI,2025-02-01,initial,1
Costco,2025-02-01 09:00:00,Y29tbWVudDoxMDM0NDgxMjg1Mzc2NzAxXzY0MjcxMDU0ODEwNDAxNw==,,Canceled my membership gladly since costco supports DEI. They will learn,2025-02-01,initial,11
Costco,2025-02-01 09:00:00,Y29tbWVudDoxMDM0NDgxMjg1Mzc2NzAxXzYwMzg0MDQ0MjI1MDk3Mw==,Y29tbWVudDoxMDM0NDgxMjg1Mzc2NzAxXzY0MjcxMDU0ODEwNDAxNw==,"good, shopping around less MAGAts sounds wonderful",2025-02-08,reply,0
Costco,2025-02-01 09:00:00,Y29tbWVudDoxMDM0NDgxMjg1Mzc2NzAxXzQ5MjA2MTU4Mzk1MTY5Mw==,Y29tbWVudDoxMDM0NDgxMjg1Mzc2NzAxXzYwMzg0MDQ0MjI1MDk3Mw==,easy cupcake,2025-02-08,reply,0
