company_name,post_date,id,parent_id,comment_text,comment_date,comment_type,reaction_count
Costco,2025-02-01 09:00:00,Y29tbWVudDoxMDUwNDM1MDc3MTE0NjU1Xzk0NzUxOTQwMDU4NTE0NDQ=,,I’ve been buying pork belly with skin on in Costco,2025-03-01,initial,0
Costco,2025-02-01 09:00:00,Y29tbWVudDoxMDQ4NzQzMDkwNjE3MTg3XzE0NzAzMzMzNjQzNTMxNTM=,,Why did you discontinue your ravioli lasagna???,2025-03-01,initial,2
Costco,2025-02-01 09:00:00,Y29tbWVudDoxMDQ4NzQzMDkwNjE3MTg3XzE0OTk5NDA3NTQzNDA5MTg=,Y29tbWVudDoxMDQ4NzQzMDkwNjE3MTg3XzE0NzAzMzMzNjQzNTMxNTM=,it was the best!,2025-03-08,reply,1
Costco,2025-02-01 09:00:00,Y29tbWVudDoxMDQxNzYyOTI3OTgxODcwXzEwMTg0NDEyODY5OTgwNjg=,,It’s time to start boycotting Costco’s get DEI out of your system or else we stop shopping and then we take you out of business. The people have spoken.,2025-02-15,initial,52
Costco,2025-02-01 09:00:00,Y29tbWVudDoxMDM4MzA2NzI4MzI3NDkwXzE5MDM0OTU4OTAxODU1MTQ=,,Turning in my Costco membership. End DEI now. Merit based hiring only,2025-02-08,initial,47
Costco,2025-02-01 09:00:00,Y29tbWVudDoxMDM2NzI0ODA4NDg1NjgyXzExMDA1ODQ3NjE4MDk4NDM=,,This company is a woke joke!,2025-02-08,initial,71
Costco,2025-02-01 09:00:00,Y29tbWVudDoxMDM1MjM4NzUxOTY3NjIxXzQ4NzEwOTgyNzc5NjAzMQ==,,I also appreciate your DEI initiatives and joined largely because of that!,2025-02-22,initial,0
Costco,2025-02-01 09:00:00,Y29tbWVudDoxMDM0NDgxMjg1Mzc2NzAxXzY1MjYxMTYzNzIyNzM4MA==,,Thank you Costco wish you could bring back combo pizza,2025-02-15,initial,0
Costco,2025-02-01 09:00:00,Y29tbWVudDoxMDMzNzQ5ODUyMTE2NTExXzU5MDQ0NTAxMzg2OTIxNw==,,"Your commitment to diversity, equity and inclusion is greatly appreciated! These programs benefit all Americans and, make us better! Thank you, Costco",2025-02-08,initial,0
Costco,2025-02-01 09:00:00,Y29tbWVudDoxMDMzMDc4OTQ1NTE2OTM1XzkzMjAyNjIxMDQ2NzkxNjM=,,I would love to try these at $24.99 a case however in washington state you have to add all the liquor taxes that makes the total $53. Over double the original cost.,2025-02-01,initial,9
Costco,2025-02-01 09:00:00,Y29tbWVudDoxMDMyMzEyMjAyMjYwMjc2XzYxNjY4MTE1NDQ0Mzk4OA==,,"Please open a store in Buffalo, NY!",2025-03-01,initial,0
Costco,2025-02-01 09:00:00,Y29tbWVudDoxMDMyMzEyMjAyMjYwMjc2XzY1NTEwMTE3MzYzNDg3MA==,Y29tbWVudDoxMDMyMzEyMjAyMjYwMjc2XzYxNjY4MTE1NDQ0Mzk4OA==,Michael- We'll add your location to the wish list. -Gerry,2025-03-01,reply,0
Costco,2025-02-01 09:00:00,Y29tbWVudDoxMDMxNzczMjA1NjQ3NTA5XzYxOTgyNDU2NDMyNjA3MQ==,,Wine downing with my sweet hubby before dinner.,2025-02-01,initial,0
Costco,2025-02-01 09:00:00,Y29tbWVudDoxMDMxMDIyMzcyMzg5MjU5XzkyODc3MTU1MjQ2MjIwMjI=,,Requesting a Costco in Brownsville,2025-02-01,initial,29
Costco,2025-02-01 09:00:00,Y29tbWVudDoxMDMxMDIyMzcyMzg5MjU5XzExNjM2MjMxNTg2MDYxMjI=,Y29tbWVudDoxMDMxMDIyMzcyMzg5MjU5XzkyODc3MTU1MjQ2MjIwMjI=,Laila- Thanks for the invite to Brownsville! We invite you to check out our upcoming locations page at the following link: https://www.costco.com/new-locations.html  -Max,2025-02-01,reply,1
Costco,2025-02-01 09:00:00,Y29tbWVudDoxMDMwNDA2MjQyNDUwODcyXzk3MjEwNzYwNDgwMzc1NQ==,,Thank you Costco. I will be shopping with you more frequently now.,2025-02-01,initial,1
Costco,2025-02-01 09:00:00,Y29tbWVudDoxMDMwNDA2MTQ5MTE3NTQ4XzU1MDE4NDEzMTM3NTcyNA==,,Please bring back Kirkland baking chips!!! They are the best.,2025-02-15,initial,0
Costco,2025-02-01 09:00:00,Y29tbWVudDoxMDMwNDA2MTQ5MTE3NTQ4XzYwMzY4ODk2NTc5NjYwMQ==,Y29tbWVudDoxMDMwNDA2MTQ5MTE3NTQ4XzU1MDE4NDEzMTM3NTcyNA==,Cherie- Thanks for the suggestion. We'll be sure to get your feedback to appropriate personnel. You can also submit suggestions by clicking the blue “Feedback” button on the right side of Costco.com. -Gerry,2025-02-22,reply,0
Costco,2025-02-01 09:00:00,Y29tbWVudDoxMDI3ODA5MTc5Mzc3MjQ1XzM3Mjk3NDI1MzA2NTkwODg=,,"For people complaining, here’s some examples of what DEIA actually is. Trainings to prevent sexual harassment in the workplace are part of DEI initiatives. Pay transparency laws are the result of DEI initiatives. Requiring wheel chair ramps and closed … See more",2025-01-25,initial,338
Costco,2025-02-01 09:00:00,Y29tbWVudDoxMDI0OTcyMDEyOTk0Mjk1XzYyNDE1NTUzNjkzNTc3Ng==,,"Costco needs to ditch its DEl efforts, such programs put the company at greater risk of being sued for discrimination.",2025-01-25,initial,67
Costco,2025-02-01 09:00:00,Y29tbWVudDoxMDM0NDgxMjg1Mzc2NzAxXzIwMTk5NTI3MTE4NDQ4OTc=,,Como puedo adquirir una membresía,2025-02-22,initial,0
Costco,2025-02-01 09:00:00,Y29tbWVudDoxMDM0NDgxMjg1Mzc2NzAxXzEwMjk4ODEyMjU2NDQ2MzA=,Y29tbWVudDoxMDM0NDgxMjg1Mzc2NzAxXzIwMTk5NTI3MTE4NDQ4OTc=,"Sanchez José- Tenemos dos tipos de membresías diferentes. La Membresía Dorada y la Membresía de Negocio. Ambas membresías cuestan $65 y te permiten comprar en todos los almacenes de Costco y en línea en http://Costco.com. Cualquiera de las membresías se pueden actualizar a una Membresía Ejecutiva por $130, la cual le ofrece una recompensa de 2% en sus compras (se aplican exclusiones) y también tiene ciertas ventajas y/o descuentos en muchos de nuestros servicios. Ambas membresías vienen con dos tarjetas, por lo cual puede compartir los beneficios de ser socio con alguien en su hogar de la edad de 16 años o mayor. Para comprar en línea, visite aquí: https://www.costco.com/join-costco.html?redirectLogin=true ¡Gracias! -Gerry",2025-02-22,reply,0
Costco,2025-02-01 09:00:00,Y29tbWVudDoxMDM0NDgxMjg1Mzc2NzAxXzY1MjYxMTYzNzIyNzM4MA==,,Thank you Costco wish you could bring back combo pizza,2025-02-15,initial,0
Costco,2025-02-01 09:00:00,Y29tbWVudDoxMDM0NDgxMjg1Mzc2NzAxXzEzMzE4NzAyMjQ3ODk2MjQ=,,Price?,2025-02-15,initial,0
Costco,2025-02-01 09:00:00,Y29tbWVudDoxMDM0NDgxMjg1Mzc2NzAxXzYxMTg1NTMzMTYwNDgzMA==,Y29tbWVudDoxMDM0NDgxMjg1Mzc2NzAxXzEzMzE4NzAyMjQ3ODk2MjQ=,Hazel- You can view pricing for this product on our website here: https://www.costco.com/ProductDisplay?catalogId=10701... Thanks for asking! -Bekah,2025-02-22,reply,0
Costco,2025-02-01 09:00:00,Y29tbWVudDoxMDM0NDgxMjg1Mzc2NzAxXzExNDk5MjM2NjYzNDcyMzY=,,"Now yesterday I got a call yesterday informing that my old frame is rejected because my eye lash is too big. Although the same frame was used last year. It appears that Costco optical is forcing me to buy a new frame every year or Costco thinks its frame is so poor quality that it should not last for more than 1 year. I do not like this policy/behavior of optical department. In my opinion, the only logical reason of it can be forcing me to buy new frame every year.",2025-02-08,initial,0
Costco,2025-02-01 09:00:00,Y29tbWVudDoxMDM0NDgxMjg1Mzc2NzAxXzE2MzcwMzczMTAyODQ4MDA=,,Do you even have them in stock.,2025-02-08,initial,0
Costco,2025-02-01 09:00:00,Y29tbWVudDoxMDM0NDgxMjg1Mzc2NzAxXzE1ODE5NjA2MTI1MTQ4NzY=,Y29tbWVudDoxMDM0NDgxMjg1Mzc2NzAxXzE2MzcwMzczMTAyODQ4MDA=,"Hello, Johanna. You can check inventory on the Costco App under Warehouse then, search by item number, 1804554 using your zip code. The KitchenAid 12-piece Hard Anodized Ceramic Non-Stick Cookware Set can be viewed on the website using the following link: https://bit.ly/4aCmVul Thanks for posting! -Kim",2025-02-22,reply,0
Costco,2025-02-01 09:00:00,Y29tbWVudDoxMDM0NDgxMjg1Mzc2NzAxXzMwNjUzOTAyNzM1OTg2NjE=,,"Your commitment to diversity, equity and inclusion is greatly appreciated! These programs benefit all Americans and, make us better! Thank you, Costco",2025-02-08,initial,1
Costco,2025-02-01 09:00:00,Y29tbWVudDoxMDM0NDgxMjg1Mzc2NzAxXzY1MjYyMjc5Mzg3MzY0Nw==,,Love Costco! Thank yo for doing the right thing.,2025-02-08,initial,1
Costco,2025-02-01 09:00:00,Y29tbWVudDoxMDM0NDgxMjg1Mzc2NzAxXzE4NDUwNTgwNDI1NjU0NDQ=,,"As one of many long term patron's to your business, I/We do not appreciate your stance on DEI and it's destructive use to further segregate society. If you do not cut if off I will be forced to Cancel my membership.",2025-02-08,initial,3
Costco,2025-02-01 09:00:00,Y29tbWVudDoxMDM0NDgxMjg1Mzc2NzAxXzExNjU0MzcyMDE4OTM1ODg=,,Costco did not hear the American People and their vote.,2025-02-08,initial,3
Costco,2025-02-01 09:00:00,Y29tbWVudDoxMDM0NDgxMjg1Mzc2NzAxXzIwMzcxMDY1MTMzNjE0Nzg=,,Love the look of these pans. Love your store too!,2025-02-08,initial,1
Costco,2025-02-01 09:00:00,Y29tbWVudDoxMDM0NDgxMjg1Mzc2NzAxXzUyMTgwNTAzNzAxNjA0MQ==,,How much are they,2025-02-08,initial,0
Costco,2025-02-01 09:00:00,Y29tbWVudDoxMDM0NDgxMjg1Mzc2NzAxXzEzNDc2NDE1OTk1OTc5NjQ=,Y29tbWVudDoxMDM0NDgxMjg1Mzc2NzAxXzUyMTgwNTAzNzAxNjA0MQ==,Hi Angie! Feel free to click on the following link for pricing and information: https://bit.ly/4aCmVul. -Ernie,2025-02-15,reply,0
Costco,2025-02-01 09:00:00,Y29tbWVudDoxMDM0NDgxMjg1Mzc2NzAxXzM5ODcwMzAwMDE1NTUwMzc=,,Thank you Costco for being true and loyal to your DEI customers,2025-02-08,initial,2
Costco,2025-02-01 09:00:00,Y29tbWVudDoxMDM0NDgxMjg1Mzc2NzAxXzg5NjI2MTEwMzcxNzk2MjM=,,"As an educator and a human who tries to generally be good to other humans, I love your cookware and your policies.",2025-02-08,initial,3
Costco,2025-02-01 09:00:00,Y29tbWVudDoxMDM0NDgxMjg1Mzc2NzAxXzE1MzcxOTU5NjY5Njc5Njc=,,Thanks Costco for being so good to your employees. It's very refreshing to know.,2025-02-08,initial,5
Costco,2025-02-01 09:00:00,Y29tbWVudDoxMDM0NDgxMjg1Mzc2NzAxXzQ3NDcwODAzMjM1ODQ1MQ==,,"Costco, I love you but your app is terrible. I want to use it but it is close to non-functional.",2025-02-08,initial,1
Costco,2025-02-01 09:00:00,Y29tbWVudDoxMDM0NDgxMjg1Mzc2NzAxXzExNDgwMDUzMDAwNDg5ODc=,,Proud Costco shopper for years! You’ve always stood up for what’s right and I appreciate you continuing to do so!,2025-02-08,initial,16
Costco,2025-02-01 09:00:00,Y29tbWVudDoxMDM0NDgxMjg1Mzc2NzAxXzMzNTg4NTgwMTQyNDkxMDM=,,"Thank you, Costco, for standing up for all people, especially in Ohio. My family has committed to shopping at Costco more often as a result because we are in this together!",2025-02-08,initial,20
Costco,2025-02-01 09:00:00,Y29tbWVudDoxMDM0NDgxMjg1Mzc2NzAxXzE0MDE2ODE3NDc0ODM2Nzk=,,We travel past two Targets to reach your store. Thank you for sticking up for humanity! #newcustomer,2025-02-08,initial,14
Costco,2025-02-01 09:00:00,Y29tbWVudDoxMDM0NDgxMjg1Mzc2NzAxXzQ3NTk5MTAxNTU4MDE0Mg==,,Thanks Costco! We rejoined yesterday.,2025-02-08,initial,2
Costco,2025-02-01 09:00:00,Y29tbWVudDoxMDM0NDgxMjg1Mzc2NzAxXzQxNjgxODM3ODEyNTY2NQ==,,"We love you Costco. Thank you for standing strong against this horrible administration. We have been a member since you opened a store in Durham, NC and will continue to shop there in support of you.",2025-02-08,initial,3
Costco,2025-02-01 09:00:00,Y29tbWVudDoxMDM0NDgxMjg1Mzc2NzAxXzUzOTYwMTg3NTA4ODU0Nw==,,Thank you for sticking to your values! I live an hour away from the closest one but it is worth the drive to support you.,2025-02-08,initial,1
Costco,2025-02-01 09:00:00,Y29tbWVudDoxMDM0NDgxMjg1Mzc2NzAxXzk2NTYxMjgyOTc3Mzk5MTE=,,keep fighting the good fight and we will keep supporting you.,2025-02-08,initial,2
Costco,2025-02-01 09:00:00,Y29tbWVudDoxMDM0NDgxMjg1Mzc2NzAxXzU5NTMxNDQ2OTkwNjgxNg==,,Costco question why don’t you sell coffee at the food court?,2025-02-08,initial,1
Costco,2025-02-01 09:00:00,Y29tbWVudDoxMDM0NDgxMjg1Mzc2NzAxXzEzMDU5NDQ0OTA2NzMyMzY=,,Love you Costco! Just stopped by to say that I appreciate you doing the right thing and sticking through adversity,2025-02-08,initial,25
Costco,2025-02-01 09:00:00,Y29tbWVudDoxMDM0NDgxMjg1Mzc2NzAxXzIwMzE1NzU5NzczMjYxMDc=,Y29tbWVudDoxMDM0NDgxMjg1Mzc2NzAxXzEzMDU5NDQ0OTA2NzMyMzY=,how is that the right thing?,2025-02-08,reply,0
Costco,2025-02-01 09:00:00,Y29tbWVudDoxMDM0NDgxMjg1Mzc2NzAxXzExNTQ2NDM4NjYwMDU0ODY=,Y29tbWVudDoxMDM0NDgxMjg1Mzc2NzAxXzIwMzE1NzU5NzczMjYxMDc=,And you are Blocked. Just like your small mind.,2025-02-08,reply,0
Costco,2025-02-01 09:00:00,Y29tbWVudDoxMDM0NDgxMjg1Mzc2NzAxXzEyOTY2NjY1OTgwNzc5NDg=,Y29tbWVudDoxMDM0NDgxMjg1Mzc2NzAxXzExNTQ2NDM4NjYwMDU0ODY=,I too appreciate and will renew my membership and continue to shop at Costco because they are continuing down the path of ensure that there are opportunities for all individuals.,2025-02-08,reply,0
Costco,2025-02-01 09:00:00,Y29tbWVudDoxMDM0NDgxMjg1Mzc2NzAxXzYwNjUwMDMyNTQyNDU0Ng==,,How much?,2025-02-08,initial,0
Costco,2025-02-01 09:00:00,Y29tbWVudDoxMDM0NDgxMjg1Mzc2NzAxXzIzOTg0NzQ1OTcyMTc3MDg=,Y29tbWVudDoxMDM0NDgxMjg1Mzc2NzAxXzYwNjUwMDMyNTQyNDU0Ng==,"Kelly- To view the price of this item, please see here: https://www.costco.com/kitchenaid-12-piece-hard-anodized... -Gerry",2025-02-15,reply,0
Costco,2025-02-01 09:00:00,Y29tbWVudDoxMDM0NDgxMjg1Mzc2NzAxXzEzMzQzODgwNjc2OTIyMDM=,,Thank you Costco!!,2025-02-01,initial,4
Costco,2025-02-01 09:00:00,Y29tbWVudDoxMDM0NDgxMjg1Mzc2NzAxXzk2ODU2MjE4MTM4MTA4Mw==,,"Please work out a deal with the union! There are so very few companies the left can still shop at. We are all rallying around Costco, Trader Joe’s, and Aldi! We need you to work it out! The Swifties and the Left are buying memberships in droves!",2025-02-01,initial,1
Costco,2025-02-01 09:00:00,Y29tbWVudDoxMDM0NDgxMjg1Mzc2NzAxXzIwNzY3Mjk3NDYxNzUzMzU=,Y29tbWVudDoxMDM0NDgxMjg1Mzc2NzAxXzk2ODU2MjE4MTM4MTA4Mw==,a deal was made yesterday,2025-02-08,reply,3
Costco,2025-02-01 09:00:00,Y29tbWVudDoxMDM0NDgxMjg1Mzc2NzAxXzYwMjQzNjQxOTQwMzM5MQ==,,I have these and I love them. Well worth the cost.,2025-02-01,initial,1
Costco,2025-02-01 09:00:00,Y29tbWVudDoxMDM0NDgxMjg1Mzc2NzAxXzk2NTE1MTcxODQ1MzM2NA==,,"I went back to Costco to ask for help and the staff couldn’t place an order with the card either. The store manager contacted Uber Eats for me, and a representative called me, but the issue still wasn’t resolved.",2025-02-01,initial,4
Costco,2025-02-01 09:00:00,Y29tbWVudDoxMDM0NDgxMjg1Mzc2NzAxXzIzMTk4NDY4NTg0MDgzNjI=,,Wish we had a Costco in far northern NY. I'd do all my shopping exclusively with you!,2025-02-01,initial,5
Costco,2025-02-01 09:00:00,Y29tbWVudDoxMDM0NDgxMjg1Mzc2NzAxXzY0MjI2NDY4MTY2MzY3Mg==,,Thank you Costco!,2025-02-01,initial,10
Costco,2025-02-01 09:00:00,Y29tbWVudDoxMDM0NDgxMjg1Mzc2NzAxXzk4NzExNDY4Mjg2NjI4Mg==,,"Thank you Costco for standing firm in your commitment to Diversity, Equity, and Inclusion, I let my Costco membership lapse for a few years, but immediately renewed my membership upon reading about your commitment and began purchasing at my warehouse again. Thank you for doing what is right by ensuring that people of all genders, ages, races, religions, ethnicities, disabilities, and sexual orientations are treated fairly and respectfully.",2025-02-01,initial,13
Costco,2025-02-01 09:00:00,Y29tbWVudDoxMDM0NDgxMjg1Mzc2NzAxXzU5NTc3NDc0OTkwODY1Mg==,Y29tbWVudDoxMDM0NDgxMjg1Mzc2NzAxXzk4NzExNDY4Mjg2NjI4Mg==,except white people who are straight. #Racism,2025-02-01,reply,2
Costco,2025-02-01 09:00:00,Y29tbWVudDoxMDM0NDgxMjg1Mzc2NzAxXzUwNTA3MTYxODg2MzY4MA==,Y29tbWVudDoxMDM0NDgxMjg1Mzc2NzAxXzU5NTc3NDc0OTkwODY1Mg==,LOL!!!! You sound ridiculous.,2025-02-01,reply,1
Costco,2025-02-01 09:00:00,Y29tbWVudDoxMDM0NDgxMjg1Mzc2NzAxXzU4Mjc5MDAxNDU4Mzg4Mw==,Y29tbWVudDoxMDM0NDgxMjg1Mzc2NzAxXzUwNTA3MTYxODg2MzY4MA==,"really? Why don't you ask about all the racism I've experienced in my life. How I couldn't get jobs because I was white. How I couldn't go to college because I didn't qualify for financial aid because I was white and had two parents alive even though I didn't live at home and they were divorced. How the black ladies at the welfare office told me to my face I couldn't get any help (when I was a battered wife and became homeless) because I was white. And I'll never forget their faces as they laughed at me at one of the worst moments in my life. How that when I moved to a black neighborhood people treated me poorly and called me names and stole from me. How when I was a student (Elementary school through High School) the black girls would threatened to beat me up for literally no reason which caused me to leave class as quickly as possible and run home. Yeah, that's all ""ridiculous"".",2025-02-01,reply,2
Costco,2025-02-01 09:00:00,Y29tbWVudDoxMDM0NDgxMjg1Mzc2NzAxXzk5MjcyODI5MjcxODUwMQ==,Y29tbWVudDoxMDM0NDgxMjg1Mzc2NzAxXzU4Mjc5MDAxNDU4Mzg4Mw==,LOL!!! You still sound ridiculous. You were a battered wife and homeless because you were white? Try not smart enough to not let a man beat you up. You couldn't get a job because you were white? Try maybe you didn't have the education or experience. You couldn't get financial aid because you were white? I can tell by that statement you never really applied for financial aid. The black girls beat you up because you were white? Maybe it was because you were a junior racist in training with a nasty personality.,2025-02-01,reply,1
Costco,2025-02-01 09:00:00,Y29tbWVudDoxMDM0NDgxMjg1Mzc2NzAxXzg5MTUwNDkxNjE5Mjc0NzY=,Y29tbWVudDoxMDM0NDgxMjg1Mzc2NzAxXzk5MjcyODI5MjcxODUwMQ==,"see, typical black Liberal reply. You hate everyone and discount their experiences. See, you even called me a racist even though I've said nothing racist. I'm married to a black man and so you believe he married a racist? And by the way, it's too bad you couldn't read and understand what I said about being a battered wife. It's quite disturbing to know there's women who will bash another woman who suffered so much.",2025-02-01,reply,2
Costco,2025-02-01 09:00:00,Y29tbWVudDoxMDM0NDgxMjg1Mzc2NzAxXzI1MDE5NTE0NDk5OTE5Njk=,Y29tbWVudDoxMDM0NDgxMjg1Mzc2NzAxXzg5MTUwNDkxNjE5Mjc0NzY=,yep.,2025-02-01,reply,0
Costco,2025-02-01 09:00:00,Y29tbWVudDoxMDM0NDgxMjg1Mzc2NzAxXzEzOTcxMDAzNTc4Mzk5OTU=,Y29tbWVudDoxMDM0NDgxMjg1Mzc2NzAxXzI1MDE5NTE0NDk5OTE5Njk=,I took a peek at your page and you truly are full of hate.,2025-02-01,reply,2
Costco,2025-02-01 09:00:00,Y29tbWVudDoxMDM0NDgxMjg1Mzc2NzAxXzExNzMxMjgwNzA4NjAxMTk=,Y29tbWVudDoxMDM0NDgxMjg1Mzc2NzAxXzEzOTcxMDAzNTc4Mzk5OTU=,"LOL!!! Bless your gas lighting heart. No, I am not full of hate. I just hate a man that is a rapist. The only thing more disgusting than a rapist are the people, especially the women, that support a rapist.",2025-02-08,reply,0
Costco,2025-02-01 09:00:00,Y29tbWVudDoxMDM0NDgxMjg1Mzc2NzAxXzEzMTg4NTY1ODI2MzU2OTQ=,,I’m joining Costco even though the closest one is an hour away. I’ll stock up on everything I can there,2025-02-01,initial,8
Costco,2025-02-01 09:00:00,Y29tbWVudDoxMDM0NDgxMjg1Mzc2NzAxXzEzODc5NjQwOTg4NTI5MzM=,,"Stand firm, Costco! We just got a membership this week because you stood up for DEI!",2025-02-01,initial,14
Costco,2025-02-01 09:00:00,Y29tbWVudDoxMDM0NDgxMjg1Mzc2NzAxXzE1Mzk5OTEwMDk5OTYyMTg=,,Love Costco and all the wonderful people you employ! Thank you.,2025-02-01,initial,20
Costco,2025-02-01 09:00:00,Y29tbWVudDoxMDM0NDgxMjg1Mzc2NzAxXzg1OTI4MTU1NjIzMDY2OQ==,,I wonder how long they will maintain this look?,2025-02-01,initial,2
Costco,2025-02-01 09:00:00,Y29tbWVudDoxMDM0NDgxMjg1Mzc2NzAxXzEwMTUzNDg2NjM4MTc5NDc=,,My daughter and I will be getting memberships as a way to support and show gratitude for Costco’s decision to keep DEI programs in place.,2025-02-01,initial,41
Costco,2025-02-01 09:00:00,Y29tbWVudDoxMDM0NDgxMjg1Mzc2NzAxXzQ4MzQ0NzIxNDU2MTIyMQ==,Y29tbWVudDoxMDM0NDgxMjg1Mzc2NzAxXzEwMTUzNDg2NjM4MTc5NDc=,Lynne Bjarnason Dunlap well he’s apparently uneducated as well since DEI is great! We just joined Costco in support of their DEI policies!! It’s not an opinion I posted it’s FACTS that you don’t want to read and educate yourselves on.,2025-02-01,reply,7
Costco,2025-02-01 09:00:00,Y29tbWVudDoxMDM0NDgxMjg1Mzc2NzAxXzE1ODg0Njc1ODg0NzQ1MTI=,Y29tbWVudDoxMDM0NDgxMjg1Mzc2NzAxXzQ4MzQ0NzIxNDU2MTIyMQ==,".so, no white men need apply?",2025-02-08,reply,0
Costco,2025-02-01 09:00:00,Y29tbWVudDoxMDM0NDgxMjg1Mzc2NzAxXzkxMDQxNTE3MDYzNTk1NTQ=,Y29tbWVudDoxMDM0NDgxMjg1Mzc2NzAxXzQ4MzQ0NzIxNDU2MTIyMQ==,DEI is marxism.,2025-02-08,reply,0
Costco,2025-02-01 09:00:00,Y29tbWVudDoxMDM0NDgxMjg1Mzc2NzAxXzY0MDczNTAxNTE1NjAyMQ==,Y29tbWVudDoxMDM0NDgxMjg1Mzc2NzAxXzEwMTUzNDg2NjM4MTc5NDc=,-being able to have medical professionals and your coworkers use your preferred name (lots of people have those),2025-02-01,reply,11
Costco,2025-02-01 09:00:00,Y29tbWVudDoxMDM0NDgxMjg1Mzc2NzAxXzYzNTUyNjcxNTU1NjczOQ==,Y29tbWVudDoxMDM0NDgxMjg1Mzc2NzAxXzEwMTUzNDg2NjM4MTc5NDc=,why? Because the orange POS didn’t tell you to believe it?,2025-02-08,reply,0
Costco,2025-02-01 09:00:00,Y29tbWVudDoxMDM0NDgxMjg1Mzc2NzAxXzQ2Nzk5OTE1NjM4MzY2Mw==,Y29tbWVudDoxMDM0NDgxMjg1Mzc2NzAxXzYzNTUyNjcxNTU1NjczOQ==,"well, someone has TDS!",2025-02-08,reply,0
Costco,2025-02-01 09:00:00,Y29tbWVudDoxMDM0NDgxMjg1Mzc2NzAxXzM4NTkzNjM1NjA5NDE5NDE=,Y29tbWVudDoxMDM0NDgxMjg1Mzc2NzAxXzQ2Nzk5OTE1NjM4MzY2Mw==,My question and not giving an answer shows that I’m right you’re wrong and also you’re an idiot.,2025-02-08,reply,0
Costco,2025-02-01 09:00:00,Y29tbWVudDoxMDM0NDgxMjg1Mzc2NzAxXzk3Mjg4Nzc0ODExNDEzNQ==,Y29tbWVudDoxMDM0NDgxMjg1Mzc2NzAxXzEwMTUzNDg2NjM4MTc5NDc=,"Lynne Bjarnason Dunlap it’s amazing that you think a faction of our society that had to be forced to make the right decisions through legal action would magically become fair minded, you are delusional if you think so…but that’s pretty obvious",2025-02-01,reply,1
Costco,2025-02-01 09:00:00,Y29tbWVudDoxMDM0NDgxMjg1Mzc2NzAxXzEzMzYzNjY4NDQ0ODM4ODk=,Y29tbWVudDoxMDM0NDgxMjg1Mzc2NzAxXzk3Mjg4Nzc0ODExNDEzNQ==,"Lynne Bjarnason Dunlap what DEI training and education do you have? Because I have a background in DEI and everything you said, is incorrect and a lie",2025-02-01,reply,2
Costco,2025-02-01 09:00:00,Y29tbWVudDoxMDM0NDgxMjg1Mzc2NzAxXzk2NDc2MDE3NTYwNTM3Nw==,Y29tbWVudDoxMDM0NDgxMjg1Mzc2NzAxXzEwMTUzNDg2NjM4MTc5NDc=,you are definitely the problem sunshine.,2025-02-01,reply,2
Costco,2025-02-01 09:00:00,Y29tbWVudDoxMDM0NDgxMjg1Mzc2NzAxXzI2MTU2NDQzNjg2Mjk5MjI=,Y29tbWVudDoxMDM0NDgxMjg1Mzc2NzAxXzk2NDc2MDE3NTYwNTM3Nw==,says a man who voted for orange Jesus…,2025-02-01,reply,0
Costco,2025-02-01 09:00:00,Y29tbWVudDoxMDM0NDgxMjg1Mzc2NzAxXzExODQ4NDkwMjk4Mzc4MDY=,Y29tbWVudDoxMDM0NDgxMjg1Mzc2NzAxXzk2NDc2MDE3NTYwNTM3Nw==,tariffs are in place…as are retaliatory tariffs…you ready for the price hikes you voted for? Slow clap,2025-02-08,reply,2
Costco,2025-02-01 09:00:00,Y29tbWVudDoxMDM0NDgxMjg1Mzc2NzAxXzE2NzMxODM1MzAyNDUzNDU=,,"Costco was crazy today! It was nice to see, but I wish for just one thing. It would actually be nice to be able to use a system similar to Sam’s with the Scan and Go to check out. It would be great particularly when the check out lines get extra long.",2025-02-01,initial,3
Costco,2025-02-01 09:00:00,Y29tbWVudDoxMDM0NDgxMjg1Mzc2NzAxXzY0Mjc0MDk3NDk1NTUwMg==,Y29tbWVudDoxMDM0NDgxMjg1Mzc2NzAxXzE2NzMxODM1MzAyNDUzNDU=,we have them in our Costcos. Maybe yours is coming soon?,2025-02-01,reply,1
Costco,2025-02-01 09:00:00,Y29tbWVudDoxMDM0NDgxMjg1Mzc2NzAxXzEwMzYwODk5NDE4ODEzOTA=,Y29tbWVudDoxMDM0NDgxMjg1Mzc2NzAxXzY0Mjc0MDk3NDk1NTUwMg==,"ooo! Yay! I hope we get it at our store soon if they don’t have it. I didn’t notice any signs today, but I will look next time. Thanks!",2025-02-01,reply,1
Costco,2025-02-01 09:00:00,Y29tbWVudDoxMDM0NDgxMjg1Mzc2NzAxXzEzODAzNDk2OTYyNzk3MjI=,,"I live alone, so don't have a need for a COSTCO membership. But I am so impressed with your commitment to DEI and doing what is right, I may just get one anyway. I'm sure you've been hit with tons of negative comments, but you stood strong against the arrogance and hate. Wish other retailers had your courage.",2025-02-01,initial,8
Costco,2025-02-01 09:00:00,Y29tbWVudDoxMDM0NDgxMjg1Mzc2NzAxXzEyOTYxMzIzNzE1MDEzOTk=,,Does ceramic give off toxins?,2025-02-01,initial,3
Costco,2025-02-01 09:00:00,Y29tbWVudDoxMDM0NDgxMjg1Mzc2NzAxXzEzMDgxNTg2MTAzMDgyMTE=,Y29tbWVudDoxMDM0NDgxMjg1Mzc2NzAxXzEyOTYxMzIzNzE1MDEzOTk=,don’t know,2025-02-01,reply,1
Costco,2025-02-01 09:00:00,Y29tbWVudDoxMDM0NDgxMjg1Mzc2NzAxXzM1NDg3Mjg2MzU0Mjc3NjU=,Y29tbWVudDoxMDM0NDgxMjg1Mzc2NzAxXzEyOTYxMzIzNzE1MDEzOTk=,"ask RFK, Jr he’s got the lowdown on all of that!",2025-02-08,reply,3
Costco,2025-02-01 09:00:00,Y29tbWVudDoxMDM0NDgxMjg1Mzc2NzAxXzk4MjU5MjIwNzEzNTk5NQ==,Y29tbWVudDoxMDM0NDgxMjg1Mzc2NzAxXzM1NDg3Mjg2MzU0Mjc3NjU=,hahaha. No thanks id probably find a dead bear in my yard.,2025-02-08,reply,1
Costco,2025-02-01 09:00:00,Y29tbWVudDoxMDM0NDgxMjg1Mzc2NzAxXzEwNDc1NDQ1MDM4MDU1MzQ=,Y29tbWVudDoxMDM0NDgxMjg1Mzc2NzAxXzM1NDg3Mjg2MzU0Mjc3NjU=,even though I find it a legit question.,2025-02-08,reply,0
Costco,2025-02-01 09:00:00,Y29tbWVudDoxMDM0NDgxMjg1Mzc2NzAxXzExMzYwNTg1MjQ5MDA5NTM=,Y29tbWVudDoxMDM0NDgxMjg1Mzc2NzAxXzEwNDc1NDQ1MDM4MDU1MzQ=,oh it is…. I just had to take the opportunity to sneak that very snarky comment in! It would have been worse were we talking about a blender! Thank you for that image stuck in my brain Caroline Kennedy!,2025-02-08,reply,1
Costco,2025-02-01 09:00:00,Y29tbWVudDoxMDM0NDgxMjg1Mzc2NzAxXzEzNDEzMDQ3NDAyMTkzMDk=,Y29tbWVudDoxMDM0NDgxMjg1Mzc2NzAxXzEwNDc1NDQ1MDM4MDU1MzQ=,"Even-heating Ceramic Forged Aluminum cookware—made without PFAs, BPA, lead and cadmium*—features durable construction and modern exteriors that are display ready from kitchen to table.",2025-02-08,reply,0
Costco,2025-02-01 09:00:00,Y29tbWVudDoxMDM0NDgxMjg1Mzc2NzAxXzExOTU4Mzc0NzE5MDI2MDM=,,"Renewing my membership! Thank you for your humanity, Costco!!!!",2025-02-01,initial,18
Costco,2025-02-01 09:00:00,Y29tbWVudDoxMDM0NDgxMjg1Mzc2NzAxXzQ0Nzc2ODI1MTYzMzgzOQ==,,Que precio tiene la membresía?,2025-02-01,initial,0
