company_name,post_date,id,parent_id,comment_text,comment_date,comment_type,reaction_count
Delta,2025-02-13 09:30:00,Y29tbWVudDoxMDIxMzAxOTAwMDE4NzIyXzEwNDk4NDY3MTcxODAyMDU=,,"Shame on you Delta Airlines Skylounge TPA. You just turned away an Army veteran, with his service dog who had a first class ticket to fly out at 8am today. The flight was delayed for over 2 hours with passengers already boarded, then cancelled and he was rebooted for a 5pm flight. So here is someone who just with the 1st class ticket should be allowed access (AA would have), but then he has a service dog with a PTSD patch on it. The gentleman also has early Alzheimers (which you wouldn't have known about) and is out of his home comfort zone. I wasn't a DL fan before and I'm certainly less of one now.",2025-02-15,initial,8
Delta,2025-02-13 09:30:00,Y29tbWVudDoxMDIxMzAxOTAwMDE4NzIyXzkyMDkyMjQ0MzU1NzAyOA==,Y29tbWVudDoxMDIxMzAxOTAwMDE4NzIyXzEwNDk4NDY3MTcxODAyMDU=,"a first class domestic ticket doesn't come with lounge access. Same policy for all US carriers, including AA. It is a membership lounge, not a first class lounge. If you want lounge access you generally will need to purchase a lounge membership.",2025-02-15,reply,0
Delta,2025-02-13 09:30:00,Y29tbWVudDoxMDIxMzAxOTAwMDE4NzIyXzE4Mjk0NjQ2Nzc4MDM0NjI=,Y29tbWVudDoxMDIxMzAxOTAwMDE4NzIyXzkyMDkyMjQ0MzU1NzAyOA==,"ok. My bad on that. Still say it would have been a great gesture after non-weather related delay after delay, then cancellation and rebooking over 9 HRS LATER (and we won't even mention the 2 hr delay that then happened for the connecting flight in ATL, because one surely would have expected their bad luck to run out with just the one delay). The reason I'm indignant over this, is here is a 75 year old Vietnam veteran with his ptsd service dog. It truly would have been a great gesture, but instead an opportunity lost. So when he should have gotten home around 11am, he landed around 11pm. I'm not entirely sure why he wasn't booked on another airline to get him home. I wish I had been there to raise the stink to the level it needed to go.",2025-02-22,reply,0
Delta,2025-02-13 09:30:00,Y29tbWVudDoxMDIxMzAxOTAwMDE4NzIyXzEwMTMyMTkxOTc1MDgyMTM=,,Super…the next step is to get CEO Ed Bastian fired! He is awful In my opinion and has ruined our Delta SkyMile program,2025-02-15,initial,26
Delta,2025-02-13 09:30:00,Y29tbWVudDoxMDIxMzAxOTAwMDE4NzIyXzY2MTE0MDAyMjkxMDI3NA==,Y29tbWVudDoxMDIxMzAxOTAwMDE4NzIyXzEwMTMyMTkxOTc1MDgyMTM=,the best in the industry,2025-02-15,reply,5
Delta,2025-02-13 09:30:00,Y29tbWVudDoxMDIxMzAxOTAwMDE4NzIyXzE1MTExMzYwMTYyMzEwMDg=,Y29tbWVudDoxMDIxMzAxOTAwMDE4NzIyXzY2MTE0MDAyMjkxMDI3NA==,nope,2025-02-15,reply,3
Delta,2025-02-13 09:30:00,Y29tbWVudDoxMDIxMzAxOTAwMDE4NzIyXzM5MjI2NzMyODc5NzYxOTY=,Y29tbWVudDoxMDIxMzAxOTAwMDE4NzIyXzY2MTE0MDAyMjkxMDI3NA==,yes they are great in flying and their safety record but awful in their SkyMiles program … please get your facts straight and get real,2025-02-15,reply,3
Delta,2025-02-13 09:30:00,Y29tbWVudDoxMDIxMzAxOTAwMDE4NzIyXzExNTkxODU0NDkxNDI3ODA=,Y29tbWVudDoxMDIxMzAxOTAwMDE4NzIyXzM5MjI2NzMyODc5NzYxOTY=,The best sky lounges in the USA - the best credit card program - easy to redeem points - lots of other perks year round ! Including head start - free drinks - Delta one lounges! The list goes on and on!,2025-02-15,reply,0
Delta,2025-02-13 09:30:00,Y29tbWVudDoxMDIxMzAxOTAwMDE4NzIyXzYzNTYxMzA2MjI4NDkzNA==,Y29tbWVudDoxMDIxMzAxOTAwMDE4NzIyXzExNTkxODU0NDkxNDI3ODA=,"again, you missed the main point…let me be clear because apparently you can’t fix stupid…they have downgraded their Delta SkyMile program and if we use our SkyMiles for flights etc we do not, repeat, do not get any MQDs so we can retain our status. Regional and global upgrades are benefits they give you based upon your medallion status. You need to read the Delta SkyMile program in depth. I will not reply to you again.",2025-02-15,reply,3
Delta,2025-02-13 09:30:00,Y29tbWVudDoxMDIxMzAxOTAwMDE4NzIyXzE4NDg5ODY5NzkxNzM2NTM=,Y29tbWVudDoxMDIxMzAxOTAwMDE4NzIyXzYzNTYxMzA2MjI4NDkzNA==,hahaha- poor dear I see Spirit in your future!,2025-02-15,reply,0
Delta,2025-02-13 09:30:00,Y29tbWVudDoxMDIxMzAxOTAwMDE4NzIyXzU5NDM1MzczMDE4Mzk2OA==,Y29tbWVudDoxMDIxMzAxOTAwMDE4NzIyXzEwMTMyMTkxOTc1MDgyMTM=,"I’m a 1.5 million miler with Delta. Of all the mileage loyalty programs I’m in, it’s the best.",2025-02-15,reply,0
Delta,2025-02-13 09:30:00,Y29tbWVudDoxMDIxMzAxOTAwMDE4NzIyXzE3NzgxNDc5ODI5Nzc0MTc=,Y29tbWVudDoxMDIxMzAxOTAwMDE4NzIyXzEwMTMyMTkxOTc1MDgyMTM=,Wow. Does name calling make you feel better?,2025-02-15,reply,0
Delta,2025-02-13 09:30:00,Y29tbWVudDoxMDIxMzAxOTAwMDE4NzIyXzY1MDg2NjU4MDc4OTU3MA==,Y29tbWVudDoxMDIxMzAxOTAwMDE4NzIyXzY2MTE0MDAyMjkxMDI3NA==,"yes 
 it’s delta not delts for one, secondly, tell me what good all our miles are when we use them we get absolutely no MQDs and we most likely have a very difficult time maintaining ￼ medallion status…. If you can’t understand that, well…what can I say about your knowledge about the new delta SkyMile program",2025-02-15,reply,0
Delta,2025-02-13 09:30:00,Y29tbWVudDoxMDIxMzAxOTAwMDE4NzIyXzE3NTM3MzU5MDIwMjYwNTg=,Y29tbWVudDoxMDIxMzAxOTAwMDE4NzIyXzY1MDg2NjU4MDc4OTU3MA==,I received MQDs when I used miles end of 2024...not sure this is correct unless they have changed the program again.,2025-02-15,reply,0
Delta,2025-02-13 09:30:00,Y29tbWVudDoxMDIxMzAxOTAwMDE4NzIyXzU3NDc2MTgzNTU1OTgyNw==,Y29tbWVudDoxMDIxMzAxOTAwMDE4NzIyXzY1MDg2NjU4MDc4OTU3MA==,"""our""? They are rewarding the customers who spend the most money with the airline. Plain and simple. I miss the various loopholes and ways of getting higher status without spending a ton of money with Delta, but it is the direction in which all of the airlines are heading.",2025-02-15,reply,1
Delta,2025-02-13 09:30:00,Y29tbWVudDoxMDIxMzAxOTAwMDE4NzIyXzY0NTQ2Njg4MTM5MzEzMw==,Y29tbWVudDoxMDIxMzAxOTAwMDE4NzIyXzU3NDc2MTgzNTU1OTgyNw==,"they are taking advantage of most of their customers…I have nearly 3 million miles which are worthless because if I use them for flights I get no MQDs and can’t retain my diamond status….also, who pays for most for flight? Not the flyers but their company which they offset from the corporate taxes…so get really",2025-02-15,reply,1
Delta,2025-02-13 09:30:00,Y29tbWVudDoxMDIxMzAxOTAwMDE4NzIyXzkzNDM3NjAwMjAxMDg1Ng==,Y29tbWVudDoxMDIxMzAxOTAwMDE4NzIyXzY0NTQ2Njg4MTM5MzEzMw==,"Well...using miles to pay for a flight doesn't give you status. That only makes sense. They give status for money paid. Also, you miles aren't worthless -- you can use them to purchase a ticket. It seems you want more than what they are offering.",2025-02-15,reply,1
Delta,2025-02-13 09:30:00,Y29tbWVudDoxMDIxMzAxOTAwMDE4NzIyXzM5NDAwMDE2MDYzMTkwNDg=,Y29tbWVudDoxMDIxMzAxOTAwMDE4NzIyXzY1MDg2NjU4MDc4OTU3MA==,Useless? You could fly a lot of places with that many miles. And why should you expect any bonus for using miles? You got MQM when you did spend money. You don’t get to double-dip.,2025-02-15,reply,0
Delta,2025-02-13 09:30:00,Y29tbWVudDoxMDIxMzAxOTAwMDE4NzIyXzExNTY2OTk1ODU4MjgyNzY=,Y29tbWVudDoxMDIxMzAxOTAwMDE4NzIyXzY0NTQ2Njg4MTM5MzEzMw==,Yes he needs to go post haste.,2025-02-15,reply,1
Delta,2025-02-13 09:30:00,Y29tbWVudDoxMDIxMzAxOTAwMDE4NzIyXzQ4MTg4Mzk2MTQ1NDgwNA==,Y29tbWVudDoxMDIxMzAxOTAwMDE4NzIyXzEwMTMyMTkxOTc1MDgyMTM=,", also, be careful what you wish for. Delta has thrived under his leadership and he has helped lead Delta to be a premium airline… instead of racing to the bottom, like most of the others. Would you rather have me or the old CEOs from US Airways/American, who treated their customers with disdain?",2025-02-15,reply,0
Delta,2025-02-13 09:30:00,Y29tbWVudDoxMDIxMzAxOTAwMDE4NzIyXzYxNjkxNTE5NzYxNzAzMQ==,,Had the opportunity to fly AMS-ATL in Delta One on this one yesterday. Great experience!,2025-02-15,initial,5
Delta,2025-02-13 09:30:00,Y29tbWVudDoxMDIxMzAxOTAwMDE4NzIyXzEzMDQ0OTk2NjM5MzAxMjk=,Y29tbWVudDoxMDIxMzAxOTAwMDE4NzIyXzYxNjkxNTE5NzYxNzAzMQ==,how are the footwells? Spacious? Easy to turn over in lay flat?,2025-02-15,reply,0
Delta,2025-02-13 09:30:00,Y29tbWVudDoxMDIxMzAxOTAwMDE4NzIyXzUwNjk4MTk3NTc3NzE3Mw==,Y29tbWVudDoxMDIxMzAxOTAwMDE4NzIyXzEzMDQ0OTk2NjM5MzAxMjk=,"the most spacious footwell I’ve experienced so far in any D1 product, and I’m 6’3” with big feet. The sleeping space felt reasonable, including for turning around. I also appreciated the new breathable, non-leather surface",2025-02-15,reply,1
Delta,2025-02-13 09:30:00,Y29tbWVudDoxMDIxMzAxOTAwMDE4NzIyXzYzMDA3NzQ4NjIzMzg4OA==,,"Hey Delta Air Lines, how about you make the seats not so unbearably, uncomfortably close together?",2025-02-15,initial,2
Delta,2025-02-13 09:30:00,Y29tbWVudDoxMDIxMzAxOTAwMDE4NzIyXzg4MTUzMTQ5NzI5MzM1OA==,Y29tbWVudDoxMDIxMzAxOTAwMDE4NzIyXzYzMDA3NzQ4NjIzMzg4OA==,I apologise for the frustrating moment kindly check on your private message I have already sent a message kindly respond back please for further assistance.,2025-02-15,reply,3
Delta,2025-02-13 09:30:00,Y29tbWVudDoxMDIxMzAxOTAwMDE4NzIyXzM0MDc1Njg4MDYwNDUwMTc=,,How bout maintain your planes and flight schedule?,2025-02-15,initial,5
Delta,2025-02-13 09:30:00,Y29tbWVudDoxMDIxMzAxOTAwMDE4NzIyXzk5NTEwNjE3NTg2MzI5MQ==,,"Add it to the DTw to Chatlrlotte route because those planes are old, uncomfortable and embarrassing.",2025-02-15,initial,13
Delta,2025-02-13 09:30:00,Y29tbWVudDoxMDIxMzAxOTAwMDE4NzIyXzE0MjUwMDQ5MzE4MDU2MjY=,Y29tbWVudDoxMDIxMzAxOTAwMDE4NzIyXzk5NTEwNjE3NTg2MzI5MQ==,these are wide body planes for transoceanic flights. Not domestic sorry lol,2025-02-15,reply,2
Delta,2025-02-13 09:30:00,Y29tbWVudDoxMDIxMzAxOTAwMDE4NzIyXzMxODI5ODU0MTE4NDM4MzY=,Y29tbWVudDoxMDIxMzAxOTAwMDE4NzIyXzE0MjUwMDQ5MzE4MDU2MjY=,"not entirely true. The wide body fleet does do some domestic. Lots of hub to hub flights for repositioning purposes are done with wide bodies and plenty of higher density routes on downtime, usually in the morning, like ATL-MCO are done with wide bodies. Plus some HNL flights. Granted you are correct that this particular route would never be serviced by this aircraft.",2025-02-15,reply,0
Delta,2025-02-13 09:30:00,Y29tbWVudDoxMDIxMzAxOTAwMDE4NzIyXzEyNzM1MDcyODAzODM2Njc=,Y29tbWVudDoxMDIxMzAxOTAwMDE4NzIyXzE0MjUwMDQ5MzE4MDU2MjY=,I’m aware I work for Delta but it’s not going DTW to Charlotte lol,2025-02-15,reply,1
Delta,2025-02-13 09:30:00,Y29tbWVudDoxMDIxMzAxOTAwMDE4NzIyXzEzODUxOTI1MTkzMTQwMjU=,Y29tbWVudDoxMDIxMzAxOTAwMDE4NzIyXzk5NTEwNjE3NTg2MzI5MQ==,I fly from CLT as my home airport. I am hoping once more A220’s come online that we get those for some of our routes. Right now it’s just basically 717’s and RJ’s to everywhere except SLC. I want LGA upgraded to mainline and have them use the A220 on that route.,2025-02-15,reply,0
Delta,2025-02-13 09:30:00,Y29tbWVudDoxMDIxMzAxOTAwMDE4NzIyXzEwNDI3NDYwNjQzODkxNjc=,Y29tbWVudDoxMDIxMzAxOTAwMDE4NzIyXzk5NTEwNjE3NTg2MzI5MQ==,Yes. Because that’s the perfect mission for that aircraft.,2025-02-15,reply,0
Delta,2025-02-13 09:30:00,Y29tbWVudDoxMDIxMzAxOTAwMDE4NzIyXzEzNzQ2NjI2MDA2Mjg0MjU=,Y29tbWVudDoxMDIxMzAxOTAwMDE4NzIyXzk5NTEwNjE3NTg2MzI5MQ==,Fly American they fly all mainline on a 737.,2025-02-15,reply,3
Delta,2025-02-13 09:30:00,Y29tbWVudDoxMDIxMzAxOTAwMDE4NzIyXzUyODczNDUyOTY2NjE4MQ==,Y29tbWVudDoxMDIxMzAxOTAwMDE4NzIyXzk5NTEwNjE3NTg2MzI5MQ==,"sure! i hate flying for long distance because of these old planes,no comfort at all",2025-02-15,reply,0
Delta,2025-02-13 09:30:00,Y29tbWVudDoxMDIxMzAxOTAwMDE4NzIyXzk3NDYzNjIzNDY1MTEyNQ==,,"My two worst flight experiences have been with Delta. Today's experience from Puerto Rico to Austin, TX was terrible. They changed my flight twice. They downgraded me from First Class to Comfort+ even though there were free seats in First Class. They sent my luggage to another destination. They forced me to wait at the airport until the next day for my luggage to arrive because there was no one available to take it to my hotel. I called to file a complaint and they told me that complaints can only be filed on their website, and I still haven't been able to file a complaint because there's an error with the flight number. I think they need to work more on improving customer service instead of continuing to expand.",2025-04-05,initial,0
Delta,2025-02-13 09:30:00,Y29tbWVudDoxMDIxMzAxOTAwMDE4NzIyXzk0MDQ4OTIzNDUxNTMxNg==,,Which flights are these going to be on. Or is it just one plane like this?,2025-02-15,initial,1
Delta,2025-02-13 09:30:00,Y29tbWVudDoxMDIxMzAxOTAwMDE4NzIyXzkxMjgwMzM3NzczMTQ3OA==,,Had a great experience flying First Class. i love it ! For 15 hours flight .So worthed and food are delicious plus the snacks,2025-02-15,initial,2
Delta,2025-02-13 09:30:00,Y29tbWVudDoxMDIxMzAxOTAwMDE4NzIyXzg1MDcxODg4NzkzODE3NDc=,,Looks good! Can't wait for it to be on the others planes,2025-02-15,initial,2
Delta,2025-02-13 09:30:00,Y29tbWVudDoxMDIxMzAxOTAwMDE4NzIyXzIyMTc4MDA2ODUyODM4Njg=,,I wish it was still safe to fly,2025-02-15,initial,3
Delta,2025-02-13 09:30:00,Y29tbWVudDoxMDIxMzAxOTAwMDE4NzIyXzYyMjY4NDU1Mzk0MjgyOQ==,,"I AM LOOKING FOR A REFUND OR ECREDIT FOR COMFORT + , ICHANGED MY FLIGHT AND WAS NOT ABLE TO GET COMFORT + AND HAD TO SIT AND SUFFER IN MAIN CABIN , I PAID FOR A REFUNDABLE TICKET , WHY CAN I NOT GET A REFUND IF I CHANGED MY RESERVATION TO A DIFFERENT CITY IN THE SAME COUNTRY, HOW UNFAIR AND WHAT AN ABSURD RULE, WHERE IS YOUR CUSTOMER SERVICE DELTA. EVEN AN ECREDIT FOR FUTURE FLIGHTS WOULD BE ACCETABLE. BUYERS BEWARE!! DELTA NEEDS TO CHANGE THIS AND REFUND PASSENGERS IF THEY CHANGE RESERVATION TO MAIN IF NO COMFORT AVAILABLE- VOLUNTARY OR INVOLUNTARY - P E R I O D !!",2025-03-29,initial,0
Delta,2025-02-13 09:30:00,Y29tbWVudDoxMDIxMzAxOTAwMDE4NzIyXzEyODAyNDg5Nzk4Njk5NDM=,,"Customer service is tanking. Every time you contact it’s a different story, different timeline and different answer. Poor.",2025-02-22,initial,3
Delta,2025-02-13 09:30:00,Y29tbWVudDoxMDIxMzAxOTAwMDE4NzIyXzEyMDA2ODg0OTQ5NTgzMTA=,Y29tbWVudDoxMDIxMzAxOTAwMDE4NzIyXzEyODAyNDg5Nzk4Njk5NDM=,Sorry for the inconvenience caused we apologies for the way you were treated kindly share your whatsApp number for further assistance please.,2025-02-22,reply,0
Delta,2025-02-13 09:30:00,Y29tbWVudDoxMDIxMzAxOTAwMDE4NzIyXzE2MjcwODkzMzE1MzI5Nzg=,Y29tbWVudDoxMDIxMzAxOTAwMDE4NzIyXzEyMDA2ODg0OTQ5NTgzMTA=,nice try scammer.,2025-02-22,reply,0
Delta,2025-02-13 09:30:00,Y29tbWVudDoxMDIxMzAxOTAwMDE4NzIyXzE2MDc0MjM5ODY3NTYwNDg=,,I guess coach class is still crammed in like sardines?,2025-02-15,initial,6
Delta,2025-02-13 09:30:00,Y29tbWVudDoxMDIxMzAxOTAwMDE4NzIyXzE4MDk2MzMwMDMyMzgzNzA=,,Not a fan of the cloth seats in D1. And let’s hope they’re firm like before because soft lie flats are terrible!,2025-02-15,initial,2
Delta,2025-02-13 09:30:00,Y29tbWVudDoxMDIxMzAxOTAwMDE4NzIyXzYzMDQ0MjQ2Mjk2ODgzMQ==,,When will Ed Bastian comment on the crash?,2025-02-22,initial,0
Delta,2025-02-13 09:30:00,Y29tbWVudDoxMDIxMzAxOTAwMDE4NzIyXzk2NDc1OTUyNTI4MDMwOQ==,,"Seems there are quite a few serial complainers here. ￼ if you don’t like this airline, choose another….. life has options. Serial complainers are boring",2025-02-15,initial,1
Delta,2025-02-13 09:30:00,Y29tbWVudDoxMDIxMzAxOTAwMDE4NzIyXzEyODkyMjU3NjIzMzI1MDM=,,"My son boarded his flight out of Atlanta last night, only to then have to deboard because they had no pilot to fly the plane. Flight pushed to 9:30 pm, then cancelled and was told he wouldn’t be able to get a flight out until Tuesday. Do better Delta. That’s unacceptable",2025-02-22,initial,4
Delta,2025-02-13 09:30:00,Y29tbWVudDoxMDIxMzAxOTAwMDE4NzIyXzExNjg3NTgwMjc5MzI1MDQ=,Y29tbWVudDoxMDIxMzAxOTAwMDE4NzIyXzEyODkyMjU3NjIzMzI1MDM=,We have spotted your post and we would like to know what happened.send us a direct message through messenger or use our Link below so that your concern can be addressed sorry you got that impression,2025-02-22,reply,0
Delta,2025-02-13 09:30:00,Y29tbWVudDoxMDIxMzAxOTAwMDE4NzIyXzYwOTc0Njk1ODYyMjA5OQ==,Y29tbWVudDoxMDIxMzAxOTAwMDE4NzIyXzEyODkyMjU3NjIzMzI1MDM=,"That sounds stressful! Please send us a DM with your contact number and flight details, and we'll do our best to assist you with this situation right away.",2025-02-22,reply,0
Delta,2025-02-13 09:30:00,Y29tbWVudDoxMDIxMzAxOTAwMDE4NzIyXzE4NzA5MTcwNjM2NTE5Nzk=,,Love it peaceful and comfortable.Excellent job everyone. Keep up a good service.,2025-02-15,initial,0
Delta,2025-02-13 09:30:00,Y29tbWVudDoxMDIxMzAxOTAwMDE4NzIyXzExNjY3NzQ4MzE2OTY5ODQ=,,It looks absolutely amazing! I can't wait for my next flight and to try it out!! Excellent job!!,2025-02-15,initial,2
Delta,2025-02-13 09:30:00,Y29tbWVudDoxMDIxMzAxOTAwMDE4NzIyXzY2MzIyMDc5OTU2NzY2MA==,,"I am a loyal Delta customer, I’ve loved and enjoyed flying with them for years. However, I am beginning to question that loyalty as their product and service is slipping. Comfort+ has become a joke!",2025-03-08,initial,0
Delta,2025-02-13 09:30:00,Y29tbWVudDoxMDIxMzAxOTAwMDE4NzIyXzEwMjk2OTk5MzIzMjkxNDY=,,Leg room?,2025-02-15,initial,1
Delta,2025-02-13 09:30:00,Y29tbWVudDoxMDIxMzAxOTAwMDE4NzIyXzk0MTkyNzkwMTgwOTU1NDU=,,Really you guys can get an award for the total number of times you can fail in a single flight. And not that it should matter but that comes from a Platinum member. Can’t imagine how it was for everyone else.,2025-02-22,initial,1
Delta,2025-02-13 09:30:00,Y29tbWVudDoxMDIxMzAxOTAwMDE4NzIyXzk5MjU4NjU2MjgxMjc3Mw==,,Seats are way too small.,2025-02-15,initial,4
Delta,2025-02-13 09:30:00,Y29tbWVudDoxMDIxMzAxOTAwMDE4NzIyXzEyNDY1NjcyMTMxMDk2NTc=,,Are the seats comfortable? Anymore leg room for 6 footers?,2025-02-15,initial,1
Delta,2025-02-13 09:30:00,Y29tbWVudDoxMDIxMzAxOTAwMDE4NzIyXzUxNzk2NjY1MTMzMTA3NA==,,Delta customer forever. Thank you for sticking to your values and keeping DEI programs. DEI programs make America stronger and better.,2025-02-22,initial,2
Delta,2025-02-13 09:30:00,Y29tbWVudDoxMDIxMzAxOTAwMDE4NzIyXzkyMzU0MzQzOTk0OTYzNQ==,,I would suggest more comfortable arm rests. Would cost a penny.,2025-02-15,initial,1
Delta,2025-02-13 09:30:00,Y29tbWVudDoxMDIxMzAxOTAwMDE4NzIyXzY0ODk5MzAwMDk4MTIyNw==,,Looks good. Not innovative or anything but looks good.,2025-02-15,initial,2
Delta,2025-02-13 09:30:00,Y29tbWVudDoxMDIxMzAxOTAwMDE4NzIyXzYzNzYzMzg1NTM5NTY0Ng==,,Looks great.,2025-02-15,initial,0
Delta,2025-02-13 09:30:00,Y29tbWVudDoxMDIxMzAxOTAwMDE4NzIyXzExMjk0NTMyODg0NzY4NzU=,,"I love Delta. Not sure when I would fly with you again, but you’re my go to airline for when I have layovers just because you know how to treat people better with disabilities than any other airline I’ve flown on. ￼",2025-02-15,initial,0
Delta,2025-02-13 09:30:00,Y29tbWVudDoxMDIxMzAxOTAwMDE4NzIyXzExNDY2NTMzMjcwNTQ0NjE=,,This makes my next million miles will be more comfortable and exciting,2025-02-15,initial,1
Delta,2025-02-13 09:30:00,Y29tbWVudDoxMDIxMzAxOTAwMDE4NzIyXzI2NjQyMDg3MDA0MzQ5MzU=,,"Are your Business Class seats bigger than previous. My last flight to Italy in Business class I got off the plane with black and blues on my shins from the foot area being so tiny, I’m 5’4”, my husband at 5’11” had his feet in the isle. Also the food was horrid, haven’t flown Delta since",2025-02-15,initial,6
Delta,2025-02-13 09:30:00,Y29tbWVudDoxMDIxMzAxOTAwMDE4NzIyXzUxMTg4MDU1ODIzNjI5MA==,,Steer clear of Delta Airlines! Cheated me out of stataus despite being a milllion miler and loyal flyer for 30 years. Company has no integrity,2025-02-22,initial,2
Delta,2025-02-13 09:30:00,Y29tbWVudDoxMDIxMzAxOTAwMDE4NzIyXzEzNjExMDQ2MTQ5MTYyMTM=,,"This was my first class experience 2 weeks ago, breakfast in my lap and it not even being acknowledged",2025-03-01,initial,0
Delta,2025-02-13 09:30:00,Y29tbWVudDoxMDIxMzAxOTAwMDE4NzIyXzM5ODA5Mjk5MDU1MDk1OTU=,,I hope the seats are softer ….￼,2025-02-15,initial,1
Delta,2025-02-13 09:30:00,Y29tbWVudDoxMDIxMzAxOTAwMDE4NzIyXzExNjc4MzIwMzE0MTQ4OTM=,,"I would have to try out the leg room and elbow room. I was recently on a SW flight that had no elbow room and the guy in front, on the way there, was reclined the whole trip which made it impossible to put my drink on the tray. On the way back we sat up front but the elbow room was so bad that I was squished against the window, trying to keep my elbow from disturbing my 87 year old husband who was ""nodding"". For over a week my whole right arm and shoulder were very sore and radiated the pain into my neck Flying is very expensive now and I don't like paying for discomfort.",2025-02-22,initial,2
Delta,2025-02-13 09:30:00,Y29tbWVudDoxMDIxMzAxOTAwMDE4NzIyXzY0MDI4OTgwODM2NzM3OA==,Y29tbWVudDoxMDIxMzAxOTAwMDE4NzIyXzExNjc4MzIwMzE0MTQ4OTM=,"+That happened on a SW flight, not Delta. I would have to travel on your new Delta plane and see how comfortable it is.",2025-02-22,reply,0
Delta,2025-02-13 09:30:00,Y29tbWVudDoxMDIxMzAxOTAwMDE4NzIyXzk4MTA5Mzc4NDAwMTkyNQ==,,"Faye I wrote you a. Long beautiful comment now I can’t find it you know I love you have something for you and Big Sister you will get it before 2025 is gone Love you with all my soul heart 
 and beyond",2025-03-22,initial,0
Delta,2025-02-13 09:30:00,Y29tbWVudDoxMDIxMzAxOTAwMDE4NzIyXzYyMDA2NzQxNDIwODc5Mw==,,"Delta needs to replace the aging widebody fleet that flies trans-continental from JFK to the west coast(SFO,LAX). Both times, I flew to LA and SFO from JFK were on 30+ year old 767-300er's. You guys want JFK to be your hub yet you fly old aging planes here. Time to retire the 767 300s and replace them with the a350s. The a330s is still too small for the jfk-lax or jfk-sfo with the 2-3-2 seating lay out.",2025-03-15,initial,0
Delta,2025-02-13 09:30:00,Y29tbWVudDoxMDIxMzAxOTAwMDE4NzIyXzk3MzQ5NTAyMDk2NzgwNA==,,"350s will be added to summer schedule for a couple of months for LAX routes, when SEA will get one of these, 2027?",2025-02-15,initial,3
Delta,2025-02-13 09:30:00,Y29tbWVudDoxMDIxMzAxOTAwMDE4NzIyXzI3MTAwMjIxMzU4NjQ5MTQ=,,I love Delta,2025-02-15,initial,3
Delta,2025-02-13 09:30:00,Y29tbWVudDoxMDIxMzAxOTAwMDE4NzIyXzk4MjQ4MzM3MDQ2MTAwNA==,,Yes! Looking forward to traveling with Delta!! Love the new design,2025-02-15,initial,0
Delta,2025-02-13 09:30:00,Y29tbWVudDoxMDIxMzAxOTAwMDE4NzIyXzQ4NjAyNzA4NzY3OTAxNQ==,,Always have an excellent experience,2025-02-15,initial,0
Delta,2025-02-13 09:30:00,Y29tbWVudDoxMDIxMzAxOTAwMDE4NzIyXzk4OTc0MDEwOTY4NTk3OQ==,,Its all about getting lighter materials to lessen weight and save on fuel cost but the real question we care about is.... is the seat cushy comfortable or hard and not?,2025-02-15,initial,0
Delta,2025-02-13 09:30:00,Y29tbWVudDoxMDIxMzAxOTAwMDE4NzIyXzE3MTg3MzU3NDIwMTM3Nzc=,,Unless you fly business class or first class you are crammed in like sardines.,2025-02-15,initial,1
Delta,2025-02-13 09:30:00,Y29tbWVudDoxMDIxMzAxOTAwMDE4NzIyXzUyNTcwMjQ5MzU1NDE4NA==,,Delta just kicked us out of our confort seat purchased 11 months ago for our family trip to Japan…anger 2 plus hours on the phone their answer was…” you can get a refund or cancel your flight’’ just 9 hours before our trip….they just don’t care!!! They have a new excuse now… “ is not personal’’ the system does it!!!,2025-03-22,initial,0
Delta,2025-02-13 09:30:00,Y29tbWVudDoxMDIxMzAxOTAwMDE4NzIyXzEzNjU1ODIzOTQ4NTQxNTM=,,Had one minute to get from different concourses no delays just connection. I don’t need food or bathroom at all,2025-02-15,initial,5
Delta,2025-02-13 09:30:00,Y29tbWVudDoxMDIxMzAxOTAwMDE4NzIyXzE3MTI0MTg3MDI3MDUxNTE=,Y29tbWVudDoxMDIxMzAxOTAwMDE4NzIyXzEzNjU1ODIzOTQ4NTQxNTM=,Customer satisfaction is our top priority and we're dedicated to ensure a positive experience for all our customer. Please share with us your number via DM as to allow us to understand the concerns better and work towards resolving them. Thank you.,2025-02-15,reply,0
Delta,2025-02-13 09:30:00,Y29tbWVudDoxMDIxMzAxOTAwMDE4NzIyXzY2NzQ1MjQ5NTYyMDg4MA==,,"I am writing to formally demand compensation for what can only be described as an absolute disaster of a travel experience on 03/10 and 03/11 2025. From the moment I arrived at the airport, your airline subjected me to a series of unacceptable failures, culminating in the loss of my luggage and a delayed arrival at my final destination.",2025-03-15,initial,0
Delta,2025-02-13 09:30:00,Y29tbWVudDoxMDIxMzAxOTAwMDE4NzIyXzM0OTkyODc1NzcwNDQzMzc=,,"Because of the uncertainty in the economy, I have canceled a river cruise for later this year. It would have involved a flight to Europe. I was not the only one who canceled. If things keep going the way they are, planes will be empty.",2025-02-15,initial,2
Delta,2025-02-13 09:30:00,Y29tbWVudDoxMDIxMzAxOTAwMDE4NzIyXzExODUxODgzOTk4NjA0MDg=,Y29tbWVudDoxMDIxMzAxOTAwMDE4NzIyXzM0OTkyODc1NzcwNDQzMzc=,This is obviously a robot responding!! Customer service is turning into a total joke.,2025-02-15,reply,0
Delta,2025-02-13 09:30:00,Y29tbWVudDoxMDIxMzAxOTAwMDE4NzIyXzEyMTI5MTIzMjAzOTgxNDQ=,,The morning before we were set to fly home I went to check in for our return flight on Delta's app and their system was down. I had no reception again until the afternoon. I checked again and our flight wasn't showing. I called in and was told that anytime you have a round trip flight and the first half gets called by law they need to cancel the second half. And was offered 1 way tickets that cost more than our original round trip tickets. I said I would not be paying that and asked for a manager. That manager told me it was an error it was canceled as the representative just forgot to click a button to save my return flight. And the best she could do to help us was get us on our original flight at the same cost. Every apology was followed by a but it's policy. And flying isn't guaranteed. And you have to be prepared for issues. And its out of their control. And FAA makes us do this.,2025-03-29,initial,0
