company_name,post_date,id,parent_id,comment_text,comment_date,comment_type,reaction_count
Delta,2025-02-13 09:30:00,Y29tbWVudDoxMDIxMzAxOTAwMDE4NzIyXzY2MTE5Njg5OTcxNDgwOA==,,"First and business class perks are hard to come by unless you've got the cash. I travel non-rev and try to get upgrades, but they hardly ever pan out. Oh, well. That A-350 looks sharp though! Wonder what the jump seat is like?",2025-02-15,initial,0
Delta,2025-02-13 09:30:00,Y29tbWVudDoxMDIxMzAxOTAwMDE4NzIyXzkxODU0MDAxMDEyNTc1MQ==,,As if Delta needs an excuse to be the most expensive airline.,2025-02-15,initial,2
Delta,2025-02-13 09:30:00,Y29tbWVudDoxMDIxMzAxOTAwMDE4NzIyXzkyNzk4MjYxOTUwNjcxMA==,,Those don’t look very comfortable. Tight leg room.,2025-02-15,initial,2
Delta,2025-02-13 09:30:00,Y29tbWVudDoxMDIxMzAxOTAwMDE4NzIyXzk4NTA5Njg5Mzc3MjczMA==,Y29tbWVudDoxMDIxMzAxOTAwMDE4NzIyXzkyNzk4MjYxOTUwNjcxMA==,Customer satisfaction is our top priority and we're dedicated to ensure a positive experience for all our customer. Please share with us your number via DM as to allow us to understand the concerns better and work towards resolving them. Thank you.,2025-02-15,reply,0
Delta,2025-02-13 09:30:00,Y29tbWVudDoxMDIxMzAxOTAwMDE4NzIyXzU2MzU2OTE0MzM2MDM3Nw==,,My favorite airline,2025-02-15,initial,1
Delta,2025-02-13 09:30:00,Y29tbWVudDoxMDIxMzAxOTAwMDE4NzIyXzEwMjkzMjI5MjIzNDA0NTI=,,Delta suites are filthy. They need to clean them at least once in a while,2025-02-15,initial,0
Delta,2025-02-13 09:30:00,Y29tbWVudDoxMDIxMzAxOTAwMDE4NzIyXzk2MjQwNjgxMDA5NzE0NjQ=,,Congratulations. Look’s awesome and I can’t wait to try it out,2025-02-15,initial,1
Delta,2025-02-13 09:30:00,Y29tbWVudDoxMDIxMzAxOTAwMDE4NzIyXzI0MDEzOTIwMDY0ODc4MDQx,,Delta Airlines flights always significantly delays between New York City and Buffalo. I’m a Skymiles Amex Gold Card member and frequent flyer. I have experienced terrible service from Delta with crazy delays every time I’m traveling New York City to and From Buffalo. I will suggest my family and friends not fly with Delta and avoid in all directions. Very poor airline management.,2025-04-05,initial,0
Delta,2025-02-13 09:30:00,Y29tbWVudDoxMDIxMzAxOTAwMDE4NzIyXzk4ODg2MDQ5OTc5Mjk3NA==,,Hopefully you have some people who know how to correctly fuel an aircraft in your organization…although I do love sitting here for another half hour in DCA after a 2 1/2 hour delay already on “high idle” burning fuel because the morons handling it over fueled the aircraft…get the basics right and then maybe I will be impressed by the other stuff.,2025-02-22,initial,2
Delta,2025-02-13 09:30:00,Y29tbWVudDoxMDIxMzAxOTAwMDE4NzIyXzM5MjY1MjM0MzQzNDE3ODI=,,I won't set foot on Delta. Too many crashes. One is too many.,2025-02-22,initial,0
Delta,2025-02-13 09:30:00,Y29tbWVudDoxMDIxMzAxOTAwMDE4NzIyXzMwMDk2ODM3NjI1MjMwMTI=,,"Very Nice
! Please please don't add starlink anywhere in your planes or systems. Not safe...",2025-02-22,initial,0
Delta,2025-02-13 09:30:00,Y29tbWVudDoxMDIxMzAxOTAwMDE4NzIyXzE0MjEzMzM0MjIxODA4ODA=,,We need someone to review those seats immediately,2025-02-15,initial,3
Delta,2025-02-13 09:30:00,Y29tbWVudDoxMDIxMzAxOTAwMDE4NzIyXzkyNzgxNDcwNjAwNTA4Mg==,,The stitching and tag on that seat remind me of my Secret Labs chair.,2025-02-15,initial,1
Delta,2025-02-13 09:30:00,Y29tbWVudDoxMDIxMzAxOTAwMDE4NzIyXzE2ODgwNzEwMzU0NTMxMzI=,,When its come to air travel… delta is my choice.,2025-02-15,initial,4
Delta,2025-02-13 09:30:00,Y29tbWVudDoxMDIxMzAxOTAwMDE4NzIyXzEyMjc4MzY0NjkxMjk4OTI=,,"Good. I don’t want to get sucked out of any pressurized tubes at 35,000ft so yay for Airbus engineering.",2025-02-15,initial,2
Delta,2025-02-13 09:30:00,Y29tbWVudDoxMDIxMzAxOTAwMDE4NzIyXzY1NjI2MzMyMDI2MjYwNg==,,Beautiful but I’ll just drive for the next 4 years.,2025-02-15,initial,4
Delta,2025-02-13 09:30:00,Y29tbWVudDoxMDIxMzAxOTAwMDE4NzIyXzEyNzU4NjI0OTM2OTUxODg=,,Nice in the premium section otherwise no thanks,2025-02-15,initial,2
Delta,2025-02-13 09:30:00,Y29tbWVudDoxMDIxMzAxOTAwMDE4NzIyXzYwMzk0NjY5OTEyMTM4OQ==,,With all the crashes don’t know if we’ll ever see it. What is going on??,2025-02-22,initial,0
Delta,2025-02-13 09:30:00,Y29tbWVudDoxMDIxMzAxOTAwMDE4NzIyXzYwODQ2NzQwMjExMTQzMg==,,I prefer the pods but I just don’t fit with wide broad shoulders.,2025-02-15,initial,2
Delta,2025-02-13 09:30:00,Y29tbWVudDoxMDIxMzAxOTAwMDE4NzIyXzExMzU4Nzk1NTE0MTc1OTY=,,Please put these on the Atlanta-Frankfurt route!!!!! I’m so tired of the old planes where the TVs don’t work and there’s no storage!,2025-02-15,initial,0
Delta,2025-02-13 09:30:00,Y29tbWVudDoxMDIxMzAxOTAwMDE4NzIyXzExMDY5Mjg4OTQ1Njc1NDI=,,"Hmmm, Ed Bastian is the only CEO of all the mainline that has kept Delta operating in the Black. They are not heavily in debt and they pay their employees better than most other airlines. They are the healthiest airline right now. I have family in the airline industry.",2025-02-15,initial,0
Delta,2025-02-13 09:30:00,Y29tbWVudDoxMDIxMzAxOTAwMDE4NzIyXzEyNTQ1MjMyMzYyMTAxMzA=,,"Love Delta Air Lines. They're ABSOLUTELY THE BEST!!! 
. We ""ONLY"" travel with Delta because we know we are in good hands!!. Way to go Delta!!!!!",2025-02-15,initial,0
Delta,2025-02-13 09:30:00,Y29tbWVudDoxMDIxMzAxOTAwMDE4NzIyXzE2ODk2NzA4OTg2MTgyNzM=,,Can we get foot rests back ? I know the tall people have their issues ( we hear about it a lot) but it’s equally uncomfortable for short people too,2025-02-22,initial,0
Delta,2025-02-13 09:30:00,Y29tbWVudDoxMDIxMzAxOTAwMDE4NzIyXzE2NTc2NjAxNzE3ODcxMjQ=,,The photos look impressive and I am looking forward to this new experience.,2025-02-15,initial,0
Delta,2025-02-13 09:30:00,Y29tbWVudDoxMDIxMzAxOTAwMDE4NzIyXzUxOTUzMTY3NzgyMjY1Nw==,,6 years too late but glad to see updates finally happening. It’s long past due!,2025-02-15,initial,1
Delta,2025-02-13 09:30:00,Y29tbWVudDoxMDIxMzAxOTAwMDE4NzIyXzY2NzA4MTU5MjMxOTUxMg==,,Is this way any Delta airfare price has almost tripled in the last three years??,2025-02-15,initial,1
Delta,2025-02-13 09:30:00,Y29tbWVudDoxMDIxMzAxOTAwMDE4NzIyXzExOTc5ODcwMTg3MDIxOTc=,,When are you going to reconfigure the ex LATAM A350s???,2025-02-15,initial,2
Delta,2025-02-13 09:30:00,Y29tbWVudDoxMDIxMzAxOTAwMDE4NzIyXzE2Mzc3Njg1MzA0NjMxODg=,,Can’t wait until the old 757 and 767 are phased out. Give me the A350 anyday,2025-02-15,initial,0
Delta,2025-02-13 09:30:00,Y29tbWVudDoxMDIxMzAxOTAwMDE4NzIyXzU5OTkzNzU1OTYxNjQxOQ==,,The only way to fly..,2025-02-15,initial,1
Delta,2025-02-13 09:30:00,Y29tbWVudDoxMDIxMzAxOTAwMDE4NzIyXzg5NDE2NjczMzkyNzg1ODM=,,I find it distressing that Delta's customer service is significantly worse that that of Allegiant. #keepdescending,2025-02-15,initial,2
Delta,2025-02-13 09:30:00,Y29tbWVudDoxMDIxMzAxOTAwMDE4NzIyXzIzNzY3NzUzMjYwMjk2ODE=,,"Sitting on a plane here in Atlanta WAITING ON PILOT
….i left my house @ 8:30 am to be on time to ride 2 trains & walk 20 miles around the airport to get through security…get to a changed gate to ride another train to correct gate & this is DELTA’S best
…..Atlanta deserves better than this",2025-02-22,initial,1
Delta,2025-02-13 09:30:00,Y29tbWVudDoxMDIxMzAxOTAwMDE4NzIyXzIzMTg3Nzg0OTg1MjI4NzM=,Y29tbWVudDoxMDIxMzAxOTAwMDE4NzIyXzIzNzY3NzUzMjYwMjk2ODE=,"That sounds stressful! Please send us a DM with your contact number and flight details, and we'll do our best to assist you with this situation right away.",2025-02-22,reply,0
Delta,2025-02-13 09:30:00,Y29tbWVudDoxMDIxMzAxOTAwMDE4NzIyXzEwMDI3NTYwNjg0MjU1MDE=,,You seem pretty proud of the labels.,2025-02-22,initial,0
Delta,2025-02-13 09:30:00,Y29tbWVudDoxMDIxMzAxOTAwMDE4NzIyXzk1NTA4NzQzMDA2MTgxOQ==,,"Thank you DELTA!! I’m a single mom of an adopted black son, a special-needs daughter, a gay son and I just want to thank you Delta for staying with DEI! For not backing down and bending a knee and kissing the ring of the Oompa Loompa. I’m gonna be saving and I’m taking my children on a trip to DisneylandTokyo in October 2026 and I don’t care what it cost. I will now be flying Delta because you supported my children and I and I will support you when the time comes. Thank you for doing what was right when everybody else is bending a knee out of fear!! THANK YOU Delta Air Lines",2025-02-15,initial,4
Delta,2025-02-13 09:30:00,Y29tbWVudDoxMDIxMzAxOTAwMDE4NzIyXzMxMDQyNDc3Njk3NDkzMzM=,,Funny this was my recent view in first class on a 4.5 hour haul,2025-02-15,initial,6
Delta,2025-02-13 09:30:00,Y29tbWVudDoxMDIxMzAxOTAwMDE4NzIyXzEzNjAwODUyODE2NDg0MTg=,Y29tbWVudDoxMDIxMzAxOTAwMDE4NzIyXzMxMDQyNDc3Njk3NDkzMzM=,yes bulkhead is not that nice in first class,2025-02-15,reply,1
Delta,2025-02-13 09:30:00,Y29tbWVudDoxMDIxMzAxOTAwMDE4NzIyXzExNjQwMzMxMTg0NjkyNzQ=,Y29tbWVudDoxMDIxMzAxOTAwMDE4NzIyXzEzNjAwODUyODE2NDg0MTg=,always agree. But take a look at the lovely IFE unit,2025-02-15,reply,1
Delta,2025-02-13 09:30:00,Y29tbWVudDoxMDIxMzAxOTAwMDE4NzIyXzU2MDcxMDY1MzY2NjU2NA==,Y29tbWVudDoxMDIxMzAxOTAwMDE4NzIyXzExNjQwMzMxMTg0NjkyNzQ=,you okay ??,2025-02-15,reply,0
Delta,2025-02-13 09:30:00,Y29tbWVudDoxMDIxMzAxOTAwMDE4NzIyXzYwNTg4MzE1ODkzMjE2NQ==,Y29tbWVudDoxMDIxMzAxOTAwMDE4NzIyXzMxMDQyNDc3Njk3NDkzMzM=,", what model of plane is this?",2025-02-15,reply,0
Delta,2025-02-13 09:30:00,Y29tbWVudDoxMDIxMzAxOTAwMDE4NzIyXzE2Mjc5MzUwNTEyMjE5NDk=,Y29tbWVudDoxMDIxMzAxOTAwMDE4NzIyXzYwNTg4MzE1ODkzMjE2NQ==,think it was an old A321.,2025-02-15,reply,1
Delta,2025-02-13 09:30:00,Y29tbWVudDoxMDIxMzAxOTAwMDE4NzIyXzEzNTE4MTU5MTkxNzcyOTQ=,Y29tbWVudDoxMDIxMzAxOTAwMDE4NzIyXzE2Mjc5MzUwNTEyMjE5NDk=,no. It’s a 737-800.,2025-02-15,reply,1
Delta,2025-02-13 09:30:00,Y29tbWVudDoxMDIxMzAxOTAwMDE4NzIyXzYwMzg0MTk2MjUwMTQ0NA==,Y29tbWVudDoxMDIxMzAxOTAwMDE4NzIyXzEzNTE4MTU5MTkxNzcyOTQ=,you right. Sorry couldn’t remember,2025-02-15,reply,0
Delta,2025-02-13 09:30:00,Y29tbWVudDoxMDIxMzAxOTAwMDE4NzIyXzQwNjc4MDQwMjM1NDI3MTM=,,"Yes spare us please with thz second hand used planes from Latham. Shame on you Delta. Every time i stepped onto one of them from Amsterdam or Paris to Atlanta, i felt bad for Delta and the so called upscale "" flying experience"".",2025-02-15,initial,0
Delta,2025-02-13 09:30:00,Y29tbWVudDoxMDIxMzAxOTAwMDE4NzIyXzYwOTA5MjIwNTI1NjMwMQ==,,"** How about the future of baggage* & returning it to your customer(s). It has been over a month since my “carry on” which I was forced to check it at the gate has went missing (vanished). I have received zero communication no emails, phone calls, & no bag showing up at my door. Very disappointed … passenger beware of your baggage. *** Delta Air Lines",2025-02-22,initial,1
Delta,2025-02-13 09:30:00,Y29tbWVudDoxMDIxMzAxOTAwMDE4NzIyXzExODYxMDkxMjI4NzczNDY=,,For $8k. Sure!,2025-02-15,initial,2
Delta,2025-02-13 09:30:00,Y29tbWVudDoxMDIxMzAxOTAwMDE4NzIyXzEwMjQ5MzA1MzI3ODg2OTg=,,Hope the seats are more comfortable for long flights.,2025-02-15,initial,1
Delta,2025-02-13 09:30:00,Y29tbWVudDoxMDIxMzAxOTAwMDE4NzIyXzk2MDAwODk5MTY3MDA0Nzg=,,Stuck in Daytona FL. Can’t get until 6am tomorrow. Then a 9 HOUR layover. WTF? Yay A350,2025-03-15,initial,0
Delta,2025-02-13 09:30:00,Y29tbWVudDoxMDIxMzAxOTAwMDE4NzIyXzkwNTgwMzQ4MTc2NTI5MjM=,,"A lot of the transatlantic routes to Ireland and europe are using the older fleet whose condition internally is terrible and old including Delta1. As a millionMiler, i speak from experience.",2025-02-15,initial,1
Delta,2025-02-13 09:30:00,Y29tbWVudDoxMDIxMzAxOTAwMDE4NzIyXzEwOTU5NDU2NzU2MjQ5NzQ=,,"Can you send it to La Guardia so it can take me to Nashville, I’ve been stranded for 24 hours due to your delays and cancellations",2025-02-22,initial,1
Delta,2025-02-13 09:30:00,Y29tbWVudDoxMDIxMzAxOTAwMDE4NzIyXzE2NDg2MTE4MDkzNDM4NzQ=,,Looks great!,2025-02-15,initial,0
Delta,2025-02-13 09:30:00,Y29tbWVudDoxMDIxMzAxOTAwMDE4NzIyXzYwNjE4ODEyNTU0MTAyNg==,,Looks great!,2025-02-15,initial,0
Delta,2025-02-13 09:30:00,Y29tbWVudDoxMDIxMzAxOTAwMDE4NzIyXzEwMjkxNDI1NjkyNDcyMTA=,,"Delta Air Lines Is this aircraft Airbus’ new production standard for the A350? If so, how is Delta utilizing additional cabin space? No one seems to know what I’m talking about.",2025-02-15,initial,1
Delta,2025-02-13 09:30:00,Y29tbWVudDoxMDIxMzAxOTAwMDE4NzIyXzEwMTY1Mjg5NTY5NzgyMjA=,,A bit disappointed with delta,2025-02-15,initial,3
Delta,2025-02-13 09:30:00,Y29tbWVudDoxMDIxMzAxOTAwMDE4NzIyXzM0Mjk3NzU2NjM4MjY2NjA=,,"Absolutely love my experiences on Delta Air Lines as the company continues to upgrade service, professionalism and the hard product. Bravo",2025-02-15,initial,0
Delta,2025-02-13 09:30:00,Y29tbWVudDoxMDIxMzAxOTAwMDE4NzIyXzgzODc2Njg1NTA0NTMyMA==,,Looks nice but the seats look even smaller and harder in these pictures,2025-02-15,initial,0
Delta,2025-02-13 09:30:00,Y29tbWVudDoxMDIxMzAxOTAwMDE4NzIyXzE3ODcyODQ2MzUzNzk4NzI=,,Cloth is way more comfortable than leather IMHO!,2025-02-15,initial,0
Delta,2025-02-13 09:30:00,Y29tbWVudDoxMDIxMzAxOTAwMDE4NzIyXzE4MDg1NDk5Mjk2ODcyODE=,,I LOVE DELTA!! BEST AIRLINER,2025-02-15,initial,3
Delta,2025-02-13 09:30:00,Y29tbWVudDoxMDIxMzAxOTAwMDE4NzIyXzkyOTIyMjUzNTg2NzUwOA==,,I love Delta my grandson wants to be a Delta pilot and he can’t’ wait to see the new seats,2025-02-22,initial,0
Delta,2025-02-13 09:30:00,Y29tbWVudDoxMDIxMzAxOTAwMDE4NzIyXzE5MDc5NDg4NjY2NzU5ODE=,,Looks beautiful! My LHR trip in July is on an A330. Can I give you the dates so you can swap it out so I can experience the new environment?,2025-02-15,initial,3
Delta,2025-02-13 09:30:00,Y29tbWVudDoxMDIxMzAxOTAwMDE4NzIyXzExNDc2OTU1MjAyMjY3ODY=,,Can't wait to fly onboard one of these!,2025-02-15,initial,2
Delta,2025-02-13 09:30:00,Y29tbWVudDoxMDIxMzAxOTAwMDE4NzIyXzIwNDY5OTg1ODkxMzgwMTE=,,I just hope the seats of cushion and comfortable like before.,2025-02-15,initial,2
Delta,2025-02-13 09:30:00,Y29tbWVudDoxMDIxMzAxOTAwMDE4NzIyXzE4NDgzOTU2MDkyNjM5NDU=,,No one wants the 3 seat configuration!,2025-02-15,initial,3
Delta,2025-02-13 09:30:00,Y29tbWVudDoxMDIxMzAxOTAwMDE4NzIyXzYxMzkyODgzNDgzNDM5Mg==,,Great privacy! Please outfit all business class aircraft with this!!,2025-02-15,initial,0
Delta,2025-02-13 09:30:00,Y29tbWVudDoxMDIxMzAxOTAwMDE4NzIyXzEzNTg5MTM3MjE5MzEwNDE=,,Loved it!,2025-02-15,initial,2
Delta,2025-02-13 09:30:00,Y29tbWVudDoxMDIxMzAxOTAwMDE4NzIyXzkzMTA0NTg4MjM0MzI0Ng==,,As much as I pay for first class this should be in all planes for first class,2025-02-15,initial,0
Delta,2025-02-13 09:30:00,Y29tbWVudDoxMDIxMzAxOTAwMDE4NzIyXzIzODY2NTk5MTUwMjY5NjQ=,,Great! I hope its going to BNE on Monday!,2025-02-15,initial,0
Delta,2025-02-13 09:30:00,Y29tbWVudDoxMDIxMzAxOTAwMDE4NzIyXzEyOTE0ODE2MDg3OTIxOTU=,,My son’s first time on a plane. The pilot showed him the cockpit.,2025-02-15,initial,0
Delta,2025-02-13 09:30:00,Y29tbWVudDoxMDIxMzAxOTAwMDE4NzIyXzEzMjE3NzQ1NjI0OTA4ODU=,,What’s the ship number?,2025-02-15,initial,1
Delta,2025-02-13 09:30:00,Y29tbWVudDoxMDIxMzAxOTAwMDE4NzIyXzk4Mjk5MTM0Mzg5MTk4OQ==,,Whoever designed this aircraft interior should design our uniforms... CLEAN and CLASSY!,2025-02-15,initial,2
Delta,2025-02-13 09:30:00,Y29tbWVudDoxMDIxMzAxOTAwMDE4NzIyXzQ4MDgwMTc3MTU2ODE0Mg==,,"If that is a photo of Delta One, it sure got smaller!",2025-02-15,initial,0
Delta,2025-02-13 09:30:00,Y29tbWVudDoxMDIxMzAxOTAwMDE4NzIyXzYxMDAwNTYxODY1MjAyMg==,,Platinum Flyers gifted with Boarding group 4 - Wow Delta from Diamond to out in less then two years,2025-02-15,initial,0
Delta,2025-02-13 09:30:00,Y29tbWVudDoxMDIxMzAxOTAwMDE4NzIyXzE4MTg4OTc3MTU1NzQwMzE=,,Stowage class looks as cramped as ever.,2025-02-15,initial,0
Delta,2025-02-13 09:30:00,Y29tbWVudDoxMDIxMzAxOTAwMDE4NzIyXzg5NzE2Njg0OTI5MTQ3Mg==,,I hope I get i get a new plane when I fly later this year,2025-02-15,initial,1
Delta,2025-02-13 09:30:00,Y29tbWVudDoxMDIxMzAxOTAwMDE4NzIyXzk3NTE3NTI1NzQxMzMxOQ==,,I want to plan a trip now!,2025-02-15,initial,1
Delta,2025-02-13 09:30:00,Y29tbWVudDoxMDIxMzAxOTAwMDE4NzIyXzYxNzc0ODU1MTQxMTkzNw==,,How about hiring customer service agents so every time a flight is delayed it's not a 90 minute hold to talk to anyone about interlining whole you miss out on those alternative flights?,2025-02-15,initial,1
Delta,2025-02-13 09:30:00,Y29tbWVudDoxMDIxMzAxOTAwMDE4NzIyXzQ4MTM4NDU5NTAyOTU1Mw==,,That’s exciting.,2025-02-15,initial,1
Delta,2025-02-13 09:30:00,Y29tbWVudDoxMDIxMzAxOTAwMDE4NzIyXzYzNDg0MjgyOTA5NDk2Nw==,,Looking good,2025-02-15,initial,1
Delta,2025-02-13 09:30:00,Y29tbWVudDoxMDIxMzAxOTAwMDE4NzIyXzI5ODc1MjM3MDQ3NDI3MTg=,,Where can I find this plane so I can ride it?,2025-02-15,initial,0
Delta,2025-02-13 09:30:00,Y29tbWVudDoxMDIxMzAxOTAwMDE4NzIyXzExNDQyNDI0NzAyNTY3OTM=,,Very nice Delta!! Thank you for always improving. #FlyDelta,2025-02-15,initial,0
Delta,2025-02-13 09:30:00,Y29tbWVudDoxMDIxMzAxOTAwMDE4NzIyXzE1NTYzMjE4MDE3NDg0ODY=,,Meanwhile I keep being put in CRJs,2025-02-15,initial,2
Delta,2025-02-13 09:30:00,Y29tbWVudDoxMDIxMzAxOTAwMDE4NzIyXzIyOTMwODAxMjQ0MDY3ODI=,Y29tbWVudDoxMDIxMzAxOTAwMDE4NzIyXzE1NTYzMjE4MDE3NDg0ODY=,feel ya! Or an E175,2025-02-15,reply,0
Delta,2025-02-13 09:30:00,Y29tbWVudDoxMDIxMzAxOTAwMDE4NzIyXzUwNjQ4MDYzMjExMzA5MQ==,,"Ha, had a Delta Platinum CC for 25 years, had status for 18 years. Then was told by Delta to pound sand. No longer a supporter.",2025-02-22,initial,0
Delta,2025-02-13 09:30:00,Y29tbWVudDoxMDIxMzAxOTAwMDE4NzIyXzQyOTkyMDY3MTM2NDAyMzQ=,,I flew on one last Dec. very nice!,2025-02-15,initial,0
Delta,2025-02-13 09:30:00,Y29tbWVudDoxMDIxMzAxOTAwMDE4NzIyXzEwMTg1NzA3NzAxMzUzODk=,,My sister and I just flew Delta One SYD-LAX and it was AMAZING! I didn’t want the 13 hours to end.,2025-02-15,initial,1
Delta,2025-02-13 09:30:00,Y29tbWVudDoxMDIxMzAxOTAwMDE4NzIyXzQ1MzQ2NDg4NzczMzM1Ng==,,Looks amazing. Can’t wait!,2025-02-15,initial,0
Delta,2025-02-13 09:30:00,Y29tbWVudDoxMDIxMzAxOTAwMDE4NzIyXzkwMjU2ODUzMDQyMTc0MDQ=,,But i still seem to be on the crappiest planes to Dc and Orlando.,2025-02-15,initial,0
Delta,2025-02-13 09:30:00,Y29tbWVudDoxMDIxMzAxOTAwMDE4NzIyXzEwNzk3MTY5NDcyOTcyMDM=,,Looks amazing!!,2025-02-15,initial,2
Delta,2025-02-13 09:30:00,Y29tbWVudDoxMDIxMzAxOTAwMDE4NzIyXzExNDQ0ODc4NzczMzQ0NTg=,,"Sure, get hopes and dreams going again.",2025-02-15,initial,0
Delta,2025-02-13 09:30:00,Y29tbWVudDoxMDIxMzAxOTAwMDE4NzIyXzEyODA1MTc4OTk5MTE5NTM=,,Boeing CEO needs to invest in replacing faulty aircraft parts and stop cutting corners and investing in threads and wireless chargers.,2025-02-15,initial,1
Delta,2025-02-13 09:30:00,Y29tbWVudDoxMDIxMzAxOTAwMDE4NzIyXzk3NDcxNjQ2NDE5NjcyMg==,,Is this the 5 different classes of service? What routes will it serve?,2025-02-15,initial,0
Delta,2025-02-13 09:30:00,Y29tbWVudDoxMDIxMzAxOTAwMDE4NzIyXzI0MzQ5NTg5ODM1MTQ5MTc=,,When will Delta be speaking out about the Trump/Musk administration destroying the agencies and systems that make flying safe?! I’ve been a SkyMiles customer for 25 years and am planning to cancel scheduled flights this spring unless Delta starts pushing back!,2025-02-22,initial,4
Delta,2025-02-13 09:30:00,Y29tbWVudDoxMDIxMzAxOTAwMDE4NzIyXzUzNzAwODY4NjA2NzQ4NQ==,,Elegant,2025-02-15,initial,1
Delta,2025-02-13 09:30:00,Y29tbWVudDoxMDIxMzAxOTAwMDE4NzIyXzE4OTkzMDMzNDc1NjU4MDE=,,awesome ! I am a frequent flyer with Delta,2025-02-15,initial,0
Delta,2025-02-13 09:30:00,Y29tbWVudDoxMDIxMzAxOTAwMDE4NzIyXzM0NDA2NjY1ODk1NzI0OTA=,,Looking good,2025-02-15,initial,0
Delta,2025-02-13 09:30:00,Y29tbWVudDoxMDIxMzAxOTAwMDE4NzIyXzU5OTg2NzUwNjI0ODg1Mg==,,looks very uncomfortable,2025-02-15,initial,1
Delta,2025-02-13 09:30:00,Y29tbWVudDoxMDIxMzAxOTAwMDE4NzIyXzE3NzEwMjk5OTY3OTQ5NTg=,,Most uncomfortable seats ever and less leg room are not selling points.,2025-02-15,initial,0
Delta,2025-02-13 09:30:00,Y29tbWVudDoxMDIxMzAxOTAwMDE4NzIyXzYwNjg4ODcyMjIwMDQ2OA==,,What route are the flying this plane on?,2025-02-15,initial,0
Delta,2025-02-13 09:30:00,Y29tbWVudDoxMDIxMzAxOTAwMDE4NzIyXzYzNDE0MDgwNjAyNjQwMA==,,"I do not lose hope that my wife and children will one day have that experience on Delta One. L
ve Delta",2025-02-15,initial,0
Delta,2025-02-13 09:30:00,Y29tbWVudDoxMDIxMzAxOTAwMDE4NzIyXzEzNTc1ODM1MzIwOTg0MDM=,,How about reducing the number of seats for additional individual space.,2025-02-15,initial,0
Delta,2025-02-13 09:30:00,Y29tbWVudDoxMDIxMzAxOTAwMDE4NzIyXzE2NDU4MTE2MTI5Njk3NDI=,,Looks the same as it did…,2025-02-15,initial,0
Delta,2025-02-13 09:30:00,Y29tbWVudDoxMDIxMzAxOTAwMDE4NzIyXzE4MzUzODMzOTM5MzE0MjU=,,Doesn’t look like much leg room in couch!,2025-02-22,initial,0
Delta,2025-02-13 09:30:00,Y29tbWVudDoxMDIxMzAxOTAwMDE4NzIyXzY2MzQ1NTk5OTU4MTIyMw==,,I wonder how much less room there is in economy.,2025-02-15,initial,0
Delta,2025-02-13 09:30:00,Y29tbWVudDoxMDIxMzAxOTAwMDE4NzIyXzUzNTg5NTMyMjIzOTc0MQ==,,I don’t want to fly in this country right now. Not with delta or anyone else.,2025-02-22,initial,0
Delta,2025-02-13 09:30:00,Y29tbWVudDoxMDIxMzAxOTAwMDE4NzIyXzExMzgxMTM5ODExOTA5NDk=,,Wish you would fly A350 to Hawaii from Seattle or Seattle to Tampa! That would rock,2025-02-15,initial,1
Delta,2025-02-13 09:30:00,Y29tbWVudDoxMDIxMzAxOTAwMDE4NzIyXzk3Mjg5NTk1NzY5NTg4OQ==,,So cool! I ALWAYS fly Delta. Class,2025-02-15,initial,0
Delta,2025-02-13 09:30:00,Y29tbWVudDoxMDIxMzAxOTAwMDE4NzIyXzEzNDM4NjAxMjY3OTc0ODc=,,I love Delta,2025-02-22,initial,0
Delta,2025-02-13 09:30:00,Y29tbWVudDoxMDIxMzAxOTAwMDE4NzIyXzIwNTE0MTAwMjg2OTM4MTg=,,How many A 350’s are in service?,2025-02-15,initial,0
Delta,2025-02-13 09:30:00,Y29tbWVudDoxMDIxMzAxOTAwMDE4NzIyXzExOTcyNzQ4MjE4MTg3MjI=,,"our very first flight beginning of our vacation was going to be delayed which meant we were going to miss our connecting so they booked us on American Airlines and we’re standing in line getting ready to get on our plane and we double check and noticed that we’re still going to miss our connecting so we had to get out of the line and go back to the Delta desk and have them change it again making us three hours late from our original arrival!! if we hadn’t noticed it, we would’ve been stuck in Phoenix overnight??? then on our way home the first flight was normal no problems, second flight delayed, of course, and we already had a three hour layover!!
 NEVER FLY DELTA!!!",2025-03-01,initial,2
Delta,2025-02-13 09:30:00,Y29tbWVudDoxMDIxMzAxOTAwMDE4NzIyXzExMjg2NDg2OTUyNTgwODc=,,Tell us about your pilots experience and qualifications.,2025-02-15,initial,0
Delta,2025-02-13 09:30:00,Y29tbWVudDoxMDIxMzAxOTAwMDE4NzIyXzExNTg1NzAwNjkxMzU0MTI=,,Love this! Can’t wait to fly on this with this upgrade!,2025-02-15,initial,0
Delta,2025-02-13 09:30:00,Y29tbWVudDoxMDIxMzAxOTAwMDE4NzIyXzQwMTQwNjE3MTIyMTY5NTU=,,"Show me the economy legroom, or it doesn’t exist!!!!",2025-02-15,initial,0
Delta,2025-02-13 09:30:00,Y29tbWVudDoxMDIxMzAxOTAwMDE4NzIyXzE5OTcwODMwMDA4MDMwMzM=,,"I don’t know, those seats look narrow, thin and uncomfortable",2025-02-15,initial,0
Delta,2025-02-13 09:30:00,Y29tbWVudDoxMDIxMzAxOTAwMDE4NzIyXzQ5MDM0MDM4MDc4NTg5MQ==,,Looking forward to flying with the new A350 Congratulation Delta airlines,2025-02-15,initial,0
Delta,2025-02-13 09:30:00,Y29tbWVudDoxMDIxMzAxOTAwMDE4NzIyXzE3MTc4Njk4NzkxMjYwMTk=,,The coach seats look unbelievably uncomfortable. The business class cubicle looks terrible. I would never pay extra for that.,2025-02-15,initial,3
Delta,2025-02-13 09:30:00,Y29tbWVudDoxMDIxMzAxOTAwMDE4NzIyXzE1OTAyMDgxNTQ5ODUyNjI=,,Sign us up!,2025-04-05,initial,0
Delta,2025-02-13 09:30:00,Y29tbWVudDoxMDIxMzAxOTAwMDE4NzIyXzEwNjg3OTU2NjE5NTI4OTA=,,Extra narrow or is it just me? ￼,2025-02-15,initial,0
Delta,2025-02-13 09:30:00,Y29tbWVudDoxMDIxMzAxOTAwMDE4NzIyXzE4ODUzODE5MzUzMjUxODk=,,What’s the Rockwell Hardness of these seats?,2025-02-15,initial,0
Delta,2025-02-13 09:30:00,Y29tbWVudDoxMDIxMzAxOTAwMDE4NzIyXzk0NTg3MjgyMTAyMTIzOQ==,,"Pésimo servicio nos dejaron botados acá en Orlando sin hotel, sin comida sin explicación",2025-02-22,initial,2
Delta,2025-02-13 09:30:00,Y29tbWVudDoxMDIxMzAxOTAwMDE4NzIyXzYzODc1MTc0MjE3MzUyOA==,,Still far behind Q suites,2025-02-15,initial,0
Delta,2025-02-13 09:30:00,Y29tbWVudDoxMDIxMzAxOTAwMDE4NzIyXzI2MTQxNDg2Mzg3OTEwNDE=,,A suggestion: put a barrier panel under the arm rest so I can have the seat I paid for and don’t have a sweaty fat thigh rolled into my seat and sweating on my thigh. From now on I’m asking for a seat I don’t have to share.,2025-02-15,initial,1
Delta,2025-02-13 09:30:00,Y29tbWVudDoxMDIxMzAxOTAwMDE4NzIyXzEzMjQzNzEzODg2MDcxNzA=,,"I love you, Delta!",2025-02-15,initial,1
Delta,2025-02-13 09:30:00,Y29tbWVudDoxMDIxMzAxOTAwMDE4NzIyXzM1ODkwNTA3MDEzOTQ1OTg=,,Sure miss Delta! Wish you had a hub in Phoenix!!,2025-02-15,initial,0
Delta,2025-02-13 09:30:00,Y29tbWVudDoxMDIxMzAxOTAwMDE4NzIyXzkzNDc3NTQwMjA3NDgxOQ==,,"I'll take two round trips, but only if you'll fly it non-stop from Tampa to Manila.",2025-02-15,initial,0
Delta,2025-02-13 09:30:00,Y29tbWVudDoxMDIxMzAxOTAwMDE4NzIyXzE2NjA4ODI1NDE1MjgyMDE=,,Low cost quality and services priced at luxury airline level. They are the worst I flew with.,2025-02-22,initial,2
Delta,2025-02-13 09:30:00,Y29tbWVudDoxMDIxMzAxOTAwMDE4NzIyXzE4NDA4MzEzNDk2NTU0MDc=,,"Only for non-US flights, I bet.",2025-02-15,initial,0
Delta,2025-02-13 09:30:00,Y29tbWVudDoxMDIxMzAxOTAwMDE4NzIyXzEyODgxNzUwMDkxMzk0NjQ=,Y29tbWVudDoxMDIxMzAxOTAwMDE4NzIyXzE4NDA4MzEzNDk2NTU0MDc=,Helen Barker I apologise for the frustrating moment kindly check on your private message I have already sent a message kindly respond back please for further assistance.,2025-02-15,reply,0
Delta,2025-02-13 09:30:00,Y29tbWVudDoxMDIxMzAxOTAwMDE4NzIyXzE2OTgyMzYxNDQzNzMxNzI=,,Now what does the cattlecar section look like?,2025-02-15,initial,0
Delta,2025-02-13 09:30:00,Y29tbWVudDoxMDIxMzAxOTAwMDE4NzIyXzI0MDA3MDY4OTM2MzAyNjI=,,I love you Delta….,2025-02-15,initial,0
Delta,2025-02-13 09:30:00,Y29tbWVudDoxMDIxMzAxOTAwMDE4NzIyXzY1NTg4Njk3MDIyMjAyNA==,,Is it true Delta is sticking with DEI?,2025-02-22,initial,0
Delta,2025-02-13 09:30:00,Y29tbWVudDoxMDIxMzAxOTAwMDE4NzIyXzY0MjIwMTUyODMyOTc3OQ==,,Nice plane. You should keep it upright.,2025-02-22,initial,0
