company_name,post_date,id,parent_id,comment_text,comment_date,comment_type,reaction_count
Delta,2025-02-13 09:30:00,Y29tbWVudDoxMDIxMzAxOTAwMDE4NzIyXzExNTExMzk2ODMzNDg4OTk=,,All I want are my skyclub visits back.......,2025-02-15,initial,0
Delta,2025-02-13 09:30:00,Y29tbWVudDoxMDIxMzAxOTAwMDE4NzIyXzE2NTczMTU4MDE1Mjg4NjM=,,"nice, but just put in some phone booths for even more privacy.",2025-02-15,initial,0
Delta,2025-02-13 09:30:00,Y29tbWVudDoxMDIxMzAxOTAwMDE4NzIyXzEzMzYyNTc4Njc0OTg2Nzg=,,Delta air is the best,2025-02-22,initial,0
Delta,2025-02-13 09:30:00,Y29tbWVudDoxMDIxMzAxOTAwMDE4NzIyXzIwMDQ2MzM4MjAwMzI3OTA=,,"I have a friend who wanted to be a pilot for Delta Air Lines A350, I now wish he was back he died due to cancer. I try my hardest even as a New Zelander. I want to be a delta pilot to honor him, in everyday I can.",2025-02-15,initial,0
Delta,2025-02-13 09:30:00,Y29tbWVudDoxMDIxMzAxOTAwMDE4NzIyXzExMzQ1OTU4ODgyNzQxMzc=,,How exciting!!!!!!,2025-02-15,initial,0
Delta,2025-02-13 09:30:00,Y29tbWVudDoxMDIxMzAxOTAwMDE4NzIyXzU5MzU3NDUwMzY1MjIwMw==,,Bring back the seats for the -75c cabins,2025-02-15,initial,0
Delta,2025-02-13 09:30:00,Y29tbWVudDoxMDIxMzAxOTAwMDE4NzIyXzE2MDc4NTcxMDcyODMwMzQ=,,It only costs an arm and a leg.,2025-02-15,initial,0
Delta,2025-02-13 09:30:00,Y29tbWVudDoxMDIxMzAxOTAwMDE4NzIyXzIzMDk5MDM0ODI3MDgwMTI=,,Looks great. We are flying the A350 from SEA to TPE in April. Excited!,2025-02-15,initial,0
Delta,2025-02-13 09:30:00,Y29tbWVudDoxMDIxMzAxOTAwMDE4NzIyXzEzMjQwMTc2MTU0NjE5ODI=,,Love it!,2025-02-15,initial,1
Delta,2025-02-13 09:30:00,Y29tbWVudDoxMDIxMzAxOTAwMDE4NzIyXzExNTQ5Mzg2ODI3MDA1NjU=,,That’s awesome,2025-02-15,initial,0
Delta,2025-02-13 09:30:00,Y29tbWVudDoxMDIxMzAxOTAwMDE4NzIyXzk4MDE5Nzc4MDI3NDc1NA==,,One coach and the rest business when it's a 85% coach and the rest what every seat should be and Delta Air Lines as well as all the others are putting nice seats out of the reach of normal rich people .. I can't afford to fly premium economy on long haul to Australia anymore and have switched to emirates where coach is as comfortable as deltas premium select and 1/3 of cost ! My last year as a diamond this year as I just don't want to fly delta anymore.. 10 years and 2 million miles and they cost them selves out of clients .. shame as diamond and million miler the service has been above average ! Hey ho,2025-02-15,initial,1
Delta,2025-02-13 09:30:00,Y29tbWVudDoxMDIxMzAxOTAwMDE4NzIyXzkyODk3MTI3NTg5MzEzNg==,,"Parachutes 
 should be build into the 
 seats. The seats should be able to turn into a raft with a thin blanket inside to keep passengers warm if it’s cold.",2025-02-15,initial,0
Delta,2025-02-13 09:30:00,Y29tbWVudDoxMDIxMzAxOTAwMDE4NzIyXzQ5MDI1NDM4NzQ2MzIxNQ==,,Should have bought the 787 and 777x,2025-02-15,initial,3
Delta,2025-02-13 09:30:00,Y29tbWVudDoxMDIxMzAxOTAwMDE4NzIyXzE4NzQwMjgyMTAwMTExNDU=,Y29tbWVudDoxMDIxMzAxOTAwMDE4NzIyXzQ5MDI1NDM4NzQ2MzIxNQ==,not with the way Boeing quality control has been lately,2025-02-15,reply,0
Delta,2025-02-13 09:30:00,Y29tbWVudDoxMDIxMzAxOTAwMDE4NzIyXzY0NDI0MjI3NDkzOTc5Mw==,,Atlanta to London . 1700. NYC to London..650. .. I hate flying to NYC.. but if I'm saving 1000 a ticket. Guess I got to do it,2025-02-15,initial,0
Delta,2025-02-13 09:30:00,Y29tbWVudDoxMDIxMzAxOTAwMDE4NzIyXzExMjUzNTc2ODIyNDc1MTI=,,I'd love to know how it feels to travel first class. One can dream.,2025-02-15,initial,0
Delta,2025-02-13 09:30:00,Y29tbWVudDoxMDIxMzAxOTAwMDE4NzIyXzM5NTExNDU4OTE4ODA3MTA=,,"Can we see more photos of all seats 
?",2025-02-15,initial,0
Delta,2025-02-13 09:30:00,Y29tbWVudDoxMDIxMzAxOTAwMDE4NzIyXzEzMTY5MDcyMTkzNDcxMzE=,,"Honestly, all I see in these pictures is uncomfortable, expensive, and stupid. Why have a 3-3-3 seat arrangement? Why no 2-5-2? Same number of seats, but only one person is 2 seats away from an aisle, and that person has a choice of TWO aisles. Seriously, have none of your high-priced designers every thought of this?",2025-02-15,initial,3
Delta,2025-02-13 09:30:00,Y29tbWVudDoxMDIxMzAxOTAwMDE4NzIyXzEyNzUwNDczNTAyMzYxNzA=,,I feel sorry for those with LONG LEGS…will be most uncomfortable…can they really squeeze in any more seats???,2025-02-15,initial,0
Delta,2025-02-13 09:30:00,Y29tbWVudDoxMDIxMzAxOTAwMDE4NzIyXzUxNzY2ODc1MTM0ODIyOA==,,Is that MagSafe/Qi2 or just a regular old Qi charging pad? Delta,2025-02-15,initial,0
Delta,2025-02-13 09:30:00,Y29tbWVudDoxMDIxMzAxOTAwMDE4NzIyXzE1MzY2NzMwNjcwMTMzMDU=,,"All I say is write a letter, write a letter. Improvement’s come with input. Thanks all",2025-02-15,initial,0
Delta,2025-02-13 09:30:00,Y29tbWVudDoxMDIxMzAxOTAwMDE4NzIyXzY0MDA0NzU2MTczMTgxOA==,,I can't wait to see it!,2025-02-15,initial,2
Delta,2025-02-13 09:30:00,Y29tbWVudDoxMDIxMzAxOTAwMDE4NzIyXzYxNDUxMDc5Nzg0ODU4MQ==,,"Será un privilegio volar en este avión, felicitaciones.",2025-02-15,initial,0
Delta,2025-02-13 09:30:00,Y29tbWVudDoxMDIxMzAxOTAwMDE4NzIyXzU5NzM2NTUwMzE5Nzg5MQ==,,Send tickets please.,2025-02-15,initial,1
Delta,2025-02-13 09:30:00,Y29tbWVudDoxMDIxMzAxOTAwMDE4NzIyXzExOTIxNzAzNTI2MjQ1MDM=,Y29tbWVudDoxMDIxMzAxOTAwMDE4NzIyXzU5NzM2NTUwMzE5Nzg5MQ==,yes!,2025-02-22,reply,1
Delta,2025-02-13 09:30:00,Y29tbWVudDoxMDIxMzAxOTAwMDE4NzIyXzExNTM3MTYyMjYxNTQ5ODE=,,Negative two inches of foam.,2025-02-15,initial,0
Delta,2025-02-13 09:30:00,Y29tbWVudDoxMDIxMzAxOTAwMDE4NzIyXzk1Mzc4MjQ1NjcyNTgzNQ==,,Great maybe you can start treating your Diamond Medallion members better. ￼￼,2025-02-15,initial,0
Delta,2025-02-13 09:30:00,Y29tbWVudDoxMDIxMzAxOTAwMDE4NzIyXzExMjQwMDM4MjYxMzExMDU=,,Lauren Bailey this is how I imagine you will be traveling from now on,2025-02-15,initial,1
Delta,2025-02-13 09:30:00,Y29tbWVudDoxMDIxMzAxOTAwMDE4NzIyXzE4MTAwNzM5NzY0NDI2NDE=,Y29tbWVudDoxMDIxMzAxOTAwMDE4NzIyXzExMjQwMDM4MjYxMzExMDU=,in my wildest dreams!!,2025-02-15,reply,2
Delta,2025-02-13 09:30:00,Y29tbWVudDoxMDIxMzAxOTAwMDE4NzIyXzYyOTk1NjY2OTQyODE2MA==,,"Nice, first class",2025-02-15,initial,1
Delta,2025-02-13 09:30:00,Y29tbWVudDoxMDIxMzAxOTAwMDE4NzIyXzk4Nzk2NzgxMzM5MjI0MA==,Y29tbWVudDoxMDIxMzAxOTAwMDE4NzIyXzYyOTk1NjY2OTQyODE2MA==,DELTA ONE,2025-02-15,reply,4
Delta,2025-02-13 09:30:00,Y29tbWVudDoxMDIxMzAxOTAwMDE4NzIyXzYwNDczNTQ1OTAzOTc0NQ==,Y29tbWVudDoxMDIxMzAxOTAwMDE4NzIyXzYyOTk1NjY2OTQyODE2MA==,"Delta One, which is Business Class. First Class is found on other carriers such as Emirates, Singapore, Air France, Etihad, and Lufthansa to name a few. Delta does not have a true first class offering.",2025-02-15,reply,0
Delta,2025-02-13 09:30:00,Y29tbWVudDoxMDIxMzAxOTAwMDE4NzIyXzEyOTMwMjIyMDE3NTE4NzE=,Y29tbWVudDoxMDIxMzAxOTAwMDE4NzIyXzYwNDczNTQ1OTAzOTc0NQ==,it’s not meant to be a first class offering,2025-02-15,reply,0
Delta,2025-02-13 09:30:00,Y29tbWVudDoxMDIxMzAxOTAwMDE4NzIyXzk2NjQ2NDQwODQzMTk4OA==,,So excited,2025-02-15,initial,0
Delta,2025-02-13 09:30:00,Y29tbWVudDoxMDIxMzAxOTAwMDE4NzIyXzE4MTQ5NDE3ODU3MTM1MDI=,,We flew the A350 from Japan to JFK. Love it!,2025-02-15,initial,0
Delta,2025-02-13 09:30:00,Y29tbWVudDoxMDIxMzAxOTAwMDE4NzIyXzEyNzI0MTkzNTQwNjEyOTc=,,Wow I cnt get over the addition tht tag on the seat is gonna mk,2025-02-15,initial,0
Delta,2025-02-13 09:30:00,Y29tbWVudDoxMDIxMzAxOTAwMDE4NzIyXzUwODQwNDYwNTIyNzQwOA==,,"Is there only one A350? Because I rode FC in one on December 13 from MSP-ATL, Flt 1046… it was pretty amazing",2025-02-15,initial,1
Delta,2025-02-13 09:30:00,Y29tbWVudDoxMDIxMzAxOTAwMDE4NzIyXzEyNTg5NzI3MTg1MTU0OTU=,,Figuring out a way to not crash should be 1st priority.,2025-02-15,initial,0
Delta,2025-02-13 09:30:00,Y29tbWVudDoxMDIxMzAxOTAwMDE4NzIyXzEwOTI1MTM2NjI2NDc2NTU=,,No telling the cost to fly on that jet,2025-02-15,initial,0
Delta,2025-02-13 09:30:00,Y29tbWVudDoxMDIxMzAxOTAwMDE4NzIyXzEzMzA0Njc5ODQ3NjE0NDY=,,"The coloring looks dated, no?",2025-02-15,initial,0
Delta,2025-02-13 09:30:00,Y29tbWVudDoxMDIxMzAxOTAwMDE4NzIyXzM4ODcwNjU3NDgxNzcyNTg=,,"Plane flippin DEIelta should change their motto to ""equity over safety, every time.""",2025-02-22,initial,2
Delta,2025-02-13 09:30:00,Y29tbWVudDoxMDIxMzAxOTAwMDE4NzIyXzk2NTgyMjMyODQ1OTgyMQ==,,"Bring back the 757, best aircraft.",2025-02-15,initial,0
Delta,2025-02-13 09:30:00,Y29tbWVudDoxMDIxMzAxOTAwMDE4NzIyXzQ3NjQzNjUxMjIwNTE4MA==,,"Those coach seats look way too close together. They should make the plane ride torture, especially since the seat cushions are so thin.",2025-02-15,initial,1
Delta,2025-02-13 09:30:00,Y29tbWVudDoxMDIxMzAxOTAwMDE4NzIyXzIxNjAwMzk4MzExMjAwNTM=,,I will give it a try tonight.,2025-02-15,initial,0
Delta,2025-02-13 09:30:00,Y29tbWVudDoxMDIxMzAxOTAwMDE4NzIyXzExNzc4OTk3MjM3MDE4NDI=,,Go woke go broke . Anti veteran vile organisation.,2025-02-15,initial,0
Delta,2025-02-13 09:30:00,Y29tbWVudDoxMDIxMzAxOTAwMDE4NzIyXzk1Mzc0NDUzNTMwMzU2Nzg=,,Is Catherine Banks getting free flights?,2025-02-15,initial,0
Delta,2025-02-13 09:30:00,Y29tbWVudDoxMDIxMzAxOTAwMDE4NzIyXzYzNjIwOTE5ODgxNzE4NA==,,I’ll see y’all tomorrow. Keep us all safe. Thanks,2025-02-22,initial,0
Delta,2025-02-13 09:30:00,Y29tbWVudDoxMDIxMzAxOTAwMDE4NzIyXzk2ODUyNDc5MTkyMjM3Nw==,,Can't wait for my flight next month,2025-02-15,initial,0
Delta,2025-02-13 09:30:00,Y29tbWVudDoxMDIxMzAxOTAwMDE4NzIyXzEzNDAwOTM4MjcxNDUxNzU=,,Is this the same whole plane or just first class?,2025-02-15,initial,0
Delta,2025-02-13 09:30:00,Y29tbWVudDoxMDIxMzAxOTAwMDE4NzIyXzEwMDMyNTc4MTE2NDQ3MTE=,,I lost my Delta flight last week ￼￼,2025-02-15,initial,2
Delta,2025-02-13 09:30:00,Y29tbWVudDoxMDIxMzAxOTAwMDE4NzIyXzU5NDExMjgxMzQzNjAwOQ==,,How pretty!,2025-02-15,initial,0
Delta,2025-02-13 09:30:00,Y29tbWVudDoxMDIxMzAxOTAwMDE4NzIyXzEzMjUzMzc5NDE5ODc3Mjk=,,Shame Delta has regressed!,2025-02-15,initial,0
Delta,2025-02-13 09:30:00,Y29tbWVudDoxMDIxMzAxOTAwMDE4NzIyXzEwMzE0MzE5OTg4MDg5NjY=,,Boeing is better,2025-02-15,initial,0
Delta,2025-02-13 09:30:00,Y29tbWVudDoxMDIxMzAxOTAwMDE4NzIyXzExNjY5MTgzOTQ3Nzg5MDM=,,"I'll take Things I'll Never Be Able To Afford for $800, Alex ..",2025-02-15,initial,0
Delta,2025-02-13 09:30:00,Y29tbWVudDoxMDIxMzAxOTAwMDE4NzIyXzM5NjgzMzAwNTM0NDUzOTA=,,Can’t wait.,2025-02-15,initial,0
Delta,2025-02-13 09:30:00,Y29tbWVudDoxMDIxMzAxOTAwMDE4NzIyXzIzODIwODE2NzU0NTk2NTA=,,Muy lindo todo hasta que en miami te desaparece la valija y te la devuelven a los días y le faltan la mitad de las cosas,2025-02-15,initial,0
Delta,2025-02-13 09:30:00,Y29tbWVudDoxMDIxMzAxOTAwMDE4NzIyXzE5ODEzMjY1NjkwNTkwNDA=,,We have been sitting here an airplane for over an hour bc your airplanes hogged all the gates.,2025-03-01,initial,1
Delta,2025-02-13 09:30:00,Y29tbWVudDoxMDIxMzAxOTAwMDE4NzIyXzg2ODc3NjYxMTkzOTcyOA==,,Still no leg room,2025-02-15,initial,1
Delta,2025-02-13 09:30:00,Y29tbWVudDoxMDIxMzAxOTAwMDE4NzIyXzY0ODY1MDQ2NzYwMTMzNQ==,,Sweet! Time to update those EX-LATAM 350’s now.,2025-02-15,initial,0
Delta,2025-02-13 09:30:00,Y29tbWVudDoxMDIxMzAxOTAwMDE4NzIyXzY0OTUwODIxMTA5NDM0Mw==,,see you soon I hope!,2025-02-15,initial,0
Delta,2025-02-13 09:30:00,Y29tbWVudDoxMDIxMzAxOTAwMDE4NzIyXzE2MDA5MDQ2NTc0NjE2MzI=,,Beautiful!!,2025-02-15,initial,1
Delta,2025-02-13 09:30:00,Y29tbWVudDoxMDIxMzAxOTAwMDE4NzIyXzE3MTQ2NTY4OTMyNjQ4NzQ=,,Love it,2025-02-15,initial,2
Delta,2025-02-13 09:30:00,Y29tbWVudDoxMDIxMzAxOTAwMDE4NzIyXzEwMjQ0OTk3NzYxNzQzOTU=,,Finally they got an A350! Berk Dogan,2025-02-15,initial,1
Delta,2025-02-13 09:30:00,Y29tbWVudDoxMDIxMzAxOTAwMDE4NzIyXzEwMjc1NjAyMzkyNjk5ODU=,,Can’t wait,2025-02-15,initial,0
Delta,2025-02-13 09:30:00,Y29tbWVudDoxMDIxMzAxOTAwMDE4NzIyXzE3OTUwOTI5Nzc5NTQ2OTI=,,Too bad its not a 777 or 787,2025-02-15,initial,1
Delta,2025-02-13 09:30:00,Y29tbWVudDoxMDIxMzAxOTAwMDE4NzIyXzUzOTUzODA3ODQ2NzkxNw==,,Every other country on earth has a premium airline that simply shines. This ain’t it.,2025-02-15,initial,0
Delta,2025-02-13 09:30:00,Y29tbWVudDoxMDIxMzAxOTAwMDE4NzIyXzYwMTUzNDQ5NjEwNTU4Mw==,,Airlines won’t have a future if they don’t pressure the FAA to do what’s right and higher back those flight controllers in the towers. Many are not going to fly anymore your airline or others.,2025-02-22,initial,1
Delta,2025-02-13 09:30:00,Y29tbWVudDoxMDIxMzAxOTAwMDE4NzIyXzI2MzYzOTYzMDk5MDQ2MjA=,,Flying is no longer comfortable. There is never enough legroom or side to side and the seats have no foam or cushion. It’s like sitting on a park bench on most airplanes nowadays.,2025-02-15,initial,3
Delta,2025-02-13 09:30:00,Y29tbWVudDoxMDIxMzAxOTAwMDE4NzIyXzExMDY0MjY5Mjc5NDY0Nzc=,,"Very curious, have a couple of flights with DL A350's in 2 months.",2025-02-15,initial,0
Delta,2025-02-13 09:30:00,Y29tbWVudDoxMDIxMzAxOTAwMDE4NzIyXzEzNTE0OTg2MjkxODE1MDI=,,"OK, it's time for me to stop flying because it has become dangerous since DOGE is firing air traffic contol personnel. If everyone comes to this conclusion it will bankrupt the airlines.",2025-02-22,initial,1
Delta,2025-02-13 09:30:00,Y29tbWVudDoxMDIxMzAxOTAwMDE4NzIyXzQ5MTc4MTQ5MDM5MjIyNQ==,,Let’s do it!!!,2025-02-15,initial,0
Delta,2025-02-13 09:30:00,Y29tbWVudDoxMDIxMzAxOTAwMDE4NzIyXzEyNjQ3NjMwMjc5MjMzOTU=,,Very nice.,2025-02-15,initial,0
Delta,2025-02-13 09:30:00,Y29tbWVudDoxMDIxMzAxOTAwMDE4NzIyXzExNzk5Mjg2MzcwNTcxNDY=,,Why are all the relevant comments in favor of Delta Air Lines. They is called filtering.,2025-02-22,initial,0
Delta,2025-02-13 09:30:00,Y29tbWVudDoxMDIxMzAxOTAwMDE4NzIyXzkzNTA3MDAyNTM1MDMxMA==,,We'll believe it when we see it,2025-02-15,initial,0
Delta,2025-02-13 09:30:00,Y29tbWVudDoxMDIxMzAxOTAwMDE4NzIyXzE0NTU0NTY3ODkxNzM3MDY=,,What route !,2025-02-15,initial,0
Delta,2025-02-13 09:30:00,Y29tbWVudDoxMDIxMzAxOTAwMDE4NzIyXzEyNjE4ODcwMzQ5MDc0NzM=,,"Thank you for standing with DEIA, I’m a loyal pax",2025-02-15,initial,0
Delta,2025-02-13 09:30:00,Y29tbWVudDoxMDIxMzAxOTAwMDE4NzIyXzk5ODU3NTg0MjE3ODUzOQ==,,Felicitaciones y buena atención Delta Air lines,2025-02-22,initial,0
Delta,2025-02-13 09:30:00,Y29tbWVudDoxMDIxMzAxOTAwMDE4NzIyXzYzMzkwOTM4MjMzMzkwMQ==,,Delta is Delta,2025-02-15,initial,1
Delta,2025-02-13 09:30:00,Y29tbWVudDoxMDIxMzAxOTAwMDE4NzIyXzEwNTI5Mjc0NjAxODYyMjE=,,Super cute!,2025-02-15,initial,0
Delta,2025-02-13 09:30:00,Y29tbWVudDoxMDIxMzAxOTAwMDE4NzIyXzIzNzU3MTAwODk0NTkxMzk=,,Want this.,2025-02-15,initial,0
Delta,2025-02-13 09:30:00,Y29tbWVudDoxMDIxMzAxOTAwMDE4NzIyXzEwMjU0NzgzODYyNjcyNDM=,,Looks very boxy,2025-02-15,initial,1
Delta,2025-02-13 09:30:00,Y29tbWVudDoxMDIxMzAxOTAwMDE4NzIyXzkzNDMzMDUwNTUxOTM0Ng==,,Luca de Vries,2025-02-15,initial,0
Delta,2025-02-13 09:30:00,Y29tbWVudDoxMDIxMzAxOTAwMDE4NzIyXzI5Njg1MjIxMDY2NTY5MDE=,,Are we getting more leg room?,2025-02-15,initial,0
Delta,2025-02-13 09:30:00,Y29tbWVudDoxMDIxMzAxOTAwMDE4NzIyXzEzMDE3Njk3MjQzODI0Mzg=,,First class probably,2025-02-15,initial,0
Delta,2025-02-13 09:30:00,Y29tbWVudDoxMDIxMzAxOTAwMDE4NzIyXzQxMjU3MTIzODYxMzUxOA==,,Where to now?,2025-02-15,initial,0
Delta,2025-02-13 09:30:00,Y29tbWVudDoxMDIxMzAxOTAwMDE4NzIyXzYxNTIzMDA2MTI0ODYxMA==,,"Airbus was and is always better (and saver obviously) than Boing, FACT!",2025-02-15,initial,0
Delta,2025-02-13 09:30:00,Y29tbWVudDoxMDIxMzAxOTAwMDE4NzIyXzEyODQ1NjI1MjkzMjkyNDk=,,Mi aerolínea preferida Dios los cuide siempre,2025-02-15,initial,0
Delta,2025-02-13 09:30:00,Y29tbWVudDoxMDIxMzAxOTAwMDE4NzIyXzUxMjQyNTMzNDgxMjg4NQ==,,Delta plane crash lands in Canada today Hope all the passengers sue and win big. I hate this airline,2025-02-22,initial,5
Delta,2025-02-13 09:30:00,Y29tbWVudDoxMDIxMzAxOTAwMDE4NzIyXzIxNjE3Mzc0ODQyNjgxMzg=,,The future of flying with DEI,2025-02-22,initial,0
Delta,2025-02-13 09:30:00,Y29tbWVudDoxMDIxMzAxOTAwMDE4NzIyXzYzMDc4ODI0NjEyMzU2MQ==,,Wonder will the Donald put one his tariffs on this fine European product,2025-02-15,initial,0
Delta,2025-02-13 09:30:00,Y29tbWVudDoxMDIxMzAxOTAwMDE4NzIyXzYwMDYwNzU5NjIxOTkzNQ==,,Vinnie Joshua Evans looks nice,2025-02-15,initial,2
Delta,2025-02-13 09:30:00,Y29tbWVudDoxMDIxMzAxOTAwMDE4NzIyXzE3ODIwOTI0MzkyMzU0MjE=,Y29tbWVudDoxMDIxMzAxOTAwMDE4NzIyXzE0MDgxMzQyMDAxNTM4MTg=,here is your flight,2025-02-15,reply,2
Delta,2025-02-13 09:30:00,Y29tbWVudDoxMDIxMzAxOTAwMDE4NzIyXzE3NzA3OTUyMjM3MTA2MzQ=,,Make Delta Air Lines Great Again!,2025-02-22,initial,0
Delta,2025-02-13 09:30:00,Y29tbWVudDoxMDIxMzAxOTAwMDE4NzIyXzEzOTc4NzUwODgyNDUzNTE=,,Nancy Manlangit Is this one of yours?,2025-02-15,initial,0
Delta,2025-02-13 09:30:00,Y29tbWVudDoxMDIxMzAxOTAwMDE4NzIyXzU5NDQ3NDAyMzQ2NjcwOQ==,,Looks fantastic! Good job,2025-02-15,initial,1
Delta,2025-02-13 09:30:00,Y29tbWVudDoxMDIxMzAxOTAwMDE4NzIyXzk4MDk1NzE2MzQ3Mzg4Nw==,,"How about the ""peoples"" (coach/economy) section?",2025-02-15,initial,0
Delta,2025-02-13 09:30:00,Y29tbWVudDoxMDIxMzAxOTAwMDE4NzIyXzEzMzM3MTc0NzA5MTQzNjY=,,overcharge for knee space. Nothing new here,2025-02-15,initial,0
Delta,2025-02-13 09:30:00,Y29tbWVudDoxMDIxMzAxOTAwMDE4NzIyXzU0MzI5ODAzMTM5NjE0OQ==,,Forget Delta if you want to arrive on time.,2025-02-15,initial,2
Delta,2025-02-13 09:30:00,Y29tbWVudDoxMDIxMzAxOTAwMDE4NzIyXzI0MDQzODQyMTMyNTE0MTU=,,Tammy Sterns tell your people to get heated seats,2025-02-15,initial,2
Delta,2025-02-13 09:30:00,Y29tbWVudDoxMDIxMzAxOTAwMDE4NzIyXzEwMDExODYxMDE4ODkwMzM=,Y29tbWVudDoxMDIxMzAxOTAwMDE4NzIyXzI0MDQzODQyMTMyNTE0MTU=,I like that idea!,2025-02-15,reply,0
Delta,2025-02-13 09:30:00,Y29tbWVudDoxMDIxMzAxOTAwMDE4NzIyXzkzOTYyOTI1MTI2MTc0Nw==,,"That DEI PUSHBACK announcement today isn’t gonna age well 
 buh bye",2025-02-22,initial,1
Delta,2025-02-13 09:30:00,Y29tbWVudDoxMDIxMzAxOTAwMDE4NzIyXzEwMDM2NDYyMDg0NjQ3ODE=,,International biz class Delta award redemptions are atrocious.,2025-02-15,initial,0
Delta,2025-02-13 09:30:00,Y29tbWVudDoxMDIxMzAxOTAwMDE4NzIyXzExMzIxMDM2OTQ3OTM4MTE=,Y29tbWVudDoxMDIxMzAxOTAwMDE4NzIyXzEwMDM2NDYyMDg0NjQ3ODE=,I apologise for the frustrating moment kindly check on your private message I have already sent a message kindly respond back please for further assistance.,2025-02-15,reply,0
Delta,2025-02-13 09:30:00,Y29tbWVudDoxMDIxMzAxOTAwMDE4NzIyXzExOTk3NzM2MTE2NzM2OTQ=,,Thank you Delta for staying inclusive and supporting diversity in all its glory.,2025-02-15,initial,1
Delta,2025-02-13 09:30:00,Y29tbWVudDoxMDIxMzAxOTAwMDE4NzIyXzU3MzQ4MTkyOTAwNDY4NA==,Y29tbWVudDoxMDIxMzAxOTAwMDE4NzIyXzExOTk3NzM2MTE2NzM2OTQ=,"Thank you for your kind words and for choosing our services we would love to compensate our loyal customers, Thank you!",2025-02-15,reply,1
Delta,2025-02-13 09:30:00,Y29tbWVudDoxMDIxMzAxOTAwMDE4NzIyXzYzODYyNTYyODYyNTg5Ng==,,DEI is dead remember that before you regret it,2025-02-15,initial,1
Delta,2025-02-13 09:30:00,Y29tbWVudDoxMDIxMzAxOTAwMDE4NzIyXzQwNjAyODkyNjc1NDA2NTg=,,Chasing Corruption,2025-02-15,initial,0
Delta,2025-02-13 09:30:00,Y29tbWVudDoxMDIxMzAxOTAwMDE4NzIyXzY1MjM5MzAxNzMzODEyNw==,,Don't do it!!!! Delta is HELL now.... what my 9 yo diabetic daughter and I have gone through in the past 2 days I wouldn't wish on anyone!!,2025-03-22,initial,0
Delta,2025-02-13 09:30:00,Y29tbWVudDoxMDIxMzAxOTAwMDE4NzIyXzE2ODIyNjcwMzYwNjE3Njc=,,This is why I left you for United.,2025-02-15,initial,0
Delta,2025-02-13 09:30:00,Y29tbWVudDoxMDIxMzAxOTAwMDE4NzIyXzU5MzY3MDY5MDMyODg3OA==,,Coach look like hell with a red tag on it!,2025-02-15,initial,0
Delta,2025-02-13 09:30:00,Y29tbWVudDoxMDIxMzAxOTAwMDE4NzIyXzEzMzQwODQzMjc3OTQzNDI=,,Delta Air Lines does not stand behind the quote they made to Fox 5 in Atlanta if items are stolen!! “… Delta has Zero Tolerance policy for baggage pilferage”.,2025-02-22,initial,1
Delta,2025-02-13 09:30:00,Y29tbWVudDoxMDIxMzAxOTAwMDE4NzIyXzE2OTE3MzAxMjg0MDc2MDg=,,Suing to remove disability rights DISGUSTING. Be ashamed,2025-02-22,initial,0
Delta,2025-02-13 09:30:00,Y29tbWVudDoxMDIxMzAxOTAwMDE4NzIyXzYxODIzMTAyNzUxMDk3OA==,,I'm sitting in Peru. My luggage has not arrived in 48 hours. Tracking shows that one of my bags is sitting at the airport but they refused to deliver it. I would castrate myself before I would ever fly Delta.,2025-02-22,initial,3
Delta,2025-02-13 09:30:00,Y29tbWVudDoxMDIxMzAxOTAwMDE4NzIyXzE2ODM1MTg0NTI1MTY1OTM=,,Is everything alright,2025-02-15,initial,1
Delta,2025-02-13 09:30:00,Y29tbWVudDoxMDIxMzAxOTAwMDE4NzIyXzE4MTU0MjIxMzU4NzYxNTI=,,Yay more emf radiation!!,2025-02-15,initial,0
Delta,2025-02-13 09:30:00,Y29tbWVudDoxMDIxMzAxOTAwMDE4NzIyXzI0MjQ2OTQ0MTc4NzU4ODI=,,What? Seats that fit a 2025 human and not a 1966 human???,2025-02-15,initial,0
Delta,2025-02-13 09:30:00,Y29tbWVudDoxMDIxMzAxOTAwMDE4NzIyXzE1NjYzMzU4OTQ3NTc4MzA=,,Just had a Great round trip Experience with Delta. Thank you !,2025-02-15,initial,1
Delta,2025-02-13 09:30:00,Y29tbWVudDoxMDIxMzAxOTAwMDE4NzIyXzExMzA4MzUxOTgzMDUyMjA=,Y29tbWVudDoxMDIxMzAxOTAwMDE4NzIyXzE1NjYzMzU4OTQ3NTc4MzA=,"Thank you for your kind words and for choosing our services we would love to compensate our loyal customers, Thank you!",2025-02-15,reply,0
Delta,2025-02-13 09:30:00,Y29tbWVudDoxMDIxMzAxOTAwMDE4NzIyXzMwNzg5OTkwNzg5MDc1MDk=,,Ohh she’s pretty!!!,2025-02-15,initial,0
Delta,2025-02-13 09:30:00,Y29tbWVudDoxMDIxMzAxOTAwMDE4NzIyXzExMTAwNTIxNzExMzE2MjI=,,Sarah Iglesia I wouldn’t mind mind this first class lol,2025-02-15,initial,0
Delta,2025-02-13 09:30:00,Y29tbWVudDoxMDIxMzAxOTAwMDE4NzIyXzk3OTA2NzUzMzY5MzI2Mg==,,Delta Airlines is promoting falso information and misinformation. how do i get in contact with ed bastin or is everyone at delta going to pretende head office does not have a phone,2025-02-22,initial,0
Delta,2025-02-13 09:30:00,Y29tbWVudDoxMDIxMzAxOTAwMDE4NzIyXzk1MTc0MjQ0NjkzODY4Nw==,,Way past time to retire some of your old and poorly maintained planes. This was in business class the last time I flew Delta.,2025-02-15,initial,1
Delta,2025-02-13 09:30:00,Y29tbWVudDoxMDIxMzAxOTAwMDE4NzIyXzYxNDM3MDY4MTU1MTI2Mg==,Y29tbWVudDoxMDIxMzAxOTAwMDE4NzIyXzk1MTc0MjQ0NjkzODY4Nw==,This was the in flight entertainment on the same flight,2025-02-15,reply,0
Delta,2025-02-13 09:30:00,Y29tbWVudDoxMDIxMzAxOTAwMDE4NzIyXzk3NTE0OTAxMTI0MjUzMw==,,How about more comfortable seats?,2025-02-15,initial,2
Delta,2025-02-13 09:30:00,Y29tbWVudDoxMDIxMzAxOTAwMDE4NzIyXzY1MTQ1MzE5MzkxODc2OQ==,,Better Business Bureau Serving Eastern Michigan & The Upper Peninsula,2025-02-15,initial,1
Delta,2025-02-13 09:30:00,Y29tbWVudDoxMDIxMzAxOTAwMDE4NzIyXzExNjI2ODg4MDIyMzcyNzE=,,Are you on drugs?,2025-02-15,initial,1
Delta,2025-02-13 09:30:00,Y29tbWVudDoxMDIxMzAxOTAwMDE4NzIyXzY5NjE0MDI3NjE4NDA0Ng==,,"More legroom? More room side by side? 
. That's all we really want.",2025-02-15,initial,1
Delta,2025-02-13 09:30:00,Y29tbWVudDoxMDIxMzAxOTAwMDE4NzIyXzEzNTEwMDk0NzkyNTUxNzI=,,Siempre me gusta volar. Delta Air Lines,2025-02-15,initial,0
Delta,2025-02-13 09:30:00,Y29tbWVudDoxMDIxMzAxOTAwMDE4NzIyXzY0MDA1NTQ5MjI0NTUxNQ==,,"The worst airline. Believe me, this airline is garbage. Never fly with them: delayed flights, lost luggage, terrible customer service, the complaints website doesn't work. THE WORST OF THE WORST",2025-04-11,initial,0
Delta,2025-02-13 09:30:00,Y29tbWVudDoxMDIxMzAxOTAwMDE4NzIyXzExMjA3MzI2NjMxMTY2MjI=,,Good morning my friend.,2025-02-15,initial,1
Delta,2025-02-13 09:30:00,Y29tbWVudDoxMDIxMzAxOTAwMDE4NzIyXzE2ODU3ODA2Mjg2NzY1Mjc=,,Ronald Reagan Washington National Airport,2025-02-15,initial,1
Delta,2025-02-13 09:30:00,Y29tbWVudDoxMDIxMzAxOTAwMDE4NzIyXzM5NzA2NTgyODY1MTg2NzE=,,My Peace airlines,2025-02-22,initial,0
Delta,2025-02-13 09:30:00,Y29tbWVudDoxMDIxMzAxOTAwMDE4NzIyXzE2Njk0ODM0MjA2NjU4NTk=,,Wondering how American feels about the administration cutting crucial FAA jobs. People are going to be afraid to fly. Are you concerned for the safety of your customers and your business?,2025-02-22,initial,2
Delta,2025-02-13 09:30:00,Y29tbWVudDoxMDIxMzAxOTAwMDE4NzIyXzExODUxMTY5NDYyODg5ODc=,,Ronald Reagan Washington National Airport,2025-02-15,initial,2
Delta,2025-02-13 09:30:00,Y29tbWVudDoxMDIxMzAxOTAwMDE4NzIyXzEzNzY1NzUyNjcwMzg5NzI=,,Is everything alright,2025-02-15,initial,1
Delta,2025-02-13 09:30:00,Y29tbWVudDoxMDIxMzAxOTAwMDE4NzIyXzEzNzk5MDU2NDMwMjE4MDk=,,Hope they the have got rid of those hard seats they have the worst .,2025-02-15,initial,0
Delta,2025-02-13 09:30:00,Y29tbWVudDoxMDIxMzAxOTAwMDE4NzIyXzEzNzEwMDQ2NjQwNjA1ODk=,,Can’t wait for the 350-1000,2025-02-15,initial,0
Delta,2025-02-13 09:30:00,Y29tbWVudDoxMDIxMzAxOTAwMDE4NzIyXzU3NDU1Mzg3ODkxNDE1Mg==,,Thank you Delta for keeping your commitment to equality! I always fly with you and will continue to do so.,2025-02-22,initial,0
Delta,2025-02-13 09:30:00,Y29tbWVudDoxMDIxMzAxOTAwMDE4NzIyXzEzNTU2ODUwMzkyMDQ5NDk=,,"My next trip in June, oh boy I can't wait to see 
 
 
 
!!!",2025-02-15,initial,1
Delta,2025-02-13 09:30:00,Y29tbWVudDoxMDIxMzAxOTAwMDE4NzIyXzEwNDYyMzA1NjcyNjg2MTQ=,,Shelley Reardon we are taking this plane to the UK in August lol,2025-02-15,initial,0
Delta,2025-02-13 09:30:00,Y29tbWVudDoxMDIxMzAxOTAwMDE4NzIyXzEzNTA1Njk3Mjk0NzM2NDg=,Y29tbWVudDoxMDIxMzAxOTAwMDE4NzIyXzEwNDYyMzA1NjcyNjg2MTQ=,um OK!,2025-02-15,reply,0
Delta,2025-02-13 09:30:00,Y29tbWVudDoxMDIxMzAxOTAwMDE4NzIyXzEzMzkxODU3MTM5MzQ3NTQ=,,Need MANY new planes. Most are so tired.,2025-02-15,initial,0
Delta,2025-02-13 09:30:00,Y29tbWVudDoxMDIxMzAxOTAwMDE4NzIyXzU5NTcyMjQ4NjY2MzIwMQ==,,Stop doing this to me…,2025-02-15,initial,1
Delta,2025-02-13 09:30:00,Y29tbWVudDoxMDIxMzAxOTAwMDE4NzIyXzIzMDkxMzQ0MDk0NzA2NjM=,,I always enjoy flying Delta. THANKS for sticking to your humanitarian values,2025-02-22,initial,1
Delta,2025-02-13 09:30:00,Y29tbWVudDoxMDIxMzAxOTAwMDE4NzIyXzk3ODU5ODk3MzY3OTkwNA==,,Chasing Corruption,2025-02-15,initial,1
Delta,2025-02-13 09:30:00,Y29tbWVudDoxMDIxMzAxOTAwMDE4NzIyXzM4MzY2MzEzMTk5MzYwNjM=,,How bout not removing posts critical of your poor service.,2025-02-15,initial,2
Delta,2025-02-13 09:30:00,Y29tbWVudDoxMDIxMzAxOTAwMDE4NzIyXzExOTc5MTU3MjIwNDU3NjY=,Y29tbWVudDoxMDIxMzAxOTAwMDE4NzIyXzM4MzY2MzEzMTk5MzYwNjM=,Customer satisfaction is our top priority and we're dedicated to ensure a positive experience for all our customer. Please share with us your number via DM as to allow us to understand the concerns better and work towards resolving them. Thank you.,2025-02-15,reply,0
