company_name,post_date,id,parent_id,comment_text,comment_date,comment_type,reaction_count
Delta,2025-02-04 11:57:00,Y29tbWVudDoxMDE1MDM2Mzc3MzExOTQxXzU5NDE5MTA0MDE5NjYyMw==,,"How is your partner, Wheels Up up doing today? It looks like you kill them, shorting their stocks. $150 share, down to $1.45 today. With partners like you, who needs enemies.",2025-02-08,initial,1
Delta,2025-02-04 11:57:00,Y29tbWVudDoxMDE1MDM2Mzc3MzExOTQxXzIwMzI5ODEyOTcyMDI0MjA=,,This is your government working hard for you.,2025-02-08,initial,1
Delta,2025-02-04 11:57:00,Y29tbWVudDoxMDE1MDM2Mzc3MzExOTQxXzEwMTYwNzY1MTM2ODYzNjA=,,"Expose Corruption, Civil Rights Violations, Judges, Cps American Airlinesi",2025-02-08,initial,1
Delta,2025-02-04 11:57:00,Y29tbWVudDoxMDE1MDM2Mzc3MzExOTQxXzExNTQ3ODA3NTk2MDEzMTQ=,,Get money stolen from Delta Air Lines,2025-02-08,initial,4
Delta,2025-02-04 11:57:00,Y29tbWVudDoxMDE1MDM2Mzc3MzExOTQxXzEzMzI1NzE2Mjc5MzQ0NDY=,Y29tbWVudDoxMDE1MDM2Mzc3MzExOTQxXzExNTQ3ODA3NTk2MDEzMTQ=,"Hello, we apologize for such an experience with us, we would like to look closely at the concern raised. Kindly share your email address, full names, and active phone number for us to look into it and resolve it. Delta",2025-02-08,reply,0
Delta,2025-02-04 11:57:00,Y29tbWVudDoxMDE1MDM2Mzc3MzExOTQxXzQwNTc2MzQwOTExMzU1ODg=,Y29tbWVudDoxMDE1MDM2Mzc3MzExOTQxXzExNTQ3ODA3NTk2MDEzMTQ=,kindly cooperate so that you can be assisted,2025-02-08,reply,0
