company_name,post_date,id,parent_id,comment_text,comment_date,comment_type,reaction_count
Costco,2025-01-26 19:21:00,Y29tbWVudDoxMDMwNDA2MjQyNDUwODcyXzExNTIzMDAyMTk4Nzg2NDY=,,I will be supporting Costco now,2025-02-01,initial,38
Costco,2025-01-26 19:21:00,Y29tbWVudDoxMDMwNDA2MjQyNDUwODcyXzExNDM5NDE1MDM3Nzg4ODM=,Y29tbWVudDoxMDMwNDA2MjQyNDUwODcyXzExNTIzMDAyMTk4Nzg2NDY=,Would you support a DEI candidate if it was your heart surgeon?,2025-02-01,reply,5
Costco,2025-01-26 19:21:00,Y29tbWVudDoxMDMwNDA2MjQyNDUwODcyXzEyNTEzMjM1NTkyNzcyNTk=,Y29tbWVudDoxMDMwNDA2MjQyNDUwODcyXzExNDM5NDE1MDM3Nzg4ODM=,what do you think DEI candidate means?,2025-02-01,reply,1
Costco,2025-01-26 19:21:00,Y29tbWVudDoxMDMwNDA2MjQyNDUwODcyXzI5ODAzMTI4NDIxMzUzNjQ=,Y29tbWVudDoxMDMwNDA2MjQyNDUwODcyXzExNTIzMDAyMTk4Nzg2NDY=,Oh like you weren't already. I love how you clowns are all about DEI until you need something and suddenly want the qualified person.,2025-02-01,reply,3
Costco,2025-01-26 19:21:00,Y29tbWVudDoxMDMwNDA2MjQyNDUwODcyXzYyMTIyMjExMDMwODMwMA==,Y29tbWVudDoxMDMwNDA2MjQyNDUwODcyXzI5ODAzMTI4NDIxMzUzNjQ=,why would a company with DEI policies have unqualified people? Explain the connection.,2025-02-01,reply,2
Costco,2025-01-26 19:21:00,Y29tbWVudDoxMDMwNDA2MjQyNDUwODcyXzEyNjQ4Njg4MTEyOTIwMTA=,Y29tbWVudDoxMDMwNDA2MjQyNDUwODcyXzYyMTIyMjExMDMwODMwMA==,you can't possibly be that ignorant. It isn't possible.,2025-02-01,reply,0
Costco,2025-01-26 19:21:00,Y29tbWVudDoxMDMwNDA2MjQyNDUwODcyXzU4OTI2MzU0NzMwODk2Nw==,Y29tbWVudDoxMDMwNDA2MjQyNDUwODcyXzEyNjQ4Njg4MTEyOTIwMTA=,"oh they can be, they accept it as a challenge to be even dumber.",2025-02-01,reply,0
Costco,2025-01-26 19:21:00,Y29tbWVudDoxMDMwNDA2MjQyNDUwODcyXzEzNTM0NjkxMjg5MDY5OTM=,Y29tbWVudDoxMDMwNDA2MjQyNDUwODcyXzU4OTI2MzU0NzMwODk2Nw==,"I’m aware of what DEIA is. I work in Talent Acquisition and I have multiple HR certifications. I’ve worked in recruiting, talent acquisition, and HR for my entire career. So I don’t know that the term ignorant would apply to me in reference to this subject matter.",2025-02-01,reply,2
Costco,2025-01-26 19:21:00,Y29tbWVudDoxMDMwNDA2MjQyNDUwODcyXzM3NzU3ODk4MDk0MDI2MjI=,Y29tbWVudDoxMDMwNDA2MjQyNDUwODcyXzExNTIzMDAyMTk4Nzg2NDY=,You probably supported Kamala as well!,2025-02-01,reply,1
Costco,2025-01-26 19:21:00,Y29tbWVudDoxMDMwNDA2MjQyNDUwODcyXzkyNzk0MjEyMDg3ODQ3MjU=,Y29tbWVudDoxMDMwNDA2MjQyNDUwODcyXzExNTIzMDAyMTk4Nzg2NDY=,"it's like this: let's say you have a company that requires a placement test like the military or a college. A heterosexual male/female scores a 95. A transgender, gender fluid, black lesbian scores 57. They hire the black lesbian because they are special.",2025-02-01,reply,0
Costco,2025-01-26 19:21:00,Y29tbWVudDoxMDMwNDA2MjQyNDUwODcyXzEyOTQyNjc0ODE5MDAwMDY=,Y29tbWVudDoxMDMwNDA2MjQyNDUwODcyXzkyNzk0MjEyMDg3ODQ3MjU=,"it wouldn’t be, but that’s not what DEI is. Do you have any evidence that Costco has a DEI initiative that supports that?",2025-02-01,reply,0
Costco,2025-01-26 19:21:00,Y29tbWVudDoxMDMwNDA2MjQyNDUwODcyXzQ2MDIyNTcwMzgzMDg1MQ==,Y29tbWVudDoxMDMwNDA2MjQyNDUwODcyXzEyOTQyNjc0ODE5MDAwMDY=,next your car needs a major repair. Are you going to take it to drag queen story hour or the mechanic? Suddenly you're against it too.,2025-02-01,reply,0
Costco,2025-01-26 19:21:00,Y29tbWVudDoxMDMwNDA2MjQyNDUwODcyXzE3NTAxOTk5MjU1NTY2NDI=,Y29tbWVudDoxMDMwNDA2MjQyNDUwODcyXzQ2MDIyNTcwMzgzMDg1MQ==,"again, why do you have the belief that DEI necessitates hiring someone that is not qualified? Is there a specific DEI initiative that Costco has that you disagree with?",2025-02-01,reply,0
Costco,2025-01-26 19:21:00,Y29tbWVudDoxMDMwNDA2MjQyNDUwODcyXzYyOTE1OTUwNjMzMzk4NA==,Y29tbWVudDoxMDMwNDA2MjQyNDUwODcyXzExNTIzMDAyMTk4Nzg2NDY=,what does DEI mean? Start there.,2025-02-01,reply,0
Costco,2025-01-26 19:21:00,Y29tbWVudDoxMDMwNDA2MjQyNDUwODcyXzExMjU2MjI0MDIxODA5MjQ=,Y29tbWVudDoxMDMwNDA2MjQyNDUwODcyXzYyOTE1OTUwNjMzMzk4NA==,I’m not having difficulty understanding what it is - I’m trying to get clarity on why you believe that it involves hiring people that are not qualified. Is there a specific DEI initiative that Costco has that you disagree with?,2025-02-01,reply,0
Costco,2025-01-26 19:21:00,Y29tbWVudDoxMDMwNDA2MjQyNDUwODcyXzkyMzMxOTA0NDMzNzA2Mzk=,Y29tbWVudDoxMDMwNDA2MjQyNDUwODcyXzExNTIzMDAyMTk4Nzg2NDY=,yeah the whole thing! I bet your parents are super proud of all your certificates. Doesn't mean anything. It's a program that openly discriminates against one group in favor of another. Thought we ended this in the 60s with the civil rights act. You're so smart are you familiar with EVERYONE being equal? Obviously not.,2025-02-01,reply,0
Costco,2025-01-26 19:21:00,Y29tbWVudDoxMDMwNDA2MjQyNDUwODcyXzU5MDI3MDE0Mzg1NTMxMw==,Y29tbWVudDoxMDMwNDA2MjQyNDUwODcyXzkyMzMxOTA0NDMzNzA2Mzk=,"Here’s an example: Multiple studies have found that applicants with white-sounding names were 50 percent more likely to be contacted for job interviews than those with typical black names. A recent study even found that AI resume screening systems tended to favor white male names. Resumes with White-associated names were selected 85% of the time for the next hiring step, while resumes with Black-associated names were only preferred 9% of the time. Both of those studies controlled for differing qualifications.",2025-02-01,reply,1
Costco,2025-01-26 19:21:00,Y29tbWVudDoxMDMwNDA2MjQyNDUwODcyXzkzNDc2NDc4NTQ2NDQ1MA==,Y29tbWVudDoxMDMwNDA2MjQyNDUwODcyXzExNTIzMDAyMTk4Nzg2NDY=,"if you really believe all the nonsense you post, I challenge you to resign and put a DEI hire in your job.",2025-02-01,reply,0
Costco,2025-01-26 19:21:00,Y29tbWVudDoxMDMwNDA2MjQyNDUwODcyXzYwNTAwMDUyMjM0OTg0Mg==,Y29tbWVudDoxMDMwNDA2MjQyNDUwODcyXzkzNDc2NDc4NTQ2NDQ1MA==,can you describe what a “DEI hire” is?,2025-02-01,reply,1
Costco,2025-01-26 19:21:00,Y29tbWVudDoxMDMwNDA2MjQyNDUwODcyXzEwMTY2NzY4MTY5NjkwNDM=,Y29tbWVudDoxMDMwNDA2MjQyNDUwODcyXzExNTIzMDAyMTk4Nzg2NDY=,"why so quiet? Are you willing to resign your job and make sure a DEI hire takes your place? Put your money where your mouth is. Make sure they are black, LGBT,....",2025-02-01,reply,0
Costco,2025-01-26 19:21:00,Y29tbWVudDoxMDMwNDA2MjQyNDUwODcyXzI1NzY2MjAwNDI1MjM3MjI=,Y29tbWVudDoxMDMwNDA2MjQyNDUwODcyXzEwMTY2NzY4MTY5NjkwNDM=,"if you would respond on one comment thread rather than creating multiple threads, it may be easier for you to locate my responses. I already responded to your other comment - what do you consider to be a “DEI hire”?",2025-02-01,reply,0
Costco,2025-01-26 19:21:00,Y29tbWVudDoxMDMwNDA2MjQyNDUwODcyXzU4MzM0ODEyNDU5MzQwNQ==,Y29tbWVudDoxMDMwNDA2MjQyNDUwODcyXzI1NzY2MjAwNDI1MjM3MjI=,"Quit deflecting. My posts are right out in the open. I said make sure your replacement is black, LGBT, an immigrant. Do it or you don't believe anything you say.",2025-02-01,reply,0
Costco,2025-01-26 19:21:00,Y29tbWVudDoxMDMwNDA2MjQyNDUwODcyXzUzMzQwMjI0NjQxMzI4Mg==,Y29tbWVudDoxMDMwNDA2MjQyNDUwODcyXzU4MzM0ODEyNDU5MzQwNQ==,"why do you think that someone that is black, LGBT, or an immigrant would necessarily be a “DEI hire”? What do you think a DEI hire is?",2025-02-01,reply,0
Costco,2025-01-26 19:21:00,Y29tbWVudDoxMDMwNDA2MjQyNDUwODcyXzE2NzIwMzE0OTcwNDk1MzA=,Y29tbWVudDoxMDMwNDA2MjQyNDUwODcyXzExNTIzMDAyMTk4Nzg2NDY=,admitting that's shows how ignorant you are,2025-02-01,reply,0
Costco,2025-01-26 19:21:00,Y29tbWVudDoxMDMwNDA2MjQyNDUwODcyXzEwMjA5MDU0ODk4NjUxNDE=,,Love my Costco,2025-02-01,initial,0
Costco,2025-01-26 19:21:00,Y29tbWVudDoxMDMwNDA2MjQyNDUwODcyXzUyMjU3NjUxMDI0OTMzNA==,,Love ya Costco,2025-02-01,initial,2
Costco,2025-01-26 19:21:00,Y29tbWVudDoxMDMwNDA2MjQyNDUwODcyXzEwOTY4Mzk4OTU1MjM0NzQ=,,Thank you Costco!,2025-02-01,initial,0
Costco,2025-01-26 19:21:00,Y29tbWVudDoxMDMwNDA2MjQyNDUwODcyXzE1NDAyMTE1MDY2ODkyNjU=,,Go Woke Go Broke. DEI is divisive and toxic.,2025-02-01,initial,4
Costco,2025-01-26 19:21:00,Y29tbWVudDoxMDMwNDA2MjQyNDUwODcyXzExNjgyNjYyOTE1NjgyODA=,Y29tbWVudDoxMDMwNDA2MjQyNDUwODcyXzE1NDAyMTE1MDY2ODkyNjU=,Do you even know what DEI stands for?,2025-02-01,reply,1
Costco,2025-01-26 19:21:00,Y29tbWVudDoxMDMwNDA2MjQyNDUwODcyXzE4NTU4MDk1NTE4MjQ4MzM=,Y29tbWVudDoxMDMwNDA2MjQyNDUwODcyXzExNjgyNjYyOTE1NjgyODA=,Dale Earnhardt Incorporated.,2025-02-01,reply,1
Costco,2025-01-26 19:21:00,Y29tbWVudDoxMDMwNDA2MjQyNDUwODcyXzkwODUxODU5NDQ2MDc5OA==,Y29tbWVudDoxMDMwNDA2MjQyNDUwODcyXzE4NTU4MDk1NTE4MjQ4MzM=,Pam Beck try education….,2025-02-01,reply,0
Costco,2025-01-26 19:21:00,Y29tbWVudDoxMDMwNDA2MjQyNDUwODcyXzE1ODA3MjQxNDk0NzE0MDg=,,I just renewed my membership!,2025-02-01,initial,3
Costco,2025-01-26 19:21:00,Y29tbWVudDoxMDMwNDA2MjQyNDUwODcyXzM0NDM1NDcyNjI2MDc5NjQ=,,Build a location in Desoto County Ms,2025-02-01,initial,1
Costco,2025-01-26 19:21:00,Y29tbWVudDoxMDMwNDA2MjQyNDUwODcyXzExNDU1NTg1MDcwOTI2ODQ=,,"No Pepsi, Coke.",2025-02-01,initial,0
Costco,2025-01-26 19:21:00,Y29tbWVudDoxMDMwNDA2MjQyNDUwODcyXzE2MjM1MzYzMDE2NzA1NTk=,,Costco travel is the best,2025-02-01,initial,0
Costco,2025-01-26 19:21:00,Y29tbWVudDoxMDMwNDA2MjQyNDUwODcyXzM5NzYwMTMzMTkzNDA3MzQ=,,Costco will you stop selling hunting gear.,2025-02-01,initial,0
Costco,2025-01-26 19:21:00,Y29tbWVudDoxMDMwNDA2MjQyNDUwODcyXzExNTk1NzA2OTU1NDU1OTE=,,"Leave it to a white man who has benefitted from generations of embedded white privilege to suddenly decide that skin color shouldn’t matter. And despite all the evidence that a diverse, inclusive society benefits EVERYONE. Racism is a huge loss for white people, not the same as for black and brown people, but a significant loss For us as well.",2025-02-08,initial,0
Costco,2025-01-26 19:21:00,Y29tbWVudDoxMDMwNDA2MjQyNDUwODcyXzg3NjI5NDg2NzcxNDkxNTE=,,Costco cancelling our membership. Won’t be back.,2025-02-01,initial,31
Costco,2025-01-26 19:21:00,Y29tbWVudDoxMDMwNDA2MjQyNDUwODcyXzgwODkyMzYzNDczMzYyMw==,,Costco has racist DEI policies.,2025-02-01,initial,1
Costco,2025-01-26 19:21:00,Y29tbWVudDoxMDMwNDA2MjQyNDUwODcyXzEzMTA4ODgxMDAwMzg1ODE=,,Looks terrific! I love Costco!,2025-02-01,initial,0
Costco,2025-01-26 19:21:00,Y29tbWVudDoxMDMwNDA2MjQyNDUwODcyXzU5NTU0NjYyNjYxNjAwNw==,,Costco please don’t switch to coke products in the food court,2025-02-15,initial,0
Costco,2025-01-26 19:21:00,Y29tbWVudDoxMDMwNDA2MjQyNDUwODcyXzEwMTc1MjcxNzM3MzY5NTQ=,,Costco’s DEI policy conflicts with my views. I will be canceling my membership. Sam’s club will be my new market place.,2025-02-01,initial,2
Costco,2025-01-26 19:21:00,Y29tbWVudDoxMDMwNDA2MjQyNDUwODcyXzEyODE1NTkzMjI5MTIwODA=,Y29tbWVudDoxMDMwNDA2MjQyNDUwODcyXzEwMTc1MjcxNzM3MzY5NTQ=,you approve of discriminatory hiring practices?,2025-02-01,reply,2
Costco,2025-01-26 19:21:00,Y29tbWVudDoxMDMwNDA2MjQyNDUwODcyXzE2NTM2NjExODUyMzI0OTM=,,RIP Cost Co. DEI’s inclusivity vs merit based hiring has is discriminatory.,2025-02-08,initial,0
Costco,2025-01-26 19:21:00,Y29tbWVudDoxMDMwNDA2MjQyNDUwODcyXzE5OTEyNzk1NDEzNTA3NTc=,,How do they validate if they are DEI compliant then? They will look at their % of all personnel and hire accordingly.,2025-02-01,initial,0
Costco,2025-01-26 19:21:00,Y29tbWVudDoxMDMwNDA2MjQyNDUwODcyXzUwODE0NDQxMjI5NjMzOQ==,,Why is Costco switching to the lesser soda pop? There is nothing better than an ice cold Mountain Dew with hot dog or pizza. Lots less Costco runs for my family.,2025-02-01,initial,3
Costco,2025-01-26 19:21:00,Y29tbWVudDoxMDMwNDA2MjQyNDUwODcyXzEzMjkzNjA3NzE1NzU1NDY=,,Cost Commie won't be scheduling our vacation.,2025-02-01,initial,2
Costco,2025-01-26 19:21:00,Y29tbWVudDoxMDMwNDA2MjQyNDUwODcyXzEzMDc4Mjc5MDAzNDE5NDI=,,"Hey @Costco …I will not be renewing my membership unless you get rid of your DEI program. DEI is racist, and I will not patronize a company that supports it. There are millions like me, so proceed at your own peril. Go woke, go broke.",2025-02-01,initial,1
Costco,2025-01-26 19:21:00,Y29tbWVudDoxMDMwNDA2MjQyNDUwODcyXzkwOTE4OTkzOTQxOTkyNTU=,Y29tbWVudDoxMDMwNDA2MjQyNDUwODcyXzEzMDc4Mjc5MDAzNDE5NDI=,please explain how Costco’s DEI policies discriminate against white people.,2025-02-01,reply,0
Costco,2025-01-26 19:21:00,Y29tbWVudDoxMDMwNDA2MjQyNDUwODcyXzIzOTE3ODgzMjQ1MTYzNDQ=,,Did you know they took themselves off of Twitter instead of engaging with their customers?,2025-02-01,initial,9
Costco,2025-01-26 19:21:00,Y29tbWVudDoxMDMwNDA2MjQyNDUwODcyXzE2MTE4Mjg0MjYxMDM3MTg=,Y29tbWVudDoxMDMwNDA2MjQyNDUwODcyXzE1ODA5NzQwMDYxMTMzNzg=,I know your heart is in the right place.,2025-02-01,reply,0
Costco,2025-01-26 19:21:00,Y29tbWVudDoxMDMwNDA2MjQyNDUwODcyXzEzNDY5MDIzMDY0NjcxNzM=,,BIG Mistake Costco peeps with DEI. Lost a LOT of RESPECT for your decision making skills. Going to be a FUN Shareholder meeting!!,2025-02-01,initial,4
Costco,2025-01-26 19:21:00,Y29tbWVudDoxMDMwNDA2MjQyNDUwODcyXzE4NTI0MTQ5MDE4Mjk4MjM=,,Dismantle your DEI or I'm out.,2025-02-01,initial,3
Costco,2025-01-26 19:21:00,Y29tbWVudDoxMDMwNDA2MjQyNDUwODcyXzIxMjM1NzUzMjgwOTMxNjU=,,"Im hoping that Costco stops buying any product from USA owned suppliers, as the criminal Trump regime will end democracy and a normal life for all Americans.. If we all never buy USA produced products, he will have to change..",2025-02-01,initial,3
Costco,2025-01-26 19:21:00,Y29tbWVudDoxMDMwNDA2MjQyNDUwODcyXzkwMTAxNzc0NjIzODQwNjg=,Y29tbWVudDoxMDMwNDA2MjQyNDUwODcyXzIxMjM1NzUzMjgwOTMxNjU=,i do not understand your thinking think about all of the jobs that would be lost in the USA,2025-02-01,reply,1
Costco,2025-01-26 19:21:00,Y29tbWVudDoxMDMwNDA2MjQyNDUwODcyXzE1MzE0ODkzNzc1MTg1MzU=,Y29tbWVudDoxMDMwNDA2MjQyNDUwODcyXzIxMjM1NzUzMjgwOTMxNjU=,wtf are you talking about?,2025-02-01,reply,0
Costco,2025-01-26 19:21:00,Y29tbWVudDoxMDMwNDA2MjQyNDUwODcyXzk4MTE3NTQxMzkzMzU2NQ==,,"This is easy. I'll do my business with SAMS. If Costco wants DEI, let it try existing with DEI customers.",2025-02-01,initial,1
Costco,2025-01-26 19:21:00,Y29tbWVudDoxMDMwNDA2MjQyNDUwODcyXzYxNzE0OTYyMDY4MjUyMQ==,,Cut Costco spending in half!!,2025-02-01,initial,0
Costco,2025-01-26 19:21:00,Y29tbWVudDoxMDMwNDA2MjQyNDUwODcyXzExMzQ2MTgxNDgzNzQyMTM=,,You are one of the best companies I know of today. Thank you for your moral courage.,2025-02-01,initial,33
Costco,2025-01-26 19:21:00,Y29tbWVudDoxMDMwNDA2MjQyNDUwODcyXzEyODg0NTg0NTU3Nzg1MDI=,Y29tbWVudDoxMDMwNDA2MjQyNDUwODcyXzExMzQ2MTgxNDgzNzQyMTM=,moral courage lmao. How dumbed down can you people go.,2025-02-01,reply,2
Costco,2025-01-26 19:21:00,Y29tbWVudDoxMDMwNDA2MjQyNDUwODcyXzE1MjAzNzI2OTU0ODA1NzY=,Y29tbWVudDoxMDMwNDA2MjQyNDUwODcyXzEyODg0NTg0NTU3Nzg1MDI=,"When people do not have an understanding of something it is easy for them to jump to conclusions when they are scared. We tend to see through goggles of fear which is replaced by anger since it is easier to feel that than for some to face their fears. It takes moral courage to discover, to question, and to educate.",2025-02-01,reply,1
Costco,2025-01-26 19:21:00,Y29tbWVudDoxMDMwNDA2MjQyNDUwODcyXzExMTkxNzEwNTMxMjAyOTQ=,Y29tbWVudDoxMDMwNDA2MjQyNDUwODcyXzE1MjAzNzI2OTU0ODA1NzY=,"Them courage? LOL They forced everyone during the plandemic, to wear masks! Masks don't protect against viruses!",2025-02-01,reply,0
Costco,2025-01-26 19:21:00,Y29tbWVudDoxMDMwNDA2MjQyNDUwODcyXzEyODU1NDk4MzI1NjY0ODA=,Y29tbWVudDoxMDMwNDA2MjQyNDUwODcyXzExMTkxNzEwNTMxMjAyOTQ=,i’m a retired United States Army chemical officer. I know for 100% fact that a mask can save your life and the lives of the people around you.,2025-02-01,reply,2
Costco,2025-01-26 19:21:00,Y29tbWVudDoxMDMwNDA2MjQyNDUwODcyXzY2MDgyNDU1OTYwNDIwMg==,Y29tbWVudDoxMDMwNDA2MjQyNDUwODcyXzQ3NTg2MDU0MjAzNDc0Nw==,a baby was an apt choice.,2025-02-01,reply,0
Costco,2025-01-26 19:21:00,Y29tbWVudDoxMDMwNDA2MjQyNDUwODcyXzExNjc2MTMzNzgyOTYzMzU=,Y29tbWVudDoxMDMwNDA2MjQyNDUwODcyXzY2MDgyNDU1OTYwNDIwMg==,there’s no shot Muriel knows what apt means or understands the joke,2025-02-01,reply,0
Costco,2025-01-26 19:21:00,Y29tbWVudDoxMDMwNDA2MjQyNDUwODcyXzk1NDg1ODkzNjc2MDQyOQ==,Y29tbWVudDoxMDMwNDA2MjQyNDUwODcyXzY2MDgyNDU1OTYwNDIwMg==,I commend them for their actions,2025-02-01,reply,1
Costco,2025-01-26 19:21:00,Y29tbWVudDoxMDMwNDA2MjQyNDUwODcyXzExMzQ3OTg4NDgxOTc3OTk=,Y29tbWVudDoxMDMwNDA2MjQyNDUwODcyXzExMzQ2MTgxNDgzNzQyMTM=,So you’re racist against whites? Go it.,2025-02-01,reply,2
Costco,2025-01-26 19:21:00,Y29tbWVudDoxMDMwNDA2MjQyNDUwODcyXzEyNjQ3MTU4NDgwOTIyMjE=,Y29tbWVudDoxMDMwNDA2MjQyNDUwODcyXzExMzQ3OTg4NDgxOTc3OTk=,racism implies that one sees a group of people of a certain color and culture as being better than others. I don’t believe that’s the case. I believe that we should judge people on the content of their character. I believe it’s important to have a diversity of opinion as well as types of people in any civilization. I believe equity is an essential factor in understanding that for quality to occur it doesn’t mean you wear the same size clothes as me or even the same type. It means that you can fill your cup to the full brim no matter what size it is just like me,2025-02-01,reply,1
Costco,2025-01-26 19:21:00,Y29tbWVudDoxMDMwNDA2MjQyNDUwODcyXzYxMTU5NDEzODI4NjMxNQ==,,Juliet De Guzman Calpo Even Costco loves the Mana Kai apparently.,2025-02-01,initial,0
Costco,2025-01-26 19:21:00,Y29tbWVudDoxMDMwNDA2MjQyNDUwODcyXzkxNjg1NjczNjkxNDUxNg==,,Will NOT shop there until DEI practices are eliminated,2025-02-01,initial,8
Costco,2025-01-26 19:21:00,Y29tbWVudDoxMDMwNDA2MjQyNDUwODcyXzUwNTY2MjM1OTMwNTM5NA==,Y29tbWVudDoxMDMwNDA2MjQyNDUwODcyXzk0OTY0NDkwMjcwNTM2Mzg=,That was funny!,2025-02-01,reply,0
Costco,2025-01-26 19:21:00,Y29tbWVudDoxMDMwNDA2MjQyNDUwODcyXzYyNTQ1MzE5OTg0MzY0Ng==,,I cancelled my membership because I will go to Sam's Club that doesn't support discrimination,2025-02-01,initial,1
Costco,2025-01-26 19:21:00,Y29tbWVudDoxMDMwNDA2MjQyNDUwODcyXzYwMjI2NjUyOTM4Nzk2Nw==,,Al Sharpton ? Really ? Did you guys hire the Bud Light marketing team ?,2025-02-01,initial,17
Costco,2025-01-26 19:21:00,Y29tbWVudDoxMDMwNDA2MjQyNDUwODcyXzk2NjM0Mzk3ODc2ODc4Ng==,,"To Costco! My husband and I are huge shoppers at Costco in Langford, CA. Vancouver Island. We will not purchase any US products or foods. We will continue to shop at Costco because you support DEI and pay your staff well. That is that reason we will return and only buy products that were not made or grown in US.",2025-02-08,initial,0
Costco,2025-01-26 19:21:00,Y29tbWVudDoxMDMwNDA2MjQyNDUwODcyXzE2MzUwNzQ5Njc4ODkwMjY=,,"Thank you, Costco! Joined 2 weeks ago because of your principles",2025-02-01,initial,2
Costco,2025-01-26 19:21:00,Y29tbWVudDoxMDMwNDA2MjQyNDUwODcyXzExMzE1MDkzOTUwNDU4NDI=,,This MAGA shopper will no longer be shopping at Costco as long as they continue with DEI,2025-02-01,initial,4
Costco,2025-01-26 19:21:00,Y29tbWVudDoxMDMwNDA2MjQyNDUwODcyXzk2MzU3MjEzODYyODE3OA==,Y29tbWVudDoxMDMwNDA2MjQyNDUwODcyXzExMzE1MDkzOTUwNDU4NDI=,where will you be shopping instead?,2025-02-01,reply,0
Costco,2025-01-26 19:21:00,Y29tbWVudDoxMDMwNDA2MjQyNDUwODcyXzExNzA0MDg2MTgxMjM2MzU=,Y29tbWVudDoxMDMwNDA2MjQyNDUwODcyXzk2MzU3MjEzODYyODE3OA==,Walmart and not have to pay a membership either.,2025-02-01,reply,0
Costco,2025-01-26 19:21:00,Y29tbWVudDoxMDMwNDA2MjQyNDUwODcyXzExNDUwOTc5ODM4OTQ1MTM=,Y29tbWVudDoxMDMwNDA2MjQyNDUwODcyXzExNzA0MDg2MTgxMjM2MzU=,so you’re okay with Walmarts “Belonging” initiatives but not Costco’s DEI initiatives? Is there a particular difference between the two that makes you want to choose Walmart?,2025-02-01,reply,0
Costco,2025-01-26 19:21:00,Y29tbWVudDoxMDMwNDA2MjQyNDUwODcyXzkyNjUwMTc3OTYwODExNg==,Y29tbWVudDoxMDMwNDA2MjQyNDUwODcyXzExNzA0MDg2MTgxMjM2MzU=,you don’t support women’s equality in the workforce?,2025-02-01,reply,1
Costco,2025-01-26 19:21:00,Y29tbWVudDoxMDMwNDA2MjQyNDUwODcyXzE1ODU3NTMzMTk0ODU4NDE=,Y29tbWVudDoxMDMwNDA2MjQyNDUwODcyXzkyNjUwMTc3OTYwODExNg==,"if you are a good employee, you do not need DEI. Susie Wiles did not need DEI to become the first female Chief of Staff.",2025-02-01,reply,0
Costco,2025-01-26 19:21:00,Y29tbWVudDoxMDMwNDA2MjQyNDUwODcyXzc3NjgzMDAxNzMyOTUyNDU=,Y29tbWVudDoxMDMwNDA2MjQyNDUwODcyXzE1ODU3NTMzMTk0ODU4NDE=,I don’t think you know what DEI is.,2025-02-01,reply,0
Costco,2025-01-26 19:21:00,Y29tbWVudDoxMDMwNDA2MjQyNDUwODcyXzEzMTk1MTcxNDI3MjQ5Mjk=,Y29tbWVudDoxMDMwNDA2MjQyNDUwODcyXzE1ODU3NTMzMTk0ODU4NDE=,I hear BJs supported the felon. Go there and give room for us adults,2025-02-01,reply,0
Costco,2025-01-26 19:21:00,Y29tbWVudDoxMDMwNDA2MjQyNDUwODcyXzk1NTAyMTA1MzI2MTEwOA==,Y29tbWVudDoxMDMwNDA2MjQyNDUwODcyXzExMzE1MDkzOTUwNDU4NDI=,thank God!!! More room for everyone else!!,2025-02-01,reply,0
Costco,2025-01-26 19:21:00,Y29tbWVudDoxMDMwNDA2MjQyNDUwODcyXzYyNDA2NDU0MzQzNjYyNg==,,Looking forward to watching your DEI Company fall apart. Bud Light ringing a bell?,2025-02-01,initial,1
Costco,2025-01-26 19:21:00,Y29tbWVudDoxMDMwNDA2MjQyNDUwODcyXzM1ODg4NDA1MDQ3NTA1NjY=,,We will not renew our membership!!!,2025-02-01,initial,8
Costco,2025-01-26 19:21:00,Y29tbWVudDoxMDMwNDA2MjQyNDUwODcyXzQ2MTY2NDc0MzY2OTQ3NA==,Y29tbWVudDoxMDMwNDA2MjQyNDUwODcyXzM1ODg4NDA1MDQ3NTA1NjY=,so you voted for Trump?,2025-02-01,reply,1
Costco,2025-01-26 19:21:00,Y29tbWVudDoxMDMwNDA2MjQyNDUwODcyXzkyNjY2ODc3NzMzNjk5NzE=,Y29tbWVudDoxMDMwNDA2MjQyNDUwODcyXzM1ODg4NDA1MDQ3NTA1NjY=,It’s ok. We did.,2025-02-01,reply,1
Costco,2025-01-26 19:21:00,Y29tbWVudDoxMDMwNDA2MjQyNDUwODcyXzYzNzE4NDQwMTk4NDk3OQ==,,Thank you Costco for standing up for your employees amidst this political climate. We appreciate your stance and will remain a lifetime member as a result!,2025-02-01,initial,0
Costco,2025-01-26 19:21:00,Y29tbWVudDoxMDMwNDA2MjQyNDUwODcyXzk2MzQ1MTcxMTk2MzYyMw==,,"Me at new Costco in Texas, I will be back.",2025-02-01,initial,2
Costco,2025-01-26 19:21:00,Y29tbWVudDoxMDMwNDA2MjQyNDUwODcyXzk0MzMzNjkwNTY3MTQxMDM=,,Thanks for being so racist that you choose people based on color and also even based on personal preference over those who deserve a job because of a good work ethic. I guess I won’t be going to Costco after all.,2025-02-01,initial,1
Costco,2025-01-26 19:21:00,Y29tbWVudDoxMDMwNDA2MjQyNDUwODcyXzExMTk3OTU2MTk0MTEzNDc=,Y29tbWVudDoxMDMwNDA2MjQyNDUwODcyXzk0MzMzNjkwNTY3MTQxMDM=,more white people work at Costco than non white people,2025-02-01,reply,0
Costco,2025-01-26 19:21:00,Y29tbWVudDoxMDMwNDA2MjQyNDUwODcyXzg4MjI4NzgwNjc4NDEwODQ=,,No thanks ending my 22 year membership since Cost Co supports the Race Bating DEI Reverend Al Sharpton.,2025-02-01,initial,2
Costco,2025-01-26 19:21:00,Y29tbWVudDoxMDMwNDA2MjQyNDUwODcyXzIyNDA4NjMxNzI5Nzc1NjQ=,,"What's the resin number in your bags that you put your rotisserie chicken in? The worst thing you can do is put hot oily goods, heating up under lamps,in plastic bags. Can we get an answer.",2025-02-01,initial,3
Costco,2025-01-26 19:21:00,Y29tbWVudDoxMDMwNDA2MjQyNDUwODcyXzkwMzM2OTk1MzAwNjAwMDc=,Y29tbWVudDoxMDMwNDA2MjQyNDUwODcyXzIyNDA4NjMxNzI5Nzc1NjQ=,the bags are BPA free,2025-02-01,reply,2
Costco,2025-01-26 19:21:00,Y29tbWVudDoxMDMwNDA2MjQyNDUwODcyXzE1ODkxNjQ4MTE3ODM3MjA=,,The only travel I will be doing is to Sam's club. DEI is racist. Al Sharpton is a race hussler who has never done anything for blacks. He shows up to promote donations and leaves with the money.,2025-02-01,initial,2
Costco,2025-01-26 19:21:00,Y29tbWVudDoxMDMwNDA2MjQyNDUwODcyXzQzMjI2OTU5MzIwNDQ4MA==,Y29tbWVudDoxMDMwNDA2MjQyNDUwODcyXzE1ODkxNjQ4MTE3ODM3MjA=,please explain how Costco’s DEI policies discriminate against white people.,2025-02-01,reply,1
Costco,2025-01-26 19:21:00,Y29tbWVudDoxMDMwNDA2MjQyNDUwODcyXzk0OTg2MTI3Mzc4OTg0Ng==,Y29tbWVudDoxMDMwNDA2MjQyNDUwODcyXzE1ODkxNjQ4MTE3ODM3MjA=,Sam’s also does DEI. They just call it something different. https://corporate.walmart.com/.../belon.../belonging-at-sams,2025-02-01,reply,0
Costco,2025-01-26 19:21:00,Y29tbWVudDoxMDMwNDA2MjQyNDUwODcyXzE5NjgzMTc4NzAzNjIzNjE=,,Thanks for standing up to the tRump storm.,2025-02-01,initial,2
Costco,2025-01-26 19:21:00,Y29tbWVudDoxMDMwNDA2MjQyNDUwODcyXzExMjM2NDU2OTU3MTAzNTQ=,,"Woo hoo, Coke coming back to the food court! Yay.",2025-02-01,initial,0
Costco,2025-01-26 19:21:00,Y29tbWVudDoxMDMwNDA2MjQyNDUwODcyXzEwMzg3OTQ4NTE2MDc5NTA=,,"My membership is up for renewal end of this month, sorry won't renew with your DEI decision.",2025-02-01,initial,5
Costco,2025-01-26 19:21:00,Y29tbWVudDoxMDMwNDA2MjQyNDUwODcyXzEzODczODQ2MTU1ODI3MjU=,Y29tbWVudDoxMDMwNDA2MjQyNDUwODcyXzEwMzg3OTQ4NTE2MDc5NTA=,so you don’t support women in the workplace?,2025-02-01,reply,2
Costco,2025-01-26 19:21:00,Y29tbWVudDoxMDMwNDA2MjQyNDUwODcyXzEzMTkwNjI5MTU5NjcyNDE=,Y29tbWVudDoxMDMwNDA2MjQyNDUwODcyXzEzODczODQ2MTU1ODI3MjU=,"Ignorant comment, I worked from the time I was 16 for 40 years.",2025-02-01,reply,0
Costco,2025-01-26 19:21:00,Y29tbWVudDoxMDMwNDA2MjQyNDUwODcyXzEzMzcxMjkzMjc2NDExNTY=,Y29tbWVudDoxMDMwNDA2MjQyNDUwODcyXzEzODczODQ2MTU1ODI3MjU=,Work should always be based on Merit.,2025-02-01,reply,0
Costco,2025-01-26 19:21:00,Y29tbWVudDoxMDMwNDA2MjQyNDUwODcyXzkzNTMyODMyNTQ1MjgzNQ==,Y29tbWVudDoxMDMwNDA2MjQyNDUwODcyXzEzMzcxMjkzMjc2NDExNTY=,DEI doesn’t exclude merit. You obviously don’t know what it is.,2025-02-01,reply,0
Costco,2025-01-26 19:21:00,Y29tbWVudDoxMDMwNDA2MjQyNDUwODcyXzE2NDQ5OTYzNDk3MTAwNzc=,Y29tbWVudDoxMDMwNDA2MjQyNDUwODcyXzkzNTMyODMyNTQ1MjgzNQ==,"It's garbage, pure and simple.",2025-02-01,reply,0
Costco,2025-01-26 19:21:00,Y29tbWVudDoxMDMwNDA2MjQyNDUwODcyXzY0NTA4MDg0NDc2NTk0OQ==,,Thank you Costco for standing up to stupidity!,2025-02-01,initial,2
Costco,2025-01-26 19:21:00,Y29tbWVudDoxMDMwNDA2MjQyNDUwODcyXzkzNjE5NTc1ODY5ODQ5Mg==,,"Obama said; there's consequences from elections!Costco says hello to DEI, and I say GOODBYE!!! I will make sure I bring everyone else with me. #systemicracists",2025-02-01,initial,0
Costco,2025-01-26 19:21:00,Y29tbWVudDoxMDMwNDA2MjQyNDUwODcyXzEyODUzODI0MDYwNTg4MjU=,,"Go Woke, Go Broke. Cutting up my Executive Club card and going to Sams.",2025-02-01,initial,10
