company_name,post_date,id,parent_id,comment_text,comment_date,comment_type,reaction_count
Costco,2025-01-26 19:21:00,Y29tbWVudDoxMDMwNDA2MjQyNDUwODcyXzExMzIxODQyNTUyNjU3MzM=,Y29tbWVudDoxMDMwNDA2MjQyNDUwODcyXzYzMzM0OTMxMjU0MjA2Ng==,not the case.,2025-02-01,reply,0
Costco,2025-01-26 19:21:00,Y29tbWVudDoxMDMwNDA2MjQyNDUwODcyXzkwNzI1MDE2MDI4MzE4NzU=,Y29tbWVudDoxMDMwNDA2MjQyNDUwODcyXzExMzIxODQyNTUyNjU3MzM=,they are so dumb they think we follow the main stream media like them. We all know fox is almost as bad as cnn,2025-02-01,reply,0
Costco,2025-01-26 19:21:00,Y29tbWVudDoxMDMwNDA2MjQyNDUwODcyXzk1MDgxMzc2NzAxMTg3Nw==,Y29tbWVudDoxMDMwNDA2MjQyNDUwODcyXzExMzIxODQyNTUyNjU3MzM=,can you please explain why you believe that DEI initiatives are antithetical to merit and which DEI initiatives Costco has in place that you have an issue with?,2025-02-01,reply,0
Costco,2025-01-26 19:21:00,Y29tbWVudDoxMDMwNDA2MjQyNDUwODcyXzEzNzcxNjg5ODM2MTA4NzQ=,Y29tbWVudDoxMDMwNDA2MjQyNDUwODcyXzUxNDkzMjgxNDQyNTAzNA==,pulling my stock too!,2025-02-01,reply,1
Costco,2025-01-26 19:21:00,Y29tbWVudDoxMDMwNDA2MjQyNDUwODcyXzEwOTU2OTMyODIzMDg1OTc=,Y29tbWVudDoxMDMwNDA2MjQyNDUwODcyXzEzNzcxNjg5ODM2MTA4NzQ=,seems like they’ll be fine,2025-02-01,reply,0
Costco,2025-01-26 19:21:00,Y29tbWVudDoxMDMwNDA2MjQyNDUwODcyXzk1MjYxOTEyMzE5MDA4Mw==,Y29tbWVudDoxMDMwNDA2MjQyNDUwODcyXzEwOTU2OTMyODIzMDg1OTc=,been investing with them for years I’m aware of the stock price. Keep investing your footstamps there please,2025-02-01,reply,0
Costco,2025-01-26 19:21:00,Y29tbWVudDoxMDMwNDA2MjQyNDUwODcyXzI5NTUyODM1NDQ2NzMxOTE=,Y29tbWVudDoxMDMwNDA2MjQyNDUwODcyXzk1MjYxOTEyMzE5MDA4Mw==,footstamps?,2025-02-01,reply,0
Costco,2025-01-26 19:21:00,Y29tbWVudDoxMDMwNDA2MjQyNDUwODcyXzE0MTM3ODAwNDI5Mzg2Mjc=,Y29tbWVudDoxMDMwNDA2MjQyNDUwODcyXzYyNzcwOTE1Mjk3MzI3NA==,"Sonya , correction to your assumed post. I am an entrepreneur owning two business. Just because I am female does not merit me a job, status, anything in life. I earn it. And that is why DEI is not successful. It does NOT award by work and merit. And that is something every person can do is earn their way fairly to whatever their dreams allow. To be passed over for any job simply to hit the numbers (minorities) is insane. Sorry you don’t agree. But I firmly believe earning by merit is the most fair way possible.",2025-02-01,reply,0
Costco,2025-01-26 19:21:00,Y29tbWVudDoxMDMwNDA2MjQyNDUwODcyXzYyNjI1OTk1MzQzNzM0Mg==,Y29tbWVudDoxMDMwNDA2MjQyNDUwODcyXzE0MTM3ODAwNDI5Mzg2Mjc=,I am a retired business owner as well. You have zero understanding of DEI. We will leave it at that.,2025-02-01,reply,0
Costco,2025-01-26 19:21:00,Y29tbWVudDoxMDMwNDA2MjQyNDUwODcyXzE0MjE4MTgyNzU4Njk3NDQ=,,Sams Club it is...,2025-02-01,initial,40
Costco,2025-01-26 19:21:00,Y29tbWVudDoxMDMwNDA2MjQyNDUwODcyXzQ3MTgwNDY3MjY1MTgzMw==,Y29tbWVudDoxMDMwNDA2MjQyNDUwODcyXzE0MjE4MTgyNzU4Njk3NDQ=,me too,2025-02-01,reply,2
Costco,2025-01-26 19:21:00,Y29tbWVudDoxMDMwNDA2MjQyNDUwODcyXzE2MTA5NzE1OTI5Mzg2MjE=,Y29tbWVudDoxMDMwNDA2MjQyNDUwODcyXzE0MjE4MTgyNzU4Njk3NDQ=,I think you should be aware that Sam’s still has their DEI policies. They just changed the name from “DEI” to “Belonging”,2025-02-01,reply,2
Costco,2025-01-26 19:21:00,Y29tbWVudDoxMDMwNDA2MjQyNDUwODcyXzE4NDY1Njc3MDkyMDg2ODg=,Y29tbWVudDoxMDMwNDA2MjQyNDUwODcyXzE2MTA5NzE1OTI5Mzg2MjE=,when they pull DEI let’s see that energy,2025-02-01,reply,0
Costco,2025-01-26 19:21:00,Y29tbWVudDoxMDMwNDA2MjQyNDUwODcyXzU5MTYxMjUyMzU4MDQ1MA==,Y29tbWVudDoxMDMwNDA2MjQyNDUwODcyXzE2MTA5NzE1OTI5Mzg2MjE=,DEI is,2025-02-01,reply,1
Costco,2025-01-26 19:21:00,Y29tbWVudDoxMDMwNDA2MjQyNDUwODcyXzE1MTk1NDA1MjYxMTUzMjc=,Y29tbWVudDoxMDMwNDA2MjQyNDUwODcyXzU5MTYxMjUyMzU4MDQ1MA==,"im supportive of DEI 
 I just thought that since Bianca isn’t, she may want to know that, despite the press releases, Sam’s still very much has DEI policies.",2025-02-01,reply,1
Costco,2025-01-26 19:21:00,Y29tbWVudDoxMDMwNDA2MjQyNDUwODcyXzExNzQ1MjI4MjQzODUyNjk=,Y29tbWVudDoxMDMwNDA2MjQyNDUwODcyXzE1MTk1NDA1MjYxMTUzMjc=,look who owns them…,2025-02-01,reply,1
Costco,2025-01-26 19:21:00,Y29tbWVudDoxMDMwNDA2MjQyNDUwODcyXzkwNTQ0MzYwMTc1NjAyNg==,Y29tbWVudDoxMDMwNDA2MjQyNDUwODcyXzExNzQ1MjI4MjQzODUyNjk=,I’m aware. Hence why their DEI page is part of Walmarts page. https://corporate.walmart.com/.../belon.../belonging-at-sams,2025-02-01,reply,0
Costco,2025-01-26 19:21:00,Y29tbWVudDoxMDMwNDA2MjQyNDUwODcyXzE4NTY4OTI2OTE3OTQ0MTU=,,Stopped buying at Costco..don’t agree with their politics,2025-02-01,initial,46
Costco,2025-01-26 19:21:00,Y29tbWVudDoxMDMwNDA2MjQyNDUwODcyXzE2MTI1NTA5MTI3MTk0MjI=,Y29tbWVudDoxMDMwNDA2MjQyNDUwODcyXzE4NTY4OTI2OTE3OTQ0MTU=,why do you follow Costco on fb then??,2025-02-01,reply,6
Costco,2025-01-26 19:21:00,Y29tbWVudDoxMDMwNDA2MjQyNDUwODcyXzE2ODcxMjI1Njg1MDMzNzc=,Y29tbWVudDoxMDMwNDA2MjQyNDUwODcyXzE2MTI1NTA5MTI3MTk0MjI=,not anymore,2025-02-01,reply,1
Costco,2025-01-26 19:21:00,Y29tbWVudDoxMDMwNDA2MjQyNDUwODcyXzQ1NzUwMTk4Mzk2MTAxMw==,Y29tbWVudDoxMDMwNDA2MjQyNDUwODcyXzE2ODcxMjI1Njg1MDMzNzc=,thank you for continuing to comment and supporting Costcos page!,2025-02-01,reply,4
Costco,2025-01-26 19:21:00,Y29tbWVudDoxMDMwNDA2MjQyNDUwODcyXzE3Njg4Mjc3NTM4OTQ0NzI=,Y29tbWVudDoxMDMwNDA2MjQyNDUwODcyXzE2ODcxMjI1Njg1MDMzNzc=,"and yet here you are, giving them engagement and making sure they’ll pop up in your feed more often. Thank you for supporting a true American company!",2025-02-01,reply,11
Costco,2025-01-26 19:21:00,Y29tbWVudDoxMDMwNDA2MjQyNDUwODcyXzU0NDQ3NTQ2MTk0MjA4Ng==,Y29tbWVudDoxMDMwNDA2MjQyNDUwODcyXzE4NTY4OTI2OTE3OTQ0MTU=,"imagine how childish that sounds? ""I only talk to and shop where people agree with me"" so do you check everywhere you go? Make it make sense. I'm not Christian but I still eat Chik fila....like who cares.....",2025-02-01,reply,4
Costco,2025-01-26 19:21:00,Y29tbWVudDoxMDMwNDA2MjQyNDUwODcyXzExMTgxNTY2NjYyNzQwMjc=,Y29tbWVudDoxMDMwNDA2MjQyNDUwODcyXzE4NTY4OTI2OTE3OTQ0MTU=,I will too,2025-02-01,reply,0
Costco,2025-01-26 19:21:00,Y29tbWVudDoxMDMwNDA2MjQyNDUwODcyXzE1MDk1MTA2OTMwNTIzNDM=,Y29tbWVudDoxMDMwNDA2MjQyNDUwODcyXzE4NTY4OTI2OTE3OTQ0MTU=,"OF course you stopped buying at Costco they don't align with your RACISM. White women like you are so EVIL. Aren't you dear? You want to ERASE and SUBJUGATE everyone who isn't white. A store can't even have a policy that might give ANYONE ELSE any support or attention can it? It really bothers you doesn't it 
 Go back and support the hate you understand",2025-02-01,reply,1
Costco,2025-01-26 19:21:00,Y29tbWVudDoxMDMwNDA2MjQyNDUwODcyXzEwMzE5NDk4ODg3Mzc0MzQ=,Y29tbWVudDoxMDMwNDA2MjQyNDUwODcyXzE4NTY4OTI2OTE3OTQ0MTU=,started buying at Costco. Agree w their politics.,2025-02-01,reply,5
Costco,2025-01-26 19:21:00,Y29tbWVudDoxMDMwNDA2MjQyNDUwODcyXzQ1NzcwMzgzNzQxMzgyNg==,Y29tbWVudDoxMDMwNDA2MjQyNDUwODcyXzE4NTY4OTI2OTE3OTQ0MTU=,Got it! So cancel culture is awesome?,2025-02-01,reply,0
Costco,2025-01-26 19:21:00,Y29tbWVudDoxMDMwNDA2MjQyNDUwODcyXzkxOTg2OTk4MzY2MDIxNw==,Y29tbWVudDoxMDMwNDA2MjQyNDUwODcyXzE4NTY4OTI2OTE3OTQ0MTU=,well I just joined to cancel out your ignorance!,2025-02-01,reply,2
Costco,2025-01-26 19:21:00,Y29tbWVudDoxMDMwNDA2MjQyNDUwODcyXzIyNjEzMDAxMjQyNjM0OTU=,Y29tbWVudDoxMDMwNDA2MjQyNDUwODcyXzE4NTY4OTI2OTE3OTQ0MTU=,"oh, Trudie- don’t worry- I joined just to cancel out you quitting.",2025-02-01,reply,1
Costco,2025-01-26 19:21:00,Y29tbWVudDoxMDMwNDA2MjQyNDUwODcyXzUwNzU3Njk1NTY5Mzc2MA==,Y29tbWVudDoxMDMwNDA2MjQyNDUwODcyXzE4NTY4OTI2OTE3OTQ0MTU=,bye,2025-02-01,reply,1
Costco,2025-01-26 19:21:00,Y29tbWVudDoxMDMwNDA2MjQyNDUwODcyXzYyNjAwMjg2NjQ1OTU2NQ==,,I guess I no longer have to show my membership card at the entrance or need it to purchase anything. So I will be cancelling it and shopping at SAM's,2025-02-01,initial,24
Costco,2025-01-26 19:21:00,Y29tbWVudDoxMDMwNDA2MjQyNDUwODcyXzE1NTkwNjk2ODE0NzM3Mjc=,Y29tbWVudDoxMDMwNDA2MjQyNDUwODcyXzYyNjAwMjg2NjQ1OTU2NQ==,I just found out I have a Sam’s about 45 minutes away. It’s worth the drive. I think Costco has to refund your membership fee if you cancel.,2025-02-01,reply,1
Costco,2025-01-26 19:21:00,Y29tbWVudDoxMDMwNDA2MjQyNDUwODcyXzE4NDkyNzcwNDI0ODYzNzc=,Y29tbWVudDoxMDMwNDA2MjQyNDUwODcyXzYyNjAwMjg2NjQ1OTU2NQ==,"I hope you’re 
asap",2025-02-01,reply,0
Costco,2025-01-26 19:21:00,Y29tbWVudDoxMDMwNDA2MjQyNDUwODcyXzQxMzQ1MTY3MTc5NTY5Mg==,,"Love you, Costco!",2025-02-01,initial,25
Costco,2025-01-26 19:21:00,Y29tbWVudDoxMDMwNDA2MjQyNDUwODcyXzEzMjAwNDk5OTYwMDIxMzA=,,Time to cancel. DEI is racism. Sad to see you supporting it.,2025-02-01,initial,42
Costco,2025-01-26 19:21:00,Y29tbWVudDoxMDMwNDA2MjQyNDUwODcyXzE2NjM0NTI4OTQ1OTA2ODQ=,Y29tbWVudDoxMDMwNDA2MjQyNDUwODcyXzEzMjAwNDk5OTYwMDIxMzA=,can you please explain why you believe that DEI initiatives are racist and which DEI initiatives Costco has in place that you have an issue with?,2025-02-01,reply,4
Costco,2025-01-26 19:21:00,Y29tbWVudDoxMDMwNDA2MjQyNDUwODcyXzYwMDM4NzA1NjAzMTkzMw==,Y29tbWVudDoxMDMwNDA2MjQyNDUwODcyXzE2NjM0NTI4OTQ1OTA2ODQ=,the fact you're posting on every comment letting the world know you're ignorant is actually pretty funny.,2025-02-01,reply,0
Costco,2025-01-26 19:21:00,Y29tbWVudDoxMDMwNDA2MjQyNDUwODcyXzY0MTM0Nzk5NTEyNDU1OA==,Y29tbWVudDoxMDMwNDA2MjQyNDUwODcyXzYwMDM4NzA1NjAzMTkzMw==,"sooo, no answer to my question?",2025-02-01,reply,3
Costco,2025-01-26 19:21:00,Y29tbWVudDoxMDMwNDA2MjQyNDUwODcyXzY1MjYxMjI5NzE5Nzg5Ng==,Y29tbWVudDoxMDMwNDA2MjQyNDUwODcyXzY0MTM0Nzk5NTEyNDU1OA==,Its the dumbest question. Its not worth an answer.,2025-02-01,reply,0
Costco,2025-01-26 19:21:00,Y29tbWVudDoxMDMwNDA2MjQyNDUwODcyXzUwMjA2ODQyOTU4MzUyMw==,Y29tbWVudDoxMDMwNDA2MjQyNDUwODcyXzEzMjAwNDk5OTYwMDIxMzA=,please explain how Costco’s DEI policies discriminate against white people.,2025-02-01,reply,3
Costco,2025-01-26 19:21:00,Y29tbWVudDoxMDMwNDA2MjQyNDUwODcyXzEyNjczNDE4NjQ1NzE5ODg=,Y29tbWVudDoxMDMwNDA2MjQyNDUwODcyXzEzMjAwNDk5OTYwMDIxMzA=,bye,2025-02-01,reply,0
Costco,2025-01-26 19:21:00,Y29tbWVudDoxMDMwNDA2MjQyNDUwODcyXzE2NDgzNzM4NDI3MjY0NDE=,Y29tbWVudDoxMDMwNDA2MjQyNDUwODcyXzEzMjAwNDk5OTYwMDIxMzA=,VETERANS are part of DEI.,2025-02-01,reply,1
Costco,2025-01-26 19:21:00,Y29tbWVudDoxMDMwNDA2MjQyNDUwODcyXzIxMjk3Nzk4OTc0NDI1NTA=,,I spend $1200 per month at your STL store and will be taking my business to Sams Club. Submit or face the boycott.,2025-02-01,initial,23
Costco,2025-01-26 19:21:00,Y29tbWVudDoxMDMwNDA2MjQyNDUwODcyXzIxMDc4ODg5OTI5Njc0MTg=,Y29tbWVudDoxMDMwNDA2MjQyNDUwODcyXzIxMjk3Nzk4OTc0NDI1NTA=,ew. Did you just tell a company to “submit”?,2025-02-01,reply,3
Costco,2025-01-26 19:21:00,Y29tbWVudDoxMDMwNDA2MjQyNDUwODcyXzYyMzM1NTMyMzU3ODc5Ng==,Y29tbWVudDoxMDMwNDA2MjQyNDUwODcyXzIxMjk3Nzk4OTc0NDI1NTA=,submit? Ya that sounds like freedom.. .,2025-02-01,reply,3
Costco,2025-01-26 19:21:00,Y29tbWVudDoxMDMwNDA2MjQyNDUwODcyXzk3NDcwNjYyNzMyMDMzMQ==,Y29tbWVudDoxMDMwNDA2MjQyNDUwODcyXzIxMjk3Nzk4OTc0NDI1NTA=,I doubt that very much.,2025-02-01,reply,1
Costco,2025-01-26 19:21:00,Y29tbWVudDoxMDMwNDA2MjQyNDUwODcyXzQwMzE1NDI0MjcxMTk5Nzc=,,"Thank you, Costco!",2025-02-01,initial,56
Costco,2025-01-26 19:21:00,Y29tbWVudDoxMDMwNDA2MjQyNDUwODcyXzE4MTIwMDExNDk1Njg1Nzc=,Y29tbWVudDoxMDMwNDA2MjQyNDUwODcyXzQwMzE1NDI0MjcxMTk5Nzc=,Dionne Renele,2025-02-01,reply,7
Costco,2025-01-26 19:21:00,Y29tbWVudDoxMDMwNDA2MjQyNDUwODcyXzU1NjYzMTE1NDA0OTQ3Nw==,Y29tbWVudDoxMDMwNDA2MjQyNDUwODcyXzE4MTIwMDExNDk1Njg1Nzc=,please explain how Costco’s DEI policies discriminate against white people.,2025-02-01,reply,1
Costco,2025-01-26 19:21:00,Y29tbWVudDoxMDMwNDA2MjQyNDUwODcyXzExNjU3MDE5OTgyNDQzNjU=,Y29tbWVudDoxMDMwNDA2MjQyNDUwODcyXzQwMzE1NDI0MjcxMTk5Nzc=,"You aren't even a member most likely, just an activist",2025-02-01,reply,0
Costco,2025-01-26 19:21:00,Y29tbWVudDoxMDMwNDA2MjQyNDUwODcyXzQwNDkzNDQ2NDUyOTQzMjQ=,Y29tbWVudDoxMDMwNDA2MjQyNDUwODcyXzExNjU3MDE5OTgyNDQzNjU=,"Thanks for taking the time out of your busy, fulfilling day to make an assumption and think of me.",2025-02-01,reply,2
Costco,2025-01-26 19:21:00,Y29tbWVudDoxMDMwNDA2MjQyNDUwODcyXzExODA4NDM2NTM0Njg5ODE=,,Canceled my membership today. Bye.,2025-02-01,initial,21
Costco,2025-01-26 19:21:00,Y29tbWVudDoxMDMwNDA2MjQyNDUwODcyXzk4NDY2MzM0MDE4MjYwMA==,Y29tbWVudDoxMDMwNDA2MjQyNDUwODcyXzYwODcyNjE4ODQyMDA3MQ==,I’ll make sure they know,2025-02-01,reply,0
Costco,2025-01-26 19:21:00,Y29tbWVudDoxMDMwNDA2MjQyNDUwODcyXzY0ODQzNDMxNzYwNjgxOA==,Y29tbWVudDoxMDMwNDA2MjQyNDUwODcyXzEyOTI5NzAwNjUyNzAwNjU=,This isn't an airport; no need to announce your departure.,2025-02-01,reply,0
Costco,2025-01-26 19:21:00,Y29tbWVudDoxMDMwNDA2MjQyNDUwODcyXzE1NzQzMzU3NTA2MjU1NDE=,,National Action and Al Sharpton are corrupt race hustlers. I will take my business to companies that don’t work with race hustlers,2025-02-01,initial,14
Costco,2025-01-26 19:21:00,Y29tbWVudDoxMDMwNDA2MjQyNDUwODcyXzE4MTkwODk4NDg5MDk4OTk=,Y29tbWVudDoxMDMwNDA2MjQyNDUwODcyXzEyOTg2MTc1MTQ2ODY3NjY=,your point?,2025-02-01,reply,0
Costco,2025-01-26 19:21:00,Y29tbWVudDoxMDMwNDA2MjQyNDUwODcyXzU1Njk0MjQ0NzMxMTAzNg==,Y29tbWVudDoxMDMwNDA2MjQyNDUwODcyXzE4MTkwODk4NDg5MDk4OTk=,uh you don’t want our vets to get hired? https://usvets.org/dei/,2025-02-01,reply,0
Costco,2025-01-26 19:21:00,Y29tbWVudDoxMDMwNDA2MjQyNDUwODcyXzEyMjk5NDA4MTUxMzU4MjA=,,"Thank you for supporting DEI programs. And I appreciate the fact that there will be less racist, bigoted and misogynistic customers to deal with when I shop.",2025-02-01,initial,38
Costco,2025-01-26 19:21:00,Y29tbWVudDoxMDMwNDA2MjQyNDUwODcyXzYyNzg1MDQ1MzIzMTM4Mg==,Y29tbWVudDoxMDMwNDA2MjQyNDUwODcyXzEzMDEzOTkyNTc4NDg0ODM=,white straight and male is not the standard,2025-02-01,reply,2
Costco,2025-01-26 19:21:00,Y29tbWVudDoxMDMwNDA2MjQyNDUwODcyXzkyNDg2ODMyMjc1MDE0NQ==,Y29tbWVudDoxMDMwNDA2MjQyNDUwODcyXzI0MzEwMzQxOTcyMzkwMjA=,"so you're outing yourself as racist, bigoted and misogynistic?",2025-02-01,reply,2
Costco,2025-01-26 19:21:00,Y29tbWVudDoxMDMwNDA2MjQyNDUwODcyXzU0MDcxNzk4OTAxNDExNA==,Y29tbWVudDoxMDMwNDA2MjQyNDUwODcyXzkyNDg2ODMyMjc1MDE0NQ==,I see you're not very bright...,2025-02-01,reply,0
Costco,2025-01-26 19:21:00,Y29tbWVudDoxMDMwNDA2MjQyNDUwODcyXzIwMjUzMDA5NzEyMjk2NDg=,Y29tbWVudDoxMDMwNDA2MjQyNDUwODcyXzU0MDcxNzk4OTAxNDExNA==,can you please explain why you believe that DEI initiatives are antithetical to merit and which DEI initiatives Costco has in place that you have an issue with?,2025-02-01,reply,1
Costco,2025-01-26 19:21:00,Y29tbWVudDoxMDMwNDA2MjQyNDUwODcyXzIwMDM0NTYzNTM0MTE4OTc=,Y29tbWVudDoxMDMwNDA2MjQyNDUwODcyXzIwMjUzMDA5NzEyMjk2NDg=,Why do you think the united states government just canceled it?,2025-02-01,reply,0
Costco,2025-01-26 19:21:00,Y29tbWVudDoxMDMwNDA2MjQyNDUwODcyXzYwMTk1Mjc3NTg4NDg5Mg==,Y29tbWVudDoxMDMwNDA2MjQyNDUwODcyXzIwMDM0NTYzNTM0MTE4OTc=,what do you consider to be everyone else’s issue with it? And which Costco specific policies do you have concerns about?,2025-02-01,reply,0
Costco,2025-01-26 19:21:00,Y29tbWVudDoxMDMwNDA2MjQyNDUwODcyXzU2NzczMTA3OTU3NzI1Mw==,Y29tbWVudDoxMDMwNDA2MjQyNDUwODcyXzYwMTk1Mjc3NTg4NDg5Mg==,I'm available for a interview. Nothing is free in life tho,2025-02-01,reply,0
Costco,2025-01-26 19:21:00,Y29tbWVudDoxMDMwNDA2MjQyNDUwODcyXzQ0MjU1MDA0ODgyNTg0OA==,Y29tbWVudDoxMDMwNDA2MjQyNDUwODcyXzU2NzczMTA3OTU3NzI1Mw==,do you just not know what DEI policies Costco has in place?,2025-02-01,reply,0
Costco,2025-01-26 19:21:00,Y29tbWVudDoxMDMwNDA2MjQyNDUwODcyXzExNDM3MDk2NDc0NjczNzM=,Y29tbWVudDoxMDMwNDA2MjQyNDUwODcyXzQ0MjU1MDA0ODgyNTg0OA==,Why do all you democrats have such learning and comprehending disabilities?,2025-02-01,reply,1
Costco,2025-01-26 19:21:00,Y29tbWVudDoxMDMwNDA2MjQyNDUwODcyXzE1MzU3ODUxMTM3NzA5MTE=,Y29tbWVudDoxMDMwNDA2MjQyNDUwODcyXzExNDM3MDk2NDc0NjczNzM=,all I’ve done is ask you to clarify your position. Why does that seem to upset you so much?,2025-02-01,reply,0
Costco,2025-01-26 19:21:00,Y29tbWVudDoxMDMwNDA2MjQyNDUwODcyXzU5NDM2ODU4MzQ4NjU1Nw==,Y29tbWVudDoxMDMwNDA2MjQyNDUwODcyXzE1MzU3ODUxMTM3NzA5MTE=,I already explained it,2025-02-01,reply,0
Costco,2025-01-26 19:21:00,Y29tbWVudDoxMDMwNDA2MjQyNDUwODcyXzE2Njk4Nzk4ODcyNjUwMDc=,Y29tbWVudDoxMDMwNDA2MjQyNDUwODcyXzU5NDM2ODU4MzQ4NjU1Nw==,you said “the same as everyone else’s issues” which is not exactly an explanation. Unless the implication is that you’re following what everyone else is doing?,2025-02-01,reply,0
Costco,2025-01-26 19:21:00,Y29tbWVudDoxMDMwNDA2MjQyNDUwODcyXzUxNTAwNzM3MTA4MzQwNw==,Y29tbWVudDoxMDMwNDA2MjQyNDUwODcyXzE2Njk4Nzk4ODcyNjUwMDc=,"No.. I said I'm available to interview, but nothing is free",2025-02-01,reply,0
Costco,2025-01-26 19:21:00,Y29tbWVudDoxMDMwNDA2MjQyNDUwODcyXzEyNzU0NjQxODAyMzk2NzE=,Y29tbWVudDoxMDMwNDA2MjQyNDUwODcyXzUxNTAwNzM3MTA4MzQwNw==,"I mean, I’m not paying you to speak. So if you are unable to explain your position, that’s fine. I appreciate you continuing to comment on Costco’s page though! The engagement is very helpful",2025-02-01,reply,0
Costco,2025-01-26 19:21:00,Y29tbWVudDoxMDMwNDA2MjQyNDUwODcyXzk0MTQxODcyNzcwNTI1MQ==,Y29tbWVudDoxMDMwNDA2MjQyNDUwODcyXzEyNzU0NjQxODAyMzk2NzE=,That always shuts the poor people up.,2025-02-01,reply,0
Costco,2025-01-26 19:21:00,Y29tbWVudDoxMDMwNDA2MjQyNDUwODcyXzM5NDAwODM1Njk1OTY2OTg=,Y29tbWVudDoxMDMwNDA2MjQyNDUwODcyXzkyNDg2ODMyMjc1MDE0NQ==,"Yep, enjoy the higher prices because of the lost business.",2025-02-01,reply,1
Costco,2025-01-26 19:21:00,Y29tbWVudDoxMDMwNDA2MjQyNDUwODcyXzU3NzAwNDA4NTMxOTIwNQ==,Y29tbWVudDoxMDMwNDA2MjQyNDUwODcyXzEyMjk5NDA4MTUxMzU4MjA=,This!!!,2025-02-01,reply,2
Costco,2025-01-26 19:21:00,Y29tbWVudDoxMDMwNDA2MjQyNDUwODcyXzE4NDczNDA1NDYwMDUyMTQ=,,"Thank you Costco for continuing to value policies of diversity, equality and inclusion! You have my continued business, and I’m proud to shop in your store",2025-02-01,initial,286
Costco,2025-01-26 19:21:00,Y29tbWVudDoxMDMwNDA2MjQyNDUwODcyXzM5MDU4Nzk5OTMwNjEyNzA=,Y29tbWVudDoxMDMwNDA2MjQyNDUwODcyXzE4NDczNDA1NDYwMDUyMTQ=,< this is exactly why women were not allowed to vote for thousands of years,2025-02-01,reply,6
Costco,2025-01-26 19:21:00,Y29tbWVudDoxMDMwNDA2MjQyNDUwODcyXzY0ODMwNTI2NDI5MDQ1Mw==,Y29tbWVudDoxMDMwNDA2MjQyNDUwODcyXzM5MDU4Nzk5OTMwNjEyNzA=,bless your heart. Hope you have a great day!,2025-02-01,reply,4
Costco,2025-01-26 19:21:00,Y29tbWVudDoxMDMwNDA2MjQyNDUwODcyXzYwMjM1MjcxMjcxNzUzMA==,Y29tbWVudDoxMDMwNDA2MjQyNDUwODcyXzY0ODMwNTI2NDI5MDQ1Mw==,"And you enjoy your 100% White neighborhood, hypocrite.",2025-02-01,reply,5
Costco,2025-01-26 19:21:00,Y29tbWVudDoxMDMwNDA2MjQyNDUwODcyXzYyNTEzNjkyNjc2MzUwMQ==,Y29tbWVudDoxMDMwNDA2MjQyNDUwODcyXzYwMjM1MjcxMjcxNzUzMA==,some of us women like myself have a brain and disagree with DEI. Pauline though is one of the ones that fit your comment perfectly. She's total embarrassment to womanhood. She probably doesn't know what a woman is.,2025-02-01,reply,3
Costco,2025-01-26 19:21:00,Y29tbWVudDoxMDMwNDA2MjQyNDUwODcyXzEyNjQ1MDc1MDQ2MzU2Mzc=,Y29tbWVudDoxMDMwNDA2MjQyNDUwODcyXzYyNTEzNjkyNjc2MzUwMQ==,"Susan, you’re on the side of someone that was just using differing beliefs as an excuse for why women couldn’t vote. I just want to ensure you understand that.",2025-02-01,reply,1
Costco,2025-01-26 19:21:00,Y29tbWVudDoxMDMwNDA2MjQyNDUwODcyXzk3MTUxNTU3NzkzMTA0MA==,Y29tbWVudDoxMDMwNDA2MjQyNDUwODcyXzEyNjQ1MDc1MDQ2MzU2Mzc=,"unfortunately, the majority of women think with emotion and not logic. For sure there are many exceptions, and I am glad you are one of them",2025-02-01,reply,1
Costco,2025-01-26 19:21:00,Y29tbWVudDoxMDMwNDA2MjQyNDUwODcyXzE3Mzk5MTUyNTM2MjYxMzU=,Y29tbWVudDoxMDMwNDA2MjQyNDUwODcyXzk3MTUxNTU3NzkzMTA0MA==,please explain how Costco’s DEI policies discriminate against white men.,2025-02-01,reply,0
Costco,2025-01-26 19:21:00,Y29tbWVudDoxMDMwNDA2MjQyNDUwODcyXzM5OTE0MjQ5Mjc4MDYwMDg=,Y29tbWVudDoxMDMwNDA2MjQyNDUwODcyXzM5MDU4Nzk5OTMwNjEyNzA=,"are you under the impression that men don’t generally think with emotion? Don’t men commit the majority of violent crimes? I’m assuming you’re straight so you’ve probably never experienced a man being angry when you dump them, but I’ve seen holes in walls and had bruises of my own that indicate men absolutely are emotional.",2025-02-01,reply,1
Costco,2025-01-26 19:21:00,Y29tbWVudDoxMDMwNDA2MjQyNDUwODcyXzYzMTkwMTM1MjU4ODMyNw==,Y29tbWVudDoxMDMwNDA2MjQyNDUwODcyXzM5OTE0MjQ5Mjc4MDYwMDg=,< my point proven,2025-02-01,reply,0
Costco,2025-01-26 19:21:00,Y29tbWVudDoxMDMwNDA2MjQyNDUwODcyXzEyNjQ2MTc5ODc5NjAzNzU=,Y29tbWVudDoxMDMwNDA2MjQyNDUwODcyXzYzMTkwMTM1MjU4ODMyNw==,can you describe how my comment proved your point that women are too emotional? Did I seem emotional because I disagreed with you?,2025-02-01,reply,0
Costco,2025-01-26 19:21:00,Y29tbWVudDoxMDMwNDA2MjQyNDUwODcyXzU2MTg3Njc1MzUxNDk3NQ==,Y29tbWVudDoxMDMwNDA2MjQyNDUwODcyXzEyNjQ2MTc5ODc5NjAzNzU=,< there she goes again,2025-02-01,reply,0
Costco,2025-01-26 19:21:00,Y29tbWVudDoxMDMwNDA2MjQyNDUwODcyXzEzMDcyNzAxOTY5ODA2MTg=,Y29tbWVudDoxMDMwNDA2MjQyNDUwODcyXzU2MTg3Njc1MzUxNDk3NQ==,"if you’re not able to engage in a conversation with someone that disagrees with you, it might be easier to say that. 
 it would save you time. Though you continuing to comment does support Costco’s engagement and visibility, so either way is a win win.",2025-02-01,reply,2
Costco,2025-01-26 19:21:00,Y29tbWVudDoxMDMwNDA2MjQyNDUwODcyXzExMzgyMjE1Mjc5OTYzNTA=,Y29tbWVudDoxMDMwNDA2MjQyNDUwODcyXzEzMDcyNzAxOTY5ODA2MTg=,"Wow you are truly insufferable, and a walking cliche. Be gone, groomer.",2025-02-01,reply,0
Costco,2025-01-26 19:21:00,Y29tbWVudDoxMDMwNDA2MjQyNDUwODcyXzEyODE1ODk5NzMwNjM2NDQ=,Y29tbWVudDoxMDMwNDA2MjQyNDUwODcyXzExMzgyMjE1Mjc5OTYzNTA=,"I’m a 28 year old woman. If you think about this logically, rather than emotionally, you’re statistically much more likely to be a groomer than I am.",2025-02-01,reply,2
Costco,2025-01-26 19:21:00,Y29tbWVudDoxMDMwNDA2MjQyNDUwODcyXzM5ODAxNjIxMjIyNjIxMDE=,Y29tbWVudDoxMDMwNDA2MjQyNDUwODcyXzEyODE1ODk5NzMwNjM2NDQ=,ew,2025-02-01,reply,0
Costco,2025-01-26 19:21:00,Y29tbWVudDoxMDMwNDA2MjQyNDUwODcyXzU4ODM4MzQxNDA0OTk2Nw==,Y29tbWVudDoxMDMwNDA2MjQyNDUwODcyXzEyNzU0NjQxODAyMzk2NzE=,Yeah you're 28 and have everything figured out don't you? Typical ...,2025-02-01,reply,0
Costco,2025-01-26 19:21:00,Y29tbWVudDoxMDMwNDA2MjQyNDUwODcyXzUwMzE4MjA3MjgxNTc4MQ==,Y29tbWVudDoxMDMwNDA2MjQyNDUwODcyXzM5MDU4Nzk5OTMwNjEyNzA=,"while I appreciate your confidence in me, I’m under no impression that I have everything figured out. However, I work in Hr and Talent Acquisition and hold multiple HR certifications, so I do think I’ve got DEI figured out more than most people. And based on Eric’s comments, I’m pretty sure I’ve got a better grasp on human emotion than he does.",2025-02-01,reply,2
Costco,2025-01-26 19:21:00,Y29tbWVudDoxMDMwNDA2MjQyNDUwODcyXzEzMzQ2NjQ1OTEwMjUzNTc=,Y29tbWVudDoxMDMwNDA2MjQyNDUwODcyXzM5MDU4Nzk5OTMwNjEyNzA=,"I don’t actually think you’re a groomer, but it would be illogical for you to accuse me of being one given that it is statistically unlikely. Now if you were just saying that because you’re upset that I disagree with you, I’d encourage you to introspect on why you felt the need to have that emotional outburst.",2025-02-01,reply,1
Costco,2025-01-26 19:21:00,Y29tbWVudDoxMDMwNDA2MjQyNDUwODcyXzUyMjY0NTUwNjkxMzExNQ==,Y29tbWVudDoxMDMwNDA2MjQyNDUwODcyXzEzMzQ2NjQ1OTEwMjUzNTc=,You again? I can't imagine a chick trying to break up with you. Go feed your cats.,2025-02-01,reply,1
Costco,2025-01-26 19:21:00,Y29tbWVudDoxMDMwNDA2MjQyNDUwODcyXzEzNDEwNTA4MTcwNjk2MTU=,Y29tbWVudDoxMDMwNDA2MjQyNDUwODcyXzUyMjY0NTUwNjkxMzExNQ==,"While I appreciate the feigned disinterest, you should try to be more convincing. The performance is currently come off as half hearted and stale.",2025-02-01,reply,1
Costco,2025-01-26 19:21:00,Y29tbWVudDoxMDMwNDA2MjQyNDUwODcyXzIyNzA2MTQ0NzY2NjUyMTg=,Y29tbWVudDoxMDMwNDA2MjQyNDUwODcyXzEzNDEwNTA4MTcwNjk2MTU=,oof,2025-02-01,reply,0
Costco,2025-01-26 19:21:00,Y29tbWVudDoxMDMwNDA2MjQyNDUwODcyXzE5NzE2NzcwMTk5ODkwMTc=,Y29tbWVudDoxMDMwNDA2MjQyNDUwODcyXzIyNzA2MTQ0NzY2NjUyMTg=,"wait, what!? I have a nicely integrated neighborhood, thank you very much. I hope you have a wonderful day.",2025-02-01,reply,1
Costco,2025-01-26 19:21:00,Y29tbWVudDoxMDMwNDA2MjQyNDUwODcyXzMwMDA2MTM0MjAwOTAyMjk=,Y29tbWVudDoxMDMwNDA2MjQyNDUwODcyXzM5MDU4Nzk5OTMwNjEyNzA=,I hope that you teach your son that it’s okay to be emotional. The last thing we need in this country is more emotionally stunted men trying to bottle everything up,2025-02-01,reply,0
Costco,2025-01-26 19:21:00,Y29tbWVudDoxMDMwNDA2MjQyNDUwODcyXzEwOTY1OTQyMzIyMTc4NTg=,Y29tbWVudDoxMDMwNDA2MjQyNDUwODcyXzE5NzE2NzcwMTk5ODkwMTc=,it's pure racism. Your skin color should never matter. If you support DEI you're admiting to being a complete racists.,2025-02-01,reply,16
Costco,2025-01-26 19:21:00,Y29tbWVudDoxMDMwNDA2MjQyNDUwODcyXzUxMzg3Mzk0MTcyMjM2Mw==,Y29tbWVudDoxMDMwNDA2MjQyNDUwODcyXzEwOTY1OTQyMzIyMTc4NTg=,hahahahahaha,2025-02-01,reply,4
Costco,2025-01-26 19:21:00,Y29tbWVudDoxMDMwNDA2MjQyNDUwODcyXzk0MTgxNjg4ODEzNjE2Mw==,Y29tbWVudDoxMDMwNDA2MjQyNDUwODcyXzUxMzg3Mzk0MTcyMjM2Mw==,SMH,2025-02-01,reply,1
Costco,2025-01-26 19:21:00,Y29tbWVudDoxMDMwNDA2MjQyNDUwODcyXzk1MTU5ODM4MzU5ODQxOA==,Y29tbWVudDoxMDMwNDA2MjQyNDUwODcyXzEwOTY1OTQyMzIyMTc4NTg=,can you explain why you feel that DEI is racist and which specific Costco DEI initiatives you disagree with?,2025-02-01,reply,1
Costco,2025-01-26 19:21:00,Y29tbWVudDoxMDMwNDA2MjQyNDUwODcyXzExMzA1NjA0MTE4NTc0ODI=,Y29tbWVudDoxMDMwNDA2MjQyNDUwODcyXzUxMzg3Mzk0MTcyMjM2Mw==,have a wonderful day in your little cave!,2025-02-01,reply,9
Costco,2025-01-26 19:21:00,Y29tbWVudDoxMDMwNDA2MjQyNDUwODcyXzExNjQ4NDQ5NzQ5OTg4NDg=,Y29tbWVudDoxMDMwNDA2MjQyNDUwODcyXzExMjE4ODgzODYwODk1NjM=,what are you so afraid of?,2025-02-01,reply,4
Costco,2025-01-26 19:21:00,Y29tbWVudDoxMDMwNDA2MjQyNDUwODcyXzM4NDY5MzU1NTg5MDIxOTY=,Y29tbWVudDoxMDMwNDA2MjQyNDUwODcyXzExNDc2OTY5MzY5MzMyMjY=,anything else in your arsenal? Have a lovely day!,2025-02-01,reply,1
