company_name,post_date,id,parent_id,comment_text,comment_date,comment_type,reaction_count
Costco,2025-01-26 19:21:00,Y29tbWVudDoxMDMwNDA2MjQyNDUwODcyXzEzMDg2NjExMTM1Nzk2MDA=,Y29tbWVudDoxMDMwNDA2MjQyNDUwODcyXzQ2OTE0OTc1NjI3MTQ4NA==,Wow. Aren’t you a great person. You despise someone you never met. Imagine my surprise.,2025-02-01,reply,1
Costco,2025-01-26 19:21:00,Y29tbWVudDoxMDMwNDA2MjQyNDUwODcyXzExMTU5MjQyMjcxNjYwMTE=,Y29tbWVudDoxMDMwNDA2MjQyNDUwODcyXzQ2OTE0OTc1NjI3MTQ4NA==,"Hahahaha!! Typical Libtards lol. Anytime you call them out on their hatred for America they pull the old, “You must be in the KKK. You must be a racist!” You dumb mf’er’s should get a new playbook. You regurgitate stupidity. You’re probably paid by Costco to troll people’s criticism of their, and your, shared stupidity and hatred of America. You’re all a bunch of baby killing, closet dwelling, panty sniffers lol. If we’re racist, you’re an America hating Communist who wants to destroy the US.",2025-02-01,reply,0
Costco,2025-01-26 19:21:00,Y29tbWVudDoxMDMwNDA2MjQyNDUwODcyXzEzMTQ5MTM1Mzk5NTg4ODM=,Y29tbWVudDoxMDMwNDA2MjQyNDUwODcyXzExMTU5MjQyMjcxNjYwMTE=,Sounds like ChiCom propaganda. Sponsored by Costco? Lol,2025-02-01,reply,0
Costco,2025-01-26 19:21:00,Y29tbWVudDoxMDMwNDA2MjQyNDUwODcyXzExMjk2MDY0OTUwMTI0MjU=,Y29tbWVudDoxMDMwNDA2MjQyNDUwODcyXzEzMTQ5MTM1Mzk5NTg4ODM=,"Yeah, ok. Lol",2025-02-01,reply,1
Costco,2025-01-26 19:21:00,Y29tbWVudDoxMDMwNDA2MjQyNDUwODcyXzIzNzkxOTY0NzU3NzM4NjU=,Y29tbWVudDoxMDMwNDA2MjQyNDUwODcyXzExMjk2MDY0OTUwMTI0MjU=,seems like they’ll be fine,2025-02-01,reply,2
Costco,2025-01-26 19:21:00,Y29tbWVudDoxMDMwNDA2MjQyNDUwODcyXzExMTkxNzYzMTY1NjgzNDc=,Y29tbWVudDoxMDMwNDA2MjQyNDUwODcyXzExMTk1MTUxMTYxMTgxNTY=,"yep, and only 1500 more signed up!",2025-02-01,reply,0
Costco,2025-01-26 19:21:00,Y29tbWVudDoxMDMwNDA2MjQyNDUwODcyXzEzMzY0ODgzMDA2OTI2NDA=,,Bye bye Costco. Doubling down on DEI did it for me.,2025-02-01,initial,64
Costco,2025-01-26 19:21:00,Y29tbWVudDoxMDMwNDA2MjQyNDUwODcyXzEwNTAwNjEyOTA0OTYxNzA=,Y29tbWVudDoxMDMwNDA2MjQyNDUwODcyXzEzMzY0ODgzMDA2OTI2NDA=,I’m going to spend double to make up for you leaving!,2025-02-01,reply,8
Costco,2025-01-26 19:21:00,Y29tbWVudDoxMDMwNDA2MjQyNDUwODcyXzU5NjYyODAwNjQ4MzM4MQ==,Y29tbWVudDoxMDMwNDA2MjQyNDUwODcyXzEwNTAwNjEyOTA0OTYxNzA=,"there's seriously some scary things that DEI stands for. Might look ok on the outside, but it's not.",2025-02-01,reply,1
Costco,2025-01-26 19:21:00,Y29tbWVudDoxMDMwNDA2MjQyNDUwODcyXzExNzQ0NTMyNjczNDg5NzE=,Y29tbWVudDoxMDMwNDA2MjQyNDUwODcyXzE1NzY3MDk3Mzk4NzMwNjY=,can you please explain why you believe that DEI initiatives are scary and which DEI initiatives Costco has in place that you have an issue with?,2025-02-01,reply,0
Costco,2025-01-26 19:21:00,Y29tbWVudDoxMDMwNDA2MjQyNDUwODcyXzkwODUyNzg0NjE1NTk4NDY=,Y29tbWVudDoxMDMwNDA2MjQyNDUwODcyXzExNzQ0NTMyNjczNDg5NzE=,its all about Biblical worldview for me. I dont see that supported.,2025-02-01,reply,0
Costco,2025-01-26 19:21:00,Y29tbWVudDoxMDMwNDA2MjQyNDUwODcyXzQ1MTYwNzExNzg5ODgxNg==,Y29tbWVudDoxMDMwNDA2MjQyNDUwODcyXzkwODUyNzg0NjE1NTk4NDY=,"okay, so you feel that DEI practices go against the Bible? I just want to clarify to ensure I’m understanding your point of view.",2025-02-01,reply,0
Costco,2025-01-26 19:21:00,Y29tbWVudDoxMDMwNDA2MjQyNDUwODcyXzI5ODQ1NDI1NTE2OTg1MjQ=,Y29tbWVudDoxMDMwNDA2MjQyNDUwODcyXzQ1MTYwNzExNzg5ODgxNg==,indeed,2025-02-01,reply,0
Costco,2025-01-26 19:21:00,Y29tbWVudDoxMDMwNDA2MjQyNDUwODcyXzU4MDAxMDcyNDk5OTA0MQ==,Y29tbWVudDoxMDMwNDA2MjQyNDUwODcyXzI5ODQ1NDI1NTE2OTg1MjQ=,can you clarify for me which parts of DEI you feel go against the Bible? I’m being genuine - I’m just not understanding the connection. Thank you in advance!,2025-02-01,reply,0
Costco,2025-01-26 19:21:00,Y29tbWVudDoxMDMwNDA2MjQyNDUwODcyXzYyNTM1Nzg3NjU0OTczMg==,Y29tbWVudDoxMDMwNDA2MjQyNDUwODcyXzEzMzY0ODgzMDA2OTI2NDA=,"Diversity, Equity, and Inclusion (DEI) encompasses a wide range of initiatives, policies, and practices aimed at fostering an inclusive and equitable environment. Here’s a list of areas typically covered by DEI:",2025-02-01,reply,8
Costco,2025-01-26 19:21:00,Y29tbWVudDoxMDMwNDA2MjQyNDUwODcyXzYzOTAyMjU4ODY5MDU2NQ==,Y29tbWVudDoxMDMwNDA2MjQyNDUwODcyXzYyNTM1Nzg3NjU0OTczMg==,Alex Trimper,2025-02-01,reply,3
Costco,2025-01-26 19:21:00,Y29tbWVudDoxMDMwNDA2MjQyNDUwODcyXzExNDkwNzk2NjMzNzQ1NzE=,Y29tbWVudDoxMDMwNDA2MjQyNDUwODcyXzYzOTAyMjU4ODY5MDU2NQ==,so you think our Military Veterans don't deserve any protection in the workplace.,2025-02-01,reply,1
Costco,2025-01-26 19:21:00,Y29tbWVudDoxMDMwNDA2MjQyNDUwODcyXzExMTM4NzQ1MTcxNTg3Njc=,Y29tbWVudDoxMDMwNDA2MjQyNDUwODcyXzEzMzY0ODgzMDA2OTI2NDA=,comment has nothing to do with travel.,2025-02-01,reply,1
Costco,2025-01-26 19:21:00,Y29tbWVudDoxMDMwNDA2MjQyNDUwODcyXzY0NjY3MjA3MTIyMDc5NA==,Y29tbWVudDoxMDMwNDA2MjQyNDUwODcyXzEzMzY0ODgzMDA2OTI2NDA=,"DEI for Costco is about employees having respect for co-workers, no matter what race , religion. Its also about giving women working there equal opportunity for advancement. Its about not discriminating against people for age etc, we have as many older, and senior employees as young people. Its about looking at an application and checking skills, not age , etc. For me that is whatALL employers should be doing.",2025-02-01,reply,4
Costco,2025-01-26 19:21:00,Y29tbWVudDoxMDMwNDA2MjQyNDUwODcyXzE5NDQzMzQ2MTU5NzY2ODE=,Y29tbWVudDoxMDMwNDA2MjQyNDUwODcyXzEzMzY0ODgzMDA2OTI2NDA=,Bye bye Boomer!,2025-02-01,reply,0
Costco,2025-01-26 19:21:00,Y29tbWVudDoxMDMwNDA2MjQyNDUwODcyXzU5OTgwNjU4OTQ2NDg2OQ==,,Terrible business decision. Should have kept their mouth shut. Average conservative Americans spend much more than progressive liberals. This will be a “Bud Light” moment for Costco.,2025-02-01,initial,44
Costco,2025-01-26 19:21:00,Y29tbWVudDoxMDMwNDA2MjQyNDUwODcyXzEzMTc3NTE5ODI1ODEzMDY=,Y29tbWVudDoxMDMwNDA2MjQyNDUwODcyXzU5OTgwNjU4OTQ2NDg2OQ==,source?,2025-02-01,reply,3
Costco,2025-01-26 19:21:00,Y29tbWVudDoxMDMwNDA2MjQyNDUwODcyXzkxNDc0NzEyNzg2NjY4ODI=,Y29tbWVudDoxMDMwNDA2MjQyNDUwODcyXzEzMTc3NTE5ODI1ODEzMDY=,"Costco caters to bulk buying. Who buys bulk? Large families. Who has large families? Well, it ain't the progressive liberals. And truth be told, most of us were willing to look past the DEI and continue to shop there until they aligned themselves with Al Sharpton. This was a really bad decision on their part. They could've just said nothing and none of this would be happening.",2025-02-01,reply,5
Costco,2025-01-26 19:21:00,Y29tbWVudDoxMDMwNDA2MjQyNDUwODcyXzYyMjU5ODAzMzU5Mjg5Nw==,Y29tbWVudDoxMDMwNDA2MjQyNDUwODcyXzEzMTc3NTE5ODI1ODEzMDY=,Source? Source? Source? Liberals are too stupid to figure it out for yourselves.,2025-02-01,reply,0
Costco,2025-01-26 19:21:00,Y29tbWVudDoxMDMwNDA2MjQyNDUwODcyXzEyNjI3NjI5NzgzNTQyNzU=,Y29tbWVudDoxMDMwNDA2MjQyNDUwODcyXzYyMjU5ODAzMzU5Mjg5Nw==,My family of six liberals shops there. Know who else has large families? Immigrants and they’re often multigenerational households. Know who else shops at Costco? Moms that want cheaper diapers and wipes and TP. We know who shops there. You just think you understand everyone’s political affiliation. You don’t.,2025-02-01,reply,2
Costco,2025-01-26 19:21:00,Y29tbWVudDoxMDMwNDA2MjQyNDUwODcyXzEwNzc2Mzc1Mzc0OTc2Njk=,Y29tbWVudDoxMDMwNDA2MjQyNDUwODcyXzEyNjI3NjI5NzgzNTQyNzU=,you think it’s a negative indication of intelligence when someone requests evidence for a claim someone else is making?,2025-02-01,reply,1
Costco,2025-01-26 19:21:00,Y29tbWVudDoxMDMwNDA2MjQyNDUwODcyXzE2NjMyNDA1Nzc2MDQ5MDA=,Y29tbWVudDoxMDMwNDA2MjQyNDUwODcyXzEwNzc2Mzc1Mzc0OTc2Njk=,"exactly. I don’t even have a Costco near me, but I bought a membership to support them and plan to order what I can for delivery to my area until I get one closer to me. I appreciate that they aren’t changing their values and stances. I think it’s weird that people are celebrating companies bowing down to the new administration. If their company leadership can change their values that easily, they never believed them to begin with. I wouldn’t trust me 
 Costco is standing on business",2025-02-01,reply,2
Costco,2025-01-26 19:21:00,Y29tbWVudDoxMDMwNDA2MjQyNDUwODcyXzE4MDQyMjczNjAzOTcxMzU=,Y29tbWVudDoxMDMwNDA2MjQyNDUwODcyXzU5OTgwNjU4OTQ2NDg2OQ==,I hope they get Bud Lighted as well. I’m seeing comments all over of people canceling their memberships. I am. In person. And telling them why.,2025-02-01,reply,1
Costco,2025-01-26 19:21:00,Y29tbWVudDoxMDMwNDA2MjQyNDUwODcyXzExNDE4NTkxMTA2NDkwOTA=,Y29tbWVudDoxMDMwNDA2MjQyNDUwODcyXzE4MDQyMjczNjAzOTcxMzU=,please explain how Costco’s DEI policies discriminate against white people.,2025-02-01,reply,0
Costco,2025-01-26 19:21:00,Y29tbWVudDoxMDMwNDA2MjQyNDUwODcyXzk1NjQxNTE1NjQ1MjgyNw==,Y29tbWVudDoxMDMwNDA2MjQyNDUwODcyXzExNDE4NTkxMTA2NDkwOTA=,"DEI is discriminatory in all aspects. If you don’t understand that already, you never will.",2025-02-01,reply,0
Costco,2025-01-26 19:21:00,Y29tbWVudDoxMDMwNDA2MjQyNDUwODcyXzYyMTg1MDIxNjg4OTI1MQ==,Y29tbWVudDoxMDMwNDA2MjQyNDUwODcyXzk1NjQxNTE1NjQ1MjgyNw==,who does it discriminate against?,2025-02-01,reply,1
Costco,2025-01-26 19:21:00,Y29tbWVudDoxMDMwNDA2MjQyNDUwODcyXzE1NDg4NTY0NTU4MjkyNDI=,Y29tbWVudDoxMDMwNDA2MjQyNDUwODcyXzE4MDQyMjczNjAzOTcxMzU=,"lol so you’re going to ruin a customer service employees day bc you’re mad about their corporate policies? God, you’re the kind of customer I dreaded when I worked at a grocery store in high school.",2025-02-01,reply,0
Costco,2025-01-26 19:21:00,Y29tbWVudDoxMDMwNDA2MjQyNDUwODcyXzQ4NDI4OTY0NDcxOTg2NA==,Y29tbWVudDoxMDMwNDA2MjQyNDUwODcyXzE1NDg4NTY0NTU4MjkyNDI=,Why on earth do you think I would ruin a customer service persons day by explaining why I am leaving their company? You're the kind of person I dread living on the same planet with.,2025-02-01,reply,0
Costco,2025-01-26 19:21:00,Y29tbWVudDoxMDMwNDA2MjQyNDUwODcyXzU5NzgzNjA3NjQ5NzU0Mw==,Y29tbWVudDoxMDMwNDA2MjQyNDUwODcyXzQ4NDI4OTY0NDcxOTg2NA==,"bc I assure you, as someone that worked for 6 years in customer service for a grocery store, they do not want to hear from ANOTHER lady try to explain to them what essentially boils down to a 1st grade understanding of what DEI is and then they have to pretend to care that you’re cancelling. If you want to explain to someone why you’re cancelling, call corporate, or better yet, just scream it into your pillow or something.",2025-02-01,reply,0
Costco,2025-01-26 19:21:00,Y29tbWVudDoxMDMwNDA2MjQyNDUwODcyXzExNDI1NTM1MDQyNDYwNjA=,Y29tbWVudDoxMDMwNDA2MjQyNDUwODcyXzU5NzgzNjA3NjQ5NzU0Mw==,Well your support of DEI certainly explains the stupidity of your comment.,2025-02-01,reply,0
Costco,2025-01-26 19:21:00,Y29tbWVudDoxMDMwNDA2MjQyNDUwODcyXzE2OTI1ODE2MTE2OTU2ODg=,,Stop your DEI practices. Risk lots of cancelled memberships!!,2025-02-01,initial,32
Costco,2025-01-26 19:21:00,Y29tbWVudDoxMDMwNDA2MjQyNDUwODcyXzEzNTY1NDMzNDg4MzcwNzU=,Y29tbWVudDoxMDMwNDA2MjQyNDUwODcyXzE2OTI1ODE2MTE2OTU2ODg=,"you mean the racist policies that have been in place ALL ALONG? The ones you didn’t mind UNTILL the rapist told you, that you should? Those ones?",2025-02-01,reply,3
Costco,2025-01-26 19:21:00,Y29tbWVudDoxMDMwNDA2MjQyNDUwODcyXzM5MDAzNjY4MTM1Mzk4NDA=,Y29tbWVudDoxMDMwNDA2MjQyNDUwODcyXzEzNTY1NDMzNDg4MzcwNzU=,what racist policies? Your TDS is showing. Didn't Earn It Policy,2025-02-01,reply,2
Costco,2025-01-26 19:21:00,Y29tbWVudDoxMDMwNDA2MjQyNDUwODcyXzEyNzcxMDY2MDAyMTUxOTg=,Y29tbWVudDoxMDMwNDA2MjQyNDUwODcyXzE2OTI1ODE2MTE2OTU2ODg=,"I didn’t see the name trump in Robert Pendergrass’ comment. So no idea WTF you’re talking about. If you need surgery anytime to save your life soon let me know and I can get it scheduled with a dr that was hired based on DEI and failed their mcats but got into med school anyway solely based on their ethnicity then could not pass their certification to get their license until finally they just gave it to them because again they weren’t a white person. You can have any doctor, dentist, pilot that got their license based on DEI! I’ll take the ones that earned their licenses by merit. And yes DEI & CRT have been taught in major universities for decades but it’s only been the last 4yrs that the stupidity and lack of common sense started. It’s sad when people go off with their mouth without doing much research other than articles from FB or IG, just sad! But then that’s the democrazies, can’t think for themselves!",2025-02-01,reply,0
Costco,2025-01-26 19:21:00,Y29tbWVudDoxMDMwNDA2MjQyNDUwODcyXzk2MzY0MDI1MTk4MzAzNg==,Y29tbWVudDoxMDMwNDA2MjQyNDUwODcyXzEyNzcxMDY2MDAyMTUxOTg=,"babe, I don’t think you know what DEI or CRT actually are.",2025-02-01,reply,0
Costco,2025-01-26 19:21:00,Y29tbWVudDoxMDMwNDA2MjQyNDUwODcyXzExMTAwODE2Mzc1NTg1MTI=,Y29tbWVudDoxMDMwNDA2MjQyNDUwODcyXzEyNzcxMDY2MDAyMTUxOTg=,actually the opposite...wouldn't want to shop next to people like you.,2025-02-01,reply,3
Costco,2025-01-26 19:21:00,Y29tbWVudDoxMDMwNDA2MjQyNDUwODcyXzEyNjc2Mzk4MzA5NzMzNTk=,Y29tbWVudDoxMDMwNDA2MjQyNDUwODcyXzExMTAwODE2Mzc1NTg1MTI=,Chicago says it all.,2025-02-01,reply,0
Costco,2025-01-26 19:21:00,Y29tbWVudDoxMDMwNDA2MjQyNDUwODcyXzI5NjQxODM1MzA0MTQwODU=,Y29tbWVudDoxMDMwNDA2MjQyNDUwODcyXzEyNjc2Mzk4MzA5NzMzNTk=,and what is your point?,2025-02-01,reply,0
Costco,2025-01-26 19:21:00,Y29tbWVudDoxMDMwNDA2MjQyNDUwODcyXzY0NTYyMzE5NDU1NzgxOQ==,Y29tbWVudDoxMDMwNDA2MjQyNDUwODcyXzI5NjQxODM1MzA0MTQwODU=,"Your city! Run by Democrats and your mayor is more corrupt than Mayor Lightfoot. Mayor loves em some Illegals. Illegals over Citizens. Hopefully you have not procreated but you would head to an abortion clinic cause Democrats love abortion, and Illegals. Looks like you took the Fauci jab and you love the money laundering of tax dollars to Ukraine.",2025-02-01,reply,0
Costco,2025-01-26 19:21:00,Y29tbWVudDoxMDMwNDA2MjQyNDUwODcyXzM5NDY0NTEzMzg5NzcwNzc=,Y29tbWVudDoxMDMwNDA2MjQyNDUwODcyXzE2OTI1ODE2MTE2OTU2ODg=,"The racial resume issue I’m referring to is the finding from multiple studies that if a candidate has a name typically associated with black people, they’re around 50% less likely to be called for an interview than someone with a “white sounding name”, even if there’s not differences in qualifications.",2025-02-01,reply,0
Costco,2025-01-26 19:21:00,Y29tbWVudDoxMDMwNDA2MjQyNDUwODcyXzExNDc4NjAyNzM1Mjc4NTI=,,"Their vacation packages are great, my family just used Costco travel over our Christmas holiday and got a great deal. We’ll be using them again!",2025-02-01,initial,57
Costco,2025-01-26 19:21:00,Y29tbWVudDoxMDMwNDA2MjQyNDUwODcyXzkyNTQwNjA1MDQ2NDg5NTU=,Y29tbWVudDoxMDMwNDA2MjQyNDUwODcyXzExNDc4NjAyNzM1Mjc4NTI=,don’t expect help in case something goes wrong.,2025-02-01,reply,1
Costco,2025-01-26 19:21:00,Y29tbWVudDoxMDMwNDA2MjQyNDUwODcyXzYwNjc0MTEzMjA2Mjc5OQ==,Y29tbWVudDoxMDMwNDA2MjQyNDUwODcyXzkyNTQwNjA1MDQ2NDg5NTU=,we were in Hawaii and a hurricane was aporaching. They had our backs. Not everything is within their control. What issue did you have?,2025-02-01,reply,3
Costco,2025-01-26 19:21:00,Y29tbWVudDoxMDMwNDA2MjQyNDUwODcyXzE2MDEzODk5NTc0MDM4Nzc=,Y29tbWVudDoxMDMwNDA2MjQyNDUwODcyXzkyNTQwNjA1MDQ2NDg5NTU=,that’s what travelers insurance is for.,2025-02-01,reply,0
Costco,2025-01-26 19:21:00,Y29tbWVudDoxMDMwNDA2MjQyNDUwODcyXzg1MzY5MDAzMzQ2NTgzOQ==,Y29tbWVudDoxMDMwNDA2MjQyNDUwODcyXzE2MDEzODk5NTc0MDM4Nzc=,we ALWAYS buy travel insurance.,2025-02-01,reply,0
Costco,2025-01-26 19:21:00,Y29tbWVudDoxMDMwNDA2MjQyNDUwODcyXzk4MDU5NjA2NzI5MDU3MA==,Y29tbWVudDoxMDMwNDA2MjQyNDUwODcyXzg1MzY5MDAzMzQ2NTgzOQ==,Welp then you should be okay if anything happens.,2025-02-01,reply,1
Costco,2025-01-26 19:21:00,Y29tbWVudDoxMDMwNDA2MjQyNDUwODcyXzE5NzM0MTQzNTMxNjcxNzQ=,Y29tbWVudDoxMDMwNDA2MjQyNDUwODcyXzk4MDU5NjA2NzI5MDU3MA==,We have never purchased travel insurance.,2025-02-01,reply,0
Costco,2025-01-26 19:21:00,Y29tbWVudDoxMDMwNDA2MjQyNDUwODcyXzk2MzUxNjk2NTI3ODUyOQ==,Y29tbWVudDoxMDMwNDA2MjQyNDUwODcyXzE5NzM0MTQzNTMxNjcxNzQ=,When we go out of the country I always get travel insurance for those “just incase of an emergency ” moments. Not everyone uses it but you never know what can happen.,2025-02-01,reply,1
Costco,2025-01-26 19:21:00,Y29tbWVudDoxMDMwNDA2MjQyNDUwODcyXzM4ODMzNTAwMjg2NDg4MjQ=,Y29tbWVudDoxMDMwNDA2MjQyNDUwODcyXzk2MzUxNjk2NTI3ODUyOQ==,we weren’t leaving the country,2025-02-01,reply,0
Costco,2025-01-26 19:21:00,Y29tbWVudDoxMDMwNDA2MjQyNDUwODcyXzU5NjM3NzkyOTg2NDkyNQ==,Y29tbWVudDoxMDMwNDA2MjQyNDUwODcyXzExNDc4NjAyNzM1Mjc4NTI=,I guess I like experience and service.,2025-02-01,reply,0
Costco,2025-01-26 19:21:00,Y29tbWVudDoxMDMwNDA2MjQyNDUwODcyXzIwNTA1OTQzNTIwNDgwNDY=,Y29tbWVudDoxMDMwNDA2MjQyNDUwODcyXzU5NjM3NzkyOTg2NDkyNQ==,I’ve always had great service with Costco travel.,2025-02-01,reply,0
Costco,2025-01-26 19:21:00,Y29tbWVudDoxMDMwNDA2MjQyNDUwODcyXzU5MjkxNDQwNzA0Mzc5OA==,Y29tbWVudDoxMDMwNDA2MjQyNDUwODcyXzk2MzUxNjk2NTI3ODUyOQ==,"I used to think the same but we've gotten much better deals through a travel agency. Just like Costco, they don't charge you for their services.",2025-02-01,reply,0
Costco,2025-01-26 19:21:00,Y29tbWVudDoxMDMwNDA2MjQyNDUwODcyXzYyNTYzMjc2MDM3OTQ3NQ==,Y29tbWVudDoxMDMwNDA2MjQyNDUwODcyXzU5MjkxNDQwNzA0Mzc5OA==,"I liked it also because I received a Costco Gift Card when I got back, it helps with restocking the house after along trip and o can’t get that from a travel agent",2025-02-01,reply,1
Costco,2025-01-26 19:21:00,Y29tbWVudDoxMDMwNDA2MjQyNDUwODcyXzExNjE0NzgyNTU0MjMyNjM=,Y29tbWVudDoxMDMwNDA2MjQyNDUwODcyXzYyNTYzMjc2MDM3OTQ3NQ==,Our savings was greater than the gift card.,2025-02-01,reply,0
Costco,2025-01-26 19:21:00,Y29tbWVudDoxMDMwNDA2MjQyNDUwODcyXzExNjY4NTQwMjg1MTEwOTg=,Y29tbWVudDoxMDMwNDA2MjQyNDUwODcyXzExNjE0NzgyNTU0MjMyNjM=,Glad you could find a great deal.,2025-02-01,reply,0
Costco,2025-01-26 19:21:00,Y29tbWVudDoxMDMwNDA2MjQyNDUwODcyXzYzNjQ4ODg4NjAwNTc4OQ==,Y29tbWVudDoxMDMwNDA2MjQyNDUwODcyXzExNjY4NTQwMjg1MTEwOTg=,Me too. You should check it out.,2025-02-01,reply,0
Costco,2025-01-26 19:21:00,Y29tbWVudDoxMDMwNDA2MjQyNDUwODcyXzIwOTc3MzM5MzQwMDg5NzE=,,"I had been thinking about buying a Costco membership and was not dissuaded by what I perceive as Costco's business decisions related to DEI, but when Al Sharpton showed up all bets were off. Also, I learned that Costco doesn't have an X account, forcing me to my nonpreferred platform to comment. If you're not willing to meet me on X, you're not serious about my business.",2025-02-01,initial,161
Costco,2025-01-26 19:21:00,Y29tbWVudDoxMDMwNDA2MjQyNDUwODcyXzk1Mjc0OTIyOTgxNTQ0NA==,Y29tbWVudDoxMDMwNDA2MjQyNDUwODcyXzIwOTc3MzM5MzQwMDg5NzE=,Never mind. Your picture says you’re way beyond that. Actually you look like that farmer’s wife in the painting where they have pitchforks. Which seems to track here,2025-02-01,reply,6
Costco,2025-01-26 19:21:00,Y29tbWVudDoxMDMwNDA2MjQyNDUwODcyXzExMjAwMzA0OTYwNzAyMTI=,Y29tbWVudDoxMDMwNDA2MjQyNDUwODcyXzk1Mjc0OTIyOTgxNTQ0NA==,you seem kind of creepy.,2025-02-01,reply,3
Costco,2025-01-26 19:21:00,Y29tbWVudDoxMDMwNDA2MjQyNDUwODcyXzQ3MDgxODI4OTIyNzk5MA==,Y29tbWVudDoxMDMwNDA2MjQyNDUwODcyXzExMjAwMzA0OTYwNzAyMTI=,and yet you voted for orange Jesus. I don’t think you know what creepy means,2025-02-01,reply,7
Costco,2025-01-26 19:21:00,Y29tbWVudDoxMDMwNDA2MjQyNDUwODcyXzU5ODA3MjQ2NjQ4MjM0Nw==,Y29tbWVudDoxMDMwNDA2MjQyNDUwODcyXzQ3MDgxODI4OTIyNzk5MA==,you should be sterilized and not be able to breed. You're an embarrassment to REAL womanhood.,2025-02-01,reply,1
Costco,2025-01-26 19:21:00,Y29tbWVudDoxMDMwNDA2MjQyNDUwODcyXzk4Mjg1MTAyMzc0NDI2NA==,Y29tbWVudDoxMDMwNDA2MjQyNDUwODcyXzU5ODA3MjQ2NjQ4MjM0Nw==,"so you claim to believe in freedom of speech, but since you don’t like Pamela Schmamela expressing her freedom, you threaten her with a radical medical procedure. You MAGAts are truly demented.",2025-02-01,reply,2
Costco,2025-01-26 19:21:00,Y29tbWVudDoxMDMwNDA2MjQyNDUwODcyXzI5NjAxNDQwNzc0OTE0MDY=,Y29tbWVudDoxMDMwNDA2MjQyNDUwODcyXzk4Mjg1MTAyMzc0NDI2NA==,Sterilized??? Spoken like a true YAHTZEE go crawl back under from whatever trailer park you came from.,2025-02-01,reply,1
Costco,2025-01-26 19:21:00,Y29tbWVudDoxMDMwNDA2MjQyNDUwODcyXzk1ODUwNDQzOTYyODg3OA==,Y29tbWVudDoxMDMwNDA2MjQyNDUwODcyXzIwOTc3MzM5MzQwMDg5NzE=,tf? What do you mean HER people??,2025-02-01,reply,0
Costco,2025-01-26 19:21:00,Y29tbWVudDoxMDMwNDA2MjQyNDUwODcyXzY5MjE0Njc2MzI0NTA4Nw==,Y29tbWVudDoxMDMwNDA2MjQyNDUwODcyXzIwOTc3MzM5MzQwMDg5NzE=,no response here Susan?,2025-02-01,reply,0
Costco,2025-01-26 19:21:00,Y29tbWVudDoxMDMwNDA2MjQyNDUwODcyXzk2NzU5MzAwODA4MzkwOQ==,Y29tbWVudDoxMDMwNDA2MjQyNDUwODcyXzExMjAwMzA0OTYwNzAyMTI=,"sure, MAGA. Glad I won’t see you in my store.",2025-02-01,reply,27
Costco,2025-01-26 19:21:00,Y29tbWVudDoxMDMwNDA2MjQyNDUwODcyXzI0Mzk1NDk4NjMwNDc5NDU=,Y29tbWVudDoxMDMwNDA2MjQyNDUwODcyXzk2NzU5MzAwODA4MzkwOQ==,"you people really need to get a life. I'm glad ""your store"" is doing so well you don't need customers.",2025-02-01,reply,10
Costco,2025-01-26 19:21:00,Y29tbWVudDoxMDMwNDA2MjQyNDUwODcyXzY0NDUzNzg5NDgwNjc0Mg==,Y29tbWVudDoxMDMwNDA2MjQyNDUwODcyXzI0Mzk1NDk4NjMwNDc5NDU=,"yes, it is VERY BUSY, and thankfully I have never seen a MAGA hat there. I’m proud of the fact that Costco embraces love, not hate. BTW, we all have a life, MAGAt. I guess mine is just better than yours since you MAGAs can never be happy. It’s that cult brain. So sorry for you.",2025-02-01,reply,4
Costco,2025-01-26 19:21:00,Y29tbWVudDoxMDMwNDA2MjQyNDUwODcyXzE2MDQwNTE2NDA0OTg3MTU=,Y29tbWVudDoxMDMwNDA2MjQyNDUwODcyXzY0NDUzNzg5NDgwNjc0Mg==,Are you drunk? Can you read? Or do you just stay up late and insult people who don't like Al Sharpton?,2025-02-01,reply,6
Costco,2025-01-26 19:21:00,Y29tbWVudDoxMDMwNDA2MjQyNDUwODcyXzE1NjA2NTY4MDEyODI0MzI=,Y29tbWVudDoxMDMwNDA2MjQyNDUwODcyXzk2NzU5MzAwODA4MzkwOQ==,says the true idiot,2025-02-01,reply,1
Costco,2025-01-26 19:21:00,Y29tbWVudDoxMDMwNDA2MjQyNDUwODcyXzEyMzg3NDE3NzcxOTMwMTk=,Y29tbWVudDoxMDMwNDA2MjQyNDUwODcyXzExMjAwMzA0OTYwNzAyMTI=,throwing random insults to elevate your angry ego. Take a walk outside. It will help you.,2025-02-01,reply,1
Costco,2025-01-26 19:21:00,Y29tbWVudDoxMDMwNDA2MjQyNDUwODcyXzE4MTUwNTQ2NTU5ODMxMDI=,Y29tbWVudDoxMDMwNDA2MjQyNDUwODcyXzEyMzg3NDE3NzcxOTMwMTk=,"oh, the irony is lost on you.",2025-02-01,reply,4
Costco,2025-01-26 19:21:00,Y29tbWVudDoxMDMwNDA2MjQyNDUwODcyXzE5OTE3NDg2MDQ2Njg5MTQ=,Y29tbWVudDoxMDMwNDA2MjQyNDUwODcyXzE4MTUwNTQ2NTU5ODMxMDI=,"A company/business should ONLY hire a person based on their merit, experience and/or QUALIFICATIONS for the job. Not to check off and make quotas on races, genders and groups. Smart people understand that. Your ignorance and unintelligence is astounding.",2025-02-01,reply,0
Costco,2025-01-26 19:21:00,Y29tbWVudDoxMDMwNDA2MjQyNDUwODcyXzExMzE3NDkyODU0MTI1MTQ=,Y29tbWVudDoxMDMwNDA2MjQyNDUwODcyXzk2NzU5MzAwODA4MzkwOQ==,you're literally the one that came on Kim's comment and started insulting her first. Stop playing victimhood. You can dish it out but can't take it.,2025-02-01,reply,0
Costco,2025-01-26 19:21:00,Y29tbWVudDoxMDMwNDA2MjQyNDUwODcyXzk5MDEwOTI4Mjk4OTA2OQ==,Y29tbWVudDoxMDMwNDA2MjQyNDUwODcyXzk2NzU5MzAwODA4MzkwOQ==,ans many many 100'sof thousands men ans woman who work..BECAUAE THEY EARNED THEIR JOBS!!,2025-02-01,reply,0
Costco,2025-01-26 19:21:00,Y29tbWVudDoxMDMwNDA2MjQyNDUwODcyXzE1OTA2OTAxNjgzMTQ4NDM=,Y29tbWVudDoxMDMwNDA2MjQyNDUwODcyXzk5MDEwOTI4Mjk4OTA2OQ==,I have no idea what you’re saying. Are you being held captive in a MAGA cultist’s basement?,2025-02-01,reply,0
Costco,2025-01-26 19:21:00,Y29tbWVudDoxMDMwNDA2MjQyNDUwODcyXzY0MDQ0MDAwODQwNTU2MA==,Y29tbWVudDoxMDMwNDA2MjQyNDUwODcyXzExMjAwMzA0OTYwNzAyMTI=,oh they will have customers they just don't need MAGATS scurrying through the store like Insurrectionist Racist Un-American rats. Get your Yahtzee a** back to the hate filled propaganda social network you aren't wanted here either.,2025-02-01,reply,1
Costco,2025-01-26 19:21:00,Y29tbWVudDoxMDMwNDA2MjQyNDUwODcyXzYyNTgyMjYwMzE0MzA2OQ==,Y29tbWVudDoxMDMwNDA2MjQyNDUwODcyXzk2NzU5MzAwODA4MzkwOQ==,shguuuuttttt uuuppppppp,2025-02-01,reply,0
Costco,2025-01-26 19:21:00,Y29tbWVudDoxMDMwNDA2MjQyNDUwODcyXzEzMTU0MTc4MDI4Mjc5NzU=,Y29tbWVudDoxMDMwNDA2MjQyNDUwODcyXzk2NzU5MzAwODA4MzkwOQ==,you can keep you California sweetheart . Look at it !,2025-02-01,reply,0
Costco,2025-01-26 19:21:00,Y29tbWVudDoxMDMwNDA2MjQyNDUwODcyXzY2NzkwNjQ1NTc5Nzk2NQ==,Y29tbWVudDoxMDMwNDA2MjQyNDUwODcyXzEzMTU0MTc4MDI4Mjc5NzU=,thank you! It’s gorgeous!,2025-02-01,reply,0
Costco,2025-01-26 19:21:00,Y29tbWVudDoxMDMwNDA2MjQyNDUwODcyXzYyODY3MTM0NjIyNDIzOA==,Y29tbWVudDoxMDMwNDA2MjQyNDUwODcyXzY2NzkwNjQ1NTc5Nzk2NQ==,"it’s burning to the ground lmfao , you should thank Trump for saving it the libtards didn’t sweetheart!",2025-02-01,reply,0
Costco,2025-01-26 19:21:00,Y29tbWVudDoxMDMwNDA2MjQyNDUwODcyXzE1MjIxMjQ5ODg0NzU2MDk=,Y29tbWVudDoxMDMwNDA2MjQyNDUwODcyXzE2MDQwNTE2NDA0OTg3MTU=,"smell ya later, dingbat",2025-02-01,reply,0
Costco,2025-01-26 19:21:00,Y29tbWVudDoxMDMwNDA2MjQyNDUwODcyXzYyMDkxNzgwMzY3MDcwMA==,Y29tbWVudDoxMDMwNDA2MjQyNDUwODcyXzIwOTc3MzM5MzQwMDg5NzE=,"you mean….you heard a 
 black man….(I know horror) speak on behalf of Costco, and now",2025-02-01,reply,3
Costco,2025-01-26 19:21:00,Y29tbWVudDoxMDMwNDA2MjQyNDUwODcyXzEwMTA0MTQ3ODExMTYxMTc=,Y29tbWVudDoxMDMwNDA2MjQyNDUwODcyXzYyMDkxNzgwMzY3MDcwMA==,"Amazing. You're calling me a racist because I don't like Al Sharpton. It must be, has to be, because he's black because I'm white. What a dope. Who's the racist, racist?",2025-02-01,reply,0
Costco,2025-01-26 19:21:00,Y29tbWVudDoxMDMwNDA2MjQyNDUwODcyXzY0ODE2NTc1NDIxNDI3Mw==,Y29tbWVudDoxMDMwNDA2MjQyNDUwODcyXzEwMTA0MTQ3ODExMTYxMTc=,", oh nooooo! You found out! Darn it. Still sounds about white.",2025-02-01,reply,3
