company_name,post_date,id,parent_id,comment_text,comment_date,comment_type,reaction_count
Costco,2025-01-26 19:21:00,Y29tbWVudDoxMDMwNDA2MjQyNDUwODcyXzk3MjEwNzYwNDgwMzc1NQ==,,Thank you Costco. I will be shopping with you more frequently now.,2025-02-01,initial,1
Costco,2025-01-26 19:21:00,Y29tbWVudDoxMDMwNDA2MjQyNDUwODcyXzEwNTU2MzM2Njk2Njc0MTM=,,"Thanks Costco for standing up for what is right! I will continue to shop and support your business BECAUSE you recognize that we are better together and our differences ultimately lead to a better culture, both in business and life!",2025-02-01,initial,1
Costco,2025-01-26 19:21:00,Y29tbWVudDoxMDMwNDA2MjQyNDUwODcyXzE0MTc4NDA1NjU4NTE5OTQ=,,Thank you Costco for creating a wonderful workplace that supports merit and while having a strong stance Diversity and inclusion. It’s called a “hand up and not a hand out.”,2025-02-01,initial,6
Costco,2025-01-26 19:21:00,Y29tbWVudDoxMDMwNDA2MjQyNDUwODcyXzYyMTMwMjM5MDU4NjM4Nw==,,We love Costco and specifically shop there because of their support of DEI and paying a living wage. Keep up the good work!!,2025-02-01,initial,9
Costco,2025-01-26 19:21:00,Y29tbWVudDoxMDMwNDA2MjQyNDUwODcyXzEzNDM2MTU1MjMzMjg0OTE=,,"Thank you, Costco for continuing to support DEI policies that make us a stronger community.",2025-02-01,initial,3
Costco,2025-01-26 19:21:00,Y29tbWVudDoxMDMwNDA2MjQyNDUwODcyXzEyOTg2MjI3MjgwMjE1OTk=,,"I am a proud, “card carrying member” of Costco. Thank you for all that you do.",2025-02-01,initial,8
Costco,2025-01-26 19:21:00,Y29tbWVudDoxMDMwNDA2MjQyNDUwODcyXzkzNTY4MTIxODY4MDM4Mg==,,"Costco, you have always been a great place to shop. You will be getting more business from me and my family. Proud of your stance on being inclusive of ALL Americans.",2025-02-01,initial,21
Costco,2025-01-26 19:21:00,Y29tbWVudDoxMDMwNDA2MjQyNDUwODcyXzkzOTIxMjA1Mjc0NzQyOTg=,Y29tbWVudDoxMDMwNDA2MjQyNDUwODcyXzkzNTY4MTIxODY4MDM4Mg==,never been in one before. But I’ll drive 1.5 hours to get to one now. Kudos to Costco,2025-02-01,reply,2
Costco,2025-01-26 19:21:00,Y29tbWVudDoxMDMwNDA2MjQyNDUwODcyXzkyNTkwNjcxNTA3OTg5ODI=,,"Yay!!! Way to go Costco!! We got our membership a few months ago. You are worth the 45 min drive. Love your store, even more now that you value policies of diversity, equality and inclusion.",2025-02-01,initial,18
Costco,2025-01-26 19:21:00,Y29tbWVudDoxMDMwNDA2MjQyNDUwODcyXzYxMTc5MzM4NDgzMTUwNA==,,"Costco just secured my loyalty for life! I’ll be buying memberships for all my friends and family for birthdays, holidays, and maybe even Groundhog Day. Supporting a company that values diversity, equity, and inclusion is the real membership perk. As for the MAGAS losing their minds over this…imagine being triggered by kindness and fairness. Maybe they need a Costco-sized box of perspective.",2025-02-01,initial,16
Costco,2025-01-26 19:21:00,Y29tbWVudDoxMDMwNDA2MjQyNDUwODcyXzYzNDEzNTU2MjQwOTg4Mg==,,THANK YOU COSTCO! You valuing your employees enough to stand up to the bullies tells us what a great company you are.,2025-02-01,initial,61
Costco,2025-01-26 19:21:00,Y29tbWVudDoxMDMwNDA2MjQyNDUwODcyXzkxODMzMjIzNjc2MTcxNg==,,Very proud to be a Costco member and shopper. Costco is a place of integrity and treats their employees and customer well. Thank you for not getting rid of DEI,2025-02-01,initial,5
Costco,2025-01-26 19:21:00,Y29tbWVudDoxMDMwNDA2MjQyNDUwODcyXzEzMDI5OTYxMTc2MDg4MTk=,,"Thank you, Costco for standing up for inclusion! I’m not sure why anyone would be opposed to that. I’m glad we just renewed our membership.",2025-02-01,initial,20
Costco,2025-01-26 19:21:00,Y29tbWVudDoxMDMwNDA2MjQyNDUwODcyXzE1NTcxNjk1NTQ5ODgzNTk=,,"Jsut joined for the the first time! Will be redirecting my shopping to Costco, who has been a great employer to family members, has great products, and great prices. Gee, it’s almost like having good values is a good business model!",2025-02-01,initial,26
Costco,2025-01-26 19:21:00,Y29tbWVudDoxMDMwNDA2MjQyNDUwODcyXzEzOTA3Mzg2NTg3NzM3NjM=,,Started buying at Costco. Agree w their politics. All the way Costco!,2025-02-01,initial,41
Costco,2025-01-26 19:21:00,Y29tbWVudDoxMDMwNDA2MjQyNDUwODcyXzEzMzQ3ODU3NDQzNzQ0NDc=,Y29tbWVudDoxMDMwNDA2MjQyNDUwODcyXzEzOTA3Mzg2NTg3NzM3NjM=,same! We are finally getting one in my area soon and I can’t wait!,2025-02-01,reply,2
Costco,2025-01-26 19:21:00,Y29tbWVudDoxMDMwNDA2MjQyNDUwODcyXzEwNjI2MDIwNjIzMDQ0MDk=,Y29tbWVudDoxMDMwNDA2MjQyNDUwODcyXzEzOTA3Mzg2NTg3NzM3NjM=,they will be closing with all the ppl leaving dei bs,2025-02-01,reply,4
Costco,2025-01-26 19:21:00,Y29tbWVudDoxMDMwNDA2MjQyNDUwODcyXzkwMzY1NTM1NDk3MzcxNQ==,,I apologize for a previous post disapproving Costco's stance on DEF in favor of shareholders which was an error and misinformation. I strongly support your stance with continuing DEI despite some shareholder views. You have always been a compassionate business especially with your employees. Continue to conduct business with your heart and not through mean-spiritedness.,2025-02-01,initial,6
Costco,2025-01-26 19:21:00,Y29tbWVudDoxMDMwNDA2MjQyNDUwODcyXzM4ODcwOTY0MzgxNzMxODE=,,WHEN WILL YOU BUILT A STORE IN Lakeland FL?,2025-02-01,initial,3
Costco,2025-01-26 19:21:00,Y29tbWVudDoxMDMwNDA2MjQyNDUwODcyXzExMjQ2NDgxMTg5NDAxNzM=,Y29tbWVudDoxMDMwNDA2MjQyNDUwODcyXzM4ODcwOTY0MzgxNzMxODE=,"DanielandSilvia- Thanks for letting us know! We'll inform our Real Estate team of your request to bring Costco to Lakeland, FL. If you wish to stay up to date on locations coming soon, check out the following link: https://www.costco.com/new-locations.html -Max",2025-02-08,reply,0
Costco,2025-01-26 19:21:00,Y29tbWVudDoxMDMwNDA2MjQyNDUwODcyXzExNjY2ODI1OTQ4NTM3MTE=,,Nope. No more Costco for me.,2025-02-01,initial,16
Costco,2025-01-26 19:21:00,Y29tbWVudDoxMDMwNDA2MjQyNDUwODcyXzEzNzIwMjU2MTA0Mzk4MTg=,Y29tbWVudDoxMDMwNDA2MjQyNDUwODcyXzExNjY2ODI1OTQ4NTM3MTE=,Bye!,2025-02-01,reply,2
Costco,2025-01-26 19:21:00,Y29tbWVudDoxMDMwNDA2MjQyNDUwODcyXzk2MjAwNjQ1MDgwMTI0NjA=,Y29tbWVudDoxMDMwNDA2MjQyNDUwODcyXzExNjY2ODI1OTQ4NTM3MTE=,good! More room for me,2025-02-01,reply,2
Costco,2025-01-26 19:21:00,Y29tbWVudDoxMDMwNDA2MjQyNDUwODcyXzk4MzA2NTkyMzcyNjk1NQ==,Y29tbWVudDoxMDMwNDA2MjQyNDUwODcyXzExNjY2ODI1OTQ4NTM3MTE=,All my experiences at Costco have been great. Daniele at the check out was fabulous- i tend to see her there almost every time I’m there. She has great wine suggestions!,2025-02-01,reply,2
Costco,2025-01-26 19:21:00,Y29tbWVudDoxMDMwNDA2MjQyNDUwODcyXzEyNjQyMTQ2NDgxNDMxOTU=,Y29tbWVudDoxMDMwNDA2MjQyNDUwODcyXzExNjY2ODI1OTQ4NTM3MTE=,bye,2025-02-01,reply,1
Costco,2025-01-26 19:21:00,Y29tbWVudDoxMDMwNDA2MjQyNDUwODcyXzkwMDk1MzQ2NTQ1MjA3MA==,Y29tbWVudDoxMDMwNDA2MjQyNDUwODcyXzExNjY2ODI1OTQ4NTM3MTE=,Good—Less xenophobia in the warehouses!,2025-02-01,reply,0
Costco,2025-01-26 19:21:00,Y29tbWVudDoxMDMwNDA2MjQyNDUwODcyXzU3NDUzMTY5ODg4OTQxOQ==,Y29tbWVudDoxMDMwNDA2MjQyNDUwODcyXzExNjY2ODI1OTQ4NTM3MTE=,", bye Felicia!",2025-02-01,reply,0
Costco,2025-01-26 19:21:00,Y29tbWVudDoxMDMwNDA2MjQyNDUwODcyXzUxNjU3MjMwMDkyNDMzMg==,Y29tbWVudDoxMDMwNDA2MjQyNDUwODcyXzExNjY2ODI1OTQ4NTM3MTE=,"Anne, are you still working? Because women are part of DEI. White women.",2025-02-01,reply,0
Costco,2025-01-26 19:21:00,Y29tbWVudDoxMDMwNDA2MjQyNDUwODcyXzE2NTUxOTk2Mzg3MTYwNTU=,Y29tbWVudDoxMDMwNDA2MjQyNDUwODcyXzUxNjU3MjMwMDkyNDMzMg==,"I’ve worked since I was 20 in 1980. I Have a degree in Accounting, an MBA and CPA certification. Was paid 50% of male counterparts. EEOC has mostly corrected this. DEI is just racial quotas.",2025-02-01,reply,0
Costco,2025-01-26 19:21:00,Y29tbWVudDoxMDMwNDA2MjQyNDUwODcyXzExNDQ1MDAyODcxODkwNzE=,Y29tbWVudDoxMDMwNDA2MjQyNDUwODcyXzE2NTUxOTk2Mzg3MTYwNTU=,"no, it's comprised of veterans, the disabled, neurodivergent, women, non white people, and our current vice president, a poor from Appalachia, got i to Yale as a DEI because of his mitary service. So shut it.",2025-02-01,reply,1
Costco,2025-01-26 19:21:00,Y29tbWVudDoxMDMwNDA2MjQyNDUwODcyXzE1Mzc1MDk4MDA1MzgyNTk=,Y29tbWVudDoxMDMwNDA2MjQyNDUwODcyXzExNDQ1MDAyODcxODkwNzE=,"Personally I do not want a 5’2” Secret Service agent protecting a 6’5” person from bullets, or Firemen (fire people?) who cannot carry a large incapacitated man out of a burning building. Or air traffic controllers who are deaf, mentally incapacitated, or in any other way not 100% the sharpest brains available. DEI is totally Stupid, and frankly very dangerous.",2025-02-01,reply,0
Costco,2025-01-26 19:21:00,Y29tbWVudDoxMDMwNDA2MjQyNDUwODcyXzEzNDMyMjIwMzY4NjIwNjk=,Y29tbWVudDoxMDMwNDA2MjQyNDUwODcyXzE1Mzc1MDk4MDA1MzgyNTk=,"EEO laws and DEI work in tandem. EEO laws are laws against discrimination in hiring, but they don’t provide solutions for thinks like implicit bias in resume review. Multiple studies have continued to show that recruiters, when reviewing resumes, at 50% more likely to contact a resume with a “white sounding name” over a “black sounding name” even when the qualifications are identical. Most people aren’t consciously making those choices; it’s implicit bias.",2025-02-01,reply,0
Costco,2025-01-26 19:21:00,Y29tbWVudDoxMDMwNDA2MjQyNDUwODcyXzU5OTMzODI3OTU0NjcyMA==,Y29tbWVudDoxMDMwNDA2MjQyNDUwODcyXzEzNDMyMjIwMzY4NjIwNjk=,"yeah, well I want a Fireman that can pull a 300 pound man out of a burning building, not a fire Chief that said the guy got himself in the wrong place, I want an an Air Traffic controller that can focus on multiple planes/copters landing, taking off, flying around. Not a certain percentage that should be a specific race, gender or disability. It seems that the DEI requirement has reduced the Air Traffic control population because they cannot find enough Qualified personnel in the DEI spectrum. Thus a thousand people are suing for being rejected because of being 100% qualified, but white.",2025-02-01,reply,0
Costco,2025-01-26 19:21:00,Y29tbWVudDoxMDMwNDA2MjQyNDUwODcyXzExODYzNTE2MzMwOTU2MDM=,Y29tbWVudDoxMDMwNDA2MjQyNDUwODcyXzU5OTMzODI3OTU0NjcyMA==,The people suing the FAA are suing due to a change in policy from when Obama was President. That change was reversed in 2018 so to insinuate that it is somehow the reason for the plane crash is insane and insulting to the victim’s families and the people investigating. The suit was also filed in 2015 so this is not a new thing.,2025-02-01,reply,0
Costco,2025-01-26 19:21:00,Y29tbWVudDoxMDMwNDA2MjQyNDUwODcyXzkxMDQ1MjAxNDI5NjI1MTg=,Y29tbWVudDoxMDMwNDA2MjQyNDUwODcyXzExODYzNTE2MzMwOTU2MDM=,"There is currently a lawsuit working its way through with over 1,000 qualified graduates from the FAA training that were rejected because they didn’t meet DEI requirements. I watched the interview with the LA fire chief and heard her say if a man had to be carried out of a fire he was in the wrong place, was so shocked my jaw dropped.",2025-02-08,reply,0
Costco,2025-01-26 19:21:00,Y29tbWVudDoxMDMwNDA2MjQyNDUwODcyXzEyOTM1MzIwMjUyNTA5NjA=,Y29tbWVudDoxMDMwNDA2MjQyNDUwODcyXzkxMDQ1MjAxNDI5NjI1MTg=,"Also, if a company utilizes DEI initiatives, then they aren’t just doing it for one candidate. They’re doing it for every candidate. So even the white men would be considered “DEI hires”. For instance, if a company uses blind resume review to mitigate implicit bias, then they aren’t just doing that for black candidate applications - they’re doing that for all candidate applications.",2025-02-08,reply,0
Costco,2025-01-26 19:21:00,Y29tbWVudDoxMDMwNDA2MjQyNDUwODcyXzM5NTAxNzU1MTUyNTI5OTI=,Y29tbWVudDoxMDMwNDA2MjQyNDUwODcyXzUxNjU3MjMwMDkyNDMzMg==,"I understand that DEI is about equal outcomes. That is not how life works. Equal opportunity is totally OK and has been in place for decades. DEI is simply quotas and racism. We don’t need a certain number of blacks, LGBTQ, transgenders, short people, tall people, green people, etc. This is simply stupid. You hire the best person for the position. Best educational background, most impressive experience, most determined attitude to succeed.",2025-02-08,reply,0
Costco,2025-01-26 19:21:00,Y29tbWVudDoxMDMwNDA2MjQyNDUwODcyXzExMzY0MDk0MzQzNDQ1Mzk=,,Costco does discriminate which is why they need to keep DEI....Pathetic!,2025-02-01,initial,6
Costco,2025-01-26 19:21:00,Y29tbWVudDoxMDMwNDA2MjQyNDUwODcyXzEzNTY1MDc0MTIzNzM0MDM=,Y29tbWVudDoxMDMwNDA2MjQyNDUwODcyXzExMzY0MDk0MzQzNDQ1Mzk=,you’re an idiot,2025-02-01,reply,0
Costco,2025-01-26 19:21:00,Y29tbWVudDoxMDMwNDA2MjQyNDUwODcyXzYwMTE4ODczOTU1MTc5NA==,,"Thank you Costco for supporting the community and continuing DEI hires. I just renewed my membership, and I am encouraging others to renew theirs or to get a new membership.",2025-02-01,initial,18
Costco,2025-01-26 19:21:00,Y29tbWVudDoxMDMwNDA2MjQyNDUwODcyXzExNzAyMTg5MTc3ODA0Mjk=,,Thank you Costco for being on the right side of history! I’m proud to have a membership there ￼,2025-02-01,initial,71
Costco,2025-01-26 19:21:00,Y29tbWVudDoxMDMwNDA2MjQyNDUwODcyXzk2NDI1Nzc4NTIwMzk0Ng==,Y29tbWVudDoxMDMwNDA2MjQyNDUwODcyXzExNzAyMTg5MTc3ODA0Mjk=,me too,2025-02-01,reply,6
Costco,2025-01-26 19:21:00,Y29tbWVudDoxMDMwNDA2MjQyNDUwODcyXzYzMDQwODExOTY3Mjg2MA==,Y29tbWVudDoxMDMwNDA2MjQyNDUwODcyXzExNzAyMTg5MTc3ODA0Mjk=,history?…,2025-02-01,reply,0
Costco,2025-01-26 19:21:00,Y29tbWVudDoxMDMwNDA2MjQyNDUwODcyXzExNzgyMjUyMTY5ODYyNDM=,Y29tbWVudDoxMDMwNDA2MjQyNDUwODcyXzExNzAyMTg5MTc3ODA0Mjk=,Tiffany Hase you mean on the discrimination side of history. You are pathetic. Dei is racist you are gross,2025-02-01,reply,0
Costco,2025-01-26 19:21:00,Y29tbWVudDoxMDMwNDA2MjQyNDUwODcyXzIwMzI4Nzg1OTA1MzAzMzI=,Y29tbWVudDoxMDMwNDA2MjQyNDUwODcyXzExNzgyMjUyMTY5ODYyNDM=,can you explain which specific Costco initiatives you feel are racist?,2025-02-01,reply,0
Costco,2025-01-26 19:21:00,Y29tbWVudDoxMDMwNDA2MjQyNDUwODcyXzEyNjQ4ODA3ODEzOTAxMDY=,Y29tbWVudDoxMDMwNDA2MjQyNDUwODcyXzkyOTM1MDE4NjA2NDcxNw==,https://www.heritage.org/.../dei-sold-way-promote-racial...,2025-02-01,reply,0
Costco,2025-01-26 19:21:00,Y29tbWVudDoxMDMwNDA2MjQyNDUwODcyXzg4NTI0OTA5MDQ4NjEwOTQ=,Y29tbWVudDoxMDMwNDA2MjQyNDUwODcyXzEyNjQ4ODA3ODEzOTAxMDY=,I don't think you want to challenge me .,2025-02-01,reply,0
Costco,2025-01-26 19:21:00,Y29tbWVudDoxMDMwNDA2MjQyNDUwODcyXzEwMjE0NTM2MjY0ODA0OTg=,Y29tbWVudDoxMDMwNDA2MjQyNDUwODcyXzg4NTI0OTA5MDQ4NjEwOTQ=,"i don't think you know how anything works. There are laws to protect people u clown, what is being removed is actual discrimination . You jerks aren't gonna discriminate against my son . Got it?",2025-02-01,reply,0
Costco,2025-01-26 19:21:00,Y29tbWVudDoxMDMwNDA2MjQyNDUwODcyXzYwNzIxNjM5ODg0MDUwMw==,Y29tbWVudDoxMDMwNDA2MjQyNDUwODcyXzEwMjE0NTM2MjY0ODA0OTg=,feel better?,2025-02-01,reply,1
Costco,2025-01-26 19:21:00,Y29tbWVudDoxMDMwNDA2MjQyNDUwODcyXzExNTY4OTc1NzI2MTQ3MTY=,Y29tbWVudDoxMDMwNDA2MjQyNDUwODcyXzExNzgyMjUyMTY5ODYyNDM=,"Things like blind resume review are moreso meant to prevent implicit bias. You may not consciously choose to favor white people over black people when screening candidates, but multiple studies have shown that resumes with “black sounding names” are less likely to be called than resumes with “white sounding names”. So blind resume screening helps to mitigate that bias.",2025-02-01,reply,0
Costco,2025-01-26 19:21:00,Y29tbWVudDoxMDMwNDA2MjQyNDUwODcyXzE5NDU2MzU2ODkyOTkxNTA=,Y29tbWVudDoxMDMwNDA2MjQyNDUwODcyXzExNzgyMjUyMTY5ODYyNDM=,"I would discourage relying on the Heritage Foundation for factual, unbiased information. Given that they are a conservative think tank, they clearly write with a political bias. I scanned through the article you linked and it seems to be an option piece rather than a factual article.",2025-02-01,reply,0
Costco,2025-01-26 19:21:00,Y29tbWVudDoxMDMwNDA2MjQyNDUwODcyXzYwMDk4OTM1NjEyMTkxNw==,Y29tbWVudDoxMDMwNDA2MjQyNDUwODcyXzExNzAyMTg5MTc3ODA0Mjk=,Obviously it is an ideology. Anyone with actual brains can see what a discriminatory practice it is. Bias ? The entire leftwing bows to the alter of dei . Foh,2025-02-01,reply,0
Costco,2025-01-26 19:21:00,Y29tbWVudDoxMDMwNDA2MjQyNDUwODcyXzU5NzQxNjE2OTg0NzQ2OQ==,Y29tbWVudDoxMDI3ODA5MTc5Mzc3MjQ1XzM3Mjk3NDI1MzA2NTkwODg=,"the entire media is basicalky a leftwing propaganda machine. Take your ""heritage foundation"" nonsense of being bias and pound sand.",2025-02-01,reply,0
Costco,2025-01-26 19:21:00,Y29tbWVudDoxMDMwNDA2MjQyNDUwODcyXzI2Njg1NTI4MzAxOTk1NDM=,Y29tbWVudDoxMDI3ODA5MTc5Mzc3MjQ1XzM3Mjk3NDI1MzA2NTkwODg=,https://nypost.com/.../dei-statements-are-bad-for-everyone/,2025-02-01,reply,0
Costco,2025-01-26 19:21:00,Y29tbWVudDoxMDMwNDA2MjQyNDUwODcyXzUxMjEzMjI0ODU2NzQzOA==,Y29tbWVudDoxMDMwNDA2MjQyNDUwODcyXzI2Njg1NTI4MzAxOTk1NDM=,Everyone writes with a political bias,2025-02-01,reply,0
Costco,2025-01-26 19:21:00,Y29tbWVudDoxMDMwNDA2MjQyNDUwODcyXzE5MTI2MTkxOTYyMTUxMTc=,Y29tbWVudDoxMDMwNDA2MjQyNDUwODcyXzUxMjEzMjI0ODU2NzQzOA==,"I don’t think the entire media is left wing propoganda. The most popular news network on the country for years has been Fox News and they’re certainly not left leaning. Twitter is almost exclusively right wing, not that I consider that a news source. OAN, New York Post, the Daily Wire, Newsmax, Breitbart, The Joe Rogan podcast, Ben Shapiros podcast, the Daily Mail, The Washington Times, Washington Free Beacon… those are all right wing publications.",2025-02-01,reply,0
Costco,2025-01-26 19:21:00,Y29tbWVudDoxMDMwNDA2MjQyNDUwODcyXzU4NTg1NDA4MDk1OTgxNQ==,Y29tbWVudDoxMDMwNDA2MjQyNDUwODcyXzExNzAyMTg5MTc3ODA0Mjk=,agreed!! I bought my membership last night and shopped there today!! Not a fan of big stores but needed something to support!,2025-02-01,reply,0
Costco,2025-01-26 19:21:00,Y29tbWVudDoxMDMwNDA2MjQyNDUwODcyXzQ4MjY5MzkxMTU0OTIwNw==,,"I love you, Costco, for showing respect and commitment to your DEI hires! I will always be a shopper at your store, and stop shopping at places that cave in to govt pressure.",2025-02-01,initial,54
Costco,2025-01-26 19:21:00,Y29tbWVudDoxMDMwNDA2MjQyNDUwODcyXzE2NTI1NjY4OTIzMTEzNjc=,Y29tbWVudDoxMDMwNDA2MjQyNDUwODcyXzQ4MjY5MzkxMTU0OTIwNw==,you love that they discriminate ? Hiring because of gender/color is the literal definition of discrimination,2025-02-01,reply,2
Costco,2025-01-26 19:21:00,Y29tbWVudDoxMDMwNDA2MjQyNDUwODcyXzE3NzM1MTUxMTM1MDA2NzY=,Y29tbWVudDoxMDMwNDA2MjQyNDUwODcyXzE2NTI1NjY4OTIzMTEzNjc=,please explain how Costco’s DEI policies discriminate against white men.,2025-02-01,reply,1
Costco,2025-01-26 19:21:00,Y29tbWVudDoxMDMwNDA2MjQyNDUwODcyXzE5OTUwNDc2MzQzMzI3NzQ=,Y29tbWVudDoxMDMwNDA2MjQyNDUwODcyXzE3NzM1MTUxMTM1MDA2NzY=,is comprhension difficult for u? Clearly ur clueless to what dei is. Costco is doubling down on this ridiculous and racist practice .,2025-02-01,reply,0
Costco,2025-01-26 19:21:00,Y29tbWVudDoxMDMwNDA2MjQyNDUwODcyXzQwMDg2NDYyOTc1MDQyNw==,Y29tbWVudDoxMDMwNDA2MjQyNDUwODcyXzE5OTUwNDc2MzQzMzI3NzQ=,this has zero to do with costco . Just,2025-02-01,reply,0
Costco,2025-01-26 19:21:00,Y29tbWVudDoxMDMwNDA2MjQyNDUwODcyXzM4MzI2Nzk1MjcwNDY3NjU=,Y29tbWVudDoxMDMwNDA2MjQyNDUwODcyXzQwMDg2NDYyOTc1MDQyNw==,this chart is from Costco’s website,2025-02-01,reply,0
Costco,2025-01-26 19:21:00,Y29tbWVudDoxMDMwNDA2MjQyNDUwODcyXzE2MTY0NTM5MTI1Njc1MzU=,Y29tbWVudDoxMDMwNDA2MjQyNDUwODcyXzQ4MjY5MzkxMTU0OTIwNw==,just say you value discrimination and stop acting like you are somehow ethical for that.,2025-02-01,reply,2
Costco,2025-01-26 19:21:00,Y29tbWVudDoxMDMwNDA2MjQyNDUwODcyXzEzMzMwMjk5NjQ1NTA0NTM=,Y29tbWVudDoxMDMwNDA2MjQyNDUwODcyXzE2MTY0NTM5MTI1Njc1MzU=,can you provide an example of a discriminatory practice that Costco has in place?,2025-02-01,reply,0
Costco,2025-01-26 19:21:00,Y29tbWVudDoxMDMwNDA2MjQyNDUwODcyXzEzMjA1NzY4MTI0MjMxNDY=,Y29tbWVudDoxMDMwNDA2MjQyNDUwODcyXzEzMzMwMjk5NjQ1NTA0NTM=,dei is literally discrimination . You can't be serious. The ignorance of so many is hilarious.,2025-02-01,reply,1
Costco,2025-01-26 19:21:00,Y29tbWVudDoxMDMwNDA2MjQyNDUwODcyXzEyOTYxMDMzNDQ4NDI5MTk=,Y29tbWVudDoxMDMwNDA2MjQyNDUwODcyXzEzMjA1NzY4MTI0MjMxNDY=,these people must be low IQ to not understand.,2025-02-01,reply,0
Costco,2025-01-26 19:21:00,Y29tbWVudDoxMDMwNDA2MjQyNDUwODcyXzkzMTExMDE3MjQ4ODQ0Nw==,Y29tbWVudDoxMDMwNDA2MjQyNDUwODcyXzEyOTYxMDMzNDQ4NDI5MTk=,the entire premise is not difficult to understand .,2025-02-01,reply,1
Costco,2025-01-26 19:21:00,Y29tbWVudDoxMDMwNDA2MjQyNDUwODcyXzI4ODM5NDM3MjU4OTgwNjky,Y29tbWVudDoxMDMwNDA2MjQyNDUwODcyXzkzMTExMDE3MjQ4ODQ0Nw==,"I’ve work in HR and talent acquisition for my entire career. I hold multiple certifications in Human Resources, one of which is specifically in reference to DEIA. But sure, I’m sure you know more about it 
 because what, you saw a tweet about it?",2025-02-01,reply,0
Costco,2025-01-26 19:21:00,Y29tbWVudDoxMDMwNDA2MjQyNDUwODcyXzk2MjAxOTkwOTIwMjc4MA==,Y29tbWVudDoxMDMwNDA2MjQyNDUwODcyXzI4ODM5NDM3MjU4OTgwNjky,"okay, since you feel you have a high IQ (doubtful) and are therefore a DEI expert, can you please explain to me what ERGs are and how they might provide value to the workplace? Additionally, can you describe the preferred DEI initiative used to address implicit bias against certain names when doing resume review and then, once you described that DEI initiative, please describe your alternative solution to the resume review issue if we were to get rid of DEI and thereby the current solution that is generally implemented at this time. Those should be easy questions since you know a lot about DEI.",2025-02-01,reply,0
Costco,2025-01-26 19:21:00,Y29tbWVudDoxMDMwNDA2MjQyNDUwODcyXzUzNTYxMTEyMjE0MjcwMA==,Y29tbWVudDoxMDMwNDA2MjQyNDUwODcyXzE2MTY0NTM5MTI1Njc1MzU=,"and yet you continue to struggle to understand. Wisdom chases you, but you are faster.",2025-02-01,reply,0
Costco,2025-01-26 19:21:00,Y29tbWVudDoxMDMwNDA2MjQyNDUwODcyXzEwMzE0NDA5Nzg4MDMxODg=,Y29tbWVudDoxMDMwNDA2MjQyNDUwODcyXzUzNTYxMTEyMjE0MjcwMA==,that explains it all...,2025-02-01,reply,0
Costco,2025-01-26 19:21:00,Y29tbWVudDoxMDMwNDA2MjQyNDUwODcyXzEyNzc5NjQxOTM0ODQ5MTQ=,Y29tbWVudDoxMDMwNDA2MjQyNDUwODcyXzE5MTI2MTkxOTYyMTUxMTc=,the fact you fail to comprehend the obvious bigotry in dei is wild. The fact you are HR proves you make a living off of this nonsense . Racism and discrimination is kept alive because it is business.,2025-02-01,reply,0
Costco,2025-01-26 19:21:00,Y29tbWVudDoxMDMwNDA2MjQyNDUwODcyXzE2NDU1ODI1OTMwMDE1OTk=,Y29tbWVudDoxMDMwNDA2MjQyNDUwODcyXzEyNzc5NjQxOTM0ODQ5MTQ=,"you think HR is nonsense? You know HR includes payroll, interviewing, benefits dispersement, backgrounds, resume review, policy enforcement, etc?",2025-02-08,reply,0
Costco,2025-01-26 19:21:00,Y29tbWVudDoxMDMwNDA2MjQyNDUwODcyXzYzMjkzOTk3MjcyMzYyNQ==,,Thank you Costco for your DEI decision! You are truly an American company.,2025-02-01,initial,51
Costco,2025-01-26 19:21:00,Y29tbWVudDoxMDMwNDA2MjQyNDUwODcyXzk4Mjk0MDY2MzczMDUxNA==,Y29tbWVudDoxMDMwNDA2MjQyNDUwODcyXzYzMjkzOTk3MjcyMzYyNQ==,So hiring based on skin color isn’t racist?? How does that work? Hire based on merit. Sam’s Club is looking better and better.,2025-02-01,reply,5
Costco,2025-01-26 19:21:00,Y29tbWVudDoxMDMwNDA2MjQyNDUwODcyXzE5Nzg0ODQ3OTYwMTAxMzY=,Y29tbWVudDoxMDMwNDA2MjQyNDUwODcyXzk4Mjk0MDY2MzczMDUxNA==,why do you believe that DEI means ignoring merit when making hiring decisions? What specific Costco DEI policies do you disagree with?,2025-02-01,reply,1
Costco,2025-01-26 19:21:00,Y29tbWVudDoxMDMwNDA2MjQyNDUwODcyXzE1NDI2ODU2ODY0Mjc0NTY=,Y29tbWVudDoxMDMwNDA2MjQyNDUwODcyXzE5Nzg0ODQ3OTYwMTAxMzY=,Why do they even need to have such a policy just hire on Merit. Why do they need to bring in the racist Al Sharpton?,2025-02-01,reply,0
Costco,2025-01-26 19:21:00,Y29tbWVudDoxMDMwNDA2MjQyNDUwODcyXzkzNzEwMjg3ODQ4MzExNg==,Y29tbWVudDoxMDMwNDA2MjQyNDUwODcyXzE1NDI2ODU2ODY0Mjc0NTY=,"what do you think DEI is exactly? I don’t think Costcos DEI initiatives are even in reference to their hiring process. I think they’re moreso regarding work culture/anti harassment, etc. I haven’t seen any DEI policies on their website that reference their hiring process.",2025-02-01,reply,0
Costco,2025-01-26 19:21:00,Y29tbWVudDoxMDMwNDA2MjQyNDUwODcyXzEzMzcxODk1MjQwODk3Njg=,Y29tbWVudDoxMDMwNDA2MjQyNDUwODcyXzYzMjkzOTk3MjcyMzYyNQ==,"The racial resume issue I’m referring to is the finding from multiple studies that if a candidate has a name typically associated with black people, they’re around 50% less likely to be called for an interview than someone with a “white sounding name”, even if there’s not differences in qualifications. Studies continuously find this to be the case. The most recent study I’m aware is from the end of 2024.",2025-02-01,reply,0
Costco,2025-01-26 19:21:00,Y29tbWVudDoxMDMwNDA2MjQyNDUwODcyXzM5MTMzMTY1NDA2MjczNQ==,Y29tbWVudDoxMDMwNDA2MjQyNDUwODcyXzYzMjkzOTk3MjcyMzYyNQ==,"so tell me would you choose your surgeon or airline pilot based on Skin Color, gender or Merit? I’ll wait",2025-02-01,reply,10
Costco,2025-01-26 19:21:00,Y29tbWVudDoxMDMwNDA2MjQyNDUwODcyXzE3OTA1NzkxNTE3MzM4OTE=,Y29tbWVudDoxMDMwNDA2MjQyNDUwODcyXzM5MTMzMTY1NDA2MjczNQ==,"That isn't the reality of DEI. The DEI is to pick the best person based on qualifications and not eliminated due to skin color, or gender. This is such a male MAGA response.",2025-02-01,reply,7
Costco,2025-01-26 19:21:00,Y29tbWVudDoxMDMwNDA2MjQyNDUwODcyXzQ0MzMyMjkyODc0NDg1NQ==,Y29tbWVudDoxMDMwNDA2MjQyNDUwODcyXzE3OTA1NzkxNTE3MzM4OTE=,lady you’re Delusional… DEI is exactly that .. It’s affirmative action on steroids,2025-02-01,reply,2
Costco,2025-01-26 19:21:00,Y29tbWVudDoxMDMwNDA2MjQyNDUwODcyXzExNjI5Mjc5NTIxNTcwODM=,Y29tbWVudDoxMDMwNDA2MjQyNDUwODcyXzQ0MzMyMjkyODc0NDg1NQ==,I'm not going to change your beliefs about DEI or anything else nor will you change mine. It's that freedom of speech thing.,2025-02-01,reply,1
Costco,2025-01-26 19:21:00,Y29tbWVudDoxMDMwNDA2MjQyNDUwODcyXzk2ODExOTEzMTM3Mjk5Mg==,Y29tbWVudDoxMDMwNDA2MjQyNDUwODcyXzExNjI5Mjc5NTIxNTcwODM=,You are some kind of stupid. DEI sets the stage for quotas based on DEI. If you worked for a living you'd understand.,2025-02-01,reply,1
