company_name,post_date,id,parent_id,comment_text,comment_date,comment_type,reaction_count
Costco,2025-01-31 09:00:00,Y29tbWVudDoxMDMzNzQ5ODUyMTE2NTExXzkwNTUzMDUzNjQ1NTg5Mjk=,,Hi Ineed opening in Copenhagen,2025-02-01,initial,0
Costco,2025-01-31 09:00:00,Y29tbWVudDoxMDMzNzQ5ODUyMTE2NTExXzk0MDY5NzU3ODIwNjMzNw==,,We support you Costco!!,2025-02-01,initial,3
Costco,2025-01-31 09:00:00,Y29tbWVudDoxMDMzNzQ5ODUyMTE2NTExXzE4Mjk2ODk4MDExMzc2MjE=,,Costco please don’t switch to coke products in the food court,2025-02-08,initial,0
Costco,2025-01-31 09:00:00,Y29tbWVudDoxMDMzNzQ5ODUyMTE2NTExXzk5ODUwMzk2ODg0MzUwOQ==,,GREAT JOB Costco!!!! Thanks for being a good company.,2025-02-01,initial,2
Costco,2025-01-31 09:00:00,Y29tbWVudDoxMDMzNzQ5ODUyMTE2NTExXzk2OTM2MjIyODYyNzE1MA==,,whats this about a costco strike? in what states?,2025-02-01,initial,1
Costco,2025-01-31 09:00:00,Y29tbWVudDoxMDMzNzQ5ODUyMTE2NTExXzY1MTUwNTI3Mzk2NTU1NA==,,Made in China!,2025-02-01,initial,3
Costco,2025-01-31 09:00:00,Y29tbWVudDoxMDMzNzQ5ODUyMTE2NTExXzE1OTk1Njc5NDA5NDg5MTU=,Y29tbWVudDoxMDMzNzQ5ODUyMTE2NTExXzY1MTUwNTI3Mzk2NTU1NA==,this is made in central California! Nothing from over seas or China. I verified the company and the ingredients are all USA,2025-02-01,reply,0
Costco,2025-01-31 09:00:00,Y29tbWVudDoxMDMzNzQ5ODUyMTE2NTExXzk1NjIwMzU5MzI3ODM2Nw==,,"Thank you Costco for standing up for decency! I’m already a long term customer but I’m going to purchase more items I don’t normally buy there. Like TV’s, laptops and glasses.",2025-02-01,initial,3
Costco,2025-01-31 09:00:00,Y29tbWVudDoxMDMzNzQ5ODUyMTE2NTExXzE4MDU0MTg0MTAyODY0MjE=,,That beef jerky tasted awful!!,2025-02-08,initial,0
Costco,2025-01-31 09:00:00,Y29tbWVudDoxMDMzNzQ5ODUyMTE2NTExXzE4MDA0NDc3Nzc0MjQwODY=,,Stand strong Costco don't give in to the union.,2025-02-01,initial,3
Costco,2025-01-31 09:00:00,Y29tbWVudDoxMDMzNzQ5ODUyMTE2NTExXzkyNTU0ODQwMzA4MTQyMQ==,,Thanks for standing strong on your DEI program. Think I’ll go shopping,2025-02-01,initial,2
Costco,2025-01-31 09:00:00,Y29tbWVudDoxMDMzNzQ5ODUyMTE2NTExXzQ4MDAyOTM0NTE0NjQ4MQ==,,"I am very happy about your commitment to diversity, equity, and inclusion policies!",2025-02-01,initial,4
Costco,2025-01-31 09:00:00,Y29tbWVudDoxMDMzNzQ5ODUyMTE2NTExXzYzMzEwNzIxOTE5NDg4NQ==,,Costco can control or limit the sale of Pokemon but not for eggs.,2025-02-08,initial,0
Costco,2025-01-31 09:00:00,Y29tbWVudDoxMDMzNzQ5ODUyMTE2NTExXzkzMjc0NDQzNTcxOTgwNw==,,Carry Wild Earth pet food.,2025-02-01,initial,0
Costco,2025-01-31 09:00:00,Y29tbWVudDoxMDMzNzQ5ODUyMTE2NTExXzYwNjEyNzY0MjE3MzEwNg==,,Thank you for standing up for supporting your employees!,2025-02-01,initial,2
Costco,2025-01-31 09:00:00,Y29tbWVudDoxMDMzNzQ5ODUyMTE2NTExXzEzODA5OTE1ODk5NDM5MDY=,Y29tbWVudDoxMDMzNzQ5ODUyMTE2NTExXzYwNjEyNzY0MjE3MzEwNg==,do you how dumb that statement sounds? This is literally going on right now with Costco and it's employees. Stop watching the fake news. https://www.facebook.com/share/v/1976qayTbm/,2025-02-01,reply,1
Costco,2025-01-31 09:00:00,Y29tbWVudDoxMDMzNzQ5ODUyMTE2NTExXzIxOTAwMjMyOTgwNTk1MzU=,Y29tbWVudDoxMDMzNzQ5ODUyMTE2NTExXzEzODA5OTE1ODk5NDM5MDY=,"Doug Baker a mistake has been made. I wasn't addressing you. When I want your opinion, I'll summon you.",2025-02-08,reply,0
Costco,2025-01-31 09:00:00,Y29tbWVudDoxMDMzNzQ5ODUyMTE2NTExXzkwOTM1MjAxMTM2Mzg1OQ==,Y29tbWVudDoxMDMzNzQ5ODUyMTE2NTExXzIxOTAwMjMyOTgwNTk1MzU=,if you don't want opinion...... don't post,2025-02-08,reply,0
Costco,2025-01-31 09:00:00,Y29tbWVudDoxMDMzNzQ5ODUyMTE2NTExXzM5Mjc1NDg0MTc0OTUyNTE=,,love costco,2025-02-08,initial,0
Costco,2025-01-31 09:00:00,Y29tbWVudDoxMDMzNzQ5ODUyMTE2NTExXzY0MjUxNzQ0ODI3NjA1Mg==,,Sadly not made in Canada,2025-02-08,initial,0
Costco,2025-01-31 09:00:00,Y29tbWVudDoxMDMzNzQ5ODUyMTE2NTExXzYxMDkwMzk1NTIxMzY4Ng==,,"Gracias Costco
 bendiciones",2025-02-01,initial,0
Costco,2025-01-31 09:00:00,Y29tbWVudDoxMDMzNzQ5ODUyMTE2NTExXzkwNzM0MzIyNDYwOTk4Mw==,,My sensitive stomach and skin doggos love this!,2025-02-08,initial,0
Costco,2025-01-31 09:00:00,Y29tbWVudDoxMDMzNzQ5ODUyMTE2NTExXzYyODQ4OTI4OTU5MDM1Ng==,,"To Costco! My husband and I are huge shoppers at Costco in Langford, CA. Vancouver Island. We will not purchase any US products or foods. We will continue to shop at Costco because you support DEI and pay your staff well. That is that reason we will return and only buy products that were not made or grown in US.",2025-02-08,initial,0
Costco,2025-01-31 09:00:00,Y29tbWVudDoxMDMzNzQ5ODUyMTE2NTExXzIwNTU3ODkyNTgxOTc0NDc=,,"Thank you costco, I know we will be keeping our membership.",2025-02-01,initial,2
Costco,2025-01-31 09:00:00,Y29tbWVudDoxMDMzNzQ5ODUyMTE2NTExXzEzMDUzMDk1ODA3MTk5MjU=,,"Thank you, Costco, for your DEI support, raising your employees wages! My husband and I are going to sign up for membership next week.",2025-02-01,initial,4
Costco,2025-01-31 09:00:00,Y29tbWVudDoxMDMzNzQ5ODUyMTE2NTExXzEwMjgwNjMxNDI2NzcwNTc=,,Please stop selling Lesser Evil products immediately!,2025-02-08,initial,0
Costco,2025-01-31 09:00:00,Y29tbWVudDoxMDMzNzQ5ODUyMTE2NTExXzEzMzM4MTEzMzExNTQxMTE=,,USA product! boycott!,2025-02-08,initial,0
Costco,2025-01-31 09:00:00,Y29tbWVudDoxMDMzNzQ5ODUyMTE2NTExXzEzNDcyMTE4MTMxMDEyMjU=,,Supporting Costco 100￼%!,2025-02-01,initial,2
Costco,2025-01-31 09:00:00,Y29tbWVudDoxMDMzNzQ5ODUyMTE2NTExXzEyODIxNjI5MDk2Nzk1NTU=,Y29tbWVudDoxMDMzNzQ5ODUyMTE2NTExXzEzNDcyMTE4MTMxMDEyMjU=,Your anti-American beliefs are noted and archived.,2025-02-01,reply,1
Costco,2025-01-31 09:00:00,Y29tbWVudDoxMDMzNzQ5ODUyMTE2NTExXzExMjM4Nzc0OTU4NDcyOTM=,,"So, I'm in Tennessee and have been a Costco member for years. I will honor the strike and so will not be seeing you all until you settle fairly with the Union. I urge you to negotiate in good faith and come to an agreement that is acceptable to your Union employees.",2025-02-01,initial,5
Costco,2025-01-31 09:00:00,Y29tbWVudDoxMDMzNzQ5ODUyMTE2NTExXzkxMTk1MTU1NzE0Mjk2MDU=,Y29tbWVudDoxMDMzNzQ5ODUyMTE2NTExXzExMjM4Nzc0OTU4NDcyOTM=,So you want higher cost goods?,2025-02-01,reply,0
Costco,2025-01-31 09:00:00,Y29tbWVudDoxMDMzNzQ5ODUyMTE2NTExXzYwNjY1MTY5MTk3ODYzOQ==,Y29tbWVudDoxMDMzNzQ5ODUyMTE2NTExXzkxMTk1MTU1NzE0Mjk2MDU=,"Dude, do the research. Higher wages and better conditions for workers are not the cause of inflation. But let me ask you the converse: is low prices for yourself all that matters to you>",2025-02-01,reply,1
Costco,2025-01-31 09:00:00,Y29tbWVudDoxMDMzNzQ5ODUyMTE2NTExXzk0NzQwODE2MjU5ODE2MDg=,Y29tbWVudDoxMDMzNzQ5ODUyMTE2NTExXzYwNjY1MTY5MTk3ODYzOQ==,"I do not agree that a good settlement for Costco workers will raise prices. But if it does, then I am find with it. Because I'm not a jerk who wants people to work for less just so I can make more money.",2025-02-01,reply,0
Costco,2025-01-31 09:00:00,Y29tbWVudDoxMDMzNzQ5ODUyMTE2NTExXzk2MTQxMTA0MjI0MTMwOA==,Y29tbWVudDoxMDMzNzQ5ODUyMTE2NTExXzk0NzQwODE2MjU5ODE2MDg=,When a businesses cost of business goes up then so do the products they sell. Costco pays very well already. Where did the topic of Inflation come? You obviously have never owned a business,2025-02-01,reply,1
Costco,2025-01-31 09:00:00,Y29tbWVudDoxMDMzNzQ5ODUyMTE2NTExXzM5NTAzNzc0NTUyNTE0NDc=,Y29tbWVudDoxMDMzNzQ5ODUyMTE2NTExXzk2MTQxMTA0MjI0MTMwOA==,"obviously Costco shareholders own a business, don't they?",2025-02-01,reply,0
Costco,2025-01-31 09:00:00,Y29tbWVudDoxMDMzNzQ5ODUyMTE2NTExXzEyNzc5Mzg2NDMzMjAzNTc=,Y29tbWVudDoxMDMzNzQ5ODUyMTE2NTExXzM5NTAzNzc0NTUyNTE0NDc=,Obviously you are clueless about Federal law. By years end DEI will be gone from Costco. https://www.foxbusiness.com/.../oleary-rips-costco...,2025-02-01,reply,0
Costco,2025-01-31 09:00:00,Y29tbWVudDoxMDMzNzQ5ODUyMTE2NTExXzYyMTQ0MDY1MDM3MDUyMA==,Y29tbWVudDoxMDMzNzQ5ODUyMTE2NTExXzk0NzQwODE2MjU5ODE2MDg=,who says Costco at fault it's a 2 way street ever thought they are asking for to much in this contract all employees got a raise last year.,2025-02-01,reply,1
Costco,2025-01-31 09:00:00,Y29tbWVudDoxMDMzNzQ5ODUyMTE2NTExXzU4ODk2ODE4MDU4MzY3MQ==,Y29tbWVudDoxMDMzNzQ5ODUyMTE2NTExXzYyMTQ0MDY1MDM3MDUyMA==,"It's called negotiating. If they negotiate in good faith, and the agreement is fair, the Union will end the strike. I'm always going to be on the side of the working people. Always.",2025-02-01,reply,0
Costco,2025-01-31 09:00:00,Y29tbWVudDoxMDMzNzQ5ODUyMTE2NTExXzU1NzgyODY2NzI1Nzk5NA==,Y29tbWVudDoxMDMzNzQ5ODUyMTE2NTExXzU4ODk2ODE4MDU4MzY3MQ==,bye,2025-02-01,reply,0
Costco,2025-01-31 09:00:00,Y29tbWVudDoxMDMzNzQ5ODUyMTE2NTExXzUyNTQzODc5MzI4NDQ0Mw==,Y29tbWVudDoxMDMzNzQ5ODUyMTE2NTExXzU1NzgyODY2NzI1Nzk5NA==,"Bye to you, too.",2025-02-01,reply,0
Costco,2025-01-31 09:00:00,Y29tbWVudDoxMDMzNzQ5ODUyMTE2NTExXzYwMTM0NjIzOTMwNTUxOQ==,Y29tbWVudDoxMDMzNzQ5ODUyMTE2NTExXzUyNTQzODc5MzI4NDQ0Mw==,I’m staying with Costco. So it’s just us saying bye to you,2025-02-01,reply,1
Costco,2025-01-31 09:00:00,Y29tbWVudDoxMDMzNzQ5ODUyMTE2NTExXzEwMDU2NTkxOTE2MTA2OTQ=,Y29tbWVudDoxMDMzNzQ5ODUyMTE2NTExXzYwMTM0NjIzOTMwNTUxOQ==,You got me confused there. I'll be staying with Costco once they make a good settlement with the Union. We're strictly a Union family.,2025-02-01,reply,0
Costco,2025-01-31 09:00:00,Y29tbWVudDoxMDMzNzQ5ODUyMTE2NTExXzY0NTc0NDg3NDYzNDE4MQ==,Y29tbWVudDoxMDMzNzQ5ODUyMTE2NTExXzEwMDU2NTkxOTE2MTA2OTQ=,you should understand that Costco employees already receive the best compensation in the retail industry.,2025-02-01,reply,1
Costco,2025-01-31 09:00:00,Y29tbWVudDoxMDMzNzQ5ODUyMTE2NTExXzYzNTI1MjY1MjMwNDA4Mg==,Y29tbWVudDoxMDMzNzQ5ODUyMTE2NTExXzY0NTc0NDg3NDYzNDE4MQ==,Why do you think I shop there? And I'll always choose Union.,2025-02-01,reply,0
Costco,2025-01-31 09:00:00,Y29tbWVudDoxMDMzNzQ5ODUyMTE2NTExXzExNDQwOTQ2NDcyOTk2OTE=,Y29tbWVudDoxMDMzNzQ5ODUyMTE2NTExXzYzNTI1MjY1MjMwNDA4Mg==,"- I love Costco and have been a member for decades. I am really not comfortable with crossing a picket line to shop, and I too REALLY hope they settle the contract dispute.",2025-02-01,reply,1
Costco,2025-01-31 09:00:00,Y29tbWVudDoxMDMzNzQ5ODUyMTE2NTExXzEyMDM2ODYxMjQ0MzMyODc=,,at first I thought these were for people! I was gonna asked how much sodium,2025-02-15,initial,0
Costco,2025-01-31 09:00:00,Y29tbWVudDoxMDMzNzQ5ODUyMTE2NTExXzkwOTU4NDQxMjA1MzUwMzg=,,Para Milah Osdelyn J Andino Molina,2025-02-01,initial,0
Costco,2025-01-31 09:00:00,Y29tbWVudDoxMDMzNzQ5ODUyMTE2NTExXzkyMzA2MDA3OTYzMzc2MQ==,,"What part of ""Go Woke, Go Broke"" do you not understand?",2025-02-01,initial,2
Costco,2025-01-31 09:00:00,Y29tbWVudDoxMDMzNzQ5ODUyMTE2NTExXzYzMjQyOTM2OTQ2NDgzMg==,Y29tbWVudDoxMDMzNzQ5ODUyMTE2NTExXzkyMzA2MDA3OTYzMzc2MQ==,just because somebody comes up with a catchy slogan doesn't mean that it's true. It's been working for Costco so far. It's also been working for a whole bunch of other countries. You are being lied to. Stop drinking the Kool-Aid.,2025-02-01,reply,1
Costco,2025-01-31 09:00:00,Y29tbWVudDoxMDMzNzQ5ODUyMTE2NTExXzExNDc5MzM4NDY2ODM3NDI=,Y29tbWVudDoxMDMzNzQ5ODUyMTE2NTExXzkyMzA2MDA3OTYzMzc2MQ==,-being able to have medical professionals and your coworkers use your preferred name (lots of people have those),2025-02-01,reply,2
Costco,2025-01-31 09:00:00,Y29tbWVudDoxMDMzNzQ5ODUyMTE2NTExXzE5OTUzMTQyODA5ODAxMzU=,,Costco sucks. Maybe they should except foodstamps since they are all for DEI,2025-02-01,initial,1
Costco,2025-01-31 09:00:00,Y29tbWVudDoxMDMzNzQ5ODUyMTE2NTExXzExMTYxMDAzMDY4MTc4MTQ=,,Just cook your own beef and put on top of your dogs food. Cheaper.,2025-02-01,initial,0
Costco,2025-01-31 09:00:00,Y29tbWVudDoxMDMzNzQ5ODUyMTE2NTExXzEzMjM5NDU1ODg4MDA2MjE=,,Boycott Costco,2025-02-01,initial,7
Costco,2025-01-31 09:00:00,Y29tbWVudDoxMDMzNzQ5ODUyMTE2NTExXzE2MDkwOTYwMzk5NzUyMTg=,Y29tbWVudDoxMDMzNzQ5ODUyMTE2NTExXzEzMjM5NDU1ODg4MDA2MjE=,"go shop at Walmart, idiot.",2025-02-01,reply,1
Costco,2025-01-31 09:00:00,Y29tbWVudDoxMDMzNzQ5ODUyMTE2NTExXzEzMTMyNjM0NjMyMDkxNjQ=,Y29tbWVudDoxMDMzNzQ5ODUyMTE2NTExXzEzMjM5NDU1ODg4MDA2MjE=,"good, shopping around less MAGAts sounds wonderful",2025-02-08,reply,0
Costco,2025-01-31 09:00:00,Y29tbWVudDoxMDMzNzQ5ODUyMTE2NTExXzYyNzc0ODIxNjg3NTQzMA==,,Please do not go the way of the MAGATs! I do not shop at Walmart or Sam’s ever! Only Costco for me and that has been the case for the last 30 yrs. Please do not change who you are!,2025-02-01,initial,3
Costco,2025-01-31 09:00:00,Y29tbWVudDoxMDMzNzQ5ODUyMTE2NTExXzg2ODU5MTY5ODYyMjAwNA==,,19 attorney generals from different states have written COSTCO warning letters that continuing to allow discriminatory DEI practices and not hire as many Asians and white people that it does open them to discrimination lawsuits in the billions $$$-- so guess we'll see if they fold or go broke-- Americans love to sue,2025-02-01,initial,2
Costco,2025-01-31 09:00:00,Y29tbWVudDoxMDMzNzQ5ODUyMTE2NTExXzU5NzE2OTgxOTkwNDMzOA==,Y29tbWVudDoxMDMzNzQ5ODUyMTE2NTExXzg2ODU5MTY5ODYyMjAwNA==,let me guess every single one was a red state right?,2025-02-08,reply,0
Costco,2025-01-31 09:00:00,Y29tbWVudDoxMDMzNzQ5ODUyMTE2NTExXzU5MjY5MTQ4MDMyMDc1Nw==,,Don’t CAVE TO THE CULT!!,2025-02-01,initial,9
Costco,2025-01-31 09:00:00,Y29tbWVudDoxMDMzNzQ5ODUyMTE2NTExXzE4MDI2Nzg0MzA1NjY1OTQ=,Y29tbWVudDoxMDMzNzQ5ODUyMTE2NTExXzU5MjY5MTQ4MDMyMDc1Nw==,they donated to trump’s campaign,2025-02-01,reply,0
Costco,2025-01-31 09:00:00,Y29tbWVudDoxMDMzNzQ5ODUyMTE2NTExXzEwODA4MDE2NTczOTExNTI=,,"All these clowns saying they'll support you??? Ha, didn't help Bud, or Harley.",2025-02-01,initial,4
Costco,2025-01-31 09:00:00,Y29tbWVudDoxMDMzNzQ5ODUyMTE2NTExXzk3NzkwNzA1MDk2OTQxOQ==,Y29tbWVudDoxMDMzNzQ5ODUyMTE2NTExXzEwODA4MDE2NTczOTExNTI=,no was cares about those companies when they do bout Costco,2025-02-01,reply,0
Costco,2025-01-31 09:00:00,Y29tbWVudDoxMDMzNzQ5ODUyMTE2NTExXzEzMTEzNzYwMDk5MDQxNzA=,Y29tbWVudDoxMDMzNzQ5ODUyMTE2NTExXzk3NzkwNzA1MDk2OTQxOQ==,"oh, that's why both did an about face when it came to losing profit share??",2025-02-01,reply,1
Costco,2025-01-31 09:00:00,Y29tbWVudDoxMDMzNzQ5ODUyMTE2NTExXzE3MDg2NzM4MjMwNzMyNDI=,Y29tbWVudDoxMDMzNzQ5ODUyMTE2NTExXzk3NzkwNzA1MDk2OTQxOQ==,"pipe down, stupid",2025-02-01,reply,0
Costco,2025-01-31 09:00:00,Y29tbWVudDoxMDMzNzQ5ODUyMTE2NTExXzU3NzMzMjQ1MTc5MjA4MA==,Y29tbWVudDoxMDMzNzQ5ODUyMTE2NTExXzE3MDg2NzM4MjMwNzMyNDI=,"those companies did a 180 to save face since there were hurting, this boycott that is almost a month old and warehouses are still completely packed",2025-02-01,reply,4
Costco,2025-01-31 09:00:00,Y29tbWVudDoxMDMzNzQ5ODUyMTE2NTExXzE4MDQzODE3NTAzNjQ0OTE=,Y29tbWVudDoxMDMzNzQ5ODUyMTE2NTExXzU3NzMzMjQ1MTc5MjA4MA==,"ok, you keep spending your money there. I have options.",2025-02-01,reply,1
Costco,2025-01-31 09:00:00,Y29tbWVudDoxMDMzNzQ5ODUyMTE2NTExXzEwMTY0MjQ3OTA1MTAyNjY=,Y29tbWVudDoxMDMzNzQ5ODUyMTE2NTExXzE4MDQzODE3NTAzNjQ0OTE=,they’ll be fine without you…just went there and they were PACKED! So they don’t want your bigoted money,2025-02-01,reply,3
Costco,2025-01-31 09:00:00,Y29tbWVudDoxMDMzNzQ5ODUyMTE2NTExXzYyODQxODk5OTc0MDY2MQ==,Y29tbWVudDoxMDMzNzQ5ODUyMTE2NTExXzExNjczNDc5MDE1ODUxNzA=,God are you a dumb bimb. lol,2025-02-08,reply,0
Costco,2025-01-31 09:00:00,Y29tbWVudDoxMDMzNzQ5ODUyMTE2NTExXzk5MjIxNTQyNjA5ODM5NA==,Y29tbWVudDoxMDMzNzQ5ODUyMTE2NTExXzExMTk3ODExODI4MDg0ODA=,"You're making me so so happy. I smile as I type. Just to know that there's imbeciles like you put there unraveling daily, is sweet sweet revenge. Enjoy your next four years. It's only just began. Muahhhh",2025-02-08,reply,0
Costco,2025-01-31 09:00:00,Y29tbWVudDoxMDMzNzQ5ODUyMTE2NTExXzEzODc0MTg4NDkzMDYzOTg=,Y29tbWVudDoxMDMzNzQ5ODUyMTE2NTExXzk5MjIxNTQyNjA5ODM5NA==,you think I’m unraveling? I suppose it makes sense that your cult brain can’t see the facts. It’s your felon47 who’s unraveling…Buwahahaha!,2025-02-08,reply,0
Costco,2025-01-31 09:00:00,Y29tbWVudDoxMDMzNzQ5ODUyMTE2NTExXzQ2MDc2NTUyMDMwNTc5NQ==,Y29tbWVudDoxMDMzNzQ5ODUyMTE2NTExXzEzODc0MTg4NDkzMDYzOTg=,yes,2025-02-08,reply,0
Costco,2025-01-31 09:00:00,Y29tbWVudDoxMDMzNzQ5ODUyMTE2NTExXzE1ODk2MDg1NDgzNTExNjk=,Y29tbWVudDoxMDMzNzQ5ODUyMTE2NTExXzExMTk3ODExODI4MDg0ODA=,I love that the wins keep coming. The media can't keep up with the speed that other countries are folding.,2025-02-08,reply,0
Costco,2025-01-31 09:00:00,Y29tbWVudDoxMDMzNzQ5ODUyMTE2NTExXzYzMTA4MzMzMjY3MDEzOQ==,Y29tbWVudDoxMDMzNzQ5ODUyMTE2NTExXzE1ODk2MDg1NDgzNTExNjk=,"a win, lol!",2025-02-08,reply,0
Costco,2025-01-31 09:00:00,Y29tbWVudDoxMDMzNzQ5ODUyMTE2NTExXzY1MTYzODE4MDU0Njg0MQ==,Y29tbWVudDoxMDMzNzQ5ODUyMTE2NTExXzYzMTA4MzMzMjY3MDEzOQ==,"yup, you're sure winning.",2025-02-08,reply,0
Costco,2025-01-31 09:00:00,Y29tbWVudDoxMDMzNzQ5ODUyMTE2NTExXzExNzc0MTM4MTc0MzAwNTY=,Y29tbWVudDoxMDMzNzQ5ODUyMTE2NTExXzExMTk3ODExODI4MDg0ODA=,No response? You finally decide to rear those little fairies?,2025-02-08,reply,0
Costco,2025-01-31 09:00:00,Y29tbWVudDoxMDMzNzQ5ODUyMTE2NTExXzExOTY5Njg1MTg2MjExNTM=,Y29tbWVudDoxMDMzNzQ5ODUyMTE2NTExXzEwODA4MDE2NTczOTExNTI=,Dumb. Entitled. Imbecile. A MAGA.,2025-02-08,reply,0
Costco,2025-01-31 09:00:00,Y29tbWVudDoxMDMzNzQ5ODUyMTE2NTExXzE2ODk3MjM4ODE5MjEyMjI=,,Katelyn Montes,2025-02-01,initial,1
Costco,2025-01-31 09:00:00,Y29tbWVudDoxMDMzNzQ5ODUyMTE2NTExXzY2MjUxMTA3OTQzMTk4Mw==,,"If you equate “diversity hire” with less, what does that say about you?",2025-02-01,initial,4
Costco,2025-01-31 09:00:00,Y29tbWVudDoxMDMzNzQ5ODUyMTE2NTExXzEyODYxNjQ3MDI2ODk0NjY=,,Thank you Costco!!!!,2025-02-01,initial,3
Costco,2025-01-31 09:00:00,Y29tbWVudDoxMDMzNzQ5ODUyMTE2NTExXzYyOTE3NjAzOTU4MzAxMA==,,Good job,2025-02-08,initial,0
Costco,2025-01-31 09:00:00,Y29tbWVudDoxMDMzNzQ5ODUyMTE2NTExXzExNzg2ODExNTA2MzE4NDM=,Y29tbWVudDoxMDMzNzQ5ODUyMTE2NTExXzE3NzEwMjM2NDcwODEzNzU=,You have mental illness.,2025-02-01,reply,1
Costco,2025-01-31 09:00:00,Y29tbWVudDoxMDMzNzQ5ODUyMTE2NTExXzE1ODg2NjgzNzUwOTgxODA=,,"Is it true...COSTCO Organic apples contain ""Apeel"" - the dangerous new coating brought to you by Bill Gates? It can't be washed off.",2025-02-01,initial,0
Costco,2025-01-31 09:00:00,Y29tbWVudDoxMDMzNzQ5ODUyMTE2NTExXzExMzI5NjA1MjgzNTg1MTA=,Y29tbWVudDoxMDMzNzQ5ODUyMTE2NTExXzE1ODg2NjgzNzUwOTgxODA=,wrong,2025-02-01,reply,0
Costco,2025-01-31 09:00:00,Y29tbWVudDoxMDMzNzQ5ODUyMTE2NTExXzk3MTg3MzQ2NzY5Mjg5MA==,Y29tbWVudDoxMDMzNzQ5ODUyMTE2NTExXzYxNDk1NTI4MTI0OTEyOA==,You have obviously been eating apeel. Enjoy the poison.,2025-02-01,reply,0
Costco,2025-01-31 09:00:00,Y29tbWVudDoxMDMzNzQ5ODUyMTE2NTExXzY0Nzg1NjE1NDU3NDQ5MQ==,,Still doing the DEI?,2025-02-01,initial,1
Costco,2025-01-31 09:00:00,Y29tbWVudDoxMDMzNzQ5ODUyMTE2NTExXzE2MDgxMDk0NDAwNzMwNTg=,,We love Costco!! Thank you for standing up for what is right!!,2025-02-01,initial,2
Costco,2025-01-31 09:00:00,Y29tbWVudDoxMDMzNzQ5ODUyMTE2NTExXzMyODAwNzk2NjU0NTY4MDY=,Y29tbWVudDoxMDMzNzQ5ODUyMTE2NTExXzE2MDgxMDk0NDAwNzMwNTg=,Anti-white racism is not right.,2025-02-01,reply,1
Costco,2025-01-31 09:00:00,Y29tbWVudDoxMDMzNzQ5ODUyMTE2NTExXzEzMzU2NTE1Nzc0NjIxOTg=,,I love and support you Costco! Stat strong.,2025-02-01,initial,3
Costco,2025-01-31 09:00:00,Y29tbWVudDoxMDMzNzQ5ODUyMTE2NTExXzk2Njg0Mjg3MTYxNzU3Mw==,,This is what happens without DEI. I'm sure all these folks were hired because they were the most qualified.,2025-02-01,initial,4
Costco,2025-01-31 09:00:00,Y29tbWVudDoxMDMzNzQ5ODUyMTE2NTExXzExNDU3NzI2ODcyNzMxNDQ=,,"Won't be renewing my Costco membership, due to your love of DEI and harmful, love of woke....it's an ignorant business model, it's divisive and discriminatory, and it's a pox on the United States! You cater to the mentally ill, I'll shop elsewhere!",2025-02-01,initial,4
Costco,2025-01-31 09:00:00,Y29tbWVudDoxMDMzNzQ5ODUyMTE2NTExXzQ4ODc0ODk0NzI5MzgxNA==,Y29tbWVudDoxMDMzNzQ5ODUyMTE2NTExXzExNDU3NzI2ODcyNzMxNDQ=,"bye-bye, fascist!",2025-02-01,reply,1
Costco,2025-01-31 09:00:00,Y29tbWVudDoxMDMzNzQ5ODUyMTE2NTExXzY0ODQyMjUyNzc2MjIxOA==,Y29tbWVudDoxMDMzNzQ5ODUyMTE2NTExXzExNDU3NzI2ODcyNzMxNDQ=,"good, shopping around less MAGAts sounds wonderful",2025-02-08,reply,0
Costco,2025-01-31 09:00:00,Y29tbWVudDoxMDMzNzQ5ODUyMTE2NTExXzk1NTUxNDQ5MDA3Mzg5MQ==,,Probably from VACCINATED COWS TOO!!,2025-02-15,initial,0
Costco,2025-01-31 09:00:00,Y29tbWVudDoxMDMzNzQ5ODUyMTE2NTExXzIwODk0Nzg2MzE0OTQxMDQ=,,diversity- equity- inclusion,2025-02-01,initial,3
Costco,2025-01-31 09:00:00,Y29tbWVudDoxMDMzNzQ5ODUyMTE2NTExXzEzMTk2NDY1NjkxODc5MzM=,,"Please don’t fold to the racist and misogynistic AGs! This is America, they can’t tell you how to run your company!",2025-02-01,initial,3
Costco,2025-01-31 09:00:00,Y29tbWVudDoxMDMzNzQ5ODUyMTE2NTExXzE3MzIwMTYyMTA5OTI0MDA=,,"America has defeated the greatest enemy in its history: Anti-white racism. You are insane, Costco. Your conduct will bankrupt you and will draw the swift attention of DOJ.",2025-02-01,initial,2
Costco,2025-01-31 09:00:00,Y29tbWVudDoxMDMzNzQ5ODUyMTE2NTExXzkzMzc1MjcxNTUzODEwNA==,,2.) My membership continues to pay for itself in full with each individual visit to your stores.,2025-02-01,initial,0
Costco,2025-01-31 09:00:00,Y29tbWVudDoxMDMzNzQ5ODUyMTE2NTExXzExNzgwNTc5NzcwMDk2ODk=,,these comments are like a libtard circle jerk !!!,2025-02-01,initial,0
Costco,2025-01-31 09:00:00,Y29tbWVudDoxMDMzNzQ5ODUyMTE2NTExXzExNTMwNTkxNTk1MjczNjE=,,Fuc. DEI Fuc. Costco POS company,2025-02-01,initial,2
Costco,2025-01-31 09:00:00,Y29tbWVudDoxMDMzNzQ5ODUyMTE2NTExXzEzMTEwODIwNTY3MTEwNjk=,,SHAME ON YOU FOR SUPPORTING DEI AND DOUBLING DOWN ON IT. YOU ARE IDIOTS.,2025-02-01,initial,3
Costco,2025-01-31 09:00:00,Y29tbWVudDoxMDMzNzQ5ODUyMTE2NTExXzI0MTk2OTE4MDg0MjMwNjM=,Y29tbWVudDoxMDMzNzQ5ODUyMTE2NTExXzEzMTEwODIwNTY3MTEwNjk=,so women shouldn't have jobs seeing since DEI is being removed the Air Force is beginning to remove women from their training videos,2025-02-01,reply,1
Costco,2025-01-31 09:00:00,Y29tbWVudDoxMDMzNzQ5ODUyMTE2NTExXzIyNjIyMTU1NTc1MDY1NjY=,Y29tbWVudDoxMDMzNzQ5ODUyMTE2NTExXzEzMTEwODIwNTY3MTEwNjk=,you’re the idiot,2025-02-01,reply,1
Costco,2025-01-31 09:00:00,Y29tbWVudDoxMDMzNzQ5ODUyMTE2NTExXzQ2MDI1NjgzNzAxODYzNw==,Y29tbWVudDoxMDMzNzQ5ODUyMTE2NTExXzExMzc2ODcxNTc3NjQ4OTA=,you're all so stupid if you think this is about women,2025-02-08,reply,0
Costco,2025-01-31 09:00:00,Y29tbWVudDoxMDMzNzQ5ODUyMTE2NTExXzE2ODUzNTA3NzU2NzI2NzI=,Y29tbWVudDoxMDMzNzQ5ODUyMTE2NTExXzQ2MDI1NjgzNzAxODYzNw==,You need to educate yourself on what DEI means for yourself.,2025-02-08,reply,0
Costco,2025-01-31 09:00:00,Y29tbWVudDoxMDMzNzQ5ODUyMTE2NTExXzUwMTIwNDAzMzAxMjI5Mg==,Y29tbWVudDoxMDMzNzQ5ODUyMTE2NTExXzE2ODUzNTA3NzU2NzI2NzI=,i think vice versa. Learn how to do research.Wikipedia is not research,2025-02-08,reply,0
Costco,2025-01-31 09:00:00,Y29tbWVudDoxMDMzNzQ5ODUyMTE2NTExXzIwMzQxODQ0MDM3NTY0MDU=,Y29tbWVudDoxMDMzNzQ5ODUyMTE2NTExXzUwMTIwNDAzMzAxMjI5Mg==,"what's your non bias resource, Encyclopedia Britannica. Here's just some of their sighted resources for how they get their information. What do you have???",2025-02-08,reply,0
Costco,2025-01-31 09:00:00,Y29tbWVudDoxMDMzNzQ5ODUyMTE2NTExXzE3NzgxMjgzNDMwMzI2NjQ=,Y29tbWVudDoxMDMzNzQ5ODUyMTE2NTExXzEwOTU0NDc1OTIzNzk5Mjk=,no I don't respond to ignorance.,2025-02-08,reply,1
Costco,2025-01-31 09:00:00,Y29tbWVudDoxMDMzNzQ5ODUyMTE2NTExXzEzMDcyODEyODcxNzgyOTk=,Y29tbWVudDoxMDMzNzQ5ODUyMTE2NTExXzE3NzgxMjgzNDMwMzI2NjQ=,"no legit resources, figured as much.",2025-02-08,reply,0
Costco,2025-01-31 09:00:00,Y29tbWVudDoxMDMzNzQ5ODUyMTE2NTExXzQwMTIzMzg4NTU3NTQ5MjY=,,"Thank you for your sensible, ethical, Constitutional, and in all ways all-American stance on continuing to promote diversity & workers' rights in your exceptional corporation! We need more companies like you! You have won back this member & I am re-joining immediately! The other superstore(s) will NOT see me after the end of this membership term (which I ONLY joined because they had a $20 return membership offer this past year). I wish your membership were more affordable, but I will cut other corners in order to support your excellence & democratic principles. Please know how very meaningful this position of yours is to the nation's people! Thank you",2025-02-01,initial,19
Costco,2025-01-31 09:00:00,Y29tbWVudDoxMDMzNzQ5ODUyMTE2NTExXzEwMDMxODQxNTE4MzczNzQ=,Y29tbWVudDoxMDMzNzQ5ODUyMTE2NTExXzQwMTIzMzg4NTU3NTQ5MjY=,"chalk another one up to another who wants reverse discrimination. You people are racist yourselves, it’s always about color, race, gender labels….",2025-02-01,reply,0
Costco,2025-01-31 09:00:00,Y29tbWVudDoxMDMzNzQ5ODUyMTE2NTExXzEyOTY1NDA5ODE1ODExNTE=,Y29tbWVudDoxMDMzNzQ5ODUyMTE2NTExXzEwMDMxODQxNTE4MzczNzQ=,"Bless your heart. DEI isn't about choosing people based on color, race or anything but merit. That is the whole point of DEI. People are to be judged on their qualifications, not just automatically cast aside because of their inherent identity.",2025-02-01,reply,1
Costco,2025-01-31 09:00:00,Y29tbWVudDoxMDMzNzQ5ODUyMTE2NTExXzE4Nzg0MDE3NDI5Njc0NTQ=,Y29tbWVudDoxMDMzNzQ5ODUyMTE2NTExXzEyOTY1NDA5ODE1ODExNTE=,"because you say it doesn’t mean it’s true. Merit based is for hiring, but bless your heart for responding",2025-02-01,reply,1
Costco,2025-01-31 09:00:00,Y29tbWVudDoxMDMzNzQ5ODUyMTE2NTExXzU1MzI3MzA5MTA2Njc2NQ==,Y29tbWVudDoxMDMzNzQ5ODUyMTE2NTExXzE4Nzg0MDE3NDI5Njc0NTQ=,"You're the one who is making statements without any merit. DEI literally is about ensuring non-discrimination. You simply don't understand DEI programs. It's not about hiring people because they're black or female, it's about making sure people are hired on merit. It's about making sure that we do not discriminate against people.",2025-02-01,reply,1
Costco,2025-01-31 09:00:00,Y29tbWVudDoxMDMzNzQ5ODUyMTE2NTExXzExNzE5MDE2OTQ1NTYwNjY=,Y29tbWVudDoxMDMzNzQ5ODUyMTE2NTExXzU1MzI3MzA5MTA2Njc2NQ==,"I understand plenty, like FAA lowering standards to include people not qualified, while overlooking qualified candidates because they are white. Just one example. Buzz off I’m not interested in you foaming at the mouth liberals opinions.",2025-02-01,reply,1
