company_name,post_date,id,parent_id,comment_text,comment_date,comment_type,reaction_count
Costco,2025-01-31 09:00:00,Y29tbWVudDoxMDMzNzQ5ODUyMTE2NTExXzU5MDQ0NTAxMzg2OTIxNw==,,"Your commitment to diversity, equity and inclusion is greatly appreciated! These programs benefit all Americans and, make us better! Thank you, Costco",2025-02-08,initial,0
Costco,2025-01-31 09:00:00,Y29tbWVudDoxMDMzNzQ5ODUyMTE2NTExXzE1MTU4NTY3NTI2MTczMjU=,,What are the Calories?,2025-02-08,initial,2
Costco,2025-01-31 09:00:00,Y29tbWVudDoxMDMzNzQ5ODUyMTE2NTExXzkzODgwNzY2NTAzNjQxNw==,Y29tbWVudDoxMDMzNzQ5ODUyMTE2NTExXzE1MTU4NTY3NTI2MTczMjU=,"Debi, thanks for your patience. The calorie content (calculated) is ME 3,316 kcal/kg 399 kcal/g. Feel free to visit the following link for further details located on the product image: https://sameday.costco.com/store/costco/s?k=1752173 -Christina",2025-02-22,reply,1
Costco,2025-01-31 09:00:00,Y29tbWVudDoxMDMzNzQ5ODUyMTE2NTExXzYxODYzOTQ2NzUyNzk1OA==,,Thank you for being a good company!,2025-02-08,initial,1
Costco,2025-01-31 09:00:00,Y29tbWVudDoxMDMzNzQ5ODUyMTE2NTExXzEwMDg5MjUwNDEyNTYxNTY=,,"I went back to Costco to ask for help and the staff couldn’t place an order with the card either. The store manager contacted Uber Eats for me, and a representative called me, but the issue still wasn’t resolved.",2025-02-01,initial,1
Costco,2025-01-31 09:00:00,Y29tbWVudDoxMDMzNzQ5ODUyMTE2NTExXzE1MzE2OTc2MDQxODgxMTc=,,Love Costco and stand with you all the way.,2025-02-01,initial,2
Costco,2025-01-31 09:00:00,Y29tbWVudDoxMDMzNzQ5ODUyMTE2NTExXzIzOTEwNjYyNDEyMzg0Mzc=,,"I need to contact a manager, as there is no information to email Costco pharmacy. I've contacted you 3 times, with no resolution regarding prescription status.",2025-02-01,initial,3
Costco,2025-01-31 09:00:00,Y29tbWVudDoxMDMzNzQ5ODUyMTE2NTExXzM4MjgzMjkxOTc0MzIyNDU=,Y29tbWVudDoxMDMzNzQ5ODUyMTE2NTExXzIzOTEwNjYyNDEyMzg0Mzc=,I’m sure commenting on a random post will help….,2025-02-01,reply,0
Costco,2025-01-31 09:00:00,Y29tbWVudDoxMDMzNzQ5ODUyMTE2NTExXzUxMTc2MDMxMTkzNzgwMA==,Y29tbWVudDoxMDMzNzQ5ODUyMTE2NTExXzM4MjgzMjkxOTc0MzIyNDU=,Apparently Amanda HelpDesk liked my post but offered no resolution. There is no email listed anywhere on how to contact these people. What freaking company doesn't offer e-mail support?,2025-02-01,reply,0
Costco,2025-01-31 09:00:00,Y29tbWVudDoxMDMzNzQ5ODUyMTE2NTExXzYxNzY2NjE3MDk4NDQyOQ==,Y29tbWVudDoxMDMzNzQ5ODUyMTE2NTExXzUxMTc2MDMxMTkzNzgwMA==,"Pat- We strive for every member interaction to be a positive one and we're sorry to hear we missed the mark. We'd like to get you in touch with the right team to share your experience with. Please email us at costcocare@costco.com with your 12 digit membership number, phone number, and any pertinent details. As soon as we receive your email we'll promptly proceed. -Kim",2025-02-15,reply,0
Costco,2025-01-31 09:00:00,Y29tbWVudDoxMDMzNzQ5ODUyMTE2NTExXzI1ODI5NDIwNDUyMzIwODc=,,"I will continue to support Costco even though we live an hour away now JUST BECAUSE they held their ground on supporting diversity. Keep it up, Costco!",2025-02-01,initial,4
Costco,2025-01-31 09:00:00,Y29tbWVudDoxMDMzNzQ5ODUyMTE2NTExXzEyODczMTg0NzkxNjA4OTA=,,"My entire family and our business will not be renewing memberships, nor making anymore purchases with this tone deaf, ill-managed company that can continue to push DEI initiatives when America has spoken. I and many others will not be financing ""Woke"" companies anymore!",2025-02-01,initial,6
Costco,2025-01-31 09:00:00,Y29tbWVudDoxMDMzNzQ5ODUyMTE2NTExXzE4MDkwMjg4NTY1NjE2MTg=,Y29tbWVudDoxMDMzNzQ5ODUyMTE2NTExXzEyODczMTg0NzkxNjA4OTA=,-being able to have medical professionals and your coworkers use your preferred name (lots of people have those),2025-02-01,reply,2
Costco,2025-01-31 09:00:00,Y29tbWVudDoxMDMzNzQ5ODUyMTE2NTExXzYxMjYxNzM2ODAxODA3MA==,Y29tbWVudDoxMDMzNzQ5ODUyMTE2NTExXzEyODczMTg0NzkxNjA4OTA=,"good, shopping around less MAGAts sounds wonderful",2025-02-08,reply,0
Costco,2025-01-31 09:00:00,Y29tbWVudDoxMDMzNzQ5ODUyMTE2NTExXzk4NjQ5NDcwNjY4MDE1NA==,,I've actually never been to Costco but now I will. Thanks for doing the right thing and not falling for the right wing hate.,2025-02-01,initial,1
Costco,2025-01-31 09:00:00,Y29tbWVudDoxMDMzNzQ5ODUyMTE2NTExXzExMzg5MTg0MTc5MzQ5NjE=,,Thank you Costco! I have always loved your store. And the fact that you treat your employees so well and stand up to do the right thing just makes me love you even more. Any chance your officials might run for political office?,2025-02-01,initial,2
Costco,2025-01-31 09:00:00,Y29tbWVudDoxMDMzNzQ5ODUyMTE2NTExXzUxMDg5ODIyNDkxMTgwMw==,,"I’ve tried to locate a better place to post...to no avail. Just FEEDBACK. We have been buying towels at Costco for years. You recently switched from Charisma to (apparently) a woman owned business. Probably part of your DEI effort. I really don’t care one way or the other, BUT: The new towels are terrible. They keep giving off colors (30 days after buying) and one of the towels shredded on the sides. I go to Costco for one reason: Value. I suspect that’s why most people go. We will certainly NOT buy those towels again...and strongly suggest you find another vendor. Just my two cents.",2025-02-01,initial,2
Costco,2025-01-31 09:00:00,Y29tbWVudDoxMDMzNzQ5ODUyMTE2NTExXzE2NTQ1NTI2Njg3NjUwNzE=,,"Costco, you are awesome! Thank you for standing up to fairness in the work force!",2025-02-01,initial,7
Costco,2025-01-31 09:00:00,Y29tbWVudDoxMDMzNzQ5ODUyMTE2NTExXzQ2MzUxMzQ4NjgzMzA4OA==,,I signed up today again after years because of your values Costco!,2025-02-01,initial,2
Costco,2025-01-31 09:00:00,Y29tbWVudDoxMDMzNzQ5ODUyMTE2NTExXzU5MDY0ODIzMzc4ODE2MA==,,Love Costco! Il give these a try,2025-02-01,initial,6
Costco,2025-01-31 09:00:00,Y29tbWVudDoxMDMzNzQ5ODUyMTE2NTExXzExMzkyNDUzNTQ1Njg5MzU=,Y29tbWVudDoxMDMzNzQ5ODUyMTE2NTExXzU5MDY0ODIzMzc4ODE2MA==,hello please joined us at Costco Bourbon Finds,2025-02-08,reply,0
Costco,2025-01-31 09:00:00,Y29tbWVudDoxMDMzNzQ5ODUyMTE2NTExXzE1NjQ3NzQyMjc1NjM4NTI=,,"Ignore the trolls! You are awesome, Costco!",2025-02-01,initial,13
Costco,2025-01-31 09:00:00,Y29tbWVudDoxMDMzNzQ5ODUyMTE2NTExXzIwNTg0ODk1MzQ2MTE5Mzc=,Y29tbWVudDoxMDMzNzQ5ODUyMTE2NTExXzE1NjQ3NzQyMjc1NjM4NTI=,What she said. Costco rocks!,2025-02-01,reply,2
Costco,2025-01-31 09:00:00,Y29tbWVudDoxMDMzNzQ5ODUyMTE2NTExXzEzMzIzNDMxMDQ3ODgwODM=,Y29tbWVudDoxMDMzNzQ5ODUyMTE2NTExXzE1NjQ3NzQyMjc1NjM4NTI=,there are so many trolls. META do something!,2025-02-01,reply,1
Costco,2025-01-31 09:00:00,Y29tbWVudDoxMDMzNzQ5ODUyMTE2NTExXzY0MDYxNTAzODQxODcwOQ==,Y29tbWVudDoxMDMzNzQ5ODUyMTE2NTExXzEzMzIzNDMxMDQ3ODgwODM=,META and gang ARE the trolls!!,2025-02-08,reply,1
Costco,2025-01-31 09:00:00,Y29tbWVudDoxMDMzNzQ5ODUyMTE2NTExXzYyMDk3NTg4NzE0MzgzNw==,,Love Costco,2025-02-01,initial,3
Costco,2025-01-31 09:00:00,Y29tbWVudDoxMDMzNzQ5ODUyMTE2NTExXzEwMjQ4NzgzMzYzNDk2MjY=,,I only feed my dog human grade treats. If people can’t eat it my dog can’t eat it.,2025-02-01,initial,0
Costco,2025-01-31 09:00:00,Y29tbWVudDoxMDMzNzQ5ODUyMTE2NTExXzU0OTA2OTg3NDg1NjY2NA==,Y29tbWVudDoxMDMzNzQ5ODUyMTE2NTExXzEwMjQ4NzgzMzYzNDk2MjY=,all dog food is edible to humans just not the best nutrition,2025-02-01,reply,0
Costco,2025-01-31 09:00:00,Y29tbWVudDoxMDMzNzQ5ODUyMTE2NTExXzExNTgyNjE4NjI1NDY0NTM=,Y29tbWVudDoxMDMzNzQ5ODUyMTE2NTExXzU0OTA2OTg3NDg1NjY2NA==,"I make my own dog food too raw meats, and veggies. I don’t buy dog food.",2025-02-01,reply,0
Costco,2025-01-31 09:00:00,Y29tbWVudDoxMDMzNzQ5ODUyMTE2NTExXzk1NzI1NzA2MjcwNDIwNg==,Y29tbWVudDoxMDMzNzQ5ODUyMTE2NTExXzExNTgyNjE4NjI1NDY0NTM=,ok but people can eat all dog food it's safe,2025-02-01,reply,0
Costco,2025-01-31 09:00:00,Y29tbWVudDoxMDMzNzQ5ODUyMTE2NTExXzYxODY3OTA3MTEwOTQyMw==,Y29tbWVudDoxMDMzNzQ5ODUyMTE2NTExXzk1NzI1NzA2MjcwNDIwNg==,sorry but they are not. You need to search it out yourself. It’s killing every dog.,2025-02-01,reply,0
Costco,2025-01-31 09:00:00,Y29tbWVudDoxMDMzNzQ5ODUyMTE2NTExXzE3OTAyMTI0ODE3MjgwNzA=,Y29tbWVudDoxMDMzNzQ5ODUyMTE2NTExXzYxODY3OTA3MTEwOTQyMw==,yes they are,2025-02-01,reply,0
Costco,2025-01-31 09:00:00,Y29tbWVudDoxMDMzNzQ5ODUyMTE2NTExXzIwMTA2MzkzNzI3ODA2MTc=,,I’ll be doing as much of my shopping at Costco as I can! I’m happy to support companies who support humans!,2025-02-01,initial,13
Costco,2025-01-31 09:00:00,Y29tbWVudDoxMDMzNzQ5ODUyMTE2NTExXzEwMjA1ODQwMjAxMDM1Mjc=,Y29tbWVudDoxMDMzNzQ5ODUyMTE2NTExXzIwMTA2MzkzNzI3ODA2MTc=,humans but not employees.....https://www.facebook.com/share/v/1976qayTbm/,2025-02-01,reply,0
Costco,2025-01-31 09:00:00,Y29tbWVudDoxMDMzNzQ5ODUyMTE2NTExXzEzMjY2NDQyMTE5MzQzOTI=,Y29tbWVudDoxMDMzNzQ5ODUyMTE2NTExXzIwMTA2MzkzNzI3ODA2MTc=,(Only non-whites),2025-02-01,reply,0
Costco,2025-01-31 09:00:00,Y29tbWVudDoxMDMzNzQ5ODUyMTE2NTExXzkxNTQ5OTAzNDEyODI3Mg==,,"Thank you, COSTCO! We see you and appreciate you!!",2025-02-01,initial,5
Costco,2025-01-31 09:00:00,Y29tbWVudDoxMDMzNzQ5ODUyMTE2NTExXzk3OTQ1ODI3MDc3MDEyNw==,,"Even though I hate crowds, it was nice to see so many shoppers at our Rochester, Mn store. So many samples",2025-02-01,initial,5
Costco,2025-01-31 09:00:00,Y29tbWVudDoxMDMzNzQ5ODUyMTE2NTExXzYxNDg5ODAzODE0NDk4Ng==,,Thank you for standing strong on the right side of history!,2025-02-01,initial,6
Costco,2025-01-31 09:00:00,Y29tbWVudDoxMDMzNzQ5ODUyMTE2NTExXzkyNDQwMTA5OTg3NDEzOQ==,Y29tbWVudDoxMDMzNzQ5ODUyMTE2NTExXzYxNDg5ODAzODE0NDk4Ng==,Yah the Federal Government will take care of their racist policies,2025-02-01,reply,1
Costco,2025-01-31 09:00:00,Y29tbWVudDoxMDMzNzQ5ODUyMTE2NTExXzIyNzI3MTE3MzY0NDc3NjI=,Y29tbWVudDoxMDMzNzQ5ODUyMTE2NTExXzkyNDQwMTA5OTg3NDEzOQ==,empathy and kindness are free. Have a great day!,2025-02-01,reply,1
Costco,2025-01-31 09:00:00,Y29tbWVudDoxMDMzNzQ5ODUyMTE2NTExXzExMzEzMjIwMjUxMDQwMTc=,Y29tbWVudDoxMDMzNzQ5ODUyMTE2NTExXzIyNzI3MTE3MzY0NDc3NjI=,Ignorance is a choice. https://www.scrippsnews.com/.../19-attorneys-general-want...,2025-02-01,reply,1
Costco,2025-01-31 09:00:00,Y29tbWVudDoxMDMzNzQ5ODUyMTE2NTExXzU4ODkwODM3NDExMTQwOA==,Y29tbWVudDoxMDMzNzQ5ODUyMTE2NTExXzYxNDg5ODAzODE0NDk4Ng==,Before year is up Costco will drop DEI. https://www.foxbusiness.com/.../oleary-rips-costco...,2025-02-01,reply,1
Costco,2025-01-31 09:00:00,Y29tbWVudDoxMDMzNzQ5ODUyMTE2NTExXzI3ODgyMzQwMTEzNjgyNzk=,,"Returned our 12yr membership yesterday. Got $120 in refund. Won't spend a dime with them until things change. So, it may be a very long time!",2025-02-01,initial,14
Costco,2025-01-31 09:00:00,Y29tbWVudDoxMDMzNzQ5ODUyMTE2NTExXzkxNjYzNjgxMDU1MDA1OA==,Y29tbWVudDoxMDMzNzQ5ODUyMTE2NTExXzI3ODgyMzQwMTEzNjgyNzk=,bye… I think there will be plenty of new memberships to help Costco overcome the loss of your one membership.,2025-02-01,reply,3
Costco,2025-01-31 09:00:00,Y29tbWVudDoxMDMzNzQ5ODUyMTE2NTExXzYzNzgxNjU2ODcwMDg3Ng==,Y29tbWVudDoxMDMzNzQ5ODUyMTE2NTExXzI3ODgyMzQwMTEzNjgyNzk=,bye racist,2025-02-01,reply,1
Costco,2025-01-31 09:00:00,Y29tbWVudDoxMDMzNzQ5ODUyMTE2NTExXzEyNTQ0NzM3MjIzMDgwNzk=,Y29tbWVudDoxMDMzNzQ5ODUyMTE2NTExXzI3ODgyMzQwMTEzNjgyNzk=,"so long, fascist!",2025-02-01,reply,1
Costco,2025-01-31 09:00:00,Y29tbWVudDoxMDMzNzQ5ODUyMTE2NTExXzk4MjQ3MjkyNjU0OTQ0Ng==,Y29tbWVudDoxMDMzNzQ5ODUyMTE2NTExXzI3ODgyMzQwMTEzNjgyNzk=,late racist bigot,2025-02-01,reply,1
Costco,2025-01-31 09:00:00,Y29tbWVudDoxMDMzNzQ5ODUyMTE2NTExXzY1ODc3MDcwMzE1NjA4MA==,Y29tbWVudDoxMDMzNzQ5ODUyMTE2NTExXzI3ODgyMzQwMTEzNjgyNzk=,"good, shopping around less MAGAts sounds wonderful",2025-02-08,reply,0
Costco,2025-01-31 09:00:00,Y29tbWVudDoxMDMzNzQ5ODUyMTE2NTExXzk2MDcxMDk2MjY3NTYzNw==,,Love Costco!,2025-02-01,initial,31
Costco,2025-01-31 09:00:00,Y29tbWVudDoxMDMzNzQ5ODUyMTE2NTExXzU4MDA3MTk0NTE4NTEzNg==,,Thank you for staying strong Costco! I’m a proud member,2025-02-01,initial,6
Costco,2025-01-31 09:00:00,Y29tbWVudDoxMDMzNzQ5ODUyMTE2NTExXzE1MzA4NzQ2Nzc1OTIwNTY=,,"Thank you Costco, have been a member for years, I love that you are sticking to your principles and to American principles.",2025-02-01,initial,20
Costco,2025-01-31 09:00:00,Y29tbWVudDoxMDMzNzQ5ODUyMTE2NTExXzYyMjMyMzczMDc0NDg2OQ==,Y29tbWVudDoxMDMzNzQ5ODUyMTE2NTExXzE1MzA4NzQ2Nzc1OTIwNTY=,hello please joined us at Costco Bourbon Finds,2025-02-08,reply,0
Costco,2025-01-31 09:00:00,Y29tbWVudDoxMDMzNzQ5ODUyMTE2NTExXzExNjAzMjEzNjU2OTc0ODg=,,This has more fat than protein. Says it’s t is made with USA beef but does not say it is made in the USA. I emailed the company to verify and got no response. Some of the wording on the package makes me unsure.,2025-02-01,initial,2
Costco,2025-01-31 09:00:00,Y29tbWVudDoxMDMzNzQ5ODUyMTE2NTExXzk5MDM0MTYzNjMwOTE5Nw==,,"Hi Costco! I am considering buying a membership and buying most of everything we need, including appliances and furniture. I have heard rumors you might cave and give into the current t administrations demands so I am going to let it marinate before I buy a membership or reassured this won’t happen.",2025-02-01,initial,9
Costco,2025-01-31 09:00:00,Y29tbWVudDoxMDMzNzQ5ODUyMTE2NTExXzYwMTI4ODk2NTk0MjkyMw==,Y29tbWVudDoxMDMzNzQ5ODUyMTE2NTExXzk5MDM0MTYzNjMwOTE5Nw==,"don't worry, Costco will be there. We go to the business and consumer locations. Both are as busy as ever. I expect they'll get busier. Haters can go straight to Sam's Club, lol.",2025-02-08,reply,0
Costco,2025-01-31 09:00:00,Y29tbWVudDoxMDMzNzQ5ODUyMTE2NTExXzEyNzQzNTEzMjM3OTU3MzM=,,"We love and support you, Costco! Thank you for supporting your employees and setting a positive example for other retailers.",2025-02-01,initial,37
Costco,2025-01-31 09:00:00,Y29tbWVudDoxMDMzNzQ5ODUyMTE2NTExXzY1MDc0NTUxNzI5Mjg0MQ==,Y29tbWVudDoxMDMzNzQ5ODUyMTE2NTExXzEyNzQzNTEzMjM3OTU3MzM=,they support their employees. Stop listening to o MSNBC. https://www.facebook.com/share/v/1976qayTbm/,2025-02-01,reply,1
Costco,2025-01-31 09:00:00,Y29tbWVudDoxMDMzNzQ5ODUyMTE2NTExXzYyNjA2ODE1NjQ2NTU2NQ==,Y29tbWVudDoxMDMzNzQ5ODUyMTE2NTExXzEyNzQzNTEzMjM3OTU3MzM=,What is positive about anti-white racism?,2025-02-01,reply,1
Costco,2025-01-31 09:00:00,Y29tbWVudDoxMDMzNzQ5ODUyMTE2NTExXzk2NzA4NDQwNDg5MDkyMQ==,,Thank You COSTCO for standing up for what is right! I LOVE COSTCO!,2025-02-01,initial,17
Costco,2025-01-31 09:00:00,Y29tbWVudDoxMDMzNzQ5ODUyMTE2NTExXzEzNDkyMzUyMTk1ODM0NjE=,Y29tbWVudDoxMDMzNzQ5ODUyMTE2NTExXzk2NzA4NDQwNDg5MDkyMQ==,"lol, it’s not right to hire people based on their gender or race, you hire people on merit, competence. please educate yourself, Martin Luther King would be so disgusted with you",2025-02-01,reply,1
Costco,2025-01-31 09:00:00,Y29tbWVudDoxMDMzNzQ5ODUyMTE2NTExXzIyMjQxNjQwNTgwMjUxOTU=,Y29tbWVudDoxMDMzNzQ5ODUyMTE2NTExXzEzNDkyMzUyMTk1ODM0NjE=,I thought COSTCO supported DEI. Am I wrong? Has that changed?,2025-02-01,reply,0
Costco,2025-01-31 09:00:00,Y29tbWVudDoxMDMzNzQ5ODUyMTE2NTExXzY0NjkzNTQ4MTEwNTcyMA==,,Wont be renewing my membership. Sams club will get my business.,2025-02-01,initial,19
Costco,2025-01-31 09:00:00,Y29tbWVudDoxMDMzNzQ5ODUyMTE2NTExXzEzMzY4ODg2NDA4MjQ3NTg=,Y29tbWVudDoxMDMzNzQ5ODUyMTE2NTExXzY0NjkzNTQ4MTEwNTcyMA==,get ready for higher markups and lower quality,2025-02-01,reply,5
Costco,2025-01-31 09:00:00,Y29tbWVudDoxMDMzNzQ5ODUyMTE2NTExXzE0MDI2MzA2MDA3MDYxODk=,Y29tbWVudDoxMDMzNzQ5ODUyMTE2NTExXzY0NjkzNTQ4MTEwNTcyMA==,no one cares.,2025-02-01,reply,4
Costco,2025-01-31 09:00:00,Y29tbWVudDoxMDMzNzQ5ODUyMTE2NTExXzEzMzg3MjQ0MzcwMDczMzg=,Y29tbWVudDoxMDMzNzQ5ODUyMTE2NTExXzE0MDI2MzA2MDA3MDYxODk=,then why did you respond?,2025-02-01,reply,0
Costco,2025-01-31 09:00:00,Y29tbWVudDoxMDMzNzQ5ODUyMTE2NTExXzEyNjIwOTgzNzE3NTU1NTk=,Y29tbWVudDoxMDMzNzQ5ODUyMTE2NTExXzEzMzg3MjQ0MzcwMDczMzg=,why are you responding?,2025-02-01,reply,0
Costco,2025-01-31 09:00:00,Y29tbWVudDoxMDMzNzQ5ODUyMTE2NTExXzExMjM3MDk1MTk0NTMwODM=,Y29tbWVudDoxMDMzNzQ5ODUyMTE2NTExXzEyNjIwOTgzNzE3NTU1NTk=,"my message was to Costco, not you, so there was no reason for you to respond at all.",2025-02-01,reply,0
Costco,2025-01-31 09:00:00,Y29tbWVudDoxMDMzNzQ5ODUyMTE2NTExXzEwNTQ4NjYxMDYzNTQ3ODU=,Y29tbWVudDoxMDMzNzQ5ODUyMTE2NTExXzExMjM3MDk1MTk0NTMwODM=,Sams club seems like your style,2025-02-01,reply,1
Costco,2025-01-31 09:00:00,Y29tbWVudDoxMDMzNzQ5ODUyMTE2NTExXzEzNDYwMDg5NDMzNzk3ODc=,Y29tbWVudDoxMDMzNzQ5ODUyMTE2NTExXzY0NjkzNTQ4MTEwNTcyMA==,Sam’s Club absolutely sucks!,2025-02-01,reply,0
Costco,2025-01-31 09:00:00,Y29tbWVudDoxMDMzNzQ5ODUyMTE2NTExXzEwMDA1NTc2MTg2NDUyNzA=,Y29tbWVudDoxMDMzNzQ5ODUyMTE2NTExXzY0NjkzNTQ4MTEwNTcyMA==,I was at Costco recently and I've never seen so few shoppers. I think them sticking to a failed policy will make a difference.,2025-02-01,reply,2
Costco,2025-01-31 09:00:00,Y29tbWVudDoxMDMzNzQ5ODUyMTE2NTExXzIxNzUzMzkzMTYxOTQ2NTE=,Y29tbWVudDoxMDMzNzQ5ODUyMTE2NTExXzY0NjkzNTQ4MTEwNTcyMA==,since you sound stupid,2025-02-01,reply,0
Costco,2025-01-31 09:00:00,Y29tbWVudDoxMDMzNzQ5ODUyMTE2NTExXzE2MjgxMzgyMDgwOTY4MzI=,Y29tbWVudDoxMDMzNzQ5ODUyMTE2NTExXzIxNzUzMzkzMTYxOTQ2NTE=,"if I'm more qualified, I should be hired, not because I'm a woman.",2025-02-01,reply,0
Costco,2025-01-31 09:00:00,Y29tbWVudDoxMDMzNzQ5ODUyMTE2NTExXzY0ODU4OTk5NDQ5NTI3Nw==,Y29tbWVudDoxMDMzNzQ5ODUyMTE2NTExXzY0NjkzNTQ4MTEwNTcyMA==,"good, shopping around less MAGAts sounds wonderful",2025-02-08,reply,0
Costco,2025-01-31 09:00:00,Y29tbWVudDoxMDMzNzQ5ODUyMTE2NTExXzIwNjcwNjgwOTM3NjQzOTk=,,Love Costco!,2025-02-01,initial,8
Costco,2025-01-31 09:00:00,Y29tbWVudDoxMDMzNzQ5ODUyMTE2NTExXzExMzg5MTA3Mzc2MzEwNTg=,,"we all have choices…Costco, BJ’S, or Sam’s club. Thats what makes our country good and getting better!",2025-02-01,initial,4
Costco,2025-01-31 09:00:00,Y29tbWVudDoxMDMzNzQ5ODUyMTE2NTExXzk1ODQ2NTY1NTg3NjIyNA==,,"Thank you, Costco, for standing strong about your company values and programs for success. I could not be happier that you are building a closer store to me and giving me an easy choice over Sam's. Keep up the good work!",2025-02-01,initial,59
Costco,2025-01-31 09:00:00,Y29tbWVudDoxMDMzNzQ5ODUyMTE2NTExXzE3NDQ2NDMzNDYxMDczMzM=,Y29tbWVudDoxMDMzNzQ5ODUyMTE2NTExXzk1ODQ2NTY1NTg3NjIyNA==,what are you talking about,2025-02-01,reply,1
Costco,2025-01-31 09:00:00,Y29tbWVudDoxMDMzNzQ5ODUyMTE2NTExXzg0ODk1MTQ3MDYzMDMwNg==,Y29tbWVudDoxMDMzNzQ5ODUyMTE2NTExXzk1ODQ2NTY1NTg3NjIyNA==,"Sam's is for MAGA shoppers, those with very poor taste.",2025-02-08,reply,0
Costco,2025-01-31 09:00:00,Y29tbWVudDoxMDMzNzQ5ODUyMTE2NTExXzYyMDM0MDc4MDQ4MDA5Mw==,,Love my Costco shopping and now that I have learned the DEI initiatives they have adopted have made the shopping experience more enjoyable for all customers (with commitment to meeting the wants/needs of all shoppers the main focus)and the bottom financial line stronger I will happily continue my patronage. Don’t relent to the stupidity of the Trump administration…keep your eye on the ball.,2025-02-01,initial,21
Costco,2025-01-31 09:00:00,Y29tbWVudDoxMDMzNzQ5ODUyMTE2NTExXzE2MjkwNjU4OTc2OTk1NjE=,Y29tbWVudDoxMDMzNzQ5ODUyMTE2NTExXzYyMDM0MDc4MDQ4MDA5Mw==,"While racism and bigotry are indeed stupid, it is important to call out the Trump administration for being bigoted and racist, not just stupid. Take care.",2025-02-01,reply,2
Costco,2025-01-31 09:00:00,Y29tbWVudDoxMDMzNzQ5ODUyMTE2NTExXzE0MzM3ODIwODc1ODQzNTQ=,,Watch the crude fat content in some of these products!,2025-02-01,initial,2
Costco,2025-01-31 09:00:00,Y29tbWVudDoxMDMzNzQ5ODUyMTE2NTExXzExNDY0NDMwMzA0NzQwOTM=,,Thank you Costco!! I’m not a member but I will be joining and buying stock. Love that you take care of your employees. Keep up the good work!,2025-02-01,initial,46
Costco,2025-01-31 09:00:00,Y29tbWVudDoxMDMzNzQ5ODUyMTE2NTExXzE1NTc5MTg5OTU2MTAyMDY=,Y29tbWVudDoxMDMzNzQ5ODUyMTE2NTExXzExNDY0NDMwMzA0NzQwOTM=,yeah they really take care if their employees. That's why they are about to go on strike. Just an uninformed liberal.,2025-02-01,reply,3
Costco,2025-01-31 09:00:00,Y29tbWVudDoxMDMzNzQ5ODUyMTE2NTExXzE4MTkwNTQyNTIyMjk2MDM=,Y29tbWVudDoxMDMzNzQ5ODUyMTE2NTExXzE1NTc5MTg5OTU2MTAyMDY=,"I'm so glad they help disabled, veterans, POC and LGBTQ people get hired. Everywhere else is going to not hire them even if they are just as qualified because of bigotry and use the excuse ""merit based""",2025-02-01,reply,0
Costco,2025-01-31 09:00:00,Y29tbWVudDoxMDMzNzQ5ODUyMTE2NTExXzY0MTA0NDIzODQ3ODAwOA==,,"Costco, I am coming BACK! You guys rock for supporting DEI.",2025-02-01,initial,13
Costco,2025-01-31 09:00:00,Y29tbWVudDoxMDMzNzQ5ODUyMTE2NTExXzEyNjg1Mjc0MDA5MjQzNDk=,Y29tbWVudDoxMDMzNzQ5ODUyMTE2NTExXzY0MTA0NDIzODQ3ODAwOA==,and donated to trump’s campaign,2025-02-01,reply,0
Costco,2025-01-31 09:00:00,Y29tbWVudDoxMDMzNzQ5ODUyMTE2NTExXzE1OTQ1OTAzOTQ1OTY1MjY=,Y29tbWVudDoxMDMzNzQ5ODUyMTE2NTExXzEyNjg1Mjc0MDA5MjQzNDk=,"Yep, I donated to ALL the real people. You forget that Mississippi although a Red State is 1 of many that get a huge portion of federal aid.",2025-02-01,reply,1
Costco,2025-01-31 09:00:00,Y29tbWVudDoxMDMzNzQ5ODUyMTE2NTExXzExMjU1MjAzNzIzNzE5Mzg=,,"Thank you Costco, you understood everything, keep up this excellent, emphatetic and humanitarian position",2025-02-01,initial,7
Costco,2025-01-31 09:00:00,Y29tbWVudDoxMDMzNzQ5ODUyMTE2NTExXzQzMzA4MDQ4NjA0ODg1ODQ=,,Thank you for treating your employees as they should be! I will continue to spend my money at Costco!,2025-02-01,initial,19
Costco,2025-01-31 09:00:00,Y29tbWVudDoxMDMzNzQ5ODUyMTE2NTExXzU1NTUxMTI5MDgwMzEyMQ==,,"I had stock in COSTCO because of 20/20 report I saw years ago, but never had a membership until last night. Lookout for us and we will look for you.",2025-02-01,initial,16
Costco,2025-01-31 09:00:00,Y29tbWVudDoxMDMzNzQ5ODUyMTE2NTExXzE2Njg3ODA3MDA2NjM4MTk=,,"We love you, Costco! Thank you for standing up and doing the right thing!",2025-02-01,initial,41
Costco,2025-01-31 09:00:00,Y29tbWVudDoxMDMzNzQ5ODUyMTE2NTExXzQ4NTY1ODIxNDMyMjExNA==,Y29tbWVudDoxMDMzNzQ5ODUyMTE2NTExXzE2Njg3ODA3MDA2NjM4MTk=,they donated to trump’s campaign,2025-02-01,reply,7
Costco,2025-01-31 09:00:00,Y29tbWVudDoxMDMzNzQ5ODUyMTE2NTExXzIwNjQzMTU1NDczNDM0MjM=,Y29tbWVudDoxMDMzNzQ5ODUyMTE2NTExXzQ4NTY1ODIxNDMyMjExNA==,that's a lie. Stop spreading your false information. Costco and it's board are doing the right thing when it comes to standing up against these bullies of the trump party (formally known as the Republican Party).,2025-02-01,reply,11
Costco,2025-01-31 09:00:00,Y29tbWVudDoxMDMzNzQ5ODUyMTE2NTExXzExNDM0Mzk3NDQxMDA5OTI=,Y29tbWVudDoxMDMzNzQ5ODUyMTE2NTExXzQ4NTY1ODIxNDMyMjExNA==,"As long as they saw the light after. Most Republicans are too dumb (it's facts, look at education levels of very red states) to understand fascism and communism even if very Russia like events are unfolding in the States. Even if it hit them in the face they wouldn't get it. You guys should be more upset about how Elon Musk just hijacked and shut government workers out of their accounts than a store making sure veterans, disabled, gay and POC people get jobs",2025-02-01,reply,0
Costco,2025-01-31 09:00:00,Y29tbWVudDoxMDMzNzQ5ODUyMTE2NTExXzEwMTMxNDg4MTQxNjgyMDQ=,Y29tbWVudDoxMDMzNzQ5ODUyMTE2NTExXzE2Njg3ODA3MDA2NjM4MTk=,Anti-white racism. Right?,2025-02-01,reply,0
Costco,2025-01-31 09:00:00,Y29tbWVudDoxMDMzNzQ5ODUyMTE2NTExXzYzMzI1MzYwMjQzODU1MA==,Y29tbWVudDoxMDMzNzQ5ODUyMTE2NTExXzEwMTMxNDg4MTQxNjgyMDQ=,"Not exactly: it is anti-Nazi. I like to shop where there aren't unhygienic types with their swastika shirts, hats, and tattoos.",2025-02-08,reply,0
Costco,2025-01-31 09:00:00,Y29tbWVudDoxMDMzNzQ5ODUyMTE2NTExXzEzMjkwNzUyNTE0MzQ0Mzc=,,As a shareholder and a club member I just want to say Thank you Costco for standing up and standing your ground on DEI! My husband and I will continue to invest in Costco!,2025-02-01,initial,27
Costco,2025-01-31 09:00:00,Y29tbWVudDoxMDMzNzQ5ODUyMTE2NTExXzk3NTExMDAwNDAxMzU2NA==,Y29tbWVudDoxMDMzNzQ5ODUyMTE2NTExXzEzMjkwNzUyNTE0MzQ0Mzc=,"aren’t main shareholders pushing for DEI removal? 
 youre just lining those shareholders pockets even more",2025-02-01,reply,0
Costco,2025-01-31 09:00:00,Y29tbWVudDoxMDMzNzQ5ODUyMTE2NTExXzkxODIzNDEwMzE4NzM3MTk=,Y29tbWVudDoxMDMzNzQ5ODUyMTE2NTExXzk3NTExMDAwNDAxMzU2NA==,this shareholder stands with Costco and will invest even more into Costco! If the other sharholders disagree than there’s the door! Don’t let the door hit you where the good lord split you!,2025-02-01,reply,4
Costco,2025-01-31 09:00:00,Y29tbWVudDoxMDMzNzQ5ODUyMTE2NTExXzE2OTY1MTk3MTQyOTYzODU=,Y29tbWVudDoxMDMzNzQ5ODUyMTE2NTExXzkxODIzNDEwMzE4NzM3MTk=,I quit shopping at Costco when I found out they donated to orange hitlers campaign,2025-02-01,reply,2
Costco,2025-01-31 09:00:00,Y29tbWVudDoxMDMzNzQ5ODUyMTE2NTExXzEzNTg2Mjc5MTIyNDMyMTQ=,Y29tbWVudDoxMDMzNzQ5ODUyMTE2NTExXzE2OTY1MTk3MTQyOTYzODU=,I think you are talking about Sam’s Club and walmart.,2025-02-01,reply,3
Costco,2025-01-31 09:00:00,Y29tbWVudDoxMDMzNzQ5ODUyMTE2NTExXzkzNzQ1NzE0NTAzNTE0NA==,Y29tbWVudDoxMDMzNzQ5ODUyMTE2NTExXzE2OTY1MTk3MTQyOTYzODU=,https://www.foxbusiness.com/.../costco-board-members...,2025-02-01,reply,1
Costco,2025-01-31 09:00:00,Y29tbWVudDoxMDMzNzQ5ODUyMTE2NTExXzYzNzU4MzA5NTQ5NjczNA==,Y29tbWVudDoxMDMzNzQ5ODUyMTE2NTExXzE2OTY1MTk3MTQyOTYzODU=,"lol, you lost !",2025-02-01,reply,2
Costco,2025-01-31 09:00:00,Y29tbWVudDoxMDMzNzQ5ODUyMTE2NTExXzU2Mzc2NDE2MzMyODU4NQ==,Y29tbWVudDoxMDMzNzQ5ODUyMTE2NTExXzE2OTY1MTk3MTQyOTYzODU=,i didnt realize this was a game!!,2025-02-01,reply,1
Costco,2025-01-31 09:00:00,Y29tbWVudDoxMDMzNzQ5ODUyMTE2NTExXzM5MzcxNTI1NDk4OTMyNDI=,Y29tbWVudDoxMDMzNzQ5ODUyMTE2NTExXzU2Mzc2NDE2MzMyODU4NQ==,"so you stand for discrimination, typical leftist! This is why you lost , lol",2025-02-01,reply,1
Costco,2025-01-31 09:00:00,Y29tbWVudDoxMDMzNzQ5ODUyMTE2NTExXzI1OTU4MTE5MTcyNzk3NTk=,Y29tbWVudDoxMDMzNzQ5ODUyMTE2NTExXzM5MzcxNTI1NDk4OTMyNDI=,"I think your confused! Thats whats wrong with the far right, ya’ll are very delusional.",2025-02-01,reply,2
