company_name,post_date,id,parent_id,comment_text,comment_date,comment_type,reaction_count
Costco,2025-01-31 09:00:00,Y29tbWVudDoxMDMzNzQ5ODUyMTE2NTExXzExNTY0NDAyMjI1MTYxNDU=,Y29tbWVudDoxMDMzNzQ5ODUyMTE2NTExXzI1OTU4MTE5MTcyNzk3NTk=,"ooh, I struck a nerve, lol. News flash…. it’s not “far right” to be against discrimination, and not to judge people based on gender and race, which leftist lunatics like you are obsessed with. MLK would be so disgusted with you. That’s why you lost big time last November!",2025-02-01,reply,1
Costco,2025-01-31 09:00:00,Y29tbWVudDoxMDMzNzQ5ODUyMTE2NTExXzE2NzAyMzU2NjcyNDg5ODY=,Y29tbWVudDoxMDMzNzQ5ODUyMTE2NTExXzEzOTMzMTM1MzU0MDg5OTI=,"lol, guess you can’t refute facts, 
 hopefully you’ll educate yourself and quit being so ignorant and discriminatory, leftist!",2025-02-01,reply,1
Costco,2025-01-31 09:00:00,Y29tbWVudDoxMDMzNzQ5ODUyMTE2NTExXzEyNTA5NDg4NzYwMDYwODU=,Y29tbWVudDoxMDMzNzQ5ODUyMTE2NTExXzEzOTMzMTM1MzU0MDg5OTI=,hello please joined us at Costco Bourbon Finds,2025-02-08,reply,0
Costco,2025-01-31 09:00:00,Y29tbWVudDoxMDMzNzQ5ODUyMTE2NTExXzExNDAyOTU3NDA5Nzc4ODI=,,"Why does everything have to be political!? Either youyou like the store or the product or you don’t. If you don’t,just scroll on!",2025-02-01,initial,22
Costco,2025-01-31 09:00:00,Y29tbWVudDoxMDMzNzQ5ODUyMTE2NTExXzEyOTg3ODQ5MjQ1ODAyODE=,Y29tbWVudDoxMDMzNzQ5ODUyMTE2NTExXzExNDAyOTU3NDA5Nzc4ODI=,"exactly, why do they have to be political?",2025-02-01,reply,1
Costco,2025-01-31 09:00:00,Y29tbWVudDoxMDMzNzQ5ODUyMTE2NTExXzkzNzU2NDM2ODUwMTk2Mg==,Y29tbWVudDoxMDMzNzQ5ODUyMTE2NTExXzExNDAyOTU3NDA5Nzc4ODI=,"with that response, you have changed my mind, I am now a certified idiot. Thank you......",2025-02-01,reply,0
Costco,2025-01-31 09:00:00,Y29tbWVudDoxMDMzNzQ5ODUyMTE2NTExXzE0MTI0NTQzMzM0NzIxMDg=,Y29tbWVudDoxMDMzNzQ5ODUyMTE2NTExXzkzNzU2NDM2ODUwMTk2Mg==,How is Costco continuing the same hiring practices they've had for years political? I would say that making sweeping sudden changes across the entire federal government and using DEI as a scapegoat for everything is way more political.,2025-02-01,reply,7
Costco,2025-01-31 09:00:00,Y29tbWVudDoxMDMzNzQ5ODUyMTE2NTExXzk2OTY3NDcyMTcyODg0Mw==,Y29tbWVudDoxMDMzNzQ5ODUyMTE2NTExXzExNDAyOTU3NDA5Nzc4ODI=,Joanne Moscatello DiNardo because the stores are making political moves don't be daft.,2025-02-01,reply,0
Costco,2025-01-31 09:00:00,Y29tbWVudDoxMDMzNzQ5ODUyMTE2NTExXzg5MjUzNzM0MTQxODQxNzQ=,Y29tbWVudDoxMDMzNzQ5ODUyMTE2NTExXzk2OTY3NDcyMTcyODg0Mw==,excuse me??!! My point was that this is a post about a specific product. Not the store or it’s policies.,2025-02-01,reply,1
Costco,2025-01-31 09:00:00,Y29tbWVudDoxMDMzNzQ5ODUyMTE2NTExXzk4MTMxOTc1NzI2MjEwMQ==,Y29tbWVudDoxMDMzNzQ5ODUyMTE2NTExXzg5MjUzNzM0MTQxODQxNzQ=,"people are commenting on the stores fb, not like you can post on their wall it has to be on their posts which will be about specific brands",2025-02-01,reply,0
Costco,2025-01-31 09:00:00,Y29tbWVudDoxMDMzNzQ5ODUyMTE2NTExXzkzNDkxOTE0ODM5OTgxNw==,Y29tbWVudDoxMDMzNzQ5ODUyMTE2NTExXzg5MjUzNzM0MTQxODQxNzQ=,"I still have my 1st amendment right to free speech. You just scroll out of her, you Trump worshiper!",2025-02-08,reply,0
Costco,2025-01-31 09:00:00,Y29tbWVudDoxMDMzNzQ5ODUyMTE2NTExXzM3ODQwOTc3ODE4NDM5NDg=,,Hi Costco. I’m joining today! Keep up the great work!,2025-02-01,initial,34
Costco,2025-01-31 09:00:00,Y29tbWVudDoxMDMzNzQ5ODUyMTE2NTExXzUwMzUwMzIzOTAzNDEwOA==,Y29tbWVudDoxMDMzNzQ5ODUyMTE2NTExXzM3ODQwOTc3ODE4NDM5NDg=,I joined last week. #NewCustomer,2025-02-08,reply,0
Costco,2025-01-31 09:00:00,Y29tbWVudDoxMDMzNzQ5ODUyMTE2NTExXzEwMTc2ODEwOTY4NTE2NDA=,,We love and support you Costco!!,2025-02-01,initial,31
Costco,2025-01-31 09:00:00,Y29tbWVudDoxMDMzNzQ5ODUyMTE2NTExXzY0NjI0NzQ5ODA3MDA2OQ==,Y29tbWVudDoxMDMzNzQ5ODUyMTE2NTExXzEwMTc2ODEwOTY4NTE2NDA=,they donated to trump’s campaign,2025-02-01,reply,4
Costco,2025-01-31 09:00:00,Y29tbWVudDoxMDMzNzQ5ODUyMTE2NTExXzYzODkzMjMwNTQ4MjA4Mg==,Y29tbWVudDoxMDMzNzQ5ODUyMTE2NTExXzY0NjI0NzQ5ODA3MDA2OQ==,They aren't following Donnie's plan.,2025-02-01,reply,1
Costco,2025-01-31 09:00:00,Y29tbWVudDoxMDMzNzQ5ODUyMTE2NTExXzQ4Mzc3MzEzMTIyMzQ5MA==,Y29tbWVudDoxMDMzNzQ5ODUyMTE2NTExXzY0NjI0NzQ5ODA3MDA2OQ==,most companies donate to both. Not unusual as some Dems vote for some republicans and republicans for dems,2025-02-01,reply,1
Costco,2025-01-31 09:00:00,Y29tbWVudDoxMDMzNzQ5ODUyMTE2NTExXzExMjE2MTY0OTI4NDQ5OTU=,,"I'm going to see if these are in my Costco. Those look great. I don't buy chicken products for my dogs and the beef is so hard to find, so I thank you for another great option.",2025-02-01,initial,10
Costco,2025-01-31 09:00:00,Y29tbWVudDoxMDMzNzQ5ODUyMTE2NTExXzEwODQ2NDczMzYzNzE0Nzc=,Y29tbWVudDoxMDMzNzQ5ODUyMTE2NTExXzExMjE2MTY0OTI4NDQ5OTU=,same here!,2025-02-01,reply,0
Costco,2025-01-31 09:00:00,Y29tbWVudDoxMDMzNzQ5ODUyMTE2NTExXzEzMzI0OTY4MDQ2MDM3ODM=,Y29tbWVudDoxMDMzNzQ5ODUyMTE2NTExXzExMjE2MTY0OTI4NDQ5OTU=,the freeze dried liver ones and freeze dried salmon treats have been a big hit with my dogs. Hopefully these are of the same quality.,2025-02-01,reply,0
Costco,2025-01-31 09:00:00,Y29tbWVudDoxMDMzNzQ5ODUyMTE2NTExXzMwNDUyMjk2MTg5Njg0NDI=,Y29tbWVudDoxMDMzNzQ5ODUyMTE2NTExXzEzMzI0OTY4MDQ2MDM3ODM=,my dogs absolutely did not like the freeze dried liver. I am gonna try these. Can somebody flip it over so I can see how many calories it is in a serving I’m trying to get my dog skinny. He’s too fat lol,2025-02-01,reply,0
Costco,2025-01-31 09:00:00,Y29tbWVudDoxMDMzNzQ5ODUyMTE2NTExXzU4MzQwNzE5Nzg2NTMxMQ==,,"Done, stick a fork in Costco! Won’t spend another penny with them!",2025-02-01,initial,42
Costco,2025-01-31 09:00:00,Y29tbWVudDoxMDMzNzQ5ODUyMTE2NTExXzEzNDE1OTAzNjM5MjI4Mzg=,Y29tbWVudDoxMDMzNzQ5ODUyMTE2NTExXzU4MzQwNzE5Nzg2NTMxMQ==,I'm sure they could care less ...,2025-02-01,reply,10
Costco,2025-01-31 09:00:00,Y29tbWVudDoxMDMzNzQ5ODUyMTE2NTExXzU4NTQ2NTc2NzYzNzIzMw==,Y29tbWVudDoxMDMzNzQ5ODUyMTE2NTExXzU4MzQwNzE5Nzg2NTMxMQ==,This is not the airport. No need to announce your departure. No one cares. Bye bye!,2025-02-01,reply,18
Costco,2025-01-31 09:00:00,Y29tbWVudDoxMDMzNzQ5ODUyMTE2NTExXzEzNDUzNTYwNzMzNTQ0Mzc=,Y29tbWVudDoxMDMzNzQ5ODUyMTE2NTExXzU4MzQwNzE5Nzg2NTMxMQ==,"it's okay. I got a Costco membership yesterday. Just as fast as you're leaving, you're being replaced. I'm glad Costco isn't bowing down to Cheeto HìtI3r like the rest of you weirdos.",2025-02-01,reply,2
Costco,2025-01-31 09:00:00,Y29tbWVudDoxMDMzNzQ5ODUyMTE2NTExXzEzMDIwOTIzNDEwMDY2MzY=,Y29tbWVudDoxMDMzNzQ5ODUyMTE2NTExXzEzNDUzNTYwNzMzNTQ0Mzc=,funny how Costco donated to trumps campaign,2025-02-01,reply,0
Costco,2025-01-31 09:00:00,Y29tbWVudDoxMDMzNzQ5ODUyMTE2NTExXzExNjI0NzI3NDg1NzQ0OTE=,Y29tbWVudDoxMDMzNzQ5ODUyMTE2NTExXzU4MzQwNzE5Nzg2NTMxMQ==,thank you for standing up for what’s right!,2025-02-01,reply,4
Costco,2025-01-31 09:00:00,Y29tbWVudDoxMDMzNzQ5ODUyMTE2NTExXzUzODAyNzY3NTkyNjI0MQ==,Y29tbWVudDoxMDMzNzQ5ODUyMTE2NTExXzU4MzQwNzE5Nzg2NTMxMQ==,Telling someone on the way out the door is hilarious. Your little bit of missed income won’t matter to them. They have gained thousands of NEW customers because of their stance. Get on down the road Cletus. We LOVE Costco and support them.,2025-02-01,reply,11
Costco,2025-01-31 09:00:00,Y29tbWVudDoxMDMzNzQ5ODUyMTE2NTExXzU5Njc1MTMwMzE0NjIyOQ==,Y29tbWVudDoxMDMzNzQ5ODUyMTE2NTExXzUzODAyNzY3NTkyNjI0MQ==,Watch,2025-02-01,reply,0
Costco,2025-01-31 09:00:00,Y29tbWVudDoxMDMzNzQ5ODUyMTE2NTExXzUwNTg1MDY1MjUzMTQ1Nw==,Y29tbWVudDoxMDMzNzQ5ODUyMTE2NTExXzU5Njc1MTMwMzE0NjIyOQ==,walmart is more your pace anyway,2025-02-01,reply,12
Costco,2025-01-31 09:00:00,Y29tbWVudDoxMDMzNzQ5ODUyMTE2NTExXzEyNTEzODI5MTU5NTQ2NDY=,Y29tbWVudDoxMDMzNzQ5ODUyMTE2NTExXzUwNTg1MDY1MjUzMTQ1Nw==,Next,2025-02-01,reply,0
Costco,2025-01-31 09:00:00,Y29tbWVudDoxMDMzNzQ5ODUyMTE2NTExXzUwODczNzM1ODkwNTk3NQ==,Y29tbWVudDoxMDMzNzQ5ODUyMTE2NTExXzEyNTEzODI5MTU5NTQ2NDY=,I just bought a membership to cancel yours..,2025-02-01,reply,16
Costco,2025-01-31 09:00:00,Y29tbWVudDoxMDMzNzQ5ODUyMTE2NTExXzk3NjA2MTU3NDQwNzAxMQ==,Y29tbWVudDoxMDMzNzQ5ODUyMTE2NTExXzU4MzQwNzE5Nzg2NTMxMQ==,"Boo Hoo, Costco doesn't support Nazis",2025-02-01,reply,5
Costco,2025-01-31 09:00:00,Y29tbWVudDoxMDMzNzQ5ODUyMTE2NTExXzU5MTEzMTkwMzc1NjMwNQ==,Y29tbWVudDoxMDMzNzQ5ODUyMTE2NTExXzU4MzQwNzE5Nzg2NTMxMQ==,bye bye!,2025-02-01,reply,1
Costco,2025-01-31 09:00:00,Y29tbWVudDoxMDMzNzQ5ODUyMTE2NTExXzEyOTc3NDk1NjE1NTAyNjQ=,Y29tbWVudDoxMDMzNzQ5ODUyMTE2NTExXzU5MTEzMTkwMzc1NjMwNQ==,Zealot!,2025-02-01,reply,0
Costco,2025-01-31 09:00:00,Y29tbWVudDoxMDMzNzQ5ODUyMTE2NTExXzYzMDM1MTU4OTQ5MjkzMg==,Y29tbWVudDoxMDMzNzQ5ODUyMTE2NTExXzEyOTc3NDk1NjE1NTAyNjQ=,You are the Zealot.,2025-02-01,reply,0
Costco,2025-01-31 09:00:00,Y29tbWVudDoxMDMzNzQ5ODUyMTE2NTExXzk4NDE3NzIwMDI1NTMyNA==,Y29tbWVudDoxMDMzNzQ5ODUyMTE2NTExXzYzMDM1MTU4OTQ5MjkzMg==,"Nice try zealot, find your normal wacko!",2025-02-08,reply,1
Costco,2025-01-31 09:00:00,Y29tbWVudDoxMDMzNzQ5ODUyMTE2NTExXzM0NzQyNzgxNTYyMTIwNDc=,Y29tbWVudDoxMDMzNzQ5ODUyMTE2NTExXzk4NDE3NzIwMDI1NTMyNA==,"Well, any store that is committed to diversity, equity, and inclusion definitely is not for a person who is racist and/or bigoted and/or misogynistic.",2025-02-01,reply,3
Costco,2025-01-31 09:00:00,Y29tbWVudDoxMDMzNzQ5ODUyMTE2NTExXzE3NzQ0MTc3OTMzODI0MzY=,Y29tbWVudDoxMDMzNzQ5ODUyMTE2NTExXzM0NzQyNzgxNTYyMTIwNDc=,"look, another CNN zealot",2025-02-01,reply,0
Costco,2025-01-31 09:00:00,Y29tbWVudDoxMDMzNzQ5ODUyMTE2NTExXzk2MjMwOTA5NTQzNzY1MDU=,Y29tbWVudDoxMDMzNzQ5ODUyMTE2NTExXzE3NzQ0MTc3OTMzODI0MzY=,"Anti BLM, anti critical race theory, anti wokeness and anti DEI is actually code for anti black. It’s a cover for being racist. So beware of these people around us who are really anti black.",2025-02-01,reply,5
Costco,2025-01-31 09:00:00,Y29tbWVudDoxMDMzNzQ5ODUyMTE2NTExXzExMzgzNDg5MDEzNDgxMTE=,Y29tbWVudDoxMDMzNzQ5ODUyMTE2NTExXzk2MjMwOTA5NTQzNzY1MDU=,Go drink some more bud light beer!,2025-02-01,reply,0
Costco,2025-01-31 09:00:00,Y29tbWVudDoxMDMzNzQ5ODUyMTE2NTExXzU4NTgwNjA4NzU1OTM4Nw==,Y29tbWVudDoxMDMzNzQ5ODUyMTE2NTExXzk2MjMwOTA5NTQzNzY1MDU=,hiring people based on race like dei is racist by definition. So if you support that then you’re racist and Costco is still using dei. You are the real racist.,2025-02-01,reply,0
Costco,2025-01-31 09:00:00,Y29tbWVudDoxMDMzNzQ5ODUyMTE2NTExXzQ2MDE1Mzk1MzY5ODIxMA==,Y29tbWVudDoxMDMzNzQ5ODUyMTE2NTExXzExMzgzNDg5MDEzNDgxMTE=,I think they're on the Bud Lite route.,2025-02-01,reply,2
Costco,2025-01-31 09:00:00,Y29tbWVudDoxMDMzNzQ5ODUyMTE2NTExXzYwOTI4MDE2ODc0ODU3NQ==,Y29tbWVudDoxMDMzNzQ5ODUyMTE2NTExXzU4MzQwNzE5Nzg2NTMxMQ==,"good, shopping around less MAGAts sounds wonderful",2025-02-08,reply,0
Costco,2025-01-31 09:00:00,Y29tbWVudDoxMDMzNzQ5ODUyMTE2NTExXzUxMzI1ODYxNTIxMTk5NQ==,Y29tbWVudDoxMDMzNzQ5ODUyMTE2NTExXzYwOTI4MDE2ODc0ODU3NQ==,duck duck fork!,2025-02-08,reply,0
Costco,2025-01-31 09:00:00,Y29tbWVudDoxMDMzNzQ5ODUyMTE2NTExXzIxMjUwNDIyNjEyNjU2MDE=,Y29tbWVudDoxMDMzNzQ5ODUyMTE2NTExXzYwOTI4MDE2ODc0ODU3NQ==,Enjoy!,2025-02-08,reply,0
Costco,2025-01-31 09:00:00,Y29tbWVudDoxMDMzNzQ5ODUyMTE2NTExXzk2NDYzNTk5NTI0NTY5MA==,,Dear Costco - you might as well stop posting. Nobody actually comments on the products you’re posting about. Unbelievable.,2025-02-01,initial,9
Costco,2025-01-31 09:00:00,Y29tbWVudDoxMDMzNzQ5ODUyMTE2NTExXzExNzA3NjE5NjQ2MjU3MDc=,Y29tbWVudDoxMDMzNzQ5ODUyMTE2NTExXzE1ODk2ODM3MzUyNDY1NzM=,And how many are about the product shown???,2025-02-01,reply,1
Costco,2025-01-31 09:00:00,Y29tbWVudDoxMDMzNzQ5ODUyMTE2NTExXzUzNDU0MDA5NTYyNTU5Ng==,Y29tbWVudDoxMDMzNzQ5ODUyMTE2NTExXzExNzA3NjE5NjQ2MjU3MDc=,"Nobody < 63. 63 less, to be precise.",2025-02-01,reply,0
Costco,2025-01-31 09:00:00,Y29tbWVudDoxMDMzNzQ5ODUyMTE2NTExXzE1NzU3NDIwMDMxMzYzNTM=,Y29tbWVudDoxMDMzNzQ5ODUyMTE2NTExXzk4NTU5ODY0MzQ1OTg0OA==,see above,2025-02-01,reply,0
Costco,2025-01-31 09:00:00,Y29tbWVudDoxMDMzNzQ5ODUyMTE2NTExXzYxMDIwOTEzODQxNjUwMA==,Y29tbWVudDoxMDMzNzQ5ODUyMTE2NTExXzk2NDYzNTk5NTI0NTY5MA==,you did…lol.lol,2025-02-01,reply,0
Costco,2025-01-31 09:00:00,Y29tbWVudDoxMDMzNzQ5ODUyMTE2NTExXzIwNTE5OTY4MjE5MjgxMDQ=,Y29tbWVudDoxMDMzNzQ5ODUyMTE2NTExXzYxMDIwOTEzODQxNjUwMA==,"yup, that makes one…",2025-02-01,reply,0
Costco,2025-01-31 09:00:00,Y29tbWVudDoxMDMzNzQ5ODUyMTE2NTExXzExNTUwMDU5MjYwNjMxMzU=,,"Thank you Costco for doing the right thing in support of diversity, equity, inclusion, and accessibility. Compassion and justice beat fascism every time!",2025-02-01,initial,34
Costco,2025-01-31 09:00:00,Y29tbWVudDoxMDMzNzQ5ODUyMTE2NTExXzU0MDc3Mzc3MjMwNTIxOQ==,Y29tbWVudDoxMDMzNzQ5ODUyMTE2NTExXzExNTUwMDU5MjYwNjMxMzU=,they donated to trump’s campaign,2025-02-01,reply,0
Costco,2025-01-31 09:00:00,Y29tbWVudDoxMDMzNzQ5ODUyMTE2NTExXzY1ODE0ODE4NjU1MDYxMw==,,"Hey Costco.....just a quick thanks for keeping your morals and ethics intact. I have always loved Costco and appreciate you standing with what is right in a country that is being led with such wrong. I keep on hearing people have stopped using other stores (grocery, Target, etc.) and are now joining Costco. Keep it up. You have loyal customers that stand with you on equity, diversity and inclusion. Thanks again.",2025-02-01,initial,39
Costco,2025-01-31 09:00:00,Y29tbWVudDoxMDMzNzQ5ODUyMTE2NTExXzMzODg1NzY4OTc5NDE0MDE=,Y29tbWVudDoxMDMzNzQ5ODUyMTE2NTExXzY1ODE0ODE4NjU1MDYxMw==,It's not over. Not by a long shot. https://www.forbes.com/.../costco-double-downed-on-dei.../,2025-02-01,reply,0
Costco,2025-01-31 09:00:00,Y29tbWVudDoxMDMzNzQ5ODUyMTE2NTExXzExNjA2NDYxNjI0Mjk5MzY=,Y29tbWVudDoxMDMzNzQ5ODUyMTE2NTExXzY1ODE0ODE4NjU1MDYxMw==,they donated to trump’s campaign,2025-02-01,reply,0
Costco,2025-01-31 09:00:00,Y29tbWVudDoxMDMzNzQ5ODUyMTE2NTExXzE2MTI2NzY2NDYyODMzMTM=,Y29tbWVudDoxMDMzNzQ5ODUyMTE2NTExXzExNjA2NDYxNjI0Mjk5MzY=,Companies are not allowed to make donations to political candidates. Individual employees may. MORE money was donated by individuals to the Harris campaign.,2025-02-01,reply,0
Costco,2025-01-31 09:00:00,Y29tbWVudDoxMDMzNzQ5ODUyMTE2NTExXzE0MjU5ODM3MDQ4Njg5NDM=,,Dose anyone know if simparica for dogs is cheaper here?,2025-02-08,initial,0
Costco,2025-01-31 09:00:00,Y29tbWVudDoxMDMzNzQ5ODUyMTE2NTExXzExMjcxNDg3MDU1NTA4NzM=,,We need more stores in Kansas.,2025-02-01,initial,4
Costco,2025-01-31 09:00:00,Y29tbWVudDoxMDMzNzQ5ODUyMTE2NTExXzUyNzAzMTQ5MzcyNzQzNg==,,"Anti BLM, anti critical race theory, anti wokeness and anti DEI is actually code for anti black. It’s a cover for being racist. So beware of these people around us who are really anti black.",2025-02-01,initial,3
Costco,2025-01-31 09:00:00,Y29tbWVudDoxMDMzNzQ5ODUyMTE2NTExXzU4MTQ5NzUxMTQyMTEzOA==,,Thank you for standing firm against the facists now trying to control our country! You are my favorite store!,2025-02-01,initial,4
Costco,2025-01-31 09:00:00,Y29tbWVudDoxMDMzNzQ5ODUyMTE2NTExXzM0ODA2NjExOTIyNDM1OTg=,Y29tbWVudDoxMDMzNzQ5ODUyMTE2NTExXzU4MTQ5NzUxMTQyMTEzOA==,hello please joined us at Costco Bourbon Finds,2025-02-08,reply,0
Costco,2025-01-31 09:00:00,Y29tbWVudDoxMDMzNzQ5ODUyMTE2NTExXzU5NDY0MTAzNjY0NTM3OA==,,Why did it take me so long to join. Thank you.,2025-02-01,initial,2
Costco,2025-01-31 09:00:00,Y29tbWVudDoxMDMzNzQ5ODUyMTE2NTExXzk5MzQ3OTA4NTk5NjIzNQ==,,Thank you for being a great company!,2025-02-01,initial,2
Costco,2025-01-31 09:00:00,Y29tbWVudDoxMDMzNzQ5ODUyMTE2NTExXzExODY1NTY1NDI4OTYzMjI=,,Proud Costco member! Thank you for standing up for all Americans!,2025-02-01,initial,3
Costco,2025-01-31 09:00:00,Y29tbWVudDoxMDMzNzQ5ODUyMTE2NTExXzkxMzM0NTMzNzYzMDk2OQ==,,I want to say that the nearest Costco is 2 hours away but we are seriously considering a membership just to support your standing strong on policy and conviction.,2025-02-01,initial,4
Costco,2025-01-31 09:00:00,Y29tbWVudDoxMDMzNzQ5ODUyMTE2NTExXzY0MjA2NDQwMTcxMTY2MQ==,,71-year-old white guy from Idaho here. I've been a satisfied Costco customer for over 25 years and fully support your refusal to terminate DEI efforts.,2025-02-01,initial,4
Costco,2025-01-31 09:00:00,Y29tbWVudDoxMDMzNzQ5ODUyMTE2NTExXzU5Njk5NzMwNjgyMDAwNA==,Y29tbWVudDoxMDMzNzQ5ODUyMTE2NTExXzY0MjA2NDQwMTcxMTY2MQ==,"why did you say you are ""white""?",2025-02-01,reply,0
Costco,2025-01-31 09:00:00,Y29tbWVudDoxMDMzNzQ5ODUyMTE2NTExXzEzMTA1MDgxNTM1MjMwMzI=,Y29tbWVudDoxMDMzNzQ5ODUyMTE2NTExXzU5Njk5NzMwNjgyMDAwNA==,"To help dispel the illusion that all white people, especially from the blood red state of Idaho, are racist jerkwads.",2025-02-01,reply,1
Costco,2025-01-31 09:00:00,Y29tbWVudDoxMDMzNzQ5ODUyMTE2NTExXzU5OTM4MTIwOTYyNTg3NA==,Y29tbWVudDoxMDMzNzQ5ODUyMTE2NTExXzEzMTA1MDgxNTM1MjMwMzI=,so what your saying is that you are one of those people who think the majority of white people who live in red states are racist,2025-02-01,reply,0
Costco,2025-01-31 09:00:00,Y29tbWVudDoxMDMzNzQ5ODUyMTE2NTExXzI1MjczMDkxNzA3OTg0NzU=,Y29tbWVudDoxMDMzNzQ5ODUyMTE2NTExXzEzMTA1MDgxNTM1MjMwMzI=,You left out the part about your hatred for Caucasians.,2025-02-01,reply,1
Costco,2025-01-31 09:00:00,Y29tbWVudDoxMDMzNzQ5ODUyMTE2NTExXzkyMjQxNDk0Njc2NTQzNQ==,,Can we see back of the package?,2025-02-01,initial,2
Costco,2025-01-31 09:00:00,Y29tbWVudDoxMDMzNzQ5ODUyMTE2NTExXzE4MzI3NjY2MDM5MzA3NDM=,,Love Costco.,2025-02-01,initial,3
Costco,2025-01-31 09:00:00,Y29tbWVudDoxMDMzNzQ5ODUyMTE2NTExXzEzNDI0MDcyNzAyMzE2NDQ=,,Best place to shop,2025-02-08,initial,0
Costco,2025-01-31 09:00:00,Y29tbWVudDoxMDMzNzQ5ODUyMTE2NTExXzk1NTY5ODM5OTQ5NjI3MQ==,,Continuing to go woke is gonna get ya broke,2025-02-01,initial,3
Costco,2025-01-31 09:00:00,Y29tbWVudDoxMDMzNzQ5ODUyMTE2NTExXzYzNzg5NTE1MjA1NDM0MA==,Y29tbWVudDoxMDMzNzQ5ODUyMTE2NTExXzk1NTY5ODM5OTQ5NjI3MQ==,yet warehouses are still completely packed this boycott isn't working,2025-02-08,reply,1
Costco,2025-01-31 09:00:00,Y29tbWVudDoxMDMzNzQ5ODUyMTE2NTExXzY2MjIyNDgyNjM5MTEyMw==,Y29tbWVudDoxMDMzNzQ5ODUyMTE2NTExXzYzNzg5NTE1MjA1NDM0MA==,"That's how ignorant you are that you think it happens over night. Enjoy your woke policies of teaching your kids they can change genders and hire people based on race. You are the true racists. Enjoy your American Family insurance through Costco who is tanking. Embrace your destiny and destroy yourselves. I'll be here saying ""I told ya so""",2025-02-08,reply,0
Costco,2025-01-31 09:00:00,Y29tbWVudDoxMDMzNzQ5ODUyMTE2NTExXzU0NDA2NTcyMTk3NTcyMw==,,Would yall be willing to use your philanthropy fund and help me save my family home? My grandmother is selling it. And none of the banks would give me a mortgage because of my student loans. I'll pay yall back monthly. I just don't have the 190k sitting around. Please. Please help me.,2025-02-01,initial,9
Costco,2025-01-31 09:00:00,Y29tbWVudDoxMDMzNzQ5ODUyMTE2NTExXzU4NTMzNDA0NzY3NDUyNw==,Y29tbWVudDoxMDMzNzQ5ODUyMTE2NTExXzU0NDA2NTcyMTk3NTcyMw==,"Victoria Young , you’ve got some nerve. Go stand on a street corner with a cardboard sign. It’s the same thing. Get another job if you don’t already have one and WORK WORK WORK INSTEAD OF BEGGING. You got to be freaking crazy if you think anyone is going to hand you over $190 k. You are pathetic.",2025-02-01,reply,3
Costco,2025-01-31 09:00:00,Y29tbWVudDoxMDMzNzQ5ODUyMTE2NTExXzE5ODQ3NTI2NTUzMzM4NTI=,Y29tbWVudDoxMDMzNzQ5ODUyMTE2NTExXzU4NTMzNDA0NzY3NDUyNw==,"one day you will know what it's like to care about something so much you are willing to do anything. Don't make any assumption about what I've done thus far. Also, I literally said i would pay them back monthly, like a mortgage. So...not a handout. OK boomer?",2025-02-01,reply,0
Costco,2025-01-31 09:00:00,Y29tbWVudDoxMDMzNzQ5ODUyMTE2NTExXzkyNDc0MTEwOTgxODEzMg==,Y29tbWVudDoxMDMzNzQ5ODUyMTE2NTExXzE5ODQ3NTI2NTUzMzM4NTI=,", you might one maybe two payments then totally skip the rest. How long do you think it would take to pay back?190k?",2025-02-01,reply,0
Costco,2025-01-31 09:00:00,Y29tbWVudDoxMDMzNzQ5ODUyMTE2NTExXzU5ODg0NTQwMzEwNTMzNw==,Y29tbWVudDoxMDMzNzQ5ODUyMTE2NTExXzE5ODQ3NTI2NTUzMzM4NTI=,"pay back one loan before taking another. 
 if they paid you how long must they wait since you still have student loans to pay back",2025-02-01,reply,0
Costco,2025-01-31 09:00:00,Y29tbWVudDoxMDMzNzQ5ODUyMTE2NTExXzEzMjU3MTYzODIyMTE3ODY=,Y29tbWVudDoxMDMzNzQ5ODUyMTE2NTExXzU0NDA2NTcyMTk3NTcyMw==,You’re not willing to to do anything. That’s why you haven’t asked your parents.,2025-02-01,reply,0
Costco,2025-01-31 09:00:00,Y29tbWVudDoxMDMzNzQ5ODUyMTE2NTExXzYyMzU2OTM0MzUwODc2OQ==,,Thank you Costco,2025-02-01,initial,3
Costco,2025-01-31 09:00:00,Y29tbWVudDoxMDMzNzQ5ODUyMTE2NTExXzExNTMzMTYxMjk1MjEyNTI=,,"""Did love Costco"" but they do not represent what the majority of Americans want and voted for. Fact check me on election results.",2025-02-08,initial,1
Costco,2025-01-31 09:00:00,Y29tbWVudDoxMDMzNzQ5ODUyMTE2NTExXzExMDg2NDI4Njc4NDAxMzA=,,Not at my Costco !,2025-02-08,initial,0
Costco,2025-01-31 09:00:00,Y29tbWVudDoxMDMzNzQ5ODUyMTE2NTExXzEyOTA1NzkyMTU1MzM2OTE=,,Love Costco,2025-02-08,initial,0
Costco,2025-01-31 09:00:00,Y29tbWVudDoxMDMzNzQ5ODUyMTE2NTExXzYxMjE0MDM3MTc1MTc4Mw==,,"Avoid this US company, shop at a Canadian chain.. Sobeys, Safeway..",2025-02-01,initial,1
Costco,2025-01-31 09:00:00,Y29tbWVudDoxMDMzNzQ5ODUyMTE2NTExXzEyODUxNjUwNDI3MzU2ODg=,,"As late as last year, the FAA was recruiting those with targeted disabilities, including “hearing, vision, missing extremities, partial paralysis, complete paralysis, epilepsy, severe intellectual disability, psychiatric disability and dwarfism.” The recruitment began during the Obama administration and appears to have continued through Mr. Trump’s first term and into Mr. Biden’s presidency.",2025-02-01,initial,16
Costco,2025-01-31 09:00:00,Y29tbWVudDoxMDMzNzQ5ODUyMTE2NTExXzE2MDkzMjAyMDcxMjkzNzA=,Y29tbWVudDoxMDMzNzQ5ODUyMTE2NTExXzEyODUxNjUwNDI3MzU2ODg=,"Chaplain John Luza Jr. If Jesus were real, he'd laugh react to this.",2025-02-01,reply,6
Costco,2025-01-31 09:00:00,Y29tbWVudDoxMDMzNzQ5ODUyMTE2NTExXzEzNzQ4OTA0NTcwMTEwNDU=,Y29tbWVudDoxMDMzNzQ5ODUyMTE2NTExXzE2MDkzMjAyMDcxMjkzNzA=,"these three people were praying to God, a different times when the Lord sent me, the second one says it, the third one it saved his life. You can see the emotion in his face…",2025-02-01,reply,0
Costco,2025-01-31 09:00:00,Y29tbWVudDoxMDMzNzQ5ODUyMTE2NTExXzEyMTYwMzg5ODMyNzQxMjQ=,Y29tbWVudDoxMDMzNzQ5ODUyMTE2NTExXzEzNzQ4OTA0NTcwMTEwNDU=,glad I don't attend your church. You voted for a rapist.,2025-02-01,reply,6
Costco,2025-01-31 09:00:00,Y29tbWVudDoxMDMzNzQ5ODUyMTE2NTExXzE2NzQ3ODQ0ODMxMzMyMTM=,Y29tbWVudDoxMDMzNzQ5ODUyMTE2NTExXzEyMTYwMzg5ODMyNzQxMjQ=,"sticks and stones… The 100% is made up fiction story, it never happened if you had any common sense, something that never happened in 1995 doesn’t come up until 2022. There’s no fax no evidence,",2025-02-01,reply,1
Costco,2025-01-31 09:00:00,Y29tbWVudDoxMDMzNzQ5ODUyMTE2NTExXzk4NTk1NjA0MzQ0NjIxNg==,Y29tbWVudDoxMDMzNzQ5ODUyMTE2NTExXzE2NzQ3ODQ0ODMxMzMyMTM=,Not even reading what you wrote. You're opinion means nothing to me...,2025-02-01,reply,2
Costco,2025-01-31 09:00:00,Y29tbWVudDoxMDMzNzQ5ODUyMTE2NTExXzExMjE5MjU1NDI1OTA2MjE=,Y29tbWVudDoxMDMzNzQ5ODUyMTE2NTExXzk4NTk1NjA0MzQ0NjIxNg==,"So you're against fairness and hiring based on merit, which is what DEI is all about. Good to know.",2025-02-01,reply,1
Costco,2025-01-31 09:00:00,Y29tbWVudDoxMDMzNzQ5ODUyMTE2NTExXzEyMjk2MzgwMzUxOTAzNTc=,Y29tbWVudDoxMDMzNzQ5ODUyMTE2NTExXzM3NTA4NTI0NDE3MjcwMzY=,WTF??,2025-02-01,reply,1
Costco,2025-01-31 09:00:00,Y29tbWVudDoxMDMzNzQ5ODUyMTE2NTExXzEzNzY5ODYzNzY3OTYwNzM=,Y29tbWVudDoxMDMzNzQ5ODUyMTE2NTExXzE4MDc3OTA3NzY2NzU5NjI=,"the ignorant unstable twist the truth, and it ends in their utter destruction 2 Pet 3:16",2025-02-08,reply,0
Costco,2025-01-31 09:00:00,Y29tbWVudDoxMDMzNzQ5ODUyMTE2NTExXzExMjg5Mzc1MTg3MjM5NDU=,,Love you Costco,2025-02-01,initial,2
Costco,2025-01-31 09:00:00,Y29tbWVudDoxMDMzNzQ5ODUyMTE2NTExXzU5ODk0Mjc3OTcwMzUxOQ==,,"Canceled my membership, currently returning everything I've bought from costco, my furniture, appliances, clothes, TVs. I'm done with these libtards!",2025-02-01,initial,6
Costco,2025-01-31 09:00:00,Y29tbWVudDoxMDMzNzQ5ODUyMTE2NTExXzkyMzUwMjY3OTk1Njg4MA==,Y29tbWVudDoxMDMzNzQ5ODUyMTE2NTExXzU5ODk0Mjc3OTcwMzUxOQ==,"wow, you sure sound stupid. You're really going to love prices going up because of those tariffs from your god. Idiot.",2025-02-01,reply,1
Costco,2025-01-31 09:00:00,Y29tbWVudDoxMDMzNzQ5ODUyMTE2NTExXzEzMjg0MDk5NTgxOTAzOTg=,Y29tbWVudDoxMDMzNzQ5ODUyMTE2NTExXzU5ODk0Mjc3OTcwMzUxOQ==,"so long, fascist!",2025-02-01,reply,1
Costco,2025-01-31 09:00:00,Y29tbWVudDoxMDMzNzQ5ODUyMTE2NTExXzEwODE5NjM1ODM3MzAyMDk=,Y29tbWVudDoxMDMzNzQ5ODUyMTE2NTExXzEzMjg0MDk5NTgxOTAzOTg=,so long libtard,2025-02-01,reply,0
Costco,2025-01-31 09:00:00,Y29tbWVudDoxMDMzNzQ5ODUyMTE2NTExXzkyMTY1MDM3MzM3MTc5NQ==,Y29tbWVudDoxMDMzNzQ5ODUyMTE2NTExXzEwODE5NjM1ODM3MzAyMDk=,I’m so sure…,2025-02-01,reply,0
Costco,2025-01-31 09:00:00,Y29tbWVudDoxMDMzNzQ5ODUyMTE2NTExXzIwNDQwNzI1MDkzNTk0NDA=,Y29tbWVudDoxMDMzNzQ5ODUyMTE2NTExXzEwODE5NjM1ODM3MzAyMDk=,also big words coming from a wuss hiding behind a blank profile. Too scared to show your face?,2025-02-01,reply,1
Costco,2025-01-31 09:00:00,Y29tbWVudDoxMDMzNzQ5ODUyMTE2NTExXzk1NDQzODQwOTk5MTMyNg==,Y29tbWVudDoxMDMzNzQ5ODUyMTE2NTExXzIwNDQwNzI1MDkzNTk0NDA=,probably a Russian bot.,2025-02-01,reply,0
Costco,2025-01-31 09:00:00,Y29tbWVudDoxMDMzNzQ5ODUyMTE2NTExXzUxNzA0MDA5ODA2MzE5Ng==,Y29tbWVudDoxMDMzNzQ5ODUyMTE2NTExXzk1NDQzODQwOTk5MTMyNg==,he’s an idiot is what he is,2025-02-01,reply,1
Costco,2025-01-31 09:00:00,Y29tbWVudDoxMDMzNzQ5ODUyMTE2NTExXzE3Nzk1MzQ2MTYyMzI3NzU=,Y29tbWVudDoxMDMzNzQ5ODUyMTE2NTExXzU5ODk0Mjc3OTcwMzUxOQ==,"good, shopping around less MAGAts sounds wonderful",2025-02-08,reply,0
Costco,2025-01-31 09:00:00,Y29tbWVudDoxMDMzNzQ5ODUyMTE2NTExXzYwMjEyNzkxMjYwNDQ2MA==,,Can you turn it around so I can see how many calories it is per serving and the size of a serving,2025-02-01,initial,0
