company_name,post_date,id,parent_id,comment_text,comment_date,comment_type,reaction_count
Costco,2025-02-18 15:25:00,Y29tbWVudDoxMDQ3NDEzOTcwNzUwMDk5XzM5MTMyMzMzODIyMjMzNjI=,,"When will West Lafayette, IN get a Costco?",2025-02-23,initial,0
Costco,2025-02-18 15:25:00,Y29tbWVudDoxMDQ3NDEzOTcwNzUwMDk5XzY0MjAyMTQzODM4MzA0NA==,,When doing an advertisement…please post the price of gas,2025-02-23,initial,5
Costco,2025-02-18 15:25:00,Y29tbWVudDoxMDQ3NDEzOTcwNzUwMDk5XzEyODM3MzczNzI3MDcxODY=,Y29tbWVudDoxMDQ3NDEzOTcwNzUwMDk5XzY0MjAyMTQzODM4MzA0NA==,"Not sure how that would work, as we aren't even in the same country, so the prices would be different.",2025-02-23,reply,2
Costco,2025-02-18 15:25:00,Y29tbWVudDoxMDQ3NDEzOTcwNzUwMDk5Xzk0OTQ5ODU2NDA1NjQ1MzQ=,Y29tbWVudDoxMDQ3NDEzOTcwNzUwMDk5XzY0MjAyMTQzODM4MzA0NA==,you do realize that varies from store to store. Biased on the cost of living in the area.,2025-02-23,reply,0
Costco,2025-02-18 15:25:00,Y29tbWVudDoxMDQ3NDEzOTcwNzUwMDk5XzExNzA3OTQyMzQ2MjU4OTk=,Y29tbWVudDoxMDQ3NDEzOTcwNzUwMDk5XzY0MjAyMTQzODM4MzA0NA==,it changes daily.,2025-02-23,reply,0
Costco,2025-02-18 15:25:00,Y29tbWVudDoxMDQ3NDEzOTcwNzUwMDk5XzE1NTcyNTkxNzQ5ODAyNDE=,Y29tbWVudDoxMDQ3NDEzOTcwNzUwMDk5XzY0MjAyMTQzODM4MzA0NA==,"you do realize that this post is nationwide, possibly worldwide, and they can’t post the cost of gas at every warehouse they have in the U.S./world??",2025-02-23,reply,1
Costco,2025-02-18 15:25:00,Y29tbWVudDoxMDQ3NDEzOTcwNzUwMDk5Xzk3NTQxMzc3MDcxNDAxMg==,Y29tbWVudDoxMDQ3NDEzOTcwNzUwMDk5XzE1NTcyNTkxNzQ5ODAyNDE=,"no I didn’t 
what I thought I was referring to was as your driving by to have a sign like all the other gas stations do…instead of having to drive in and see what the price is",2025-02-23,reply,1
Costco,2025-02-18 15:25:00,Y29tbWVudDoxMDQ3NDEzOTcwNzUwMDk5Xzk4MTI4NDAxNDE0NzEwNA==,Y29tbWVudDoxMDQ3NDEzOTcwNzUwMDk5Xzk3NTQxMzc3MDcxNDAxMg==,ah. I don’t think they’ll ever do that. Do you have the app? The app shows the price at each location.,2025-02-23,reply,1
Costco,2025-02-18 15:25:00,Y29tbWVudDoxMDQ3NDEzOTcwNzUwMDk5XzExMzE3ODAzMzQ5MTg2OTU=,Y29tbWVudDoxMDQ3NDEzOTcwNzUwMDk5XzY0MjAyMTQzODM4MzA0NA==,"you can look it up at costco website when you enter your location, call the warehouse or use the costco app.",2025-02-23,reply,1
Costco,2025-02-18 15:25:00,Y29tbWVudDoxMDQ3NDEzOTcwNzUwMDk5XzY1NzIzNjcxMDA3ODAxNw==,Y29tbWVudDoxMDQ3NDEzOTcwNzUwMDk5Xzk3NTQxMzc3MDcxNDAxMg==,Which Costo? Which Country? Which State? Which City? Are you getting it!,2025-02-23,reply,1
Costco,2025-02-18 15:25:00,Y29tbWVudDoxMDQ3NDEzOTcwNzUwMDk5XzExNDEwODY3MDA5OTcxMDg=,Y29tbWVudDoxMDQ3NDEzOTcwNzUwMDk5XzY0MjAyMTQzODM4MzA0NA==,You can find it in the Costco app. It’s pretty cool to see there lowest and highest prices around the nation.,2025-02-23,reply,0
Costco,2025-02-18 15:25:00,Y29tbWVudDoxMDQ3NDEzOTcwNzUwMDk5XzE2ODQxOTUzMzI1MTIzOTc=,,Costco should be open later especially in The Weeknd’s. The hours aren’t feasible for in store shopping,2025-02-23,initial,4
Costco,2025-02-18 15:25:00,Y29tbWVudDoxMDQ3NDEzOTcwNzUwMDk5XzY3NjUzMzIyNDcwMDY2Nw==,,That’s great but can you open the car wash at same time?,2025-02-23,initial,2
Costco,2025-02-18 15:25:00,Y29tbWVudDoxMDQ3NDEzOTcwNzUwMDk5Xzk1MDEzODM4ODY1NzMzMTA=,,I’m wondering why this is newsworthy?,2025-02-23,initial,0
Costco,2025-02-18 15:25:00,Y29tbWVudDoxMDQ3NDEzOTcwNzUwMDk5XzkxMjkzNDcxMzM4MDAyNzA=,Y29tbWVudDoxMDQ3NDEzOTcwNzUwMDk5Xzk1MDEzODM4ODY1NzMzMTA=,you idiot! this is a Costco platform!,2025-02-23,reply,1
Costco,2025-02-18 15:25:00,Y29tbWVudDoxMDQ3NDEzOTcwNzUwMDk5XzEzNTkxMDQ4NzIyMDc0OTg=,Y29tbWVudDoxMDQ3NDEzOTcwNzUwMDk5XzkxMjkzNDcxMzM4MDAyNzA=,showed up in my news feed. Do your research before you embarrass yourself so completely.,2025-02-23,reply,1
Costco,2025-02-18 15:25:00,Y29tbWVudDoxMDQ3NDEzOTcwNzUwMDk5XzQ2NDY2MzAxMzI2NjkxNA==,Y29tbWVudDoxMDQ3NDEzOTcwNzUwMDk5XzkxMjkzNDcxMzM4MDAyNzA=,you must of voted for trump,2025-03-02,reply,1
Costco,2025-02-18 15:25:00,Y29tbWVudDoxMDQ3NDEzOTcwNzUwMDk5XzEwOTQ0ODE2MjYwMjM3NjY=,Y29tbWVudDoxMDQ3NDEzOTcwNzUwMDk5XzkxMjkzNDcxMzM4MDAyNzA=,you confirmed my suspicions,2025-03-02,reply,1
Costco,2025-02-18 15:25:00,Y29tbWVudDoxMDQ3NDEzOTcwNzUwMDk5XzYwOTk5NTQ2NTE1NTIzNg==,Y29tbWVudDoxMDQ3NDEzOTcwNzUwMDk5XzEwOTQ0ODE2MjYwMjM3NjY=,"Why all the hate over Costco gas station hours? Karen, you are a real sweet heart. Enjoy your hate filled life.",2025-03-02,reply,0
Costco,2025-02-18 15:25:00,Y29tbWVudDoxMDQ3NDEzOTcwNzUwMDk5Xzk4ODM0MTU2OTQyNzUzMw==,,Does this include Canada as well?,2025-02-23,initial,2
Costco,2025-02-18 15:25:00,Y29tbWVudDoxMDQ3NDEzOTcwNzUwMDk5XzYwMjM1OTY1MjU5ODQzNg==,Y29tbWVudDoxMDQ3NDEzOTcwNzUwMDk5Xzk4ODM0MTU2OTQyNzUzMw==,when Canada becomes our 51st state.,2025-02-23,reply,3
Costco,2025-02-18 15:25:00,Y29tbWVudDoxMDQ3NDEzOTcwNzUwMDk5XzU4OTcxNzg2NDA5NzEwNg==,Y29tbWVudDoxMDQ3NDEzOTcwNzUwMDk5Xzk4ODM0MTU2OTQyNzUzMw==,No,2025-02-23,reply,1
Costco,2025-02-18 15:25:00,Y29tbWVudDoxMDQ3NDEzOTcwNzUwMDk5XzE1NjczNDA5NTM5NzQ5MTQ=,,I don’t get that benefit being a Costco membership because they don’t have diesel fuel.,2025-02-23,initial,0
Costco,2025-02-18 15:25:00,Y29tbWVudDoxMDQ3NDEzOTcwNzUwMDk5XzE4MDQ2MjA5MDAzODEwNTc=,,"Avon, MA and Everett, MA stores need the gas stations.",2025-02-23,initial,1
Costco,2025-02-18 15:25:00,Y29tbWVudDoxMDQ3NDEzOTcwNzUwMDk5XzQ0MjMyMTkxODg3MTE3Ng==,,Costco Does the app say when the gas station is closed for compliance testing?,2025-02-23,initial,0
Costco,2025-02-18 15:25:00,Y29tbWVudDoxMDQ3NDEzOTcwNzUwMDk5XzkwNTA0ODE3MTUzNzk2MQ==,Y29tbWVudDoxMDQ3NDEzOTcwNzUwMDk5XzQ0MjMyMTkxODg3MTE3Ng==,No at least in my state it's random they show up to check a few pumps.,2025-02-23,reply,1
Costco,2025-02-18 15:25:00,Y29tbWVudDoxMDQ3NDEzOTcwNzUwMDk5XzE3MzY2ODEzOTM5MzkwMjM=,,"My local Costco business closed Sunday for a long time, now they open 7 days......",2025-02-23,initial,0
Costco,2025-02-18 15:25:00,Y29tbWVudDoxMDQ3NDEzOTcwNzUwMDk5XzEzMzA4Njc0NTgzMzE5NTM=,,our Costco doesn’t provide gas pumps.,2025-02-23,initial,1
Costco,2025-02-18 15:25:00,Y29tbWVudDoxMDQ3NDEzOTcwNzUwMDk5Xzk2ODE3ODQzNTUxNjY1MTM=,,Why can’t the pumps be 24 hours ?,2025-02-23,initial,1
Costco,2025-02-18 15:25:00,Y29tbWVudDoxMDQ3NDEzOTcwNzUwMDk5XzYwMDA3NTI4OTUzNjEyMQ==,,Mine has def hours than this but good !,2025-02-23,initial,1
Costco,2025-02-18 15:25:00,Y29tbWVudDoxMDQ3NDEzOTcwNzUwMDk5Xzk5MjI2MTcxOTQ3MDM4Nw==,,Is this in Canada too?,2025-02-23,initial,0
Costco,2025-02-18 15:25:00,Y29tbWVudDoxMDQ3NDEzOTcwNzUwMDk5XzE2Mjc2NzMzNTE0NjYxMzQ=,,Are you hiring in teterboro NJ?,2025-02-23,initial,0
Costco,2025-02-18 15:25:00,Y29tbWVudDoxMDQ3NDEzOTcwNzUwMDk5XzEzNzE4MTk0NzQxODQyMjY=,,Wish actual warehouse opens later than 6PM on Saturdays...,2025-02-23,initial,1
Costco,2025-02-18 15:25:00,Y29tbWVudDoxMDQ3NDEzOTcwNzUwMDk5XzEwMDE1ODExNzUyMDY0NTA=,,How about bringing back diesel fuel to Irvine?,2025-02-23,initial,2
Costco,2025-02-18 15:25:00,Y29tbWVudDoxMDQ3NDEzOTcwNzUwMDk5XzE3OTE3OTU4MTgyNzk1MDc=,,"On the other hand, lines would move much quicker if people were prepared before they get to the pump. On average I can pump 3-6 gallons before unprepared people start pumping. When you’re in a line, why do you reach for your wallet or purse once you get to the pump??? Tapping with the Citi Costco card or scanning with the app both work great and are super quick. The app is actually my preferred method now.",2025-03-09,initial,0
Costco,2025-02-18 15:25:00,Y29tbWVudDoxMDQ3NDEzOTcwNzUwMDk5XzM5NTI0NTU5ODE3NDA4OTI=,,I will never understand why people pay a fee to shop for the same prices elsewhere,2025-02-23,initial,1
Costco,2025-02-18 15:25:00,Y29tbWVudDoxMDQ3NDEzOTcwNzUwMDk5XzEzMzc2ODIzNzczNjc5Njg=,,This is nice but it sucks for the employees.,2025-02-23,initial,0
Costco,2025-02-18 15:25:00,Y29tbWVudDoxMDQ3NDEzOTcwNzUwMDk5Xzk5MDAzNjE0OTcwNjI4Mw==,,Now if they would change the store hours to 8 to 8:30 pm I would shop there!!,2025-02-23,initial,3
Costco,2025-02-18 15:25:00,Y29tbWVudDoxMDQ3NDEzOTcwNzUwMDk5XzEwMjMxOTE2Mjk2NDE1NDI=,,Poway Costco is 5:30am-10 pm. Nothing has really changed except staying open a 1/2 hour later. Weekend is still the same times.,2025-02-23,initial,2
Costco,2025-02-18 15:25:00,Y29tbWVudDoxMDQ3NDEzOTcwNzUwMDk5XzE2MDY3ODYwNjY3MDg0MzY=,,What about pre-Covid shopping hours?,2025-02-23,initial,3
Costco,2025-02-18 15:25:00,Y29tbWVudDoxMDQ3NDEzOTcwNzUwMDk5XzUwMzM4ODIzMjc5NDEyMA==,,How come gas is considerably higher than others in town right now?,2025-02-23,initial,3
Costco,2025-02-18 15:25:00,Y29tbWVudDoxMDQ3NDEzOTcwNzUwMDk5Xzk2ODI0NTcwMTYwMTA0Nw==,,Bring back the Combo Pizza,2025-02-23,initial,1
Costco,2025-02-18 15:25:00,Y29tbWVudDoxMDQ3NDEzOTcwNzUwMDk5XzExNzAyMjk5Mjc4NTAxNzg=,,"Does this include Canada, the nation you are at war with, or is it only the United States of Mexico?",2025-02-23,initial,0
Costco,2025-02-18 15:25:00,Y29tbWVudDoxMDQ3NDEzOTcwNzUwMDk5XzExNjk4OTUzNDc4MTExNjM=,,Is it in Perrysburg Ohio & Toledo Ohio locations?,2025-02-23,initial,2
Costco,2025-02-18 15:25:00,Y29tbWVudDoxMDQ3NDEzOTcwNzUwMDk5XzYzOTkzOTI4ODU3MTU2MQ==,,"Awesome! Please try to open the car wash at the Torrance location one hour earlier. I don't believe the ""trial"" was long enough!",2025-02-23,initial,0
Costco,2025-02-18 15:25:00,Y29tbWVudDoxMDQ3NDEzOTcwNzUwMDk5XzYxNjgxNjY0NDQ2NjUzNg==,,It’s the same price as any other gas station,2025-02-23,initial,1
Costco,2025-02-18 15:25:00,Y29tbWVudDoxMDQ3NDEzOTcwNzUwMDk5XzY1ODA2MzU2OTkwMDQ1OA==,,Marissa dad is gonna love this. He can get gas before work now!,2025-02-23,initial,1
Costco,2025-02-18 15:25:00,Y29tbWVudDoxMDQ3NDEzOTcwNzUwMDk5XzM3NTY4MTA1NDc5NTE2NDM=,,"I don't understand why the pumps aren't 24hours. They are self service, you can only use debt or credit and you have scan you membership card..... wait I do understand you want the pumps to draw people into the store.",2025-02-23,initial,2
Costco,2025-02-18 15:25:00,Y29tbWVudDoxMDQ3NDEzOTcwNzUwMDk5XzUwNzc3ODg5NTMwNDk1NQ==,,When does this change take effect?,2025-02-23,initial,0
Costco,2025-02-18 15:25:00,Y29tbWVudDoxMDQ3NDEzOTcwNzUwMDk5Xzk4ODM5NjYyNTk2NTk2Ng==,,Can we get diesel in the Dallas area locations?,2025-02-23,initial,0
Costco,2025-02-18 15:25:00,Y29tbWVudDoxMDQ3NDEzOTcwNzUwMDk5XzExODA4MzU2MzM2MzQxNTQ=,,"No Costco in Flagstaff, but hey, we have two Walmarts and a Sam's Club.",2025-02-23,initial,0
Costco,2025-02-18 15:25:00,Y29tbWVudDoxMDQ3NDEzOTcwNzUwMDk5XzM4Mzk2NDA1MzYyOTk0NjQ=,,And now we are waiting for EV charging stations,2025-02-23,initial,1
Costco,2025-02-18 15:25:00,Y29tbWVudDoxMDQ3NDEzOTcwNzUwMDk5Xzk0NjE5MjM1NDMxMDYxMw==,,Costco bring back diesel please!,2025-02-23,initial,1
Costco,2025-02-18 15:25:00,Y29tbWVudDoxMDQ3NDEzOTcwNzUwMDk5XzE2MzMwMTEzNDgwOTk2MjY=,,No more 530am?????,2025-02-23,initial,1
Costco,2025-02-18 15:25:00,Y29tbWVudDoxMDQ3NDEzOTcwNzUwMDk5XzU1NjM3NjAzMDE5NTkyNA==,,Lines are always so long at our Costco. Not with the wait,2025-02-23,initial,0
Costco,2025-02-18 15:25:00,Y29tbWVudDoxMDQ3NDEzOTcwNzUwMDk5XzIwNjk0ODk1MjY4OTY2MjQ=,,This is fantastic news!,2025-02-23,initial,1
Costco,2025-02-18 15:25:00,Y29tbWVudDoxMDQ3NDEzOTcwNzUwMDk5XzE2OTEzMTAyNTE3OTE2MzE=,,I go just for my steaks not gas there a station close to a location in my town 24 hrs cheaper and sometimes the same and no line,2025-02-23,initial,0
Costco,2025-02-18 15:25:00,Y29tbWVudDoxMDQ3NDEzOTcwNzUwMDk5XzYyMDY3NDY4NzQxNTUyOA==,,Now match the store hours to the gas hours. Or at least open at 7am Monday -Saturday. I got stuff to do.,2025-02-23,initial,2
Costco,2025-02-18 15:25:00,Y29tbWVudDoxMDQ3NDEzOTcwNzUwMDk5XzE5NDkxOTkxMDg4MjE5MDc=,,Costco should put vending machines at its gas stations. Water and other products would sell,2025-02-23,initial,1
Costco,2025-02-18 15:25:00,Y29tbWVudDoxMDQ3NDEzOTcwNzUwMDk5XzUxNzA1NjE3NDMyNzgwNA==,,We need Costco car chargers!!!,2025-02-23,initial,6
Costco,2025-02-18 15:25:00,Y29tbWVudDoxMDQ3NDEzOTcwNzUwMDk5Xzk3NDQwNjYyNzU4Nzc2Mw==,,They use to open at 5 am,2025-02-23,initial,0
Costco,2025-02-18 15:25:00,Y29tbWVudDoxMDQ3NDEzOTcwNzUwMDk5XzExMTU2NDM5NDM2NDYxOTQ=,,Costco needs diesel too.,2025-02-23,initial,3
Costco,2025-02-18 15:25:00,Y29tbWVudDoxMDQ3NDEzOTcwNzUwMDk5XzU3MTIyNzU0MjA0MjU4MA==,,I go to the Costco liquor in Woodbury and they are always 6 or 7 deep at each pump. Good plan.,2025-02-23,initial,1
Costco,2025-02-18 15:25:00,Y29tbWVudDoxMDQ3NDEzOTcwNzUwMDk5XzYxNDE5MTg1Nzk5NzE1MA==,,Costco you should consider adding diesel fuel at the pumps... just a thought,2025-02-23,initial,4
Costco,2025-02-18 15:25:00,Y29tbWVudDoxMDQ3NDEzOTcwNzUwMDk5XzEzMTU2ODc1NTYzNjc2MjU=,,When did they changed their hours & why did they do it?,2025-02-23,initial,1
Costco,2025-02-18 15:25:00,Y29tbWVudDoxMDQ3NDEzOTcwNzUwMDk5Xzk2OTQzODAyODQ4ODkzMA==,Y29tbWVudDoxMDQ3NDEzOTcwNzUwMDk5XzEzMTU2ODc1NTYzNjc2MjU=,"within the past few days. The reason for the 
 post! To let consumers know!!",2025-02-23,reply,0
Costco,2025-02-18 15:25:00,Y29tbWVudDoxMDQ3NDEzOTcwNzUwMDk5XzE3NTEyOTMxOTkxMzQzNjg=,Y29tbWVudDoxMDQ3NDEzOTcwNzUwMDk5XzEzMTU2ODc1NTYzNjc2MjU=,to allow more people to get gas,2025-02-23,reply,2
Costco,2025-02-18 15:25:00,Y29tbWVudDoxMDQ3NDEzOTcwNzUwMDk5XzIwMDY2NDg1MDMxOTM2NzU=,,Thank you for putting Diesel at every pump in Prescott Az!!! We used to only have 1 row then they built a new station and put it in every pump!!!,2025-02-23,initial,1
Costco,2025-02-18 15:25:00,Y29tbWVudDoxMDQ3NDEzOTcwNzUwMDk5XzU3MzA3NjUzMjQxNjQ5NA==,Y29tbWVudDoxMDQ3NDEzOTcwNzUwMDk5XzIwMDY2NDg1MDMxOTM2NzU=,we have a new Costco in Surprise and they have zero diesel pumps,2025-02-23,reply,1
Costco,2025-02-18 15:25:00,Y29tbWVudDoxMDQ3NDEzOTcwNzUwMDk5XzExMzc1OTcxMzgwNjM0NTc=,,"Beside the cheapest gas , 5% rebate back into Costco account",2025-02-23,initial,1
Costco,2025-02-18 15:25:00,Y29tbWVudDoxMDQ3NDEzOTcwNzUwMDk5XzEzMDI3Mjc3MjA5NDA5MjY=,,It's great to see local businesses adapting to better serve their customers.,2025-03-02,initial,0
Costco,2025-02-18 15:25:00,Y29tbWVudDoxMDQ3NDEzOTcwNzUwMDk5XzExMzk1MjUwNTQzOTI0ODk=,,Open gas stations earlier! Please,2025-02-23,initial,0
Costco,2025-02-18 15:25:00,Y29tbWVudDoxMDQ3NDEzOTcwNzUwMDk5XzEyODE3OTMzNzk1NjIwMjQ=,,They don’t post the prices at the entrance at the Costcos in our area for some reason,2025-02-23,initial,0
Costco,2025-02-18 15:25:00,Y29tbWVudDoxMDQ3NDEzOTcwNzUwMDk5XzQ5MTQzOTAzMDQ1OTY2Mw==,,Why would I need that for the US. I am in Canada,2025-02-23,initial,1
Costco,2025-02-18 15:25:00,Y29tbWVudDoxMDQ3NDEzOTcwNzUwMDk5XzkxOTY3ODE1MDA4NDk0Ng==,,Should be 24/7 with attendants only on duty during certain times. Also you need to add EV quick chargers at every location.,2025-02-23,initial,4
Costco,2025-02-18 15:25:00,Y29tbWVudDoxMDQ3NDEzOTcwNzUwMDk5XzU1NDk3NjY5MDMzNTc5OQ==,,Now you just need Diesel pumps in MN!,2025-02-23,initial,3
Costco,2025-02-18 15:25:00,Y29tbWVudDoxMDQ3NDEzOTcwNzUwMDk5XzkyMzY3NDA2NDMwNDc5NDA=,,Favorite gas station!,2025-02-23,initial,4
Costco,2025-02-18 15:25:00,Y29tbWVudDoxMDQ3NDEzOTcwNzUwMDk5XzE2NjM3OTQxNDEyMDM4MjU=,,Take a half an hour on the front end and put it on tge back end. Costco near me gas opened ay 530am,2025-02-23,initial,0
Costco,2025-02-18 15:25:00,Y29tbWVudDoxMDQ3NDEzOTcwNzUwMDk5XzE4ODQ4Nzk2Nzg5NTExOTA=,,Wish Costco would bring diesel back to our stations. Smh.,2025-02-23,initial,2
Costco,2025-02-18 15:25:00,Y29tbWVudDoxMDQ3NDEzOTcwNzUwMDk5XzEyMTg3NTE5NDI5MzM1NDU=,,Don't have any nearby,2025-02-23,initial,1
Costco,2025-02-18 15:25:00,Y29tbWVudDoxMDQ3NDEzOTcwNzUwMDk5XzIwMjI1MTczNDQ5MTMzMzY=,,Can you be open till 8pm on Saturdays like sams club?,2025-02-23,initial,2
Costco,2025-02-18 15:25:00,Y29tbWVudDoxMDQ3NDEzOTcwNzUwMDk5XzYyNjM1MDU5NzAwNTgxMg==,,"I’d love to enjoy this Costco if y’all would put a warehouse in WACO, TEXAS!!!!!!!!!!!!!!",2025-02-23,initial,0
Costco,2025-02-18 15:25:00,Y29tbWVudDoxMDQ3NDEzOTcwNzUwMDk5XzUwODE0OTUwMTk1OTczMQ==,,"Waiting for our gas station at St Johns town center, in Jacksonville can't wait.",2025-02-23,initial,2
Costco,2025-02-18 15:25:00,Y29tbWVudDoxMDQ3NDEzOTcwNzUwMDk5XzU5NjMyNTEyMzI3OTMxMA==,,"What happens is someone goes to pump on the opposite side of their gas tank and stretches the hose, that's great, except getting around that person is a bit more tricky cause they are standing out...",2025-02-23,initial,0
Costco,2025-02-18 15:25:00,Y29tbWVudDoxMDQ3NDEzOTcwNzUwMDk5XzEwMDEzMTEwODY1MzgzNTMw,,There are many people waiting before 5:30am to get gas so they can get to work and now you changed that time to 6am? Why?,2025-02-23,initial,1
Costco,2025-02-18 15:25:00,Y29tbWVudDoxMDQ3NDEzOTcwNzUwMDk5XzIwODQ5MzE2MDg2MjY1MDI=,,Bring Diesel fuel to a few pumps please.,2025-02-23,initial,3
Costco,2025-02-18 15:25:00,Y29tbWVudDoxMDQ3NDEzOTcwNzUwMDk5XzExNDEwNDEzMDQyMzkxMDA=,,They need to open earlier in our town of Hanford. 9 am.,2025-02-23,initial,0
Costco,2025-02-18 15:25:00,Y29tbWVudDoxMDQ3NDEzOTcwNzUwMDk5XzYxNzIyNTczMTAzMzY1Mw==,,I wish the Medicine Hat Costco sold diesel…,2025-02-23,initial,1
Costco,2025-02-18 15:25:00,Y29tbWVudDoxMDQ3NDEzOTcwNzUwMDk5XzEwMTE2NTE4Mjc0ODgxNDA=,,It’s the little things that matter and this is awesome news! With work I’m always needing gas later in the day. Thank you!,2025-02-23,initial,0
Costco,2025-02-18 15:25:00,Y29tbWVudDoxMDQ3NDEzOTcwNzUwMDk5XzYxMDQwMzg0MTYxMjY3MQ==,,This is great but the different Sat and Sun hours are going to get confusing…. Why not just make them the same on the weekend??,2025-02-23,initial,0
Costco,2025-02-18 15:25:00,Y29tbWVudDoxMDQ3NDEzOTcwNzUwMDk5Xzk5MTIzODE1NjQ0NjEyMg==,,So it looks like they only moved from 9:30 to 10 weekday and from 8 PM to 8:30 PM on Saturdays. No granted I’m not complaining that extra half an hour. That helps dramatically. This is at the Fullerton Costco.,2025-02-23,initial,1
Costco,2025-02-18 15:25:00,Y29tbWVudDoxMDQ3NDEzOTcwNzUwMDk5XzE1NzkxNTkyNTYxMzI5ODg=,,bet the employees are thrilled. then open up the warehouse at 8 am and close later,2025-02-23,initial,2
Costco,2025-02-18 15:25:00,Y29tbWVudDoxMDQ3NDEzOTcwNzUwMDk5XzE3MjAzMTc1MzE5MTczOTg=,,I get my gas at Sam’s because Costco never has their price Visible￼. I’m a member of both.,2025-02-23,initial,4
Costco,2025-02-18 15:25:00,Y29tbWVudDoxMDQ3NDEzOTcwNzUwMDk5XzY1NTk3OTE1MDQyNTI0OA==,,"I’m trying to figure out who at Costco thought it was a great idea to place the new Costco in Daytona Beach right across from the Daytona International Speedway? Us residents stay away from the tourist trap areas of DAB, and the location is terrible traffic wise.",2025-02-23,initial,2
Costco,2025-02-18 15:25:00,Y29tbWVudDoxMDQ3NDEzOTcwNzUwMDk5XzE0MTMzODUxMTM0MDI2OTE=,,Costco Gas by me is More than other stations.,2025-02-23,initial,1
Costco,2025-02-18 15:25:00,Y29tbWVudDoxMDQ3NDEzOTcwNzUwMDk5XzExNjMzOTIyOTUyOTIyMDI=,,"Good, now open the store earlier at least for the executive level members. SAM'S Cup Plus members get this perk. Some of us need to get things done before 10 am and without having to compete with the general shoppers.",2025-02-23,initial,4
Costco,2025-02-18 15:25:00,Y29tbWVudDoxMDQ3NDEzOTcwNzUwMDk5XzYxMzcyOTcyODMwNjI3OA==,,Open the warehouse earlier too please!!,2025-02-23,initial,1
Costco,2025-02-18 15:25:00,Y29tbWVudDoxMDQ3NDEzOTcwNzUwMDk5Xzk4NjM4NjE2MjgyNDc3Mg==,,not sure why costco got rid of diesel,2025-02-23,initial,2
Costco,2025-02-18 15:25:00,Y29tbWVudDoxMDQ3NDEzOTcwNzUwMDk5XzExNDk2OTI1MTk5NTgxNDk=,,Yes! I have soooo needed this extra 30 minutes for meetings that last until 9:30!,2025-03-02,initial,1
Costco,2025-02-18 15:25:00,Y29tbWVudDoxMDQ3NDEzOTcwNzUwMDk5XzYwNzc2NDUyODg0NzE2Ng==,,UP the price AND extend your hours. Why are we not getting the same savings we were getting 6 months ago??,2025-02-23,initial,0
Costco,2025-02-18 15:25:00,Y29tbWVudDoxMDQ3NDEzOTcwNzUwMDk5XzE4OTUwMTI5ODQ2NDIzNDA=,,Now if they could do a scan n’ go like Sam’s. That would make Costco even better.,2025-02-23,initial,1
Costco,2025-02-18 15:25:00,Y29tbWVudDoxMDQ3NDEzOTcwNzUwMDk5XzExNDU3NzA3NjM3MTEzNTU=,,should just have them open 24/7. people know how to pump gas and credit cards are needed anyways,2025-02-23,initial,0
Costco,2025-02-18 15:25:00,Y29tbWVudDoxMDQ3NDEzOTcwNzUwMDk5Xzk5NDExMTcxNjExMTk3Nw==,,"same in sevierville TN with all the tourist stuff, a BJ is going in guess costco lost out.",2025-02-23,initial,1
Costco,2025-02-18 15:25:00,Y29tbWVudDoxMDQ3NDEzOTcwNzUwMDk5XzIzMTYzNzc0ODU0MDQyMzU=,,"The 2 stores that are in my town are so busy, I'm to the point of canceling my membership. They replaced a store 18 months ago, and it made it worse for congestion.",2025-02-23,initial,1
Costco,2025-02-18 15:25:00,Y29tbWVudDoxMDQ3NDEzOTcwNzUwMDk5XzE4MDgyNTA1ODk5NzcxMTU=,,GREAT NEWS. Love Costco in Oregon. Having someone pump gas for you is awesome,2025-02-23,initial,3
Costco,2025-02-18 15:25:00,Y29tbWVudDoxMDQ3NDEzOTcwNzUwMDk5XzY1MzQ4MDkzNzEwMDc2MA==,,"now my hour and a half or 2 Hour drive to the nearest one, maybe be less of a waste of time. ￼ what I can’t understand is why there are two in South Carolina a half an hour from each other and two in the Greensboro Winston-Salem area there are a half an hour apart from each other, but why you can’t build one in the Asheville area",2025-02-23,initial,1
Costco,2025-02-18 15:25:00,Y29tbWVudDoxMDQ3NDEzOTcwNzUwMDk5XzY2MDQ1MjYyOTY0NTAzNw==,,I can confirmed the time in my local Costco. It used to be 5:30am but I’m guessing that is 2 early to open.,2025-02-23,initial,0
Costco,2025-02-18 15:25:00,Y29tbWVudDoxMDQ3NDEzOTcwNzUwMDk5Xzk4NjM2OTQwNjczOTQyMQ==,,Please bring back the gas key fob. It was awesome!,2025-02-23,initial,0
Costco,2025-02-18 15:25:00,Y29tbWVudDoxMDQ3NDEzOTcwNzUwMDk5XzQ5NDcwMjE4MDM0Njc4Mw==,,Yes! Local hours match this. And warehouse opens 9:30 on Saturday.,2025-02-23,initial,2
Costco,2025-02-18 15:25:00,Y29tbWVudDoxMDQ3NDEzOTcwNzUwMDk5XzE4MjE4NzkwNzg1NzM1MDU=,,"They are probably getting gas every day because they are afraid that if they wait, tomorrow’s price will be higher.",2025-02-23,initial,0
Costco,2025-02-18 15:25:00,Y29tbWVudDoxMDQ3NDEzOTcwNzUwMDk5XzE3NjE0Njk3NTgwMzU1MTY=,,"Open in Spearfish, South Dakota!!!!",2025-02-23,initial,1
Costco,2025-02-18 15:25:00,Y29tbWVudDoxMDQ3NDEzOTcwNzUwMDk5XzM5MDUwNTUyNDMwNTg4MzA=,,How about 24 hours!,2025-02-23,initial,1
Costco,2025-02-18 15:25:00,Y29tbWVudDoxMDQ3NDEzOTcwNzUwMDk5XzEyOTYyNTM5OTQ5NDQ3NzU=,,Awesome- now I have to memorize a whole new set of gas hours!,2025-02-23,initial,1
Costco,2025-02-18 15:25:00,Y29tbWVudDoxMDQ3NDEzOTcwNzUwMDk5XzE4NzMwMDEzODM0NDEzNzc=,,Love the 6am open times!!!,2025-02-23,initial,4
Costco,2025-02-18 15:25:00,Y29tbWVudDoxMDQ3NDEzOTcwNzUwMDk5XzExOTMyNDE4NTU2NjQ5Mzg=,,"Costco petrol used to be quite a bit cheaper but not so much now. Only get it from there now if in the area otherwise the few pence it saves is used up driving there lol 
 x",2025-03-02,initial,0
Costco,2025-02-18 15:25:00,Y29tbWVudDoxMDQ3NDEzOTcwNzUwMDk5XzY0MjQwNDQzNTAwNTQ2MA==,,If only the warehouse could open at 9,2025-02-23,initial,4
Costco,2025-02-18 15:25:00,Y29tbWVudDoxMDQ3NDEzOTcwNzUwMDk5XzExNTYzOTAyOTU4NzcyMDQ=,,The store needs to stay open later. Some people work and it's hard to make it during the few hours of operation. I can't believe I pay for a membership.,2025-02-23,initial,1
Costco,2025-02-18 15:25:00,Y29tbWVudDoxMDQ3NDEzOTcwNzUwMDk5XzE5OTcxNDMyNTQxMDMwOTI=,,Now we want diesel back!n,2025-02-23,initial,2
Costco,2025-02-18 15:25:00,Y29tbWVudDoxMDQ3NDEzOTcwNzUwMDk5XzE0MTQ5MDM4Nzk4ODMxNTY=,,Expand your EV charging stations. Please.....,2025-02-23,initial,5
Costco,2025-02-18 15:25:00,Y29tbWVudDoxMDQ3NDEzOTcwNzUwMDk5XzIwNDE1NzkzMDI5NzUyOTU=,Y29tbWVudDoxMDQ3NDEzOTcwNzUwMDk5XzE0MTQ5MDM4Nzk4ODMxNTY=,"it’s not worth it for costco at the moment. Gas is more profitable. It takes an average person 4 mins to pump gas and go. EV cars average 15 mins to charge and go. Then you have to build and make space for the chargers unless you make it at the main parking lot. Well then you will have customers that drive gas vehicles parking at the EV stations since it’s closer. Finding parking to shop at costco is already a nightmare. I can see them making 6 charging station max by the gas stations. Until EV makes about 15% or more of cars sold in America, it won’t expand by much.",2025-02-23,reply,1
Costco,2025-02-18 15:25:00,Y29tbWVudDoxMDQ3NDEzOTcwNzUwMDk5XzUyNzYzMTgyMzE1MjEzNw==,Y29tbWVudDoxMDQ3NDEzOTcwNzUwMDk5XzE0MTQ5MDM4Nzk4ODMxNTY=,"it’s a waste, they won’t do it.",2025-02-23,reply,1
Costco,2025-02-18 15:25:00,Y29tbWVudDoxMDQ3NDEzOTcwNzUwMDk5XzkzMzU0ODExMjMwNTA5Ng==,,I just said I need to start getting my gas from Costco.,2025-02-23,initial,0
Costco,2025-02-18 15:25:00,Y29tbWVudDoxMDQ3NDEzOTcwNzUwMDk5XzUzMzI0MzA5MjUzOTE1NA==,,Thank you for being awesome. And also for supporting DEI.,2025-02-23,initial,0
Costco,2025-02-18 15:25:00,Y29tbWVudDoxMDQ3NDEzOTcwNzUwMDk5XzEyODQwODkzMzk1MzUyODE=,,We need Costco gas in Salinas Ca,2025-02-23,initial,3
Costco,2025-02-18 15:25:00,Y29tbWVudDoxMDQ3NDEzOTcwNzUwMDk5XzExNDM0NjM2MTQxNDUwNTA=,,Won’t be shopping at Costco any more-until USA appreciates Canadians.,2025-02-23,initial,3
Costco,2025-02-18 15:25:00,Y29tbWVudDoxMDQ3NDEzOTcwNzUwMDk5XzExODAzMTcyNjAwOTI0OTY=,,Is this for real??,2025-02-23,initial,3
Costco,2025-02-18 15:25:00,Y29tbWVudDoxMDQ3NDEzOTcwNzUwMDk5XzE3NzMxMjIyNTY1OTU0MzE=,Y29tbWVudDoxMDQ3NDEzOTcwNzUwMDk5XzExODAzMTcyNjAwOTI0OTY=,yes according to their website.,2025-02-23,reply,1
Costco,2025-02-18 15:25:00,Y29tbWVudDoxMDQ3NDEzOTcwNzUwMDk5Xzk2MzQyODY0Njk5MzY2MTQ=,Y29tbWVudDoxMDQ3NDEzOTcwNzUwMDk5XzExODAzMTcyNjAwOTI0OTY=,why wouldn't it be?,2025-02-23,reply,0
Costco,2025-02-18 15:25:00,Y29tbWVudDoxMDQ3NDEzOTcwNzUwMDk5XzM4MDgzODk2NzkzNzU0MDE=,,"Thank you - especially welcome during ""Season"" in SW FL!",2025-02-23,initial,2
Costco,2025-02-18 15:25:00,Y29tbWVudDoxMDQ3NDEzOTcwNzUwMDk5XzExNjM3NTk1ODUyNDM4NTQ=,Y29tbWVudDoxMDQ3NDEzOTcwNzUwMDk5XzM4MDgzODk2NzkzNzU0MDE=,"what season? Summer x4 here 
 but I’m glad it will be off daylight savings time soon",2025-02-23,reply,0
