company_name,post_date,id,parent_id,comment_text,comment_date,comment_type,reaction_count
Costco,2025-02-18 15:25:00,Y29tbWVudDoxMDQ3NDEzOTcwNzUwMDk5XzEwMjg1ODk1MDI0Mjc3Njk=,,Now keep the warehouses open until 9 or 9:30 Monday-Saturday and until 7 or 8 on Sundays.,2025-02-23,initial,3
Costco,2025-02-18 15:25:00,Y29tbWVudDoxMDQ3NDEzOTcwNzUwMDk5XzgxOTY1NzA5MzY3NTQ4MQ==,,I hope that is just stores in the US.,2025-02-23,initial,2
Costco,2025-02-18 15:25:00,Y29tbWVudDoxMDQ3NDEzOTcwNzUwMDk5XzIwODg2NzEzNTgyNDAzOTQ=,Y29tbWVudDoxMDQ3NDEzOTcwNzUwMDk5XzgxOTY1NzA5MzY3NTQ4MQ==,Why would you go out of country to buy gas?,2025-02-23,reply,0
Costco,2025-02-18 15:25:00,Y29tbWVudDoxMDQ3NDEzOTcwNzUwMDk5Xzg0OTM1NjQ5Mzk2NDYzNw==,,You're making my daily commute so much easier!,2025-02-23,initial,0
Costco,2025-02-18 15:25:00,Y29tbWVudDoxMDQ3NDEzOTcwNzUwMDk5XzEzMzEzODg5MDc5OTAwMzE=,,The Costco Gas near me opens at 5:30 M-F and closes at 10…. This new math is hard.,2025-02-23,initial,2
Costco,2025-02-18 15:25:00,Y29tbWVudDoxMDQ3NDEzOTcwNzUwMDk5Xzk1MDc4Mjg5MzkwNTkwMg==,,Get rid of the Bio-Diesel please just 100% diesel from crude oil..,2025-02-23,initial,2
Costco,2025-02-18 15:25:00,Y29tbWVudDoxMDQ3NDEzOTcwNzUwMDk5XzYxOTg1NjQxNzQzMTA0OQ==,,is your web site down?,2025-02-23,initial,0
Costco,2025-02-18 15:25:00,Y29tbWVudDoxMDQ3NDEzOTcwNzUwMDk5XzEzOTYxODU4NTEzNjU0OTE=,,"Good. Thats how it was precovid, @106 2008 but at 624 not sure if ever that late",2025-02-23,initial,0
Costco,2025-02-18 15:25:00,Y29tbWVudDoxMDQ3NDEzOTcwNzUwMDk5XzExMjI2NDM0MTkzNTk1NDg=,,Doesn't seem their prices are in a lower than anyone else. Can't see The hubb bub,2025-02-23,initial,1
Costco,2025-02-18 15:25:00,Y29tbWVudDoxMDQ3NDEzOTcwNzUwMDk5XzUxMzMyMTQ3ODQ1MzgxNw==,Y29tbWVudDoxMDQ3NDEzOTcwNzUwMDk5XzExMjI2NDM0MTkzNTk1NDg=,if gas is 2.99 it’s 2.68 there,2025-02-23,reply,0
Costco,2025-02-18 15:25:00,Y29tbWVudDoxMDQ3NDEzOTcwNzUwMDk5XzEzNTQ2MDg5MzU3MjExNjQ=,,Don't buy appliances from Costco. Their logistics and scheduling is from the 1940s.,2025-02-23,initial,1
Costco,2025-02-18 15:25:00,Y29tbWVudDoxMDQ3NDEzOTcwNzUwMDk5XzY2MTI5NjQyNjM2ODM4NA==,,"THIS LOOKS BAD,TOO MANY CARS IN THIS IS A KINE JAM",2025-03-16,initial,0
Costco,2025-02-18 15:25:00,Y29tbWVudDoxMDQ3NDEzOTcwNzUwMDk5XzExNzM5NjU2MTQzMjYxMzc=,,How about posting the price of gas before we get in line?,2025-02-23,initial,5
Costco,2025-02-18 15:25:00,Y29tbWVudDoxMDQ3NDEzOTcwNzUwMDk5XzM0NzU1NTU3NTExOTU5NQ==,Y29tbWVudDoxMDQ3NDEzOTcwNzUwMDk5XzExNzM5NjU2MTQzMjYxMzc=,I check the website before I head over,2025-02-23,reply,5
Costco,2025-02-18 15:25:00,Y29tbWVudDoxMDQ3NDEzOTcwNzUwMDk5XzY3MzkwMDg1NDk3MTQ5NA==,Y29tbWVudDoxMDQ3NDEzOTcwNzUwMDk5XzExNzM5NjU2MTQzMjYxMzc=,how about you look it up on the app like everyone else does?!,2025-02-23,reply,0
Costco,2025-02-18 15:25:00,Y29tbWVudDoxMDQ3NDEzOTcwNzUwMDk5XzU5MDg4ODEwMzc2NjU2MA==,Y29tbWVudDoxMDQ3NDEzOTcwNzUwMDk5XzExNzM5NjU2MTQzMjYxMzc=,gas prices are on the app,2025-02-23,reply,7
Costco,2025-02-18 15:25:00,Y29tbWVudDoxMDQ3NDEzOTcwNzUwMDk5Xzk0Mzg3MzQ4NDE3NDY2OA==,Y29tbWVudDoxMDQ3NDEzOTcwNzUwMDk5XzExNzM5NjU2MTQzMjYxMzc=,It's still cheaper than any other gas station so why bother?,2025-02-23,reply,0
Costco,2025-02-18 15:25:00,Y29tbWVudDoxMDQ3NDEzOTcwNzUwMDk5XzUwMTIzNTAxOTQ0MzAxMA==,Y29tbWVudDoxMDQ3NDEzOTcwNzUwMDk5XzExNzM5NjU2MTQzMjYxMzc=,get the Costco app,2025-02-23,reply,3
Costco,2025-02-18 15:25:00,Y29tbWVudDoxMDQ3NDEzOTcwNzUwMDk5XzEzNDQyMzQ1MTM2OTUzMzk=,,I love the 6am open. It’s fast and almost no cars.,2025-02-23,initial,2
Costco,2025-02-18 15:25:00,Y29tbWVudDoxMDQ3NDEzOTcwNzUwMDk5XzE0MTgxMzc3NDMyNDM5MDc=,,"I wish they had gas station in Nashua,NH.",2025-02-23,initial,1
Costco,2025-02-18 15:25:00,Y29tbWVudDoxMDQ3NDEzOTcwNzUwMDk5XzEzNTgwNjg2NTkwNTM2NDc=,,Costco in Mayfield Hts just changed the station hours to 8pm closing on Sundays. Download the app and check your local warehouse station hours.,2025-02-23,initial,1
Costco,2025-02-18 15:25:00,Y29tbWVudDoxMDQ3NDEzOTcwNzUwMDk5XzE2MTc5NDkwNzkwODU0NzM=,,YES! I love the extended weekend hours. Thank you!,2025-02-23,initial,3
Costco,2025-02-18 15:25:00,Y29tbWVudDoxMDQ3NDEzOTcwNzUwMDk5XzE2OTg1MTQzMjQ0MjM5MTk=,,Still won’t be able to get near the pumps in season,2025-02-23,initial,1
Costco,2025-02-18 15:25:00,Y29tbWVudDoxMDQ3NDEzOTcwNzUwMDk5Xzk1NjA1NjczMzM2NzIyMQ==,,Our Costco has been out of gas for almost 2 weeks now. ￼,2025-02-23,initial,2
Costco,2025-02-18 15:25:00,Y29tbWVudDoxMDQ3NDEzOTcwNzUwMDk5XzQxMzU3MTI1ODQ4NDI4MQ==,,Thank you Costco!,2025-02-23,initial,1
Costco,2025-02-18 15:25:00,Y29tbWVudDoxMDQ3NDEzOTcwNzUwMDk5Xzk4ODkzNjE3NjE5MTA0OA==,,Costco needs to read these comments and then take note!,2025-03-02,initial,0
Costco,2025-02-18 15:25:00,Y29tbWVudDoxMDQ3NDEzOTcwNzUwMDk5XzkyNjExNzU3MjY3MDU5Nw==,,Ripley's believe-it or not. I live in county that doesn't allow Costco to sell gas or alcohol.,2025-02-23,initial,2
Costco,2025-02-18 15:25:00,Y29tbWVudDoxMDQ3NDEzOTcwNzUwMDk5XzYwODk4MzYzNTQ0NTc4MA==,,"Pay for a membership to get fuel more expensive, what a perfect idea",2025-02-23,initial,1
Costco,2025-02-18 15:25:00,Y29tbWVudDoxMDQ3NDEzOTcwNzUwMDk5XzEwMTAzNjQ1NDc4MjQ2MzI=,Y29tbWVudDoxMDQ3NDEzOTcwNzUwMDk5XzYwODk4MzYzNTQ0NTc4MA==,I pay 20 to 25 cents a gallon less at Costco.,2025-02-23,reply,0
Costco,2025-02-18 15:25:00,Y29tbWVudDoxMDQ3NDEzOTcwNzUwMDk5Xzk2MzEyMDc5MjYxNjI3MA==,,Why not 24hrs????,2025-02-23,initial,0
Costco,2025-02-18 15:25:00,Y29tbWVudDoxMDQ3NDEzOTcwNzUwMDk5XzI2Njg2NjY3NDAxODc4NTM=,Y29tbWVudDoxMDQ3NDEzOTcwNzUwMDk5Xzk2MzEyMDc5MjYxNjI3MA==,they don't want employees there 24 hours,2025-02-23,reply,0
Costco,2025-02-18 15:25:00,Y29tbWVudDoxMDQ3NDEzOTcwNzUwMDk5XzExNTI5MjE4MDMyODE3OTk=,,Gas hours aren’t the problem. The store hours are what is horrible! BJs is open 4 hours longer every day than Costco and never crowded!,2025-02-23,initial,0
Costco,2025-02-18 15:25:00,Y29tbWVudDoxMDQ3NDEzOTcwNzUwMDk5XzIwNzg5NjUzNjI1NDE4MjE=,,We just need a Costco in northwest Arkansas. We would cancel our Sam’s card for a Costco card.,2025-02-23,initial,0
Costco,2025-02-18 15:25:00,Y29tbWVudDoxMDQ3NDEzOTcwNzUwMDk5XzExNjI2MTk4NDIxOTAyMjY=,,"About time, costco is crazy dangerous for gas",2025-02-23,initial,2
Costco,2025-02-18 15:25:00,Y29tbWVudDoxMDQ3NDEzOTcwNzUwMDk5XzM0NzkyODkwNDkwNDYwNTI=,Y29tbWVudDoxMDQ3NDEzOTcwNzUwMDk5XzExNjI2MTk4NDIxOTAyMjY=,"naaa, you just don't know how to drive.",2025-02-23,reply,0
Costco,2025-02-18 15:25:00,Y29tbWVudDoxMDQ3NDEzOTcwNzUwMDk5XzE2MDI4NjU3ODcyNjUxNjE=,,When is Salinas getting a costco gas station?? And a second costco store for that matter??? That place is a congestion nightmare both out and indoors!!!,2025-02-23,initial,0
Costco,2025-02-18 15:25:00,Y29tbWVudDoxMDQ3NDEzOTcwNzUwMDk5XzYxNzg2NjU4NDE4MzMzNw==,,Extended warehouse hours on the weekends would be lovely!!!,2025-02-23,initial,2
Costco,2025-02-18 15:25:00,Y29tbWVudDoxMDQ3NDEzOTcwNzUwMDk5XzkxNjY2ODAzMzAwODU5NDg=,,Store hours are fine,2025-02-23,initial,2
Costco,2025-02-18 15:25:00,Y29tbWVudDoxMDQ3NDEzOTcwNzUwMDk5XzE2NzcxMjYwOTk4ODk0OTc=,,is it the same in canada as well ?,2025-02-23,initial,0
Costco,2025-02-18 15:25:00,Y29tbWVudDoxMDQ3NDEzOTcwNzUwMDk5XzYxMDM0MTU0NTI5NjgzMQ==,,That’s one way to get more sales,2025-02-23,initial,1
Costco,2025-02-18 15:25:00,Y29tbWVudDoxMDQ3NDEzOTcwNzUwMDk5XzEwMzE1NTk2MjU0ODIwNTE=,,At our location in Rockyview Alberta we are open 6 AM - 10 PM Monday to Saturday!,2025-02-23,initial,2
Costco,2025-02-18 15:25:00,Y29tbWVudDoxMDQ3NDEzOTcwNzUwMDk5Xzk4NjQyMDYwMzM5OTQ1OA==,,Have never bought gas at Costco.,2025-02-23,initial,2
Costco,2025-02-18 15:25:00,Y29tbWVudDoxMDQ3NDEzOTcwNzUwMDk5XzkyNTQ1MzM5NjI3NDUyOA==,,New Costco Brentwood Ca coming soon in March 2025,2025-02-23,initial,1
Costco,2025-02-18 15:25:00,Y29tbWVudDoxMDQ3NDEzOTcwNzUwMDk5XzQ5NDAwNTQ4Njg0MjkxOQ==,,My husband works at Costco and he is a gas station attendant. I think it was a stupid idea . Thank God he is retiring the end of March. He worked the first and second day of the new hours and maybe had 3 ppl show up that last hour. If they were going to change the hours they need to keep the store open later as well.,2025-02-23,initial,4
Costco,2025-02-18 15:25:00,Y29tbWVudDoxMDQ3NDEzOTcwNzUwMDk5XzIzNjA2MDc0NzQzMDUwNjc=,Y29tbWVudDoxMDQ3NDEzOTcwNzUwMDk5XzQ5NDAwNTQ4Njg0MjkxOQ==,once people learn of the extended hours I'm guessing they're will be more customers during the extended times.,2025-02-23,reply,0
Costco,2025-02-18 15:25:00,Y29tbWVudDoxMDQ3NDEzOTcwNzUwMDk5XzIyODU3NTg0ODE3OTUxMTE=,,Woohoo!! I drive for ride share and always fuel up at Costco!!,2025-02-23,initial,0
Costco,2025-02-18 15:25:00,Y29tbWVudDoxMDQ3NDEzOTcwNzUwMDk5XzIwMzE3ODUxNzA2NDA2OTQ=,,Yet they still don’t have diesel.,2025-02-23,initial,3
Costco,2025-02-18 15:25:00,Y29tbWVudDoxMDQ3NDEzOTcwNzUwMDk5Xzk3MjI5MDA3MTUxNDI2Ng==,,Facebook the land of people complaining about everything.,2025-02-23,initial,6
Costco,2025-02-18 15:25:00,Y29tbWVudDoxMDQ3NDEzOTcwNzUwMDk5XzExNjM1NTE4Njg3NzQzMDI=,,"Costco, just keeps getting better and better.",2025-02-23,initial,0
Costco,2025-02-18 15:25:00,Y29tbWVudDoxMDQ3NDEzOTcwNzUwMDk5XzU5MjgxMDA0MDI2MTAyMg==,,I'm taking my wife to date night at the gas station tonight,2025-02-23,initial,0
Costco,2025-02-18 15:25:00,Y29tbWVudDoxMDQ3NDEzOTcwNzUwMDk5Xzk1MjkxMTI5NzAyODQ2Mg==,,"Sweet, gas is almost $4 a gallon.",2025-02-23,initial,0
Costco,2025-02-18 15:25:00,Y29tbWVudDoxMDQ3NDEzOTcwNzUwMDk5XzEwNTgxNTI1NTI3NDQ1NjI=,,Can ya'll look into carrying E-85 long time member here (since I was a teen),2025-02-23,initial,0
Costco,2025-02-18 15:25:00,Y29tbWVudDoxMDQ3NDEzOTcwNzUwMDk5XzEwNjYzMTMzNzIxOTQyMDk=,,Thanks I didn’t know that!,2025-02-23,initial,0
Costco,2025-02-18 15:25:00,Y29tbWVudDoxMDQ3NDEzOTcwNzUwMDk5XzY3OTIxODA2NDY3NzA2Nw==,,Same price as other stations around them.,2025-02-23,initial,1
Costco,2025-02-18 15:25:00,Y29tbWVudDoxMDQ3NDEzOTcwNzUwMDk5XzIzNzE2MzAyNDY1MjMzMzk=,Y29tbWVudDoxMDQ3NDEzOTcwNzUwMDk5XzY3OTIxODA2NDY3NzA2Nw==,not by me. It’s 20-25 cents less a gallon.,2025-02-23,reply,0
Costco,2025-02-18 15:25:00,Y29tbWVudDoxMDQ3NDEzOTcwNzUwMDk5XzE3MTc0NTk4MTU0Nzk1MTQ=,Y29tbWVudDoxMDQ3NDEzOTcwNzUwMDk5XzY3OTIxODA2NDY3NzA2Nw==,not the same quality of gas,2025-02-23,reply,0
Costco,2025-02-18 15:25:00,Y29tbWVudDoxMDQ3NDEzOTcwNzUwMDk5XzYwNTU2NTU4ODk2MTAyOA==,,Be sure to check the Costco app for your local Costco hours . I just checked mine and they are open at 5:30AM on weekdays,2025-02-23,initial,4
Costco,2025-02-18 15:25:00,Y29tbWVudDoxMDQ3NDEzOTcwNzUwMDk5XzExNjYyODc4MDUwMjkzMDI=,,Please bring back the book table. You are losing $100 a month just on me. Books are more important than alcohol. Surely you have room for 1 book table.,2025-02-23,initial,2
Costco,2025-02-18 15:25:00,Y29tbWVudDoxMDQ3NDEzOTcwNzUwMDk5Xzk4MTU1MDAzMDAzNjAwMQ==,,Many people on this post are just not happy with life and love to complain about everything.,2025-02-23,initial,3
Costco,2025-02-18 15:25:00,Y29tbWVudDoxMDQ3NDEzOTcwNzUwMDk5XzY4MDE4OTAzMTI2MTA4Ng==,,Still want diesel back.,2025-02-23,initial,0
Costco,2025-02-18 15:25:00,Y29tbWVudDoxMDQ3NDEzOTcwNzUwMDk5XzQ1NjQwODI0NDEwNjQwMg==,,were the Novato ca gas station we were going to get still not built yet,2025-02-23,initial,3
Costco,2025-02-18 15:25:00,Y29tbWVudDoxMDQ3NDEzOTcwNzUwMDk5XzYzNTk0NDEyNTY0OTE5OQ==,,Who's bright idea was to change the blueberry muffin ? Not even close to the original.......,2025-02-23,initial,3
Costco,2025-02-18 15:25:00,Y29tbWVudDoxMDQ3NDEzOTcwNzUwMDk5XzUyNDgzMTQ2MzQ3NzYzMA==,,These hour have been in effect for a month,2025-02-23,initial,0
Costco,2025-02-18 15:25:00,Y29tbWVudDoxMDQ3NDEzOTcwNzUwMDk5XzY0MTQxNDYyMTYzNjMzMw==,,Costco how about more diesel options in SoCal?,2025-02-23,initial,0
Costco,2025-02-18 15:25:00,Y29tbWVudDoxMDQ3NDEzOTcwNzUwMDk5Xzk0MTM4Njc0NDczNTc5OA==,,Wow! Thats awesome…especially in the summer,2025-02-23,initial,1
Costco,2025-02-18 15:25:00,Y29tbWVudDoxMDQ3NDEzOTcwNzUwMDk5XzY0Mjc3NjYzNDkwODUxMQ==,,Wow! I hope our local Costco follows suit!!,2025-02-23,initial,1
Costco,2025-02-18 15:25:00,Y29tbWVudDoxMDQ3NDEzOTcwNzUwMDk5XzM5MTUyOTUyMjUzNTAyNDQ=,,Why would Costco build a new loaction and NOT put in Diesel pumps????,2025-02-23,initial,0
Costco,2025-02-18 15:25:00,Y29tbWVudDoxMDQ3NDEzOTcwNzUwMDk5XzE0MTg2OTczODU3Njk5NTc=,,some new ones have diesel even have propane,2025-02-23,initial,1
Costco,2025-02-18 15:25:00,Y29tbWVudDoxMDQ3NDEzOTcwNzUwMDk5XzY0NjQ0MDU0NDU0MTgyNQ==,,Great. My costco is right next to my favorite cinema and I will appreciate getting gas after I'm done with the movie.,2025-02-23,initial,1
Costco,2025-02-18 15:25:00,Y29tbWVudDoxMDQ3NDEzOTcwNzUwMDk5XzQ4OTIzNzIxMDg5MzgwNQ==,,"I hope they open at 6 am on Sunday in my area. I get off work at 6 am and sometimes, I need gas on Sunday. Please.",2025-02-23,initial,1
Costco,2025-02-18 15:25:00,Y29tbWVudDoxMDQ3NDEzOTcwNzUwMDk5XzEzODMwODI5ODYxODc1MzI=,,This would be great if they open 24/7,2025-02-23,initial,0
Costco,2025-02-18 15:25:00,Y29tbWVudDoxMDQ3NDEzOTcwNzUwMDk5XzYyODQ1NjE0NjcxNDc4NQ==,,What a jam just fir gas,2025-03-16,initial,0
Costco,2025-02-18 15:25:00,Y29tbWVudDoxMDQ3NDEzOTcwNzUwMDk5XzEzMTk0MDI5MDI2MTcwOTc=,,"New??? Not here, has been like this for sometime.",2025-02-23,initial,3
Costco,2025-02-18 15:25:00,Y29tbWVudDoxMDQ3NDEzOTcwNzUwMDk5XzE2NTk0NjgwMTQ2Njc3OTk=,,I like Costco BUT:: This month I’ve noticed a LOT of shopping carts in the parking lots.,2025-02-23,initial,1
Costco,2025-02-18 15:25:00,Y29tbWVudDoxMDQ3NDEzOTcwNzUwMDk5XzE1Mzc0ODkxMjM4Mzc5MzA=,,Show this to Brian.,2025-02-23,initial,1
Costco,2025-02-18 15:25:00,Y29tbWVudDoxMDQ3NDEzOTcwNzUwMDk5XzE2MzE0MDA3NTc3MzgwMTE=,,5 am weekdays for AZ summer heat.,2025-02-23,initial,1
Costco,2025-02-18 15:25:00,Y29tbWVudDoxMDQ3NDEzOTcwNzUwMDk5XzYzMDM3Njc0NjI1MDE4OA==,,Party at pump 5,2025-02-23,initial,1
Costco,2025-02-18 15:25:00,Y29tbWVudDoxMDQ3NDEzOTcwNzUwMDk5XzEzNTM2NzUxODI0MzM3ODQ=,,Get diesel.,2025-02-23,initial,4
Costco,2025-02-18 15:25:00,Y29tbWVudDoxMDQ3NDEzOTcwNzUwMDk5XzEwNjkzNjI1OTE4OTU3ODM=,,The gas station on Greenspot Rd in Highland opened yesterday. Store to open March 8.,2025-02-23,initial,0
Costco,2025-02-18 15:25:00,Y29tbWVudDoxMDQ3NDEzOTcwNzUwMDk5XzExNDI4MzcyNjY5OTAxMDA=,,Now if they could extend the store hours.,2025-02-23,initial,0
Costco,2025-02-18 15:25:00,Y29tbWVudDoxMDQ3NDEzOTcwNzUwMDk5XzExNjYzNjk5NjQ5NTk1NDU=,,I like getting gas on my way to work. It’s always empty at 6:30am. I always get a pump right away,2025-02-23,initial,0
Costco,2025-02-18 15:25:00,Y29tbWVudDoxMDQ3NDEzOTcwNzUwMDk5XzI4MzcwMzI0NjY0NzkwNjc=,,Gotta use the same hours to run the gas station,2025-02-23,initial,1
Costco,2025-02-18 15:25:00,Y29tbWVudDoxMDQ3NDEzOTcwNzUwMDk5XzEzMzExMjc1NjgwOTQzODA=,,Thank you! This really really would help,2025-02-23,initial,1
Costco,2025-02-18 15:25:00,Y29tbWVudDoxMDQ3NDEzOTcwNzUwMDk5XzE4MjcyNjk0MzgxMTI0MjE=,,This is awesome news!,2025-02-23,initial,0
Costco,2025-02-18 15:25:00,Y29tbWVudDoxMDQ3NDEzOTcwNzUwMDk5XzE2ODU2MDUwMTUzNjk0MzU=,,This is big news.,2025-02-23,initial,1
Costco,2025-02-18 15:25:00,Y29tbWVudDoxMDQ3NDEzOTcwNzUwMDk5XzYyMjk2NDk5MzY2MjE4OA==,,Bring back diesel!,2025-02-23,initial,0
Costco,2025-02-18 15:25:00,Y29tbWVudDoxMDQ3NDEzOTcwNzUwMDk5XzM5Nzg0OTgyMTI0MzI3OTA=,,This is a warning,2025-02-23,initial,0
Costco,2025-02-18 15:25:00,Y29tbWVudDoxMDQ3NDEzOTcwNzUwMDk5XzExNTYyMjg2OTYyNDU4NDk=,Y29tbWVudDoxMDQ3NDEzOTcwNzUwMDk5XzM5Nzg0OTgyMTI0MzI3OTA=,Huh?,2025-02-23,reply,0
Costco,2025-02-18 15:25:00,Y29tbWVudDoxMDQ3NDEzOTcwNzUwMDk5XzE3NDAzMDUxMTY1Mjg4NjY=,,We need one in Erie Pa,2025-02-23,initial,0
Costco,2025-02-18 15:25:00,Y29tbWVudDoxMDQ3NDEzOTcwNzUwMDk5XzE0MTgzMjM2OTkxMzgyNjg=,,Thanks so awesome,2025-03-02,initial,1
Costco,2025-02-18 15:25:00,Y29tbWVudDoxMDQ3NDEzOTcwNzUwMDk5Xzg0OTI1MzA3ODA4NDkxOTc=,,"Sadly not at my Costco, according to the website.",2025-02-23,initial,2
Costco,2025-02-18 15:25:00,Y29tbWVudDoxMDQ3NDEzOTcwNzUwMDk5XzM5NjM3OTgzMDcxNzI4NDM=,,Costco is amazing company,2025-02-23,initial,0
Costco,2025-02-18 15:25:00,Y29tbWVudDoxMDQ3NDEzOTcwNzUwMDk5XzE3NTE3NDkyMzUzOTYyMTQ=,,Makes sense,2025-02-23,initial,1
Costco,2025-02-18 15:25:00,Y29tbWVudDoxMDQ3NDEzOTcwNzUwMDk5XzExNzgxNjAzNjM5NDE2ODI=,,Please come to West Monroe/Monroe.,2025-02-23,initial,0
Costco,2025-02-18 15:25:00,Y29tbWVudDoxMDQ3NDEzOTcwNzUwMDk5XzY0MzkxMDA0NDgwOTk4NQ==,,"Hope the one off Rt 80 Wharton, NJ follows suit. Especially with Rt 80 collapse in getting there!",2025-02-23,initial,1
Costco,2025-02-18 15:25:00,Y29tbWVudDoxMDQ3NDEzOTcwNzUwMDk5XzExMDA2NDE5MjUxOTUzNTU=,,Yes earlier would be great.,2025-02-23,initial,0
Costco,2025-02-18 15:25:00,Y29tbWVudDoxMDQ3NDEzOTcwNzUwMDk5XzE4NjU2OTYyMDc1MTQ3NDc=,,Thank you Costco for not caving in!,2025-02-23,initial,0
Costco,2025-02-18 15:25:00,Y29tbWVudDoxMDQ3NDEzOTcwNzUwMDk5XzEzMDAyNDI3MDQ2MDUzMDI=,,This is awesome,2025-02-23,initial,0
Costco,2025-02-18 15:25:00,Y29tbWVudDoxMDQ3NDEzOTcwNzUwMDk5XzkxOTk5MDM5MzM0Mjc5MTg=,,Crazy line up today at Costco Sudbury,2025-02-23,initial,1
Costco,2025-02-18 15:25:00,Y29tbWVudDoxMDQ3NDEzOTcwNzUwMDk5XzM4NTg5MDI3Mjc3MDcxODc=,,No longer shopping at Costco. They followed the DEI protocols and keep piling them on. Changed to Sam's.,2025-02-23,initial,0
Costco,2025-02-18 15:25:00,Y29tbWVudDoxMDQ3NDEzOTcwNzUwMDk5XzExNzgwODE2NzM4NzE4NDM=,,Thank you baby Jesus,2025-02-23,initial,0
Costco,2025-02-18 15:25:00,Y29tbWVudDoxMDQ3NDEzOTcwNzUwMDk5XzYyMzM0MDE5MzcyNjM0MA==,,Ours is 5:30 am -10:00 pm Torrance,2025-02-23,initial,0
Costco,2025-02-18 15:25:00,Y29tbWVudDoxMDQ3NDEzOTcwNzUwMDk5XzI1NTE2MDI3Njg1MDUwOTY=,,I'm glad richland washington is getting a new store with 12 pumps,2025-02-23,initial,0
Costco,2025-02-18 15:25:00,Y29tbWVudDoxMDQ3NDEzOTcwNzUwMDk5XzU5ODcyODA3OTU4NDU3Mw==,,"Why extend the hours? Seriously, why?",2025-02-23,initial,0
Costco,2025-02-18 15:25:00,Y29tbWVudDoxMDQ3NDEzOTcwNzUwMDk5XzE5NzU3MDE3NDYyNTcyODE=,,Money hungry Costco,2025-02-23,initial,1
Costco,2025-02-18 15:25:00,Y29tbWVudDoxMDQ3NDEzOTcwNzUwMDk5XzExOTYyNjI1MDUxNjI5MDA=,Y29tbWVudDoxMDQ3NDEzOTcwNzUwMDk5XzE5NzU3MDE3NDYyNTcyODE=,you spelled Walmart wrong,2025-02-23,reply,0
Costco,2025-02-18 15:25:00,Y29tbWVudDoxMDQ3NDEzOTcwNzUwMDk5XzExOTY0NzY4MzE4Mzc2NjY=,,I wish we can have one COSTCO in Patterson. CA.,2025-02-23,initial,0
Costco,2025-02-18 15:25:00,Y29tbWVudDoxMDQ3NDEzOTcwNzUwMDk5XzE5NjE1OTc4NzQzMjg0Nzg=,,Sh pi ups be open 24/7 with automation payment,2025-02-23,initial,0
Costco,2025-02-18 15:25:00,Y29tbWVudDoxMDQ3NDEzOTcwNzUwMDk5XzYwMDA4MTcyOTQ1NTE3OQ==,,Sams club is always cheaper than Costco,2025-02-23,initial,1
Costco,2025-02-18 15:25:00,Y29tbWVudDoxMDQ3NDEzOTcwNzUwMDk5XzEzMjI0NzE3MTg4NzQxMzU=,,Ahh poor workers who have to stand there,2025-02-23,initial,0
Costco,2025-02-18 15:25:00,Y29tbWVudDoxMDQ3NDEzOTcwNzUwMDk5XzEwNzM5NzU1MzQ1MDAxMTU=,,Build a gas station at the norwalk CT Costco and I will buy gas there. You bought the property next door and are doing major renovations but no gas station and no liquor.,2025-02-23,initial,0
Costco,2025-02-18 15:25:00,Y29tbWVudDoxMDQ3NDEzOTcwNzUwMDk5Xzk3NjQ2MTY4MDczNTc4NQ==,,Love love love Costco.,2025-02-23,initial,0
Costco,2025-02-18 15:25:00,Y29tbWVudDoxMDQ3NDEzOTcwNzUwMDk5XzU5NjAxNDI3OTk3NTkxMg==,,Raven Barefoot Sweta Senjalia Patel ANOTHER REASON WE LOVE COSTCO,2025-02-23,initial,0
Costco,2025-02-18 15:25:00,Y29tbWVudDoxMDQ3NDEzOTcwNzUwMDk5XzE5NzYzOTE4Nzk1NTE2OTc=,,Hallelujah!,2025-02-23,initial,1
Costco,2025-02-18 15:25:00,Y29tbWVudDoxMDQ3NDEzOTcwNzUwMDk5XzEzMjUwMzA4Nzg4MDY4NTY=,,"EV owners don’t wait in lines after charging a couple nights each week at home 
!",2025-02-23,initial,1
Costco,2025-02-18 15:25:00,Y29tbWVudDoxMDQ3NDEzOTcwNzUwMDk5XzI2NzM4MjI0Mzk0NzA5NjM=,,No more Costco for me,2025-02-23,initial,4
Costco,2025-02-18 15:25:00,Y29tbWVudDoxMDQ3NDEzOTcwNzUwMDk5XzM1MjUxODUwMTQ0NTU4Mjg=,,Lately their gas has caused my Check Engine light to come on???,2025-02-23,initial,1
Costco,2025-02-18 15:25:00,Y29tbWVudDoxMDQ3NDEzOTcwNzUwMDk5XzEyMDk5ODY3OTQ0NjA3MjE=,,That's great.,2025-02-23,initial,0
Costco,2025-02-18 15:25:00,Y29tbWVudDoxMDQ3NDEzOTcwNzUwMDk5XzMwOTU4NDAwNzM5MDM1NDM=,,It would be nice if Weekend store hours were extended to 7:30,2025-02-23,initial,0
Costco,2025-02-18 15:25:00,Y29tbWVudDoxMDQ3NDEzOTcwNzUwMDk5XzEwMjk1OTQzMTU2NjQ2MDE=,,It makes sense.,2025-02-23,initial,1
Costco,2025-02-18 15:25:00,Y29tbWVudDoxMDQ3NDEzOTcwNzUwMDk5XzM3OTk1NzQ2MjcwMjE5ODA=,,Sweet,2025-02-23,initial,0
Costco,2025-02-18 15:25:00,Y29tbWVudDoxMDQ3NDEzOTcwNzUwMDk5XzY0OTY4OTYzNzUyODg5Nw==,,Can you open a costco in Belleville ON,2025-02-23,initial,1
Costco,2025-02-18 15:25:00,Y29tbWVudDoxMDQ3NDEzOTcwNzUwMDk5XzExMTM1OTg2MzM4MzgzMjA=,,I don’t get good mileage with Costco gas..,2025-02-23,initial,1
Costco,2025-02-18 15:25:00,Y29tbWVudDoxMDQ3NDEzOTcwNzUwMDk5XzQzNjA5NDc0NjQxMzIyODY=,,Can you open at 5am ?,2025-02-23,initial,1
Costco,2025-02-18 15:25:00,Y29tbWVudDoxMDQ3NDEzOTcwNzUwMDk5XzE1OTMzNzQ3NjEzODMyNzI=,,Does anyone at the Lancaster PA Costco know how the man is that was getting CPR there yesterday afternoon? I was so worried about him.,2025-02-23,initial,1
Costco,2025-02-18 15:25:00,Y29tbWVudDoxMDQ3NDEzOTcwNzUwMDk5XzE4NDczMjE5ODkzNDAwMDg=,,"Right, hit my vehicle doing one of those maneuvers and we got a problem.",2025-02-23,initial,1
Costco,2025-02-18 15:25:00,Y29tbWVudDoxMDQ3NDEzOTcwNzUwMDk5XzYyNTUxNTQyMDA5MTA3Ng==,,Yes,2025-02-23,initial,0
Costco,2025-02-18 15:25:00,Y29tbWVudDoxMDQ3NDEzOTcwNzUwMDk5XzY0ODkyODgxNDI2NzQyOQ==,,I bet your entitled employees aint happy about this change!,2025-02-23,initial,2
Costco,2025-02-18 15:25:00,Y29tbWVudDoxMDQ3NDEzOTcwNzUwMDk5XzQ3NzgyNzE4ODczNTIzMw==,,HALLELUJAH!!!,2025-02-23,initial,0
Costco,2025-02-18 15:25:00,Y29tbWVudDoxMDQ3NDEzOTcwNzUwMDk5XzIxMDc3OTY2OTI5ODY2MzM=,,Never been there. Never going there,2025-02-23,initial,0
Costco,2025-02-18 15:25:00,Y29tbWVudDoxMDQ3NDEzOTcwNzUwMDk5XzExMzM3OTA1NDgyMjgyNzc=,,Not in Guelph,2025-02-23,initial,0
Costco,2025-02-18 15:25:00,Y29tbWVudDoxMDQ3NDEzOTcwNzUwMDk5Xzk3NTExMzg2NDE3ODYwMA==,,Thank you for ppl who work,2025-02-23,initial,0
Costco,2025-02-18 15:25:00,Y29tbWVudDoxMDQ3NDEzOTcwNzUwMDk5XzYwMDQzODY5OTYzNTA4NQ==,,Stephen did you know this ?,2025-02-23,initial,0
Costco,2025-02-18 15:25:00,Y29tbWVudDoxMDQ3NDEzOTcwNzUwMDk5Xzk3MTA4MTA1MTI1MDg1Nw==,,Wa2w2wqwaww sw wwq wwqqwqwsqwwswwwwwwsws,2025-02-23,initial,0
Costco,2025-02-18 15:25:00,Y29tbWVudDoxMDQ3NDEzOTcwNzUwMDk5XzkyMzQwMzgzOTAwMDU5ODM=,,"I need a little later on Sun please! 
 (Day ￼trips to NYC - I always get back to MA just after closing)",2025-02-23,initial,0
Costco,2025-02-18 15:25:00,Y29tbWVudDoxMDQ3NDEzOTcwNzUwMDk5Xzk1MDQwMDMyMzg4NTYzNg==,,How about all the stations have the 4 4 pump set up. 24 cars at a time reduces wait times greatly,2025-02-23,initial,1
Costco,2025-02-18 15:25:00,Y29tbWVudDoxMDQ3NDEzOTcwNzUwMDk5XzI4MzM4OTUyOTM0NTY4MTc=,,Why not 24 hrs a day? You dont need staff there all the time.,2025-02-23,initial,1
Costco,2025-02-18 15:25:00,Y29tbWVudDoxMDQ3NDEzOTcwNzUwMDk5XzE1MzUxMjk1MjM4MzA5MjI=,Y29tbWVudDoxMDQ3NDEzOTcwNzUwMDk5XzI4MzM4OTUyOTM0NTY4MTc=,gas station is only open if employees are there,2025-02-23,reply,0
Costco,2025-02-18 15:25:00,Y29tbWVudDoxMDQ3NDEzOTcwNzUwMDk5XzExMTczMjM0NTY4MDY3Mzk=,,"For the time lost waiting in line the majority of the time, a HARD PASS. Not worth saving $2.00 for twenty minutes or more in lost time.",2025-02-23,initial,1
Costco,2025-02-18 15:25:00,Y29tbWVudDoxMDQ3NDEzOTcwNzUwMDk5XzEzMDYxOTg0MjczNzY0NjE=,,"All you folks complaining about the store hours,they will change in the spring, relax.",2025-02-23,initial,1
Costco,2025-02-18 15:25:00,Y29tbWVudDoxMDQ3NDEzOTcwNzUwMDk5XzIwNDM2MTA3MzYwNDQzNTk=,,I like that the hoses are long enough that it doesn’t matter what side you gas hole is on.,2025-02-23,initial,0
Costco,2025-02-18 15:25:00,Y29tbWVudDoxMDQ3NDEzOTcwNzUwMDk5XzEzMjI4MTM3NzIzNjczNTY=,,I intentionally let my Costco membership expire (years ago) and didn’t renew because of a disgusting experience incident at the gas pump. A gas employee rudely kicked me out after pumping my gas as I was cleaning my window with the provided squeegee (just before closing time. There was no car behind me waiting and i clearly stated if one pulled up I would gladly stop and vacate. Still I was hounded to leave right then “if my gas was already pumped”.,2025-02-23,initial,3
Costco,2025-02-18 15:25:00,Y29tbWVudDoxMDQ3NDEzOTcwNzUwMDk5XzU0MzMzNjc5NDc3MTAzOQ==,,I enjoy cheese.,2025-02-23,initial,0
Costco,2025-02-18 15:25:00,Y29tbWVudDoxMDQ3NDEzOTcwNzUwMDk5XzYyMTg4MTkxMzc3MzEwOA==,,"Here in the land of 85 octane being “regular”, Costco and Sam’s only sell 85 and 91. Modern cars don’t run well on 85 (the altitude argument is a crock), so I wish Costco would sell 87. Buying 91 doesn’t save any money or make waiting in the inevitable huge line worth it.",2025-02-23,initial,0
Costco,2025-02-18 15:25:00,Y29tbWVudDoxMDQ3NDEzOTcwNzUwMDk5XzIxMDA3NDY4MDAzNjI2MDE=,,"Varies by location, make sure to check your local Costco gas station for hours of operation.",2025-02-23,initial,1
Costco,2025-02-18 15:25:00,Y29tbWVudDoxMDQ3NDEzOTcwNzUwMDk5XzEzNjMzNDgxMjE0ODkwOTc=,,Nice. Good to know.,2025-02-23,initial,0
Costco,2025-02-18 15:25:00,Y29tbWVudDoxMDQ3NDEzOTcwNzUwMDk5XzYyMzQ3NjE1Mzc0OTE0OQ==,,YES! finally,2025-02-23,initial,0
Costco,2025-02-18 15:25:00,Y29tbWVudDoxMDQ3NDEzOTcwNzUwMDk5XzYwNzc4NTc2MjE4MjA5Nw==,,Just make it open all hours like every other gas station to ever exist.,2025-02-23,initial,1
Costco,2025-02-18 15:25:00,Y29tbWVudDoxMDQ3NDEzOTcwNzUwMDk5XzEzNTU1MTQ2ODU0NjA2MDU=,Y29tbWVudDoxMDQ3NDEzOTcwNzUwMDk5XzYwNzc4NTc2MjE4MjA5Nw==,they don't have employees there all hours,2025-02-23,reply,0
Costco,2025-02-18 15:25:00,Y29tbWVudDoxMDQ3NDEzOTcwNzUwMDk5XzExNjAwNTcyODQ5OTQwOTg=,Y29tbWVudDoxMDQ3NDEzOTcwNzUwMDk5XzEzNTU1MTQ2ODU0NjA2MDU=,You don't need an employee? You put a card in the slot and hit the button and gas comes out. Don't be retarded.,2025-02-23,reply,0
