company_name,post_date,id,parent_id,comment_text,comment_date,comment_type,reaction_count
Costco,2025-02-18 15:25:00,Y29tbWVudDoxMDQ3NDEzOTcwNzUwMDk5XzE4MDc4NDg4MDY3MzQ5NzU=,Y29tbWVudDoxMDQ3NDEzOTcwNzUwMDk5XzI2NTM0ODMwOTgxOTI2NTI=,we have diesel at every pump in Prescott Az!!! We used to only have 1 row then they built a new station and put it in every pump!!!,2025-02-23,reply,1
Costco,2025-02-18 15:25:00,Y29tbWVudDoxMDQ3NDEzOTcwNzUwMDk5XzU1MDgxMjQzNDY2MzQyOQ==,Y29tbWVudDoxMDQ3NDEzOTcwNzUwMDk5XzI2NTM0ODMwOTgxOTI2NTI=,some do,2025-02-23,reply,0
Costco,2025-02-18 15:25:00,Y29tbWVudDoxMDQ3NDEzOTcwNzUwMDk5XzE1NzM3NDEzMDczNjI0MDA=,Y29tbWVudDoxMDQ3NDEzOTcwNzUwMDk5XzI2NTM0ODMwOTgxOTI2NTI=,some do. None of the ones I used do.,2025-02-23,reply,0
Costco,2025-02-18 15:25:00,Y29tbWVudDoxMDQ3NDEzOTcwNzUwMDk5XzkzODk1NzU5ODQwODA1Nw==,Y29tbWVudDoxMDQ3NDEzOTcwNzUwMDk5XzI2NTM0ODMwOTgxOTI2NTI=,depends on location,2025-02-23,reply,0
Costco,2025-02-18 15:25:00,Y29tbWVudDoxMDQ3NDEzOTcwNzUwMDk5XzY4NDI3NDkzMzkyNzcyOQ==,Y29tbWVudDoxMDQ3NDEzOTcwNzUwMDk5XzI2NTM0ODMwOTgxOTI2NTI=,yes,2025-02-23,reply,0
Costco,2025-02-18 15:25:00,Y29tbWVudDoxMDQ3NDEzOTcwNzUwMDk5XzExNDEwNTMyMjc1MDMwMzk=,Y29tbWVudDoxMDQ3NDEzOTcwNzUwMDk5XzI2NTM0ODMwOTgxOTI2NTI=,no,2025-02-23,reply,0
Costco,2025-02-18 15:25:00,Y29tbWVudDoxMDQ3NDEzOTcwNzUwMDk5Xzk0Njg4NzI1NzQyNDczMQ==,Y29tbWVudDoxMDQ3NDEzOTcwNzUwMDk5XzI2NTM0ODMwOTgxOTI2NTI=,Terrina Jones-Sasser yes they do in Illinois,2025-02-23,reply,0
Costco,2025-02-18 15:25:00,Y29tbWVudDoxMDQ3NDEzOTcwNzUwMDk5XzU1ODQxMzI5NzIyODA5Mg==,Y29tbWVudDoxMDQ3NDEzOTcwNzUwMDk5XzI2NTM0ODMwOTgxOTI2NTI=,depends on location. Check in your app for the location you want to go to.,2025-02-23,reply,0
Costco,2025-02-18 15:25:00,Y29tbWVudDoxMDQ3NDEzOTcwNzUwMDk5XzI2NzI3Mjg5MjYyNDUxMDY=,Y29tbWVudDoxMDQ3NDEzOTcwNzUwMDk5XzI2NTM0ODMwOTgxOTI2NTI=,"some do, some don't. Seems like a question for YOUR Costco...",2025-02-23,reply,0
Costco,2025-02-18 15:25:00,Y29tbWVudDoxMDQ3NDEzOTcwNzUwMDk5XzkxNDA0ODQzMDYwMzk3MDQ=,,Great! Now do the same with the warehouse hours.,2025-02-23,initial,19
Costco,2025-02-18 15:25:00,Y29tbWVudDoxMDQ3NDEzOTcwNzUwMDk5XzEwODg2Njg1NTMwNjYxMjU=,,"At every Costco at which I have ever gotten gas, the pumps are sufficiently far apart that any licensed and competent driver of any passenger vehicle should be able to access and exit any pump position quite easily . . . it isn't exactly parallel parking on a San Francisco hill in a spot 8 inches longer than your vehicle length.",2025-02-23,initial,168
Costco,2025-02-18 15:25:00,Y29tbWVudDoxMDQ3NDEzOTcwNzUwMDk5XzEwMjc3NjcwNDI0OTIxNTA=,Y29tbWVudDoxMDQ3NDEzOTcwNzUwMDk5XzEwODg2Njg1NTMwNjYxMjU=,"not everyone ""stays in their lane"" when they throw it in park to pump gas. I'm waiting for the car at the front pump to finish and move out because I don't feel like ""threading the needle""",2025-02-23,reply,58
Costco,2025-02-18 15:25:00,Y29tbWVudDoxMDQ3NDEzOTcwNzUwMDk5XzE4NDI1MjczMzMyNDA5NTY=,Y29tbWVudDoxMDQ3NDEzOTcwNzUwMDk5XzEwODg2Njg1NTMwNjYxMjU=,Andrew Kennelly you see the size some of these rigs getting gas?,2025-02-23,reply,9
Costco,2025-02-18 15:25:00,Y29tbWVudDoxMDQ3NDEzOTcwNzUwMDk5XzIwMDgxNzkyNTI5NzkzNTA=,Y29tbWVudDoxMDQ3NDEzOTcwNzUwMDk5XzEwODg2Njg1NTMwNjYxMjU=,if ur in that much of a rush to get gas don't go to the longest waiting gas station.,2025-02-23,reply,15
Costco,2025-02-18 15:25:00,Y29tbWVudDoxMDQ3NDEzOTcwNzUwMDk5XzE4MTk2MjYxNzIxMzc3MzI=,Y29tbWVudDoxMDQ3NDEzOTcwNzUwMDk5XzEwODg2Njg1NTMwNjYxMjU=,"wow, don’t you know these people have been out of their car and off their phones for 2 minutes, when they get back in they have to check their e-mail, im’s and get caught up on what’s happened is the last 2 minutes",2025-02-23,reply,0
Costco,2025-02-18 15:25:00,Y29tbWVudDoxMDQ3NDEzOTcwNzUwMDk5XzEyNzA1OTc2NTA3MDA2ODY=,Y29tbWVudDoxMDQ3NDEzOTcwNzUwMDk5XzEwODg2Njg1NTMwNjYxMjU=,"if you have issues with how people park at a gas station, then you have major issues.",2025-02-23,reply,3
Costco,2025-02-18 15:25:00,Y29tbWVudDoxMDQ3NDEzOTcwNzUwMDk5XzE4MzAzODIxMTc3MTA5MTI=,Y29tbWVudDoxMDQ3NDEzOTcwNzUwMDk5XzEwODg2Njg1NTMwNjYxMjU=,"you've never been to the H. Street Chula Vista, CA location and it shows.",2025-02-23,reply,0
Costco,2025-02-18 15:25:00,Y29tbWVudDoxMDQ3NDEzOTcwNzUwMDk5XzExNTgxMzk4NDkzMTgwNjU=,Y29tbWVudDoxMDQ3NDEzOTcwNzUwMDk5XzEwODg2Njg1NTMwNjYxMjU=,"unless towing trailer, campers,boats, rvs, exc. Alot of that in my area.",2025-02-23,reply,0
Costco,2025-02-18 15:25:00,Y29tbWVudDoxMDQ3NDEzOTcwNzUwMDk5XzE1NjQ5OTEwNDc1NDQwMDc=,Y29tbWVudDoxMDQ3NDEzOTcwNzUwMDk5XzEwODg2Njg1NTMwNjYxMjU=,how much for your DEI grade?,2025-02-23,reply,3
Costco,2025-02-18 15:25:00,Y29tbWVudDoxMDQ3NDEzOTcwNzUwMDk5XzEzMjg3NTYwNDg0NjY1Mzg=,Y29tbWVudDoxMDQ3NDEzOTcwNzUwMDk5XzEwODg2Njg1NTMwNjYxMjU=,"lmao yes sir, anything you say sir.",2025-02-23,reply,1
Costco,2025-02-18 15:25:00,Y29tbWVudDoxMDQ3NDEzOTcwNzUwMDk5XzY0NTU2NzA2NDYwODAyMw==,Y29tbWVudDoxMDQ3NDEzOTcwNzUwMDk5XzEwODg2Njg1NTMwNjYxMjU=,bro. That’s the whole purpose. You stay in your lane and two cars can then load into the fueling area.,2025-02-23,reply,15
Costco,2025-02-18 15:25:00,Y29tbWVudDoxMDQ3NDEzOTcwNzUwMDk5XzEzMTM1MjU2MjY1ODYzNTM=,,I have been trying to get a problem resolved that happened 11/13/24 at a local Costco gas station. Here it is 3 months later and still waiting. I love Costco and have never had an issue in the many years I have been a member. Is there someone else I can deal with other than the store manager? I am 72 years old. Please help me. Thank you,2025-02-23,initial,24
Costco,2025-02-18 15:25:00,Y29tbWVudDoxMDQ3NDEzOTcwNzUwMDk5Xzk0MTE0ODQwMTMzMzQ0OQ==,Y29tbWVudDoxMDQ3NDEzOTcwNzUwMDk5XzEzMTM1MjU2MjY1ODYzNTM=,"Becareful with Costco, now they have a new CEO, Custmer care is no longer there priority, it has all become how to please there employees and if you complain and you get no response and you keep pushing for there Manager to resolve an issue, your membership will be canceled, because you pushed a complaint where they dont know how to respond to a customers complaint and they will not respond to you and you will be canceled just like they did to my spouse and I 6 months ago, we pushed to get an issue resolved at opitical dept., they refused to fix the issue and we got a letter in the mail by there Seattle attorney saying ""we appreciate your loyalty as a Costco member unfortunately we would have to cancel your membership at no fault of your, but we do have the right to cancel members membership for no reasons"", there a nasty Company and now we are in litigation with them for canceling without good cause.",2025-02-23,reply,22
Costco,2025-02-18 15:25:00,Y29tbWVudDoxMDQ3NDEzOTcwNzUwMDk5XzY0ODYyNzgyNzczMTQ2MA==,Y29tbWVudDoxMDQ3NDEzOTcwNzUwMDk5Xzk0MTE0ODQwMTMzMzQ0OQ==,so sorry this happened to you. I would be so upset if that were to happen to me. Good luck.,2025-02-23,reply,1
Costco,2025-02-18 15:25:00,Y29tbWVudDoxMDQ3NDEzOTcwNzUwMDk5XzM0ODg1NTI2NzQ2MjE3MDQ=,Y29tbWVudDoxMDQ3NDEzOTcwNzUwMDk5XzY0ODYyNzgyNzczMTQ2MA==,"Seemed like she was just overstepping her bounds wanting to clear the pumps so they’d be clear to close up a few minutes later when the deadline hit (like 10-15 min later) but there was no real cause for her to treat me as she did. And calling her out on it she just doubled down without giving a reason or justification why I couldn’t continue cleaning up my window, if my fuel was already done pumping, despite that even with my leaving, other cars were still actively pumping in the other lanes.",2025-02-23,reply,2
Costco,2025-02-18 15:25:00,Y29tbWVudDoxMDQ3NDEzOTcwNzUwMDk5XzE1ODYzODc3MTUzNDU2NDA=,Y29tbWVudDoxMDQ3NDEzOTcwNzUwMDk5XzM0ODg1NTI2NzQ2MjE3MDQ=,a nail in a tire is not covered by a warranty anywhere in the U.S.!,2025-02-23,reply,1
Costco,2025-02-18 15:25:00,Y29tbWVudDoxMDQ3NDEzOTcwNzUwMDk5XzIzOTgwMjEyNzM4NzQwMjI=,Y29tbWVudDoxMDQ3NDEzOTcwNzUwMDk5XzE1ODYzODc3MTUzNDU2NDA=,it’s covered by a road hazard warranty…not a regular warranty!,2025-02-23,reply,1
Costco,2025-02-18 15:25:00,Y29tbWVudDoxMDQ3NDEzOTcwNzUwMDk5Xzk0NTc2Mzc1MTAwMDkwOQ==,Y29tbWVudDoxMDQ3NDEzOTcwNzUwMDk5XzIzOTgwMjEyNzM4NzQwMjI=,"Laugh all you want, As a purchaser if im not treated well (and ive payed for membership “status” to even be there), im taking my business and my money ELSEWHERE where I and my money will be treated well and right. I did exactly that. Over the years “since” (about 6) that one incident by a poorly performing “out of line” service employee cost Costco annual revenue dues in the hundreds of dollars, and cost them thousands of dollars in lost gross revenue (average American household spends over $2000/yr on gasoline), let alone gross and net on anything else bedsides fuel my household would have purchased over the years. Just goes to show how a bad employee can be costly to a business. And im only one member, consider how such an bad actor employee’s other interactions with other members over the years might have alienated other similar outcomes.",2025-02-23,reply,1
Costco,2025-02-18 15:25:00,Y29tbWVudDoxMDQ3NDEzOTcwNzUwMDk5Xzk5ODEwNTYxNTUyOTY3NA==,Y29tbWVudDoxMDQ3NDEzOTcwNzUwMDk5Xzk0MTE0ODQwMTMzMzQ0OQ==,whoa! Whaaaat???? Can you mention the state this happened in?,2025-02-23,reply,0
Costco,2025-02-18 15:25:00,Y29tbWVudDoxMDQ3NDEzOTcwNzUwMDk5XzYxMTExNDkyODU1MTE1NA==,Y29tbWVudDoxMDQ3NDEzOTcwNzUwMDk5XzY0ODYyNzgyNzczMTQ2MA==,try the store feedback on their app drives the store managers crazy because its goes through their company customer service first. I did it for the tire store after they installed one of the new tires wrongly and it work like magic they refunded the tire reinstallation fee and didn’t have to wait.,2025-02-23,reply,1
Costco,2025-02-18 15:25:00,Y29tbWVudDoxMDQ3NDEzOTcwNzUwMDk5Xzk0NjM3MzA5NzI2NjcyMg==,Y29tbWVudDoxMDQ3NDEzOTcwNzUwMDk5XzEzMTM1MjU2MjY1ODYzNTM=,"call the corporate office in Issaquah, Washington!",2025-02-23,reply,14
Costco,2025-02-18 15:25:00,Y29tbWVudDoxMDQ3NDEzOTcwNzUwMDk5XzE3NDQyMzE2MjYxNDgwNzg=,Y29tbWVudDoxMDQ3NDEzOTcwNzUwMDk5XzEzMTM1MjU2MjY1ODYzNTM=,I don’t know that u would put this out in public for safety reasons you don’t know who will reach out to you and if they are in fact Costco.,2025-02-23,reply,0
Costco,2025-02-18 15:25:00,Y29tbWVudDoxMDQ3NDEzOTcwNzUwMDk5XzU4MDkyNzE4NDk3NTYyNQ==,Y29tbWVudDoxMDQ3NDEzOTcwNzUwMDk5XzEzMTM1MjU2MjY1ODYzNTM=,"If the warehouse doesn't play ball, straight to corporate. I've had managers in the wrong get sent emails from corporate to resolve my issues after contacting them.",2025-02-23,reply,11
Costco,2025-02-18 15:25:00,Y29tbWVudDoxMDQ3NDEzOTcwNzUwMDk5XzYzNDg1MTE4OTAyNTQwNQ==,Y29tbWVudDoxMDQ3NDEzOTcwNzUwMDk5XzEzMTM1MjU2MjY1ODYzNTM=,start with corporate office in Oak brook if not resolved get in contact with Issaquah,2025-02-23,reply,3
Costco,2025-02-18 15:25:00,Y29tbWVudDoxMDQ3NDEzOTcwNzUwMDk5XzI1ODkwODgyNDQ2MjQxNjQ=,Y29tbWVudDoxMDQ3NDEzOTcwNzUwMDk5XzEzMTM1MjU2MjY1ODYzNTM=,credit card company may investigate,2025-02-23,reply,1
Costco,2025-02-18 15:25:00,Y29tbWVudDoxMDQ3NDEzOTcwNzUwMDk5XzU5NDc2ODEzMzM5ODY0Mw==,Y29tbWVudDoxMDQ3NDEzOTcwNzUwMDk5XzEzMTM1MjU2MjY1ODYzNTM=,how about support?,2025-02-23,reply,1
Costco,2025-02-18 15:25:00,Y29tbWVudDoxMDQ3NDEzOTcwNzUwMDk5XzE2MDQwMDgyMDM2NTI1OTE=,Y29tbWVudDoxMDQ3NDEzOTcwNzUwMDk5XzEzMTM1MjU2MjY1ODYzNTM=,reaching out to an ad doesnt really help.,2025-02-23,reply,6
Costco,2025-02-18 15:25:00,Y29tbWVudDoxMDQ3NDEzOTcwNzUwMDk5Xzk4NzkzMjMzOTMyOTk4Mg==,Y29tbWVudDoxMDQ3NDEzOTcwNzUwMDk5XzEzMTM1MjU2MjY1ODYzNTM=,contact corporate.,2025-02-23,reply,2
Costco,2025-02-18 15:25:00,Y29tbWVudDoxMDQ3NDEzOTcwNzUwMDk5XzY0NzY5MDM2NzYzNjUxOQ==,,Awesome!!,2025-02-23,initial,1
Costco,2025-02-18 15:25:00,Y29tbWVudDoxMDQ3NDEzOTcwNzUwMDk5XzExMDU1MjQxNDc5NzUzODE=,,FYI the Costco on monument is closed hopefully they are expanding and widening the entrance also!,2025-02-23,initial,7
Costco,2025-02-18 15:25:00,Y29tbWVudDoxMDQ3NDEzOTcwNzUwMDk5XzY0MjgxNTkxNDgwMjY2MA==,Y29tbWVudDoxMDQ3NDEzOTcwNzUwMDk5XzExMDU1MjQxNDc5NzUzODE=,construction on 1 side or entire stations closed in concord ca,2025-02-23,reply,0
Costco,2025-02-18 15:25:00,Y29tbWVudDoxMDQ3NDEzOTcwNzUwMDk5XzE4MTM4NzY0NTk0Mjk2MDY=,Y29tbWVudDoxMDQ3NDEzOTcwNzUwMDk5XzExMDU1MjQxNDc5NzUzODE=,What city? There are Monument streets all over.,2025-02-23,reply,1
Costco,2025-02-18 15:25:00,Y29tbWVudDoxMDQ3NDEzOTcwNzUwMDk5Xzk1NTc0NTk4NjI5MTY5Mw==,Y29tbWVudDoxMDQ3NDEzOTcwNzUwMDk5XzExMDU1MjQxNDc5NzUzODE=,not 10 cents cheaper anymore. Changed that.,2025-02-23,reply,0
Costco,2025-02-18 15:25:00,Y29tbWVudDoxMDQ3NDEzOTcwNzUwMDk5Xzk5MzM5NDAxOTMzNjM0NA==,Y29tbWVudDoxMDQ3NDEzOTcwNzUwMDk5XzExMDU1MjQxNDc5NzUzODE=,where ?,2025-02-23,reply,0
Costco,2025-02-18 15:25:00,Y29tbWVudDoxMDQ3NDEzOTcwNzUwMDk5XzExNzQ3NDY2NTA5MDA1MDQ=,Y29tbWVudDoxMDQ3NDEzOTcwNzUwMDk5XzExMDU1MjQxNDc5NzUzODE=,"not a helpful comment, as people all over the world may see this post, but no complete location listed",2025-02-23,reply,0
Costco,2025-02-18 15:25:00,Y29tbWVudDoxMDQ3NDEzOTcwNzUwMDk5XzQ5MDQ1NTM2MDU4NDg1MQ==,Y29tbWVudDoxMDQ3NDEzOTcwNzUwMDk5XzExMDU1MjQxNDc5NzUzODE=,"no it's not, you're lying.",2025-02-23,reply,1
Costco,2025-02-18 15:25:00,Y29tbWVudDoxMDQ3NDEzOTcwNzUwMDk5Xzk2Mzg2MzExOTE3MDkyNA==,Y29tbWVudDoxMDQ3NDEzOTcwNzUwMDk5XzExMDU1MjQxNDc5NzUzODE=,Is that in Davenport?,2025-02-23,reply,0
Costco,2025-02-18 15:25:00,Y29tbWVudDoxMDQ3NDEzOTcwNzUwMDk5XzIzODk4MTI0NzgwMzkzMTA=,,Super exciting!!,2025-02-23,initial,2
Costco,2025-02-18 15:25:00,Y29tbWVudDoxMDQ3NDEzOTcwNzUwMDk5Xzk2MTkzMjkyOTQ2NjkyMQ==,,Why is the volume of customers up at Sun Prairie WI location up so much? Traffic is terrible inside and out.,2025-02-23,initial,3
Costco,2025-02-18 15:25:00,Y29tbWVudDoxMDQ3NDEzOTcwNzUwMDk5XzU5NTk1NTMyOTg2ODEzNQ==,Y29tbWVudDoxMDQ3NDEzOTcwNzUwMDk5Xzk2MTkzMjkyOTQ2NjkyMQ==,"people love Costco, don't get it.",2025-02-23,reply,0
Costco,2025-02-18 15:25:00,Y29tbWVudDoxMDQ3NDEzOTcwNzUwMDk5XzUzODQ2MzU4NTI5MTgwOQ==,Y29tbWVudDoxMDQ3NDEzOTcwNzUwMDk5Xzk2MTkzMjkyOTQ2NjkyMQ==,"insider tip, the volume goes down during Packer/Badger games and during a snow storm.",2025-02-23,reply,0
Costco,2025-02-18 15:25:00,Y29tbWVudDoxMDQ3NDEzOTcwNzUwMDk5XzExMTI1MjQ1MTcyODE5ODY=,Y29tbWVudDoxMDQ3NDEzOTcwNzUwMDk5Xzk2MTkzMjkyOTQ2NjkyMQ==,all of the Madison stores are getting busier and busier.,2025-02-23,reply,0
Costco,2025-02-18 15:25:00,Y29tbWVudDoxMDQ3NDEzOTcwNzUwMDk5Xzk1ODI5ODU0OTc0MDg3MA==,Y29tbWVudDoxMDQ3NDEzOTcwNzUwMDk5Xzk2MTkzMjkyOTQ2NjkyMQ==,more people are shopping at Costco,2025-02-23,reply,8
Costco,2025-02-18 15:25:00,Y29tbWVudDoxMDQ3NDEzOTcwNzUwMDk5Xzk0ODExNDkxMDc5NjYwMQ==,Y29tbWVudDoxMDQ3NDEzOTcwNzUwMDk5Xzk2MTkzMjkyOTQ2NjkyMQ==,"by “volume of customers” do you mean the people are louder, or they’re larger (obese) people?",2025-02-23,reply,1
Costco,2025-02-18 15:25:00,Y29tbWVudDoxMDQ3NDEzOTcwNzUwMDk5XzEwMTU2MzQ0MjM3NDYyODY=,Y29tbWVudDoxMDQ3NDEzOTcwNzUwMDk5Xzk2MTkzMjkyOTQ2NjkyMQ==,What a stupid comment from @justin McGill The amount of people at our local Costco seems to have tripled very suddenly. I love Costco and understand more people wanting to shop there especially with prices of groceries. You don't even live here loser.,2025-02-23,reply,1
Costco,2025-02-18 15:25:00,Y29tbWVudDoxMDQ3NDEzOTcwNzUwMDk5Xzk4MDI0NjUxMDc0NDYyOQ==,,Can you start rolling out more EV chargers too? Would love to charge while I'm shopping.,2025-02-23,initial,32
Costco,2025-02-18 15:25:00,Y29tbWVudDoxMDQ3NDEzOTcwNzUwMDk5XzIxMTE2ODMyODI1OTc4MjA=,Y29tbWVudDoxMDQ3NDEzOTcwNzUwMDk5Xzk4MDI0NjUxMDc0NDYyOQ==,"The employees will get the same hours. As someone who worked there in gas in retirement, this isn’t good for employees. We didn’t sell much gas before 7:00am. And If the store closes at 8:30, they won’t sell much after 9:00pm.",2025-02-23,reply,11
Costco,2025-02-18 15:25:00,Y29tbWVudDoxMDQ3NDEzOTcwNzUwMDk5XzYxMjA5MzgzNDg5OTEwMA==,,It would be nice if the store hours could change to 9a to 9p,2025-02-23,initial,49
Costco,2025-02-18 15:25:00,Y29tbWVudDoxMDQ3NDEzOTcwNzUwMDk5XzMwNTUxMDQ4OTQ2MzY2MjQ=,,Costco Is the free air for tires open the same hours?,2025-02-23,initial,0
Costco,2025-02-18 15:25:00,Y29tbWVudDoxMDQ3NDEzOTcwNzUwMDk5XzExNDE5Njk4NTc2NTEzOTk=,,"Now, can you open the store earlier?",2025-02-23,initial,108
Costco,2025-02-18 15:25:00,Y29tbWVudDoxMDQ3NDEzOTcwNzUwMDk5XzQ0MzQwNjYzNTQyODMwMQ==,Y29tbWVudDoxMDQ3NDEzOTcwNzUwMDk5XzExNDE5Njk4NTc2NTEzOTk=,"do you realize what the merchandisers do every morning just to get open by 9:45? We have so many incoming trucks that we have to deal with, put the merchandise on the floor and then get it up in the steel. We have 5 hours and 45 minutes to make it show time ready.",2025-02-23,reply,39
Costco,2025-02-18 15:25:00,Y29tbWVudDoxMDQ3NDEzOTcwNzUwMDk5XzE0MTM5NjYwMzk5ODQ3Nzc=,Y29tbWVudDoxMDQ3NDEzOTcwNzUwMDk5XzQ0MzQwNjYzNTQyODMwMQ==,How do y’all get an hour longer than us? It’s always so stressful trying to get everything done in less than 5 hours..,2025-02-23,reply,0
Costco,2025-02-18 15:25:00,Y29tbWVudDoxMDQ3NDEzOTcwNzUwMDk5XzYyNzk1MTgxOTk1NTQ3Mw==,Y29tbWVudDoxMDQ3NDEzOTcwNzUwMDk5XzExNDE5Njk4NTc2NTEzOTk=,"how early do u want it to open 
 it already opens at 9-9:30 every day",2025-02-23,reply,16
Costco,2025-02-18 15:25:00,Y29tbWVudDoxMDQ3NDEzOTcwNzUwMDk5XzExNzAwNzkyNzQ4NjU2NjM=,Y29tbWVudDoxMDQ3NDEzOTcwNzUwMDk5XzYyNzk1MTgxOTk1NTQ3Mw==,"a proper time like 7am weekdays, 8am weekends.",2025-02-23,reply,35
Costco,2025-02-18 15:25:00,Y29tbWVudDoxMDQ3NDEzOTcwNzUwMDk5XzM4ODg4ODE2MjgwOTUzMjE=,Y29tbWVudDoxMDQ3NDEzOTcwNzUwMDk5XzExNzAwNzkyNzQ4NjU2NjM=,we come in at 3-4am every morning. To fix and stock the store. If we opened at 7 we’d have to come in at like midnight. 9 is very reasonable for all the work we have to do,2025-02-23,reply,40
Costco,2025-02-18 15:25:00,Y29tbWVudDoxMDQ3NDEzOTcwNzUwMDk5XzU5MTA2ODk3MzgzMDkyNg==,Y29tbWVudDoxMDQ3NDEzOTcwNzUwMDk5XzM4ODg4ODE2MjgwOTUzMjE=,ours doesn’t open till 10:00 except Saturday it’s 9:30.,2025-02-23,reply,18
Costco,2025-02-18 15:25:00,Y29tbWVudDoxMDQ3NDEzOTcwNzUwMDk5XzExNDYxMjE0ODcxNjE5NDE=,Y29tbWVudDoxMDQ3NDEzOTcwNzUwMDk5XzU5MTA2ODk3MzgzMDkyNg==,I’m sorry about that most of the stores try to open as early as possible. My store tries to be open at 9:30,2025-02-23,reply,0
Costco,2025-02-18 15:25:00,Y29tbWVudDoxMDQ3NDEzOTcwNzUwMDk5XzEzMTM3MzU1OTMyNjQ0MTQ=,Y29tbWVudDoxMDQ3NDEzOTcwNzUwMDk5XzExNDYxMjE0ODcxNjE5NDE=,Maddie Grimes Our local store in California doesn’t open until 10:00 AM and everybody and their brother from surrounding cities flock in there.,2025-02-23,reply,3
Costco,2025-02-18 15:25:00,Y29tbWVudDoxMDQ3NDEzOTcwNzUwMDk5XzIwNzgwMjUxNjkyOTMwNDk=,Y29tbWVudDoxMDQ3NDEzOTcwNzUwMDk5XzYyNzk1MTgxOTk1NTQ3Mw==,"they probably never worked retail, they think we wave a wand and it's done.",2025-02-23,reply,8
Costco,2025-02-18 15:25:00,Y29tbWVudDoxMDQ3NDEzOTcwNzUwMDk5XzExMjU3OTAwNzI1NjE0OTM=,Y29tbWVudDoxMDQ3NDEzOTcwNzUwMDk5XzExNDE5Njk4NTc2NTEzOTk=,need to stock the store,2025-02-23,reply,4
Costco,2025-02-18 15:25:00,Y29tbWVudDoxMDQ3NDEzOTcwNzUwMDk5Xzk3NzMyMDQ0MTE5NTkwMw==,Y29tbWVudDoxMDQ3NDEzOTcwNzUwMDk5XzExNDE5Njk4NTc2NTEzOTk=,Sam’s Club opens at 8:00 am for Plus Club members. Worth every penny. I too wish Costco opened earlier.,2025-02-23,reply,11
Costco,2025-02-18 15:25:00,Y29tbWVudDoxMDQ3NDEzOTcwNzUwMDk5Xzk1MTg0MjE1NzA1MjYxMg==,Y29tbWVudDoxMDQ3NDEzOTcwNzUwMDk5XzExNDE5Njk4NTc2NTEzOTk=,no they have to stock it completely!!,2025-02-23,reply,1
Costco,2025-02-18 15:25:00,Y29tbWVudDoxMDQ3NDEzOTcwNzUwMDk5XzEwMjE1NjM5MTk5ODk3MDM=,Y29tbWVudDoxMDQ3NDEzOTcwNzUwMDk5XzExNDE5Njk4NTc2NTEzOTk=,and close later,2025-02-23,reply,3
Costco,2025-02-18 15:25:00,Y29tbWVudDoxMDQ3NDEzOTcwNzUwMDk5Xzk4MTY5MTgzMDA1NzMzNg==,Y29tbWVudDoxMDQ3NDEzOTcwNzUwMDk5XzExNDE5Njk4NTc2NTEzOTk=,no,2025-02-23,reply,0
Costco,2025-02-18 15:25:00,Y29tbWVudDoxMDQ3NDEzOTcwNzUwMDk5XzE1MzMxMjUyNzcyNzMwMjg=,Y29tbWVudDoxMDQ3NDEzOTcwNzUwMDk5XzExNDE5Njk4NTc2NTEzOTk=,10:00 in NC,2025-02-23,reply,0
Costco,2025-02-18 15:25:00,Y29tbWVudDoxMDQ3NDEzOTcwNzUwMDk5XzEzMzk3NzI2NzA2NzA0MzE=,,This is very convenient for customers. I hope there are employees who are willing to work the extra hours.,2025-02-23,initial,11
Costco,2025-02-18 15:25:00,Y29tbWVudDoxMDQ3NDEzOTcwNzUwMDk5XzE1Mzk0NDYxODMzODU3MjE=,,"This is awesome! Thanks, Costco!!!",2025-02-23,initial,20
Costco,2025-02-18 15:25:00,Y29tbWVudDoxMDQ3NDEzOTcwNzUwMDk5XzEyOTIxNDQzNDIxMTQ4NTE=,,Figures. I just bought an EV.. Costco should get a bank of discounted EV fast charge.,2025-02-23,initial,34
Costco,2025-02-18 15:25:00,Y29tbWVudDoxMDQ3NDEzOTcwNzUwMDk5XzY0NzQ3NTg0MTA0NzYwOQ==,Y29tbWVudDoxMDQ3NDEzOTcwNzUwMDk5XzEyOTIxNDQzNDIxMTQ4NTE=,I’m sure Costco would install charging stations if they thought they would get a return on their investment..With electric vehicles being at approximately 8% of annual vehicle sales that would be a long time if ever… not to mention the time factor it takes to charge a vehicle,2025-02-23,reply,13
Costco,2025-02-18 15:25:00,Y29tbWVudDoxMDQ3NDEzOTcwNzUwMDk5XzI0NTg3MTk0MDQ0OTc0ODg=,Y29tbWVudDoxMDQ3NDEzOTcwNzUwMDk5XzY0NzQ3NTg0MTA0NzYwOQ==,"most EV’s can charge from 20% to 80% in about 30 minutes, that’s about the time an average shopper spends in Costco",2025-02-23,reply,5
Costco,2025-02-18 15:25:00,Y29tbWVudDoxMDQ3NDEzOTcwNzUwMDk5XzExNTU5NjM4ODkzMjIzNzk=,Y29tbWVudDoxMDQ3NDEzOTcwNzUwMDk5XzI0NTg3MTk0MDQ0OTc0ODg=,have you ever seen the lines for gas at Costco?? If it took 30 minutes to charge I can’t imagine what the line would be for a charge and assuming it was a fast charger… I would also worry that non-Costco members allowed to charge which would add to the wait times,2025-02-23,reply,1
Costco,2025-02-18 15:25:00,Y29tbWVudDoxMDQ3NDEzOTcwNzUwMDk5Xzk0Mjg1ODY4NDY0MjI1OQ==,Y29tbWVudDoxMDQ3NDEzOTcwNzUwMDk5XzExNTU5NjM4ODkzMjIzNzk=,"costco parking is already a nightmare. Imagine the arguments between customers when non EV park in that charging station since it’s closer to warehouse or it’s the only available parking spot. Unless they put the station near the gas station, away from the main lot.",2025-02-23,reply,2
Costco,2025-02-18 15:25:00,Y29tbWVudDoxMDQ3NDEzOTcwNzUwMDk5XzYwOTgwMTg0ODQzMTI0OA==,Y29tbWVudDoxMDQ3NDEzOTcwNzUwMDk5XzEyOTIxNDQzNDIxMTQ4NTE=,wrong -get rid of your EV- wait until you have to replace the battery- super expensive,2025-02-23,reply,1
Costco,2025-02-18 15:25:00,Y29tbWVudDoxMDQ3NDEzOTcwNzUwMDk5XzIwNzY1Nzk0NjI4NTU1NjA=,Y29tbWVudDoxMDQ3NDEzOTcwNzUwMDk5XzEyOTIxNDQzNDIxMTQ4NTE=,My Costco has charging stations. They also have air pumps for your tires.,2025-02-23,reply,1
Costco,2025-02-18 15:25:00,Y29tbWVudDoxMDQ3NDEzOTcwNzUwMDk5XzE3MDM1OTY1MDcyMjk1NjM=,Y29tbWVudDoxMDQ3NDEzOTcwNzUwMDk5XzEyOTIxNDQzNDIxMTQ4NTE=,I think some have but only 5 costco so far.,2025-02-23,reply,0
Costco,2025-02-18 15:25:00,Y29tbWVudDoxMDQ3NDEzOTcwNzUwMDk5XzQxMzI5NzgwMTg0NTE2Mw==,Y29tbWVudDoxMDQ3NDEzOTcwNzUwMDk5XzEyOTIxNDQzNDIxMTQ4NTE=,LOL just posted the same.,2025-02-23,reply,2
Costco,2025-02-18 15:25:00,Y29tbWVudDoxMDQ3NDEzOTcwNzUwMDk5XzkxMDQ5NzAzNzgyODcxNA==,Y29tbWVudDoxMDQ3NDEzOTcwNzUwMDk5XzEyOTIxNDQzNDIxMTQ4NTE=,yes and they should put them out on the farthest boundaries of the parking lot and not right next to the door,2025-02-23,reply,11
Costco,2025-02-18 15:25:00,Y29tbWVudDoxMDQ3NDEzOTcwNzUwMDk5XzUzNjA1OTkwMjIzNzUzOQ==,Y29tbWVudDoxMDQ3NDEzOTcwNzUwMDk5XzEyOTIxNDQzNDIxMTQ4NTE=,what a waste energy,2025-02-23,reply,3
Costco,2025-02-18 15:25:00,Y29tbWVudDoxMDQ3NDEzOTcwNzUwMDk5Xzk3MDU2MDMzOTk0NTkzNDc=,Y29tbWVudDoxMDQ3NDEzOTcwNzUwMDk5XzEyOTIxNDQzNDIxMTQ4NTE=,"They are actually expanding them at some stores, hopefully they will continue to do so.",2025-02-23,reply,3
Costco,2025-02-18 15:25:00,Y29tbWVudDoxMDQ3NDEzOTcwNzUwMDk5Xzk4NTM4ODQ3MzUwODU5MA==,,Is this everywhere? Or certain costcos,2025-02-23,initial,1
Costco,2025-02-18 15:25:00,Y29tbWVudDoxMDQ3NDEzOTcwNzUwMDk5Xzk3NDM2MDQyMTQ2MTUzMA==,,When are they going to sell gas in Nova Scotia?,2025-02-23,initial,0
Costco,2025-02-18 15:25:00,Y29tbWVudDoxMDQ3NDEzOTcwNzUwMDk5Xzk1ODIyMDEzOTcxMDQwOA==,Y29tbWVudDoxMDQ3NDEzOTcwNzUwMDk5Xzk3NDM2MDQyMTQ2MTUzMA==,have to ask Costco Canada this is the US group,2025-02-23,reply,0
Costco,2025-02-18 15:25:00,Y29tbWVudDoxMDQ3NDEzOTcwNzUwMDk5XzE2MTQ2MzU4OTU4NDY3NTU=,,Now they need to carry Diesel!!!,2025-02-23,initial,7
Costco,2025-02-18 15:25:00,Y29tbWVudDoxMDQ3NDEzOTcwNzUwMDk5XzYxMjIxMjA5MTczODUzOA==,Y29tbWVudDoxMDQ3NDEzOTcwNzUwMDk5XzE2MTQ2MzU4OTU4NDY3NTU=,now this I can get behind!,2025-02-23,reply,1
Costco,2025-02-18 15:25:00,Y29tbWVudDoxMDQ3NDEzOTcwNzUwMDk5XzY0MDAxODA5ODQ0NDMyMw==,Y29tbWVudDoxMDQ3NDEzOTcwNzUwMDk5XzE2MTQ2MzU4OTU4NDY3NTU=,some do.,2025-02-23,reply,0
Costco,2025-02-18 15:25:00,Y29tbWVudDoxMDQ3NDEzOTcwNzUwMDk5XzYxMzE4MDE1NDgzNjU0Mw==,,Il already switched to Sam's club.. Costco natzi protocol finally broke me,2025-02-23,initial,25
Costco,2025-02-18 15:25:00,Y29tbWVudDoxMDQ3NDEzOTcwNzUwMDk5Xzg4NTIwNzMxMjQ5MDQ0ODI=,Y29tbWVudDoxMDQ3NDEzOTcwNzUwMDk5XzYxMzE4MDE1NDgzNjU0Mw==,Need a better way than stopping you at the door. It’s a bottleneck and I hate it. Love the store and Costco but the exit nonsense needs to stop. Stop shoplifting another way please.,2025-02-23,reply,0
Costco,2025-02-18 15:25:00,Y29tbWVudDoxMDQ3NDEzOTcwNzUwMDk5XzI3Mzg4MjQxMDYyOTAwOTk=,Y29tbWVudDoxMDQ3NDEzOTcwNzUwMDk5XzYxMzE4MDE1NDgzNjU0Mw==,But if you get the Costco Citi card for purchases you will more than pay for membership on the purchase rewards,2025-02-23,reply,2
Costco,2025-02-18 15:25:00,Y29tbWVudDoxMDQ3NDEzOTcwNzUwMDk5XzIwNTExMTY1MzU0MDEyNDk=,Y29tbWVudDoxMDQ3NDEzOTcwNzUwMDk5XzYxMzE4MDE1NDgzNjU0Mw==,Very stupid comment.,2025-02-23,reply,15
Costco,2025-02-18 15:25:00,Y29tbWVudDoxMDQ3NDEzOTcwNzUwMDk5Xzk3Njc5NTAzMzkzMDUzNA==,Y29tbWVudDoxMDQ3NDEzOTcwNzUwMDk5XzYxMzE4MDE1NDgzNjU0Mw==,what are you talking about? We go to both and Sam’s has been much more thorough checking our receipt when we leave than Costco.,2025-02-23,reply,2
