company_name,post_date,id,parent_id,comment_text,comment_date,comment_type,reaction_count
Costco,2025-02-19 16:14:00,Y29tbWVudDoxMDQ4MjU1NTYwNjY1OTQwXzY1NDExODA3NzA1NTY2MQ==,,Viva la Costco! Yay Costco!,2025-02-23,initial,8
Costco,2025-02-19 16:14:00,Y29tbWVudDoxMDQ4MjU1NTYwNjY1OTQwXzk0NTg4Njc5MTA3MzY1MA==,,They better not ruin the croissants!,2025-02-23,initial,2
Costco,2025-02-19 16:14:00,Y29tbWVudDoxMDQ4MjU1NTYwNjY1OTQwXzU1MzM5ODg0NDM4MTU4NA==,,Ik ben al 2maanden op mijn zetel aant wachten . Ik heb hem nog niet . Is costco wel te vertrouwen ?,2025-02-23,initial,1
Costco,2025-02-19 16:14:00,Y29tbWVudDoxMDQ4MjU1NTYwNjY1OTQwXzQwOTgzMzI5MzcwNjI3NDc=,Y29tbWVudDoxMDQ4MjU1NTYwNjY1OTQwXzU1MzM5ODg0NDM4MTU4NA==,this is the US Costco group,2025-02-23,reply,0
Costco,2025-02-19 16:14:00,Y29tbWVudDoxMDQ4MjU1NTYwNjY1OTQwXzM1Nzk2MTY0NzkwMDkzOTE=,,Nayelis Shaomy,2025-03-02,initial,2
Costco,2025-02-19 16:14:00,Y29tbWVudDoxMDQ4MjU1NTYwNjY1OTQwXzEwNzUwMjAwODc3MjY0MDc=,,Your DEI policies are great. Your muffin policies are not great. Please revert the muffin formula. I will be Karen-ing your muffins and boycotting them.,2025-02-23,initial,21
Costco,2025-02-19 16:14:00,Y29tbWVudDoxMDQ4MjU1NTYwNjY1OTQwXzE4NDEzOTIzMzMyOTI0NDk=,Y29tbWVudDoxMDQ4MjU1NTYwNjY1OTQwXzEwNzUwMjAwODc3MjY0MDc=,agreed. The new muffins are awful!!,2025-02-23,reply,7
Costco,2025-02-19 16:14:00,Y29tbWVudDoxMDQ4MjU1NTYwNjY1OTQwXzY1NDA4OTgzMzg1NjQ3MQ==,Y29tbWVudDoxMDQ4MjU1NTYwNjY1OTQwXzEwNzUwMjAwODc3MjY0MDc=,what changed?,2025-02-23,reply,0
Costco,2025-02-19 16:14:00,Y29tbWVudDoxMDQ4MjU1NTYwNjY1OTQwXzEwMTQzNzcxODM4NzE1OTE=,Y29tbWVudDoxMDQ4MjU1NTYwNjY1OTQwXzY1NDA4OTgzMzg1NjQ3MQ==,"The options are different. The muffins are smaller. The muffins are more dry. Poppeyseed? Gone. Chocolate chunk? Gone. In fact, there are no options that have chocolate. The deal is 8 normal sized muffins for $7 instead of 12 gigantic muffins for $10. The product for the consumer is just worse in every way.",2025-02-23,reply,5
Costco,2025-02-19 16:14:00,Y29tbWVudDoxMDQ4MjU1NTYwNjY1OTQwXzIxNTE0NDUxNzE5NDA1MTc=,Y29tbWVudDoxMDQ4MjU1NTYwNjY1OTQwXzEwMTQzNzcxODM4NzE1OTE=,Thanks. I haven't gotten them in a while. We usually do the double chocolate and the blueberry and freeze them,2025-02-23,reply,2
Costco,2025-02-19 16:14:00,Y29tbWVudDoxMDQ4MjU1NTYwNjY1OTQwXzQwMjEwNDk3NDQ3ODMzNzE=,Y29tbWVudDoxMDQ4MjU1NTYwNjY1OTQwXzEwNzUwMjAwODc3MjY0MDc=,I don’t mind the smaller size. It’s actually more of a normal serving. But the flavors offered or not that great although I did hear that the blueberry is pretty good. And supposedly they will continue offering the original size corn muffin.,2025-02-23,reply,1
Costco,2025-02-19 16:14:00,Y29tbWVudDoxMDQ4MjU1NTYwNjY1OTQwXzEyNTcwNDU5OTg3Mjg4MTc=,Y29tbWVudDoxMDQ4MjU1NTYwNjY1OTQwXzEwMTQzNzcxODM4NzE1OTE=,"right?! They're awful 
 .",2025-02-23,reply,2
Costco,2025-02-19 16:14:00,Y29tbWVudDoxMDQ4MjU1NTYwNjY1OTQwXzI0MzgyNzk3MDMyMDM0MDQ=,Y29tbWVudDoxMDQ4MjU1NTYwNjY1OTQwXzEwNzUwMjAwODc3MjY0MDc=,"Maybe, just maybe the DEI has affected the muffins.",2025-02-23,reply,2
Costco,2025-02-19 16:14:00,Y29tbWVudDoxMDQ4MjU1NTYwNjY1OTQwXzY0OTk3MTMyNzYxNDY0Nw==,,quite great,2025-02-23,initial,1
Costco,2025-02-19 16:14:00,Y29tbWVudDoxMDQ4MjU1NTYwNjY1OTQwXzM3NTk1Nzc0NzEwMTg5Mjg=,,Why is this garbage in my feed?,2025-02-23,initial,8
Costco,2025-02-19 16:14:00,Y29tbWVudDoxMDQ4MjU1NTYwNjY1OTQwXzExNTgzNzY0MTI1NTgzOTk=,Y29tbWVudDoxMDQ4MjU1NTYwNjY1OTQwXzM3NTk1Nzc0NzEwMTg5Mjg=,it's ok to just scroll on by...,2025-02-23,reply,2
Costco,2025-02-19 16:14:00,Y29tbWVudDoxMDQ4MjU1NTYwNjY1OTQwXzExMDEyNzE5ODUxMDU2OTk=,Y29tbWVudDoxMDQ4MjU1NTYwNjY1OTQwXzM3NTk1Nzc0NzEwMTg5Mjg=,It's an ad.,2025-02-23,reply,1
Costco,2025-02-19 16:14:00,Y29tbWVudDoxMDQ4MjU1NTYwNjY1OTQwXzEzMjA3MzE5NzU2Mzg4MzI=,Y29tbWVudDoxMDQ4MjU1NTYwNjY1OTQwXzM3NTk1Nzc0NzEwMTg5Mjg=,someone doesn’t know how the algorithm works,2025-02-23,reply,2
Costco,2025-02-19 16:14:00,Y29tbWVudDoxMDQ4MjU1NTYwNjY1OTQwXzExNDYzODMwNDAyNjA2NTE=,Y29tbWVudDoxMDQ4MjU1NTYwNjY1OTQwXzM3NTk1Nzc0NzEwMTg5Mjg=,Commenting and engaging will definitely show the algorithm you’re not interested,2025-02-23,reply,6
Costco,2025-02-19 16:14:00,Y29tbWVudDoxMDQ4MjU1NTYwNjY1OTQwXzExNDU5NDk5NTcxODQ1NjQ=,Y29tbWVudDoxMDQ4MjU1NTYwNjY1OTQwXzM3NTk1Nzc0NzEwMTg5Mjg=,you're bald I'm guessing?? Who doesn't want to pay over 300 for a blow dryer??,2025-02-23,reply,0
Costco,2025-02-19 16:14:00,Y29tbWVudDoxMDQ4MjU1NTYwNjY1OTQwXzIwODYzMjM3MzE4MTY3NTA=,Y29tbWVudDoxMDQ4MjU1NTYwNjY1OTQwXzM3NTk1Nzc0NzEwMTg5Mjg=,and your comment guarantees Costco will continue to show up in your feed.,2025-02-23,reply,2
Costco,2025-02-19 16:14:00,Y29tbWVudDoxMDQ4MjU1NTYwNjY1OTQwXzU1MDI4MzMyODAzNTc2NA==,Y29tbWVudDoxMDQ4MjU1NTYwNjY1OTQwXzQ0MzI2NzU5ODc4MDA1NA==,You can.find that anywhere that sells strawberry,2025-02-23,reply,3
Costco,2025-02-19 16:14:00,Y29tbWVudDoxMDQ4MjU1NTYwNjY1OTQwXzExNzkyNTAyMTA0NjcwNTE=,Y29tbWVudDoxMDQ4MjU1NTYwNjY1OTQwXzU1MDI4MzMyODAzNTc2NA==,I am in the USA duh,2025-02-23,reply,1
Costco,2025-02-19 16:14:00,Y29tbWVudDoxMDQ4MjU1NTYwNjY1OTQwXzEyOTY4MTI1NTQ4NzAxODE=,Y29tbWVudDoxMDQ4MjU1NTYwNjY1OTQwXzExNzkyNTAyMTA0NjcwNTE=,sorry tagged the wrong person - fixed,2025-02-23,reply,1
Costco,2025-02-19 16:14:00,Y29tbWVudDoxMDQ4MjU1NTYwNjY1OTQwXzE2ODE1MzAzNjI0OTk0Mjc=,Y29tbWVudDoxMDQ4MjU1NTYwNjY1OTQwXzEyOTY4MTI1NTQ4NzAxODE=,Tis ok,2025-02-23,reply,0
Costco,2025-02-19 16:14:00,Y29tbWVudDoxMDQ4MjU1NTYwNjY1OTQwXzEzNDkyMjQxNjYwODkxNDI=,,I want my Challenger Bread Pan i bought and paid for. I will take this to court. I have nothing but time. SEND ME MY PAN!,2025-02-23,initial,10
Costco,2025-02-19 16:14:00,Y29tbWVudDoxMDQ4MjU1NTYwNjY1OTQwXzM4NDU3Njc1OTkwNzI4OTI=,Y29tbWVudDoxMDQ4MjU1NTYwNjY1OTQwXzEzNDkyMjQxNjYwODkxNDI=,sure was real Costco and not a fake bussiness pretending to be Costco,2025-02-23,reply,2
Costco,2025-02-19 16:14:00,Y29tbWVudDoxMDQ4MjU1NTYwNjY1OTQwXzI0NTEzODE5NTE4NzIxMDI=,Y29tbWVudDoxMDQ4MjU1NTYwNjY1OTQwXzEzNDkyMjQxNjYwODkxNDI=,"and you think a post on FB will help, ""TimsWoman""? Tim probably took your pan to use to ice the beer down and too scared to tell you.",2025-02-23,reply,1
Costco,2025-02-19 16:14:00,Y29tbWVudDoxMDQ4MjU1NTYwNjY1OTQwXzEzMTIyOTc2NjMzMjQ0ODI=,Y29tbWVudDoxMDQ4MjU1NTYwNjY1OTQwXzI0NTEzODE5NTE4NzIxMDI=,"nah, let her figure it out.",2025-02-23,reply,0
Costco,2025-02-19 16:14:00,Y29tbWVudDoxMDQ4MjU1NTYwNjY1OTQwXzY2MTkxNDc4NjQ5NzY0Nw==,,Regular price $200,2025-02-23,initial,2
Costco,2025-02-19 16:14:00,Y29tbWVudDoxMDQ4MjU1NTYwNjY1OTQwXzY1NDIyNjQ5MDMxMjE3OA==,,Oh first comment - love u Costco,2025-02-23,initial,2
Costco,2025-02-19 16:14:00,Y29tbWVudDoxMDQ4MjU1NTYwNjY1OTQwXzE5ODQ0MjE2NzIwNjc5MTA=,Y29tbWVudDoxMDQ4MjU1NTYwNjY1OTQwXzE4MjQzNzMxMTgzNzM1NjI=,"Página de Facebook incorrecta: esta es la página de EE. UU., por lo que no pueden ayudarte",2025-02-23,reply,0
Costco,2025-02-19 16:14:00,Y29tbWVudDoxMDQ4MjU1NTYwNjY1OTQwXzk1MjEwNjk3NzEwNjgxNA==,Y29tbWVudDoxMDQ4MjU1NTYwNjY1OTQwXzE5ODQ0MjE2NzIwNjc5MTA=,"claro que pueden, en cuanto se haga viral le darán aviso a Costco México",2025-02-23,reply,1
Costco,2025-02-19 16:14:00,Y29tbWVudDoxMDQ4MjU1NTYwNjY1OTQwXzE2NzY1MzM5MzYyNzMyNjU=,Y29tbWVudDoxMDQ4MjU1NTYwNjY1OTQwXzE5ODQ0MjE2NzIwNjc5MTA=,la seguridad ocupa a Costco a nivel internacional así que tu comentario es más que limitado!,2025-02-23,reply,0
Costco,2025-02-19 16:14:00,Y29tbWVudDoxMDQ4MjU1NTYwNjY1OTQwXzkzNzgyMzE2ODQ5NzcyMw==,Y29tbWVudDoxMDQ4MjU1NTYwNjY1OTQwXzE2NzY1MzM5MzYyNzMyNjU=,A moldy strawberry is the most important thing you have to worry about? I'm happy for you.,2025-02-23,reply,3
Costco,2025-02-19 16:14:00,Y29tbWVudDoxMDQ4MjU1NTYwNjY1OTQwXzI5OTk2MjY1OTAxOTM1Nzk=,,DEI-viants.,2025-02-23,initial,4
Costco,2025-02-19 16:14:00,Y29tbWVudDoxMDQ4MjU1NTYwNjY1OTQwXzk0NjY4MTgxMDk0NjMxMw==,Y29tbWVudDoxMDQ4MjU1NTYwNjY1OTQwXzI5OTk2MjY1OTAxOTM1Nzk=,TROLL,2025-02-23,reply,0
Costco,2025-02-19 16:14:00,Y29tbWVudDoxMDQ4MjU1NTYwNjY1OTQwXzEyOTYwNzEyMzE2ODM3ODI=,Y29tbWVudDoxMDQ4MjU1NTYwNjY1OTQwXzI5OTk2MjY1OTAxOTM1Nzk=,"omg you are so smart and witty, everybody here is super duper impressed!",2025-02-23,reply,4
Costco,2025-02-19 16:14:00,Y29tbWVudDoxMDQ4MjU1NTYwNjY1OTQwXzE4ODc1MjI0NDQ5ODg1NzY=,Y29tbWVudDoxMDQ4MjU1NTYwNjY1OTQwXzEyOTYwNzEyMzE2ODM3ODI=,"Gosh, thanks!",2025-02-23,reply,0
